index,link,text,marker
0,http://cpuvhkcluw4vbgbhh2bck5esfa2idk4wrn6qyomsz2qz2jivqp7mjaid.onion/,Los Urabenos buy colombian cocaine darknet wickr cdgcartel straight Colombia wickrcdgcartel Home Us Services Contact Us Words Us sell best quality merchandise send worse quality better quality others thing everyone whether ordered ten times big orders small Weve business years provide highest quality cocaine secure stealth shipping respect clients provide bonuses business certain grade exclusiveness completely sure find better price vendors safe ordering stealth reliable bulk order rutadedrogasprotonmailcom losurabenostorbox36ijlcevujx7mjb4oiusvwgvmue7jfn2cvutwa6kl6to3uyqadonion wickr cdgcartel session id 05ad4479ec1e3b5162904356ebe6098b8272169c5c96e4aed29a587df92bdc2625 Rules beg samples lower quantities order btc ready pay ask custom pictures packaging product time photoshoots meetups face face deals escrow deals accounts EmpireDarkfox Darkmarket exit scammed seized trust worthy ask help purchasing btc setting pgp google search answers 90 questions Dont contact us still unsure ordering Read avoid unnecessary discussions Order Process rules deal new customers 1 Order using order button 2 Payment made monero btc 3d Delivery details sent wickr cdgcartel4 receive tracking number within hours bigger orders 10kg days 5 Monitor package 6 Arrival packages Thats way business ways possible Theres payment delivery comfortable working way please contact Quality guarantee 9095 pure cocaine Pure cocaine watersoluble hydrochloride salt form much easier nose adulterants coca alkaloids residues acids solvents usually accompany illicit market begin process caring nose search pedigree lineage growers refiners importers dealers would rather raise price cut product Unfortunately pedigree hard find Even dealers cannot often get unadulterated cocaine Las reglas del trato para todos los nuevos 1 Realizar pedido 2 Pago confirmación 3d Detalles de entrega 4 Monitor 5 Supervise su paquete 6 Llegada de paquetes Así es como trabajo hay dinero en la entrega Si se siente cómodo trabajando de esta manera por favor escriba Clients Sales 2Hours Support Workers Services Bulk Delivery team professionals within Colombia offer best Cocaine service ever get Shipping times North America within 10days western European countries within 7working days Asia 17working days Australia working days Payment CoinatmradarLocalcryptos Kycmenot cash id required Stealth info Mylar layers Vacuum sealing decoys stealth methods offer shipments also covered refundreship policy Bulk Stealth always choose efficient way transporting cargo FCL LCL DHLCorreo colombia parcel shipping Refund reship policy Option 1 reship order 100 case proof seizure Option 2 refund order 50 estimated Products Fishcale colombian Cocaine 90 PURE UNCUT Straight kitchen never touch products order ensure absolute high standard cocaine one best flakey colombian high quality cocaine get deepweb one best prices buy always sell uncut straight brick stuff rutadedrogasprotonmailcom losurabenostorbox36ijlcevujx7mjb4oiusvwgvmue7jfn2cvutwa6kl6to3uyqadonion wickr cdgcartel session id 05ad4479ec1e3b5162904356ebe6098b8272169c5c96e4aed29a587df92bdc2625 Fishcale colombian cocaine amount 25g70050g1400100g2800250g7000250g7000500g14USD1000g280000050kg450000100kg600000250kg1200000500kg24000001000kg4800priority mail worldwideDHLCoreo Colombia 25g50g1100g2250g7500g 141000g 2850kg 450100kg 500250kg 1200500kg 24001000kg 48002000kg 9600Dutch MDMA champagne crystals 84 HIGHEST QUALITY MDMA CRYSTALS lab personally tested Perfect party added substances pure MDMA Uncut clear crystals best quality find FREE SHIPPING 50ggrams MDMA crystal made PMK oil Clean pure MDMA straight labsproducers cuts stimulating additives Dont forget hydrate drink least one glass water nonalcohol beverage every hour Hope enjoy much rutadedrogasprotonmailcom losurabenostorbox36ijlcevujx7mjb4oiusvwgvmue7jfn2cvutwa6kl6to3uyqadonion wickr cdgcartel session id 05ad4479ec1e3b5162904356ebe6098b8272169c5c96e4aed29a587df92bdc2625 100g 250g 2500g 1kg 25kg 215kg 4210kg 85Dutch MDMA champagne crystals 84 amount 100g250g500g1 kg2kg5 kg10 kg 850212542508500212504250085Contact Welcome Los Urabenos orders questions use contact details Turbo Colombia rutadedrogasprotonmailcom losurabenostorbox36ijlcevujx7mjb4oiusvwgvmue7jfn2cvutwa6kl6to3uyqadonion wickr cdgcartel session id 05ad4479ec1e3b5162904356ebe6098b8272169c5c96e4aed29a587df92bdc2625 Copyright Los Urabenos Rights Reserved,none
1,http://drugsednqhasbyoyg2oekzbnllbujro54zrogqbf3p6e7qflxti5eeqd.onion/,DRUGS EMPIRE WEED HEMP METH LSD COCAINE CANNABIS DRUGS EMPIRE View cart 0 CannabisDiablo 5g20 THCAdd cartAfghan Kush 5g15 THCAdd cartPure Love 5g14 THC35Add cartGuava Gelato 5g18 THCAdd cartAmnesia Haze Spain 5g21 THCAdd cartWedding Cake 5g29 THCAdd cartPremium OG Kush 5g24 THCAdd cartGirl Scout Cookies 5g28 THCAdd cartLemon Haze 5g19 THCAdd cartCrystal Candy 5g21 THCAdd cartForbidden Fruit 5g26 THCAdd cartGorilla Glue 5g28 THCAdd cartLSD10 tabs 200ugAdd cart10 tabs 200ugAdd cart100 tabs 250ugAdd cart100 tabs 200ugAdd cartEcstasy100 pills ecstasy 500mgAdd cart100x Blue Tesla 250mgAdd cart100x FC Barcelona 250mgAdd cart100x Blue Android 200mgAdd cartCocainePeruvian 88 Pure 5gAdd cartBLUE CRYSTAL METH 5gAdd cartWHITE CRYSTAL METH 5gAdd cartColombian Coke 5g35Add cartOpioidsPure Afghan Heroin 1gAdd cartCodeine capsAdd cartAfghan opium 1gAdd cartMescaline HCL pure 1gAdd cartOther2CB smiley 5x12mgAdd cart2CB pills 10x5mgAdd cartMephedrone 4MMC 1gAdd cartXanax pills 2mgAdd cartDMT 5gAdd cartFentanyl 10x1mgAdd cartEtizolam 10x1mgAdd cartPotassium Cyanide 5gAdd cart FAQ safe buy drugs store Yes completely safe buy drugs store address strongly encrypted removed shipping order quantity add product cart may change amount buy 50g Pure Love 5g weed set quantity 10 ship ship Netherlands EU ship ship worldwide live unusual hard reach place feel free message package looks like best hide real content package keep stealth top priority changing style keep top game package sent legal business store pretending electronic device video game clothes DVD movies depending destination country postman household members know ordered conceal smell weed Weed packaged discreet smellproof vacuumsealed bags making hard detect dogs pay drugs Payments dark web cryptocurrencies acceptBitcoin BTC recommended beginnersMonero XMR provides higher anonymity buy bitcoins several ways buy bitcoins includingfind bitcoin ATM exchange cityuse major online exchanges like Binance Coinbaseuse P2P exchanges like Bisq LocalBitcoins HodlHodl avoid getting caught low possibility get caught buying drugs store strongly encrypt information provide remove shipping also use good stealth conceal smell drugs stay safer follow additional rulesUse latest version Tor BrowserDont order drugs workplaceDont tell anyone darknet activityDo order one package timeDispose packaging away home safest items buy products easier conceal ship eg LSD others eg weed matter safer actually want order best minimize risk order arriving sell squares blotters LSD sell whole blotters Quick guide beginners blotter sheet paper soaked liquid LSD divided small squares tabs tab one dose LSD may divided pieces get microdoses recognize controlled delivery rare cases packages dark web selected deep inspection package comes longer usual may mean controlled delivery courier asks signature refuse couriers one policeman long delivery time Regular shipping free takes days depending countryOvernight shipping costs extra delivered 1days worldwide Looking drugs Looking drugs available store Talk us drugsempirednmxorg help return policy offer full moneyback purchases made store satisfied product get money back eligible full reimbursement within calendar days purchase 14day period longer able receive refund Thank time hope like products mission keep customers high happy possible way grow trade maintain rep keep coming back ask discount large orders system automatically gives discount according rules order get 10 discount order get 20 discount order get 30 discount order get 40 discount order get 50 discount contact questions contact us drugsempirednmxorg Public key BEGIN PGP PUBLIC KEY BLOCK mQENBGFPcLQBCADT0lVUdmQIBYrxjr4gfR1dhBrMLrtW5XRPuMJTV8r2oxXbhQF 1YnqeNSh64Z7op4d2gJiYZ8HVgtLJWaZp3Npd3XpY8kUNFZbdMgfGacvY7edB pkZEltOnhcIxA1JyXiA5gQkrOltVJIIt3NHGWFZKQpvVpv3m6Xges7mrmIpk N6suZ0wcfnKjtHHm4dj6rIA4QXjf4WQtcJ9rBWjLM8bK0EqklGLFqDZ8PNYLGiB8 3SWdJGH8HnSV6h3aBIFtcAjt5iJoQWD62oaKhFivqWMNMHcAepTpX1aYrQEeIJ Aml1T6njAIA4ir7zfVVXINSr3VRnVHUgP6TABEBAAG0JERydWdzIEVtcGlyZSA8 ZHJ1Z3MuZW1waXJlQGRubXgub3JnPokBTgQTAQoAOBYhBGMxQWzccgqAeAtQj2 NPRvHARdBQJhT3C0AhsDBQsJCAcDBRUKCQgLBRYCAwEAAh4BAheAAAoJEAj2NPRv HARdHaMIALkQ6lfqJUhtJA4QyFQoUhjqlz4FXGOw1QqtYOYf62DdUYAz6g61RJKw 7SXZ1wgRql0HohFpDv73HnlWA6QUic1Asf0uzLewtXTMUUc1OJk1DKuoTAAfN qmBz128M770NkcSLKD3dYigeLUB6O1w6Lli4SlhwBVSYZ9XwGLpbAGJggP9rW0 t1jotPXySSOHfKAKIfZXIvMNh3SV6jEiEFt5TpiTBXYuECQF5PgIyi6yfpL 4A41fHI9t3rbo0DfyIr3YAPqbaRhZAfC30kfjUdWAUF5lQh3hWzm6PMFHMFLaN8 4n69iu2vTxo47OOh5y6qShf45Cr5AQ0EYU9wtAEIALXl8rqSTC8wEl43j7O IijU8mUrPgzuFbsC05fTmFrVDKvP9I0OJ4uNQT8ktI3r9qxXBnOOXzOGOkqG 1HWuBitwcNHoMeZCUdfhnhZ7VkfszagFOlhvEPMHT5VInZutIkvyTlsG6ShYrL mhbGic4D3BUvDynGbXBYNDjr5oitSzRuCPGnnu6HSmdzrOXhGBt6CemWjOzyyFuS s66bQMvEDBceYcgYP7rPGzvEdPufWm2gUSkPEyQV4X820QL8FVikLwM8j3rqeP RnYagu5y19QPOgblUniXwS8fRwFCSDrVUqoYuhGgdhzWEfzmRrBny2txVwz iu8AEQEAAYkBNgQYAQoAIBYhBGMxQWzccgqAeAtQj2NPRvHARdBQJhT3C0AhsM AAoJEAj2NPRvHARdLsEIAJnxUVm3TfNvvmcX73VBliCZDP9k8kuMY89YwtBg3j Py2cZBz8fXJEEhoyV98GQXFfwym8I8fw9OxPwVOUqcBrnWCnW6mRCURtQKRbj bAfBeVr6JodToQtnH2qxdwKmJ8n64EXytOMfXcRkQiYhJ28ViOK6KikvaR3y OZ8Dr9OCJRsxjcjHIpqHwc90dU2XYxvC2t90cqXQPSGg6ZzKyh6k9wnhptcUII ZlOrKwWxaHIqSD4cctlrzDUX90xJmQYlsOHjWantDWUPbO5z27YQ57UdTerKp6 d2LYWw7L9vXoUIwQgE5qWLSSr2ix5eEMJduxpuBQLVI VZvo END PGP PUBLIC KEY BLOCK Drugs Empire illegal stuff Tor,none
2,http://charlyuklqm45jjwxwichotzub2ua4uflixvbioleyfuixz57q5lahqd.onion/,CharlieUK Cocaine Vendorshop home PGP keyFAQSHow order 03grams05grams07grams10grams14grams20gramsHaze skunk UK Darknet Cocaine Vendor WEEKEND SERVICE SITUATION Weekend late Friday queriesorders dealt LATE SUNDAY EVENINGthis due lack mail movement also enables us address areas operation PATIENT THANKS PLEASE CLICK LINK CONTINUE charlyuklqm45jjwxwichotzub2ua4uflixvbioleyfuixz57q5lahqdonion KIND IMPORTANT REMINDERIF GETTING EMAILS CHECK SPAM FOLDER CharlieUK eeyovrly7charukuonioncharlyuklqm45jjwxwichotzub2ua4uflixvbioleyfuixz57q5lahqdonion,none
3,http://anonblogd4pcarck2ff6qlseyawjljaatp6wjq6rqpet2wfuoom42kyd.onion/tag/cocaine,Cocaine Tagged Posts AnonBlogs AnonBlogs Signup Login Home DarkLight Tag Cocaine ama1 ama1s Blog Multi Pharmacy Store Multi Pharmacy Store developed maintained leading Pharmacy offer multi services like selling drugs Drugs Prescription drugs Inperson EClinic treatment COVIDtreatment services provide products like Weeds DrugsMay 22min read Popular Tags Thoughtfulness Common Sense Community Activism Political Scam Football Fixed Bets Buy Drivers Licens Business Matches Tramadol Easym Covid Certificate Fast Efect Dark Web Business Malware Cocaine Seller Update Pedophilia Buy Covid Cards China Ccs Digital Covid Pass Communism Dark Web Business Buy Covid19 Card Digital Id Release Notes Hate Satirical Help Green Pass Pgp Shooting Adderall Covid Pass Easymoneygroup Buy Fake Drivers L Buy Real Passport Id Cards Murder Struggle Buy Id Card Buy Covid Certific Money Format,none
4,http://anonblogd4pcarck2ff6qlseyawjljaatp6wjq6rqpet2wfuoom42kyd.onion/tag/cocaine,Cocaine Tagged Posts AnonBlogs AnonBlogs Signup Login Home DarkLight Tag Cocaine ama1 ama1s Blog Multi Pharmacy Store Multi Pharmacy Store developed maintained leading Pharmacy offer multi services like selling drugs Drugs Prescription drugs Inperson EClinic treatment COVIDtreatment services provide products like Weeds DrugsMay 22min read Popular Tags Thoughtfulness Activism Community Political Common Sense Scam Fixed Football Buy Drivers Licens Bets Matches Business Seller Nembutal Nuke Buy Covid Passport Greenpass Cocaine Buy Id Card Update Shooting Dark Web Business Drugs Digital Id Fast Communism Covid Certificate Id Cards Drivers License Buy Fake Drivers L Buy Nhs Covid Reco Buy Covid Certific Ccs Dark Web Business Anonblogs Help Digital Covid Pass China Dogs Easymoney Format Covid Pass Satirical Easym Meta Buy Covid Cards Tramadol Buy Covid19 Card Green Pass Buy Real Passport,none
5,http://sokm37fvacv5lp65cbzrbfcjepzn6fqkjhgr2j5axupogiyjnp5bvtqd.onion/products.html,Cartel Jaliso Nuevo Generation Industrial cocaine distribtion official Domainhttpuiyy5xyosjawijoxonion wickrcjng Jalisco State Mexico Wickrjaliscocartel1 cartejaliscoprotonmailcom Official Domainhttpuiyy5xyosjawijoxonion C J N G Toggle navigation Home Products Contact Us PGP dead dropsSEa shipmentair cargo Products Bubblegum Kush Forbidden Fruit Dime OG Wedding CakeMinimum West Coast Carts CARTS AVAILABLE DIME Bubblegum Kush Forbidden Fruit Dime OG Wedding Cake BUDDHA Pinacoco Sourbelt RAWGARDEN Animas Lime Fuego Banana Wubba Cookies LIONSBREATH Jack Herer Sour Patch Kids Sour Diesel Grand Daddy Purp MUHAMEDS Northern Lights Cherry Berry Grape Ape Maui Wowie Girl Scout Cookies Bubblegum Kush Forbidden Fruit Dime OG Wedding Cake amount 100x950250x2375500x47501000xpriority mail worldwideUSPS Domesticpriority mail DomesticUSPS Worldwide Colombia Cocaine Premium Cocaine Colombia purity Like everybody know Cocaine Kings business nobody better quality us highness strong dont overplay purity 84 CJNG CJNG Stamp earmark Group every time another sort want sort buy sort 250g2500g51000g10Fishcale Colombian cocaine amount 250g270000500g5400001000g10800005kg5000010kg10000025kg22550050kg450000100kg900priority mail worldwideUSPS Domesticpriority mail DomesticUSPS Worldwide Humboldt FIRE dispensary weed strainsGelato 41ZookiesGSC Humboldt FIRE dispensary strains deep discounts larger bulk orders Californias state flower Gelato strains beauty equivalent PullnSnap consistency Product pictured Processed indoor flower Professionally extracted using Cloosed Loop system Dewaxed inline vac purged 48 hours 500g11000g35kg50Gelato 41ZookiesGSC amount 500g1950001000g3800005kg5000010kg10000025kg22550050kg450000100kg900priority mail worldwideUSPS Domesticpriority mail DomesticUSPS Worldwide Amphetamine Crystal Shards grams Mexican Quality Amphetamine Crystal Shards INTRO PRICE Ask us anything High Quality let dry lose little 250g3500g71000g155kg7510kg15025kg35050kg700100kg1250Amphetamine Crystal Shards amount 250g375000500g7500001000g15000005kg7500010kg15000025kg35000050kg700000100kg1250priority mail worldwideUSPS Domesticpriority mail DomesticUSPS Worldwide News Admin March 20All orders way everything running smoothly Admin February 21Due large ammount orders ordered multiple items could get packages due trying keep next day service looked future long mention multiple order come one package items shipping Admin January 09BRAND NEW STOCK ARRIVED GOOD NEWS FOLKS BEST COCAINE DARKNETMARKETS BACK CJNG09JAN ALSO SPECIAL LIQUORICE MDMA CJNG Stock Cocaine Amphetamine Crystal Meth Shards Cannabis Stardawg Hybrid Extra Cannabis 90 THC Distillate Vape Cartridges LSD Needle Point Blotters Technicolor 220ug BRAND NEW Jalisco Mexico WICKR jaliscocartel1 PGP KEY Navigation Product Contact Us CJNG rights reserved,none
6,http://onionv3qe2xl6b7rpweh4s27pnf7koxgokgxpbcrxf4ptlrg2c46taad.onion/Vote.php?id=84,Buy Cocaine Onion Link Directory Onion Link Directory Home Add Search Please bookmark site first Click Ctrl add site favorites Categories Markets Hacking Carding Communication Services WikiLinks Forums Social Blog Adult Hosting Private Sites Buy Cocaine Tor Cocaine Market Trusted Vendors httpu3d46uctgt66lqsionion Vote Onion Site Like DisLike Please select option Comment Captcha Image Captcha Vote Voting Results,none
7,http://tfcw5fa2m66hxcbcg2lro7yzpstq2ioewysrv7u6iz5n26zysj6pqzid.onion/vote.php?id=84,Buy Cocaine OnionDir OnionDir httptfcw5fa2m66hxcbcg2lro7yzpstq2ioewysrv7u6iz5n26zysj6pqzidonion Home Categories Markets Hacking Carding Communication Services WikiLinks Forums Social Blog Adult Hosting Private Sites Buy Cocaine Tor Cocaine Market Trusted Vendors httpu3d46uctgt66lqsionion Please leave rating Positive Negative Comment Captcha Image Captcha Voting Results Disclaimer site provides links Tor hidden services responsibility linked content hosting 20142022,none
8,http://yylcipxq4qbqw32ugwsgzlgevpdse4orqgynzlooej43fcdlpx55fcyd.onion/vote.php?id=84,Buy Cocaine Link Dir Onion Home Add Contact Categories Markets Hacking Carding Communication Services WikiLinks Forums Social Blog Adult Hosting Private Sites Buy Cocaine Tor Cocaine Market Trusted Vendors httpu3d46uctgt66lqsionion feedback Positive Negative Comment Captcha Image Captcha Vote Link Dir Onion 20162022,none
9,http://onionv3qe2xl6b7rpweh4s27pnf7koxgokgxpbcrxf4ptlrg2c46taad.onion/Vote.php?id=1952,Cocaine Market Onion Link Directory Onion Link Directory Home Add Search Please bookmark site first Click Ctrl add site favorites Categories Markets Hacking Carding Communication Services WikiLinks Forums Social Blog Adult Hosting Private Sites Cocaine Market Tor Cocaine Market Trusted Vendors httpcocainybzbgnkpo4onion Vote Onion Site Like DisLike Please select option Comment Captcha Image Captcha Vote Voting Results,none
10,http://onionv3qe2xl6b7rpweh4s27pnf7koxgokgxpbcrxf4ptlrg2c46taad.onion/Vote.php?id=2054,Buy Cocaine Pure Cocaine High Quality Cocaine Pure Fish Scale Cocaine Crack Onion Link Directory Onion Link Directory Home Add Search Please bookmark site first Click Ctrl add site favorites Categories Markets Hacking Carding Communication Services WikiLinks Forums Social Blog Adult Hosting Private Sites Buy Cocaine Pure Cocaine High Quality Cocaine Pure Fish Scale Cocaine Crack Buy Cocaine Pure Cocaine High Quality Cocaine Pure Fish Scale Cocaine Crack Cocaine Preuvian Cocaine Columbia Cocaine Synthetic Cocaine httpdrugm2k6qhlqqpixonion Vote Onion Site Like DisLike Please select option Comment Captcha Image Captcha Vote Voting Results,none
11,http://tfcw5fa2m66hxcbcg2lro7yzpstq2ioewysrv7u6iz5n26zysj6pqzid.onion/vote.php?id=1952,Cocaine Market OnionDir OnionDir httptfcw5fa2m66hxcbcg2lro7yzpstq2ioewysrv7u6iz5n26zysj6pqzidonion Home Categories Markets Hacking Carding Communication Services WikiLinks Forums Social Blog Adult Hosting Private Sites Cocaine Market Tor Cocaine Market Trusted Vendors httpcocainybzbgnkpo4onion Please leave rating Positive Negative Comment Captcha Image Captcha Voting Results Disclaimer site provides links Tor hidden services responsibility linked content hosting 20142022,none
12,http://tfcw5fa2m66hxcbcg2lro7yzpstq2ioewysrv7u6iz5n26zysj6pqzid.onion/vote.php?id=2054,Buy Cocaine Pure Cocaine High Quality Cocaine Pure Fish Scale Cocaine Crack OnionDir OnionDir httptfcw5fa2m66hxcbcg2lro7yzpstq2ioewysrv7u6iz5n26zysj6pqzidonion Home Categories Markets Hacking Carding Communication Services WikiLinks Forums Social Blog Adult Hosting Private Sites Buy Cocaine Pure Cocaine High Quality Cocaine Pure Fish Scale Cocaine Crack Buy Cocaine Pure Cocaine High Quality Cocaine Pure Fish Scale Cocaine Crack Cocaine Preuvian Cocaine Columbia Cocaine Synthetic Cocaine httpdrugm2k6qhlqqpixonion Please leave rating Positive Negative Comment Captcha Image Captcha Voting Results Disclaimer site provides links Tor hidden services responsibility linked content hosting 20142022,none
13,http://yylcipxq4qbqw32ugwsgzlgevpdse4orqgynzlooej43fcdlpx55fcyd.onion/vote.php?id=1952,Cocaine Market Link Dir Onion Home Add Contact Categories Markets Hacking Carding Communication Services WikiLinks Forums Social Blog Adult Hosting Private Sites Cocaine Market Tor Cocaine Market Trusted Vendors httpcocainybzbgnkpo4onion feedback Positive Negative Comment Captcha Image Captcha Vote Link Dir Onion 20162022,none
14,http://yylcipxq4qbqw32ugwsgzlgevpdse4orqgynzlooej43fcdlpx55fcyd.onion/vote.php?id=2054,Buy Cocaine Pure Cocaine High Quality Cocaine Pure Fish Scale Cocaine Crack Link Dir Onion Home Add Contact Categories Markets Hacking Carding Communication Services WikiLinks Forums Social Blog Adult Hosting Private Sites Buy Cocaine Pure Cocaine High Quality Cocaine Pure Fish Scale Cocaine Crack Buy Cocaine Pure Cocaine High Quality Cocaine Pure Fish Scale Cocaine Crack Cocaine Preuvian Cocaine Columbia Cocaine Synthetic Cocaine httpdrugm2k6qhlqqpixonion feedback Positive Negative Comment Captcha Image Captcha Vote Link Dir Onion 20162022,none
15,http://onionv3qe2xl6b7rpweh4s27pnf7koxgokgxpbcrxf4ptlrg2c46taad.onion/Vote.php?id=64004,Buy Cocaine Delivery Escrow accepted CocaWay Shop Onion Link Directory Onion Link Directory Home Add Search Please bookmark site first Click Ctrl add site favorites Categories Markets Hacking Carding Communication Services WikiLinks Forums Social Blog Adult Hosting Private Sites Buy Cocaine Delivery Escrow accepted CocaWay Shop Buy HQ Cocaine city Worldwide delivery Delivered reship Good price Many satisfied customers Safe deal httpe7xutgiri67xistbxllnimfs4ic7pjqxmiincdlu6azqxvl2w4h5qwqdonion Vote Onion Site Like DisLike Please select option Comment Captcha Image Captcha Vote Voting Results,none
16,http://tfcw5fa2m66hxcbcg2lro7yzpstq2ioewysrv7u6iz5n26zysj6pqzid.onion/vote.php?id=64004,Buy Cocaine Delivery Escrow accepted CocaWay Shop OnionDir OnionDir httptfcw5fa2m66hxcbcg2lro7yzpstq2ioewysrv7u6iz5n26zysj6pqzidonion Home Categories Markets Hacking Carding Communication Services WikiLinks Forums Social Blog Adult Hosting Private Sites Buy Cocaine Delivery Escrow accepted CocaWay Shop Buy HQ Cocaine city Worldwide delivery Delivered reship Good price Many satisfied customers Safe deal httpe7xutgiri67xistbxllnimfs4ic7pjqxmiincdlu6azqxvl2w4h5qwqdonion Please leave rating Positive Negative Comment Captcha Image Captcha Voting Results Disclaimer site provides links Tor hidden services responsibility linked content hosting 20142022,none
17,http://yylcipxq4qbqw32ugwsgzlgevpdse4orqgynzlooej43fcdlpx55fcyd.onion/vote.php?id=64004,Buy Cocaine Delivery Escrow accepted CocaWay Shop Link Dir Onion Home Add Contact Categories Markets Hacking Carding Communication Services WikiLinks Forums Social Blog Adult Hosting Private Sites Buy Cocaine Delivery Escrow accepted CocaWay Shop Buy HQ Cocaine city Worldwide delivery Delivered reship Good price Many satisfied customers Safe deal httpe7xutgiri67xistbxllnimfs4ic7pjqxmiincdlu6azqxvl2w4h5qwqdonion feedback Positive Negative Comment Captcha Image Captcha Vote Link Dir Onion 20162022,none
18,http://ly75dbzixy7hlp663j32xo4dtoiikm6bxb53jvivqkpo6jwppptx3sad.onion/3-Gram-Cocaine-Powder,Gram Cocaine Powder High Quality 100 Pure Best Currency Euro Pound Sterling US Dollar Vendor Account Account Register Login Wish List 0 Shopping Cart Checkout items shopping cart empty Categories Digital Electronic Products 8 Phone 3 Computer 5 Hacking Service 3 Show Digital Pills Adderall 2 Ritalin 2 Xanax 4 Oxycodone 3 Tramadol 2 Suboxone 1 Morphine 1 Methadone 2 Diazepam 4 Valium 4 Alprazolam 2 Captagon 1 Targin 1 Hydrocodone 1 YABA 2 Testosteron Enanthate 2 Show Pills Stimulants Cocaine 7 MDMA 6 Ecstasy XTC 9 Meth 6 Fentanyl 2 Ketamine 4 GHB 1 Potassium Cyanide 2 Show Stimulants Cannabis Weed 10 Hash 10 Kush 10 Vape 3 Capsules 1 Show Cannabis Psychedelic LSD 3 DMT 2 Show Psychedelic Money Transfers Western Union Transfer 4 Paypal Transfer 4 MoneyGram Transfers 4 Show Money Transfers Credit Card CCCVV 5 Show Credit Card Gift Cards Amazon Gift Cards 0 eBay Gift Cards 0 iTunes Gift Cards 0 Steam Gift Cards 0 Google Play Store Gift Cards 0 Show Gift Cards Counterfeits Money Weapons Guns Pistols 3 Rifles 1 Ammo Bullet 3 Show Weapons Guns Links Onion 0 Market 0 Marketplace 0 Dir Onion Dir 0 Drugs 0 Bitcoin 0 Escrow Service 0 Search Engine 0 Darknet Market 0 DeepWeb Market 0 Venus Market 0 Show Links Venus Marketplace Welcome Venus Marketplace Venus Marketplace established 2018 among best marketplaces Darknet ranks high search engines browse products place orders website keeps records encrypted hashes gives importance seller buyer security Escrow service available refund seller doesnt ship products Products calculated dollars Payments made Bitcoin Shipping countries Cargo content confidential secure Website Vendors Products 100 verified 25 Discount Express Cargo purchases Coupon Code VM250 Gram Cocaine Powder High Quality 100 Pure Best Description Vendor Information Venus Market verified product 100 Real Product Please read descriptionAs Flexx Cocaine send best quality cocaine completely clean customers satisfiedWe offer full refund via Venus Market Escrow system item reach encounter problems itemEscrow ServiceWe offer full refund via Venus Market Escrow system item reach encounter problems itemProduct shipping descriptionProducts magazine box etc mixed packages shipped vacuum bags antixray proof bagsCant caught take security measures ourselvesThe cargo sent 100 securely wish regular customerWhat xray proof bagsFrom trials comparisons checks found nothing compares xray proof bagsA heavy coating blended alloys synthetics layered become superior choice storage requirementsXrayproof heat sealable bags provide greatest protection retain preserve smellsThey completely UV Proof oxygen proof gas proof water proof antistatic proof even xray proof Vendor Information Vendor Name FlexxCocaine Total Sales Member Since 17Account Type Verified Customer protection Escrow Yes Gram Cocaine Powder High Quality 100 Pure Best Product Code Cocaine Availability Stock Qty Add Cart Information Us Delivery Information Privacy Policy Terms Conditions Customer Service Contact Us Returns Site Map Vendor Vendor Account Vendor Register Verify Vendor Account Account Account Order History Wish List Venus Market 2021,none
