index,link,text,marker
30,http://oirolrkrppy6sei6x6bvkkdolc4cjqzqfhxisfzu6exqblahwrrvktyd.onion/product/DoupLRnuSyAZGRD78kUTGk2KCWlBAzpi,Buy de 1g 92 uncut kolumbianisches kokain cocain koks worldwide shipping Listings Shopping Cart 0 Search Vendor Area Help Infos Support Tickets Bitcoin 2077903USDMonero 12438USD DrugsShow 14312Benzos 1504Ecstasy 1352Opiods 1055Psychedelics 1684Cannabis 3099Stimulants 3294Dissociatives 777Steroids 405Prescription 900Common Raw Drugs 24default 0Rcs China Suppliers 46Drugs Precursors 33Weight Scale 3Drugs Paraphernalia 6Custom Orders 18Physical Drop 30Civil SoftwaresShow 393Malware 69Bootkits 6Hacked Social Network Database 8Backdoors 9Keyloggers 11Wireless Trackers 1Screen Scrapers 4Mobile forensics tools 2WiFi Jammers 1TutorialsShow 2223eBooks 961Theft 42Carding 192Mining 28Gambling 28Worms 10Dump 102Viruses 19Drugs Production 43Trojans 19Botnets 10Cameras Photography 4Security Technology 4Computers 6Art 1Bribery 1Confidential infoShow 13DigitalShow 5066Cards CVV 329Hacks 374Porn 1780SSN 150Device drivers 17Application software 119Accounts 276Documents 447False Documents 139Exploit kit 27Drop Bank 50Surgical masks 1Security 50System software 56Utilities 29Software forensics tools 2Cash Crypto 4Detectors 1Private Security Guards 1ForgeryShow 138Network ServicesShow 93VPN 42Hosting 25SOCKS 24CurrencyShow 296Counterfeiting 191Crypto Cash 24Endtoend Encrypted Phones 2GoldShow 28Other Jewelry 10Yellow Gold 1DatabaseShow 280Email Databases 89Phone Databases 22Messaggers Database 4Hacked Sites Databases 21Logs 24Ransomware 22SurveillanceShow 3JewelyShow 2Watches 2Leaked DocumentsShow 12TobaccoShow 4Offshore servicesShow 15Foreign partnerships 2Vendors EquipmentShow 1Digital ForensicsShow 18Spy listening Bugging 20dayShow 7Computer forensics tools 1IntelligenceShow 17Spam 15HUMINT 1Private SecurityShow 10Covid19 OutbreakShow 1Money LaunderingShow 0RacketeeringShow 2APTShow 1CamgirlsShow 0AlcoholShow 1ElectronicsShow 8Mobile Phones 6Sound Vision 1Shill MarketingShow 1Illegal GamblingShow 1Diamond TradeShow 0Media InfluenceShow 2CorruptionShow 2Chem EquipmentShow 0CountersurveillanceShow 0 de 1g 92 uncut kolumbianisches kokain cocain koksPriceUSDSellerlilawolkenSeller locationGermanyShips sellerWorldwideShips productWorldwideCategoryStimulantsQuantity stock9923Dead dropNoAvailabilityAvailableBriefversand Inland ca Tage USDEinwurf Einschreiben Inland ca Tage USDKombiVersand mehrere Order eine Sendung USDAdd cartView cartDescriptionRefund PolicyKolumbianisches Kokain Dieser Artikel besteht nur aus Steinen nur Steine kein Pulver über Seeweg importiert uncut sehr stark Vorsicht schimmert wie Fischschuppen Demnächst haben wir neben Weed und Koks auch folgende Angebote Mdma Xanax LSD Wax party cocainRefund Policy Bei _Einschreiben_ oder _Einschwurf Einschreiben_ 100 wenn alle der folgenden Punkte erfüllt sind Keine Packstation kein Postfach und keine Filiale Postlagernd als Empfängeradresse Kein Fehler der Empfängeradresse Mindestens Order auf Dark0de kein Status der darauf schließen lässt dass der Empfänger schuld einem erfolgslosen Zustellversuch ist zB Sendung wird Absender zurück gesendet Bei _Briefsendungen_ 0 _______ Refund Policy english selected shipping method _Einschreiben_ _Einwurf Einschreiben_ 100 refundingreshipping following points matches postbox services recipientaddress mismatchtypo recipientaddress atlest orders Dark0de trackingstatus indicates customers fault like _sending back sender_ means postman coudnt reach mailbox faulty recipientaddress selected shipping method _Briefversand_ 0Comments 33o Perfekt Vielen Dank für die schnelle LIeferungf Topk fast safe rocks like 3dd excellent stealth big rock received thank absolutly recommendeda TOP perfect services fast delivery everything finea 1dd prime delivery great quality top stelth thx k rocks like first time still okg Fast good qualityf Topb Top Support fast answers writing two mails problem wasnt longer problem 4DD Top Quality Stealth good Top Vendor Price high stuff get worthf nice Vendor good stealth customer orientedd Next day domestic delivery safe stealth nice quality reliable vendor thankss 1dd thankss dd good qualitys Super weiter sod Super stealth fast good quality come backr Alles Bestensb Hat alles super geklappt Bestelle gerne wiederf 1dd everything perfect Good vendorb best Stoff DD germanyThanks bro order Yous Super weiter soc Fast shipment good product buy hered Schneller Versand gute Qualität vernünftiger Preis Frage Wo waren die Gummibärchen e thanksfast delivery good stuffb Perfect Top Qualityn Quick delivery good stealth good qualitya fast delivery Product looks good tested yetf fast shipping everything perfect def become goto vendor stays like thate Perfekt THXb Perfect Quality Top Vendorf Everything fine fast before7 super fast good quality thanks lotRelated productslilawolkende 1g 92 uncut kolumbianisches kokain cocain koks Kolumbianisches Kokain Dieser Artikel besteht nur aus Steinen nur Steine kein Pulver über Seeweg importiert uncut sehr stark Vorsicht schimmert wie Fischschuppen Demnächst haben Germany Worldwide USD View lilawolkende 5g 92 uncut kolumbianisches kokain cocain koks Kolumbianisches Kokain Dieser Artikel besteht nur aus Steinen nur Steine kein Pulver über Seeweg importiert uncut sehr stark Vorsicht schimmert wie Fischschuppen Demnächst haben Germany Worldwide USD View lilawolkende 05g 92 uncut kolumbianisches kokain koks Kolumbianisches Kokain Dieser Artikel besteht nur aus Steinen nur Steine kein Pulver über Seeweg importiert uncut sehr stark Vorsicht schimmert wie Fischschuppen Demnächst haben Germany Worldwide USD View lilawolkende 10g uncut kolumbianisches kokain steine Kolumbianisches Kokian Dieser Artikel besteht nur aus Steinen nur Steine kein Pulver über Seeweg importiert uncut sehr stark Vorsicht schimmert wie Fischschuppen Germany Worldwide USD View lilawolkende 3g 92 uncut kolumbianisches kokain cocain koks Kolumbianisches Kokain Dieser Artikel besteht nur aus Steinen nur Steine kein Pulver über Seeweg importiert uncut sehr stark Vorsicht schimmert wie Fischschuppen Demnächst haben Germany Worldwide USD View,none
31,http://g4eyyhx62lmueffp3au7xpsl5ob3ggegf5eidsfuiyiimy7fpdkwr4ad.onion,TheDeepDarkNet HomeTop Onion Sites V3 Deep Web Search Engines V3 Deep Web Chat Rooms V3 Deep Web Email Provider V3 Deep Web BrowsersVisit Clearnet Site HomeTop Onion Sites V3 Deep Web Search Engines V3 Deep Web Chat Rooms V3 Deep Web Email Provider V3 Deep Web BrowsersVisit Clearnet Site site show dangers precautions must entering browsing deep web addition informing types sites find deep web newbie Warning However thinking logging use powerful reliable VPN protect information safe use hidden links without VPN system several reasons publish level links links change continuously since sites close move prevent closing means link published today could stop working next day Another reason simply posting onion links problems site find several entry points start looking onion pages good repertoire kinds online communities several pages online services related multimedia content fact going visit proposals would advisable open article directly Tor browser make easier open find website following words search engine deep web links 2020 onion links 2020 deep websites 2020 dark websites 2020 links tor 2020 However came right place page find links updated June deep web deep web deep web hidden part internet contains material information web pages indexed existing search engines Google hypothetical case search engines could index entire content web would mean deep web would disappear make analogy movie matrix could say totality people take blue pill would people navigate know call superficial network totality people would take red pill people would know existence deep web 96 Internet accessible standard search engines find everything child pornography money laundering buying narcotics weapons contents Deep web links appear Google Bing Yahoo methods prevent web pages indexed traditional search engines Web Archives allow users view archived versions web pages time indexed search engines Contextual Web Pages different content different access contexts Dynamic content Dynamic pages return response submitted question access form especially input elements used open domain text fields NonHTML content textual content multimedia files extensions exe rar zip etc Limited access content sites limit access pages technical way example using robot exclusion standard captcha forbids search engines navigating creating cached copies Private Web sites require registration login passwordprotected resources Scripted content pages accessible links produced JavaScript well content downloaded dynamically web servers Flash Ajax solutions Software hidden sites superficial web accessible special software like Tor I2P software example Tor allows users access websites using onion server address anonymously hiding IP address big deep web According data Wikipedia year 2000 superficial Internet size Terabytes deep Web size Terabytes means content deep web times greater information access moment Currently University California Berkeley estimates actual size deep network 91Terabytes find deep web contents deep web illegal find interesting diverse content Files information stored governments different countries Organizations store information NASA stores information scientific investigations carries meteorological data financial data directories information witness protection program Large number databases different kinds databases represent important percentage information stored deep web Forums diverse themes However also find unpleasant dangerous content Note noted 90 content exists deep web accessible users content sale drugs weapons various forums warez content much 4 content belongs governments organizations great power 6 content belongs groups paid killers terrorist groups Precautions must navigate deep web able inside virtual machine download files unless youre sure know download possible files bring hidden scripts Therefore simple fact downloading file give information third party identity use TorBundle receive notification time go perform unsafe act perform downloads chat without first set chat applications downloads completely anonymous point noted LiveUSB distribution based Debian called tails enter usual mail gmail hotmail case give clues identity may open word pdf files files may contain scripts reveal identity case open files inside virtual machine disconnected internet Avoid browsing sites Candy Pedo bear etc nomenclatures content going find unpleasant activate browser plug ways enter deep web material belonging deep web accessible ordinary way access content access proxy server case want investigate experience good option start Tor network Tor network allow us browse superficial web within deep web anonymously safely search net see many ways navigate deep web using Tor truth several options Follow steps properly easily access deep web dangers Deep Web deep internet However beyond know part Internet escapes search engines allows users remain anonymous addition experts warn risks existence child pornography sale drugs deep web links unknown Internet face dangerous activities allowed delving sea knowledge thousands thousands unknown web pages generally indexed major search engines Google Bing Yahoo thunder box uncovered Deep Web Deep Internet part Internet part superficial Internet rather invisible search engines since content indexed deep web links Previous article Top Onion Sites Prev access deep web Contact us bestdeepdnmxorg,none
32,http://ujuwmruwekgs7ekzlpzrmvkgj7bmsykrcqbmhup3hinpm7lhl2howbqd.onion,Choose Better telling whether onion site scam Categories Cloned Cards Paypal Accounts Gift Cards Electronics Counterfeit Money Fixed Matches Hacking Services Fake passportsIDs Escrow Services Covid certificates Need Help choosebettersafemailnet Choose Better buy something onion site dont want get scammed could help already tested lot sites know scams Note dont sell gadgets cards fixed matches etc share informations legit services scams deep web money choosebettersafemailnet start exploring website surely find many interesting things Scam links presented free category Choose category Cloned Cards help checked many cloned cards sellers scam legit lists scam one legit one Learn Buy Paypal Accounts found Paypal transfers well WU MoneyGram scam found legit paypal accounts sellers Learn Buy Gift Cards gift cards sellers checked many lists scam legit Learn Buy Electronics people lounder money selling expensive original gadgets people try scam people Check lists Learn Buy Counterfeit Money Everybody knows counterfeits myth checked many counterfeits sellers create scam legit lists Learn Buy Fixed Matches believe fixed matches best way earn money involving criminal fixed matches sellers legit Learn Buy Hacking Services Hackers demanded nowadays Thats many scammers provide hacking service Check lists hackers Learn Buy Fake passportsIDs need fake ID surely try buy one deep web Check scam list buy legit list fake ID sellers Learn Buy Escrow Services Unfortunately deep web escrow services scam list legit clearnet escrow services Learn Buy Covid Certificates Nowadays many providers vaccination certificates deep web legit Learn Buy Confirmed scam categories Bitcoin multipliers reason sell Bitcoin Bitcoin excuses Prepaid cards reason sell money money NB legit sellers cloned cards WU MoneyGram transfers reason sell real money real money NB legit paypal accounts sellers Categories never check Drugs Narcotics pure evil Also dangerous check Guns People use weapon kill people dangerous check Adult categories kids protected Checking category would disgusting Frequently Asked Questions check general check sellers test purchases add seller legit list get stuff Also accept customers feedbacks strong proofs scam cases links different categories one seller could provide different services instance cards gift cards paypal case add seller different categories scam categories mean Confirmed scam categories sellers scammers Sad true CATEGORIES totally scam legit sellers list Bitcoin multipliers Prepaid Cards Preshredded money Western Union transfers MoneyGram transfers SCAM Note prepaid cards cloned cards Cloned cards exist trust Choose Better best make sure service soe picks Check unmoderated comments People could add anything want Check score Onion Scanner Try find negative reviews deep web bet wont find place order choose categories want buy buy via bitcoin payment gate contact us choosebettersafemailnet buy via another crypto refund guarantee havent received refund requests yet face troubles sellers provided contact us refund loss Instant delivery blockchain confirmations Support 24Contact us hours day Secure Payments 100 anonymous payments Free updates find new legit sellers Email choosebettersafemailnet Choose Better Cloned Cards Paypal Accounts Gift Cards Electronics Counterfeit Money Fixed Matches Hacking Services Fake passportsIDs Escrow Services Covid Certificates Accept Payment Via Choose Better 2022,none
33,http://kp6ewvhvc3mkimzlr43is6fy4voa7r6rdyta5kyb7nr4rgfkrombopqd.onion,Hidden Wiki Onion Directory Onion Wall OnionWall trusted links SAFE EMAIL Dnmx BlackHost TorBox Mail2Tor CockMail SEARCH ENGINES Torch TorDex Ahmia Tor66 MetGer HIDDEN WIKIS TorHiddenWiki TorHiddenLinks TheDeepDarkNet OnionList TheHiddenWiki BLOGSFORUMSCHATS Rutor Black Hat Chat SuprBay AbleOnion JitJat TOP ONION MARKETS ECash RentAHacker Cardstop MoneyTeam ONION WHISTLEBLOWING Abc New York Times Pro Publica TechCrunch Intercept OPEN SOURCE SOFTWARE Tor Browser Bitcoin Core KeyBase Qubes OS OnionShare Contact bestdeepdnmxorg,none
34,http://6ji7dfurszw7ymbkjrksyskgy5e4niuv4qvntoy5v766qplaqqppkqad.onion,Top Onion Sites V3 TorHiddenLinks bestdeepdnmxorg Top Onion Sites started using Tor Network finding safe onion sites overwhelming outright risky much content could illegal end landing trouble back list Top Darkweb Sites Dont Appear Google Search Results Note need Tor browser gain access dark web sites open best dark web links ECash Websitehttptowfqvw7wlvqyoczyb57xdxqorm4fmi2u4ohk3vhfcaoehuohoo2k7qdonion Highly rated vendor meney positive reviews Sells anything Paypal Western Union transfers gift cards much Offers moment 10 discount new buyers Read reviews customers site Looks amazing TorBuy Website httptorbuyxpe6auueywlctu4wz6ur3o5n2meybt6tyi4rmeudtjsysayqydonion TorBuy huge DarkNet Market Money transfers Paypal Western Union Prepaid Cards Visa Master Card Appliances Apple iPhones Phones Samsung Huawei Buy gift codes Amazon Asos Ebay AppStore EmpireMarket Websitehttp2a2a2abbjsjcjwfuozip6idfxsxyowoi3ajqyehqzfqyxezhacur7oydonionws EmpireMarket Escrow Market selling guns counterfeits documents money transfers EmpireMarket trusted market around meney years Hire Hitman Websitehttpocqren76bqb5vdggsialpskvdn53aryyimhp4hpbufn3f6qq36o4p6adonion One best hitman marketplaces hundreds hitmen thousands satisfied customers unmoderated forum builtin escrow mixer accepts external escrows bitcoin monero CardStop Websitehttphtzgsde5xacu5k4eo4k5ijac32pxbrwap2266ef4dniyvolvr3o2lcidonion Card stop CC seller Sells digital info delivers data following order Card number experation date balance cvv address details cardholder seller fresh live cards world Send desired preference country ordering RentAHacker Website httpiovtddwsrcg4omiygxetsjuugpdool3qtnk6ciy5ud2eruuybpb5i6ydonion RentAHacker hack target provide bit pricy experts cost money seller following DDos social media hacking espionage Spear Phishing Attacks get accounts selected targets much Breaking Bad Website httpchemforuminfomtm_campaign52mtm_kwdBreaking Bad forum professional participants drug market MoneyTeam Website httpauvx3ftfa4kmz6lp66b6zvv5f3u2h4xnga4qn2j4j7bb4a3nepkettadonion MoneyTeam Paypal Western Union Gift Cards Credit cards Trustable ClearNet websites BestDeepWebCom TorHiddenwiki Thedeepdarknet Previous article Dark Web Search Engines Prev Main Menu Top Onion Sites V3Onion Tor Search Engines V3Onion Email Provider V3 Onion BlogsForumsChats V3Onion Whistleblowing V3Where Buy bitcoins Clearnet Best VPN Provider ClearnetTor Hosting Provider Clearnet Bitcoin Casinos ClearnetDark Web GuidesVisit Clearnet Domain,none
35,http://jt3it42syepkpcplixdxcnv2vz53cpk27lek2pptqlgrnqyb7cuqojqd.onion,Scam List Tor TOR SCAM LIST VERIFIED SITES Report false listing Add new scam SCAM LINKS LIST Home Welcome site scam Dear HackersScammers know every day send hundreds megabytes try destroy site thing destroy one link Im gonna fight forever fucking hate DDoS stop us wont stop whole community FUCK Write email get notDDoSed Scam List mirrors torscamlist2022dnmxorg HelloSome time ago stupidity tried make several transactions Dark InternetAnd know many times deceived freaking times think already muchThat created website check product service buy really true another scam dark web tool safe anonymous hidden web government dont see everything doSo order buy take minute check list onion site person listed SCAM LINKS LIST people steal money think twice whether want lose money add verified scamsites proofs scams Im sure itThis list complete never together constantly supplement itIf scammed someone site isnt listed submit site person using theADD NEW SCAM linkIf legit seller proofs buyer want recommend site REAL proofs screenshot emails fake photos etc also write case Im gonna add VERIFIED SITES scammer offer even deleting site add verified dont waste time finding legit sellers dont need money Honor God important Thanks Donate site saved money want donate save page everyone donate maintain advertising site appreciate Contact torscamlist2022dnmxorg,none
36,http://tordexpmg4xy32rfp4ovnz7zq5ujoejwq2u26uxxtkscgo5u3losmeid.onion,Uncensored Index Tor Onion Sites TorDex Directory Advertising Contact Soon update TorDex 2017Sitemap Home Advertising Contact Top Searches hidden wiki paypal accounts forums porn Directory Best Marketplaces Best Wikis Best Email Services Best Search Engines Services DNMX Email Realm Search Torch Search,none
37,http://orealmvxooetglfeguv2vp65a3rig2baq2ljc7jxxs4hsqsrcemkxcad.onion,Uncensored Tor Search Engine OurRealm Advertising Search beyond censorship Search Carding Forum Porn Bitcoin western union Hidden Wiki Copyright OurRealm Search orealmvxooetglfeguv2vp65a3rig2baq2ljc7jxxs4hsqsrcemkxcadonion,none
38,http://hackltxlmapssd5u6wro4ms7cn3tjbtyij5iuhfgaoxjmpwcc224ibyd.onion,Social Media Hackers effective reliable team cybersecurity experts hackers certified pentesters digital investigators keyhacker_smhprotonmailcom Services also provide Custom Software advanced hacking tools dont see service need write us keyhacker_smhprotonmailcom Messengers HackingWhatsApp Telegram Messenger etc full access victims Whatsapp software delivered upon completion service Social Media HackingFacebook Instagram TikTok Snapchat Twitter etc special malware vulnerability social engineering able obtain account password Email Hacking billion email records corresponding passwords email looking among data always rely abilities Phone hackingAndroid IOS want control victim phoneall specific functions like camera microphone Computer Hacking need access computer remotely without detected smartphones webservers everything vulnerable human factor always play Using phishing hacking networks installing malware help achieve goal Custom Software Need personalized software deliver highefficient undetectable custom software malwares trojans backdoors custom DDoS botnets custom RATs Apps monitor target surveillance geolocation much IP Tracking want track person IP address date use Dont worry dont also find Debt clearing debt cant pay name included defaulter list help Grades Change access universitycollege system order change grades missed classes among things InstagramFacebookSnapchat hacking program also sell program InstagramFacebook Snapchat hack price 300 want buy write keyhacker_smhprotonmailcom Examples Buy program Telegram WhatsApp hacking program also sell program Telegram WhatsApp hack price 350 want buy write keyhacker_smhprotonmailcom Examples Buy program Email hacking program also sell program Email hack price 250 want buy write keyhacker_smhprotonmailcom Examples Buy program Location finding program also sell program finding location target price 350 want buy write keyhacker_smhprotonmailcom Examples Buy program guarantee suggest accept 50 payment upfront 50 payment work done Dont find need recommend services Fixed Matches httpm6af37hzmmyvb4isskn7tjiofboy2xtvmm3hza5f2d2y5buyvmq64radonion Electronic discounter http2lzycz6p52fwc3tqzugjpg6osiveib367aw22m5h7npklpjrt4v6apqdonion Credit cards PayPal Western Union httputd3jszzyuuc6ydjvope7wukncwq7tmu2lduyrtbjn4vs2ox4hz3piidonion Contact Us reach us keyhacker_smhprotonmailcom keyhackersafemailnet real link httphackltxlmapssd5u6wro4ms7cn3tjbtyij5iuhfgaoxjmpwcc224ibydonion Social Media Hackers 20192022,none
39,http://hxuzjtocnzvv5g2rtg2bhwkcbupmk7rclb6lly3fo4tvqkk5oyrv3nid.onion/,DNMX Anonymous Email Provider Login Email Email Password Login Register DNMX DNMX Dark Net Mail Exchange free use email service works like Gmail yMail dont care never ask information reveal identity dark net trust Dont Dont trust service dark net strongly recommend use PGP encryption sending sensitive information encrypt servers make best effort secure site never trust us iMap PoP3 support would make easy users send spam available service buy advertising Ad cost month Banner size 468x60 Please use TorDex advertising service place ad Blog,none
