index,link,text,marker
19,http://ly75dbzixy7hlp663j32xo4dtoiikm6bxb53jvivqkpo6jwppptx3sad.onion/50-Gram-Cocaine-Powder,Gram Columbian Cocaine 100Pure Best Currency Euro Pound Sterling US Dollar Vendor Account Account Register Login Wish List 0 Shopping Cart Checkout items shopping cart empty Categories Digital Electronic Products 8 Phone 3 Computer 5 Hacking Service 3 Show Digital Pills Adderall 2 Ritalin 2 Xanax 4 Oxycodone 3 Tramadol 2 Suboxone 1 Morphine 1 Methadone 2 Diazepam 4 Valium 4 Alprazolam 2 Captagon 1 Targin 1 Hydrocodone 1 YABA 2 Testosteron Enanthate 2 Show Pills Stimulants Cocaine 7 MDMA 6 Ecstasy XTC 9 Meth 6 Fentanyl 2 Ketamine 4 GHB 1 Potassium Cyanide 2 Show Stimulants Cannabis Weed 10 Hash 10 Kush 10 Vape 3 Capsules 1 Show Cannabis Psychedelic LSD 3 DMT 2 Show Psychedelic Money Transfers Western Union Transfer 4 Paypal Transfer 4 MoneyGram Transfers 4 Show Money Transfers Credit Card CCCVV 5 Show Credit Card Gift Cards Amazon Gift Cards 0 eBay Gift Cards 0 iTunes Gift Cards 0 Steam Gift Cards 0 Google Play Store Gift Cards 0 Show Gift Cards Counterfeits Money Weapons Guns Pistols 3 Rifles 1 Ammo Bullet 3 Show Weapons Guns Links Onion 0 Market 0 Marketplace 0 Dir Onion Dir 0 Drugs 0 Bitcoin 0 Escrow Service 0 Search Engine 0 Darknet Market 0 DeepWeb Market 0 Venus Market 0 Show Links Venus Marketplace Welcome Venus Marketplace Venus Marketplace established 2018 among best marketplaces Darknet ranks high search engines browse products place orders website keeps records encrypted hashes gives importance seller buyer security Escrow service available refund seller doesnt ship products Products calculated dollars Payments made Bitcoin Shipping countries Cargo content confidential secure Website Vendors Products 100 verified 25 Discount Express Cargo purchases Coupon Code VM250 Gram Cocaine Powder High Quality 100 Pure Best Description Vendor Information Venus Market verified product 100 Real Product Please read descriptionAs Flexx Cocaine send best quality cocaine completely clean customers satisfiedWe offer full refund via Venus Market Escrow system item reach encounter problems itemEscrow ServiceWe offer full refund via Venus Market Escrow system item reach encounter problems itemProduct shipping descriptionProducts magazine box etc mixed packages shipped vacuum bags antixray proof bagsCant caught take security measures ourselvesThe cargo sent 100 securely wish regular customerWhat xray proof bagsFrom trials comparisons checks found nothing compares xray proof bagsA heavy coating blended alloys synthetics layered become superior choice storage requirementsXrayproof heat sealable bags provide greatest protection retain preserve smellsThey completely UV Proof oxygen proof gas proof water proof antistatic proof even xray proof Vendor Information Vendor Name FlexxCocaine Total Sales Member Since 17Account Type Verified Customer protection Escrow Yes Gram Cocaine Powder High Quality 100 Pure Best Product Code Cocaine Availability Stock Qty Add Cart Information Us Delivery Information Privacy Policy Terms Conditions Customer Service Contact Us Returns Site Map Vendor Vendor Account Vendor Register Verify Vendor Account Account Account Order History Wish List Venus Market 2021,none
20,http://q7fn5gvufkvqmg2p7hxdihbkfutgftv6pu5dors4t3r7sec6tcmewhid.onion/363/how-to-cut-cocaine,Cut Cocaine Hidden Answers Remember Register Hidden Answers Advertise Questions Hot Unanswered Tags Categories Users Ask Question Welcome Hidden Answers ask questions receive answers users dark net Categories categories Misc 217 Technology 218 Tor 155 Crypto 110 Markets 240 Drugs vices 145 Sex relationships 441 Politcs World News 31 Religion Ideology 13 16k questions 24k answers comments 32k users Cut Cocaine votes Hey guys 250g Cocaine Cut asked Mar Drugs vices ReNaTaA points Please log register answer question Answers votes use caffeine powder answered Mar bluemail points Please log register add comment votes use Hammer answered Mar tiliton90 points Please log register add comment votes Good got coke already cut cocaine already need cut want buy coke anonymously best store come across still delivery till date httpkjsba5xg6vb7gvtzu7eecpwvsggem6qbvmw3h5enj3b4viqvksvktuydonionproductbuycocaineonline answered Apr voldemort78841307 12k points Please log register add comment Related questions votes answer Cut uncut cocaine sale onlineBest place buy Cocaine Telegram willyjones01 asked Apr Drugs vices certified01n points drugs cocaine mdma mushroom weed vote answers Hypothetically large amount uncut coke cut asked May Drugs vices gap points votes answers pure heroin converted something usable asked days ago Drugs vices nebeka1513 points drugs votes answers check site legit scam darkweb asked days ago Drugs vices huee8199 points votes answers anyone tell make cyanide asked days ago Drugs vices dgfdfgd43 points howto Snow Theme Q2A Market Powered Question2Answer Advertise,none
21,http://ly75dbzixy7hlp663j32xo4dtoiikm6bxb53jvivqkpo6jwppptx3sad.onion/3-Gram-Columbian-Cocaine,Gram Colombian Cocaine High Quality Currency Euro Pound Sterling US Dollar Vendor Account Account Register Login Wish List 0 Shopping Cart Checkout items shopping cart empty Categories Digital Electronic Products 8 Phone 3 Computer 5 Hacking Service 3 Show Digital Pills Adderall 2 Ritalin 2 Xanax 4 Oxycodone 3 Tramadol 2 Suboxone 1 Morphine 1 Methadone 2 Diazepam 4 Valium 4 Alprazolam 2 Captagon 1 Targin 1 Hydrocodone 1 YABA 2 Testosteron Enanthate 2 Show Pills Stimulants Cocaine 7 MDMA 6 Ecstasy XTC 9 Meth 6 Fentanyl 2 Ketamine 4 GHB 1 Potassium Cyanide 2 Show Stimulants Cannabis Weed 10 Hash 10 Kush 10 Vape 3 Capsules 1 Show Cannabis Psychedelic LSD 3 DMT 2 Show Psychedelic Money Transfers Western Union Transfer 4 Paypal Transfer 4 MoneyGram Transfers 4 Show Money Transfers Credit Card CCCVV 5 Show Credit Card Gift Cards Amazon Gift Cards 0 eBay Gift Cards 0 iTunes Gift Cards 0 Steam Gift Cards 0 Google Play Store Gift Cards 0 Show Gift Cards Counterfeits Money Weapons Guns Pistols 3 Rifles 1 Ammo Bullet 3 Show Weapons Guns Links Onion 0 Market 0 Marketplace 0 Dir Onion Dir 0 Drugs 0 Bitcoin 0 Escrow Service 0 Search Engine 0 Darknet Market 0 DeepWeb Market 0 Venus Market 0 Show Links Venus Marketplace Welcome Venus Marketplace Venus Marketplace established 2018 among best marketplaces Darknet ranks high search engines browse products place orders website keeps records encrypted hashes gives importance seller buyer security Escrow service available refund seller doesnt ship products Products calculated dollars Payments made Bitcoin Shipping countries Cargo content confidential secure Website Vendors Products 100 verified 25 Discount Express Cargo purchases Coupon Code VM250 Gram Colombian Cocaine High Quality Description Vendor Information Venus Market verified product 100 Real Product Please read descriptionEscrow ServiceWe offer full refund via Venus Market Escrow system item reach encounter problems itemProduct shipping descriptionProducts magazine box etc mixed packages shipped vacuum bags antixray proof bagsCant caught take security measures ourselvesThe cargo sent 100 securely wish regular customerWhat xray proof bagsFrom trials comparisons checks found nothing compares xray proof bagsA heavy coating blended alloys synthetics layered become superior choice storage requirementsXrayproof heat sealable bags provide greatest protection retain preserve smellsThey completely UV Proof oxygen proof gas proof water proof antistatic proof even xray proof Vendor Information Vendor Name BULLS Total Sales Member Since 17Account Type Verified Customer protection Escrow Yes Gram Colombian Cocaine High Quality Product Code Cocaine Availability Stock Qty Add Cart Information Us Delivery Information Privacy Policy Terms Conditions Customer Service Contact Us Returns Site Map Vendor Vendor Account Vendor Register Verify Vendor Account Account Account Order History Wish List Venus Market 2021,none
22,http://ly75dbzixy7hlp663j32xo4dtoiikm6bxb53jvivqkpo6jwppptx3sad.onion/3-Gram-Fishscale-Cocaine,Gram Fishscale Cocaine AAA Quality Currency Euro Pound Sterling US Dollar Vendor Account Account Register Login Wish List 0 Shopping Cart Checkout items shopping cart empty Categories Digital Electronic Products 8 Phone 3 Computer 5 Hacking Service 3 Show Digital Pills Adderall 2 Ritalin 2 Xanax 4 Oxycodone 3 Tramadol 2 Suboxone 1 Morphine 1 Methadone 2 Diazepam 4 Valium 4 Alprazolam 2 Captagon 1 Targin 1 Hydrocodone 1 YABA 2 Testosteron Enanthate 2 Show Pills Stimulants Cocaine 7 MDMA 6 Ecstasy XTC 9 Meth 6 Fentanyl 2 Ketamine 4 GHB 1 Potassium Cyanide 2 Show Stimulants Cannabis Weed 10 Hash 10 Kush 10 Vape 3 Capsules 1 Show Cannabis Psychedelic LSD 3 DMT 2 Show Psychedelic Money Transfers Western Union Transfer 4 Paypal Transfer 4 MoneyGram Transfers 4 Show Money Transfers Credit Card CCCVV 5 Show Credit Card Gift Cards Amazon Gift Cards 0 eBay Gift Cards 0 iTunes Gift Cards 0 Steam Gift Cards 0 Google Play Store Gift Cards 0 Show Gift Cards Counterfeits Money Weapons Guns Pistols 3 Rifles 1 Ammo Bullet 3 Show Weapons Guns Links Onion 0 Market 0 Marketplace 0 Dir Onion Dir 0 Drugs 0 Bitcoin 0 Escrow Service 0 Search Engine 0 Darknet Market 0 DeepWeb Market 0 Venus Market 0 Show Links Venus Marketplace Welcome Venus Marketplace Venus Marketplace established 2018 among best marketplaces Darknet ranks high search engines browse products place orders website keeps records encrypted hashes gives importance seller buyer security Escrow service available refund seller doesnt ship products Products calculated dollars Payments made Bitcoin Shipping countries Cargo content confidential secure Website Vendors Products 100 verified 25 Discount Express Cargo purchases Coupon Code VM250 Gram Fishscale Cocaine AAA Quality Description Vendor Information Venus Market verified product 100 Real Product Please read descriptionEscrow ServiceWe offer full refund via Venus Market Escrow system item reach encounter problems itemProduct shipping descriptionProducts magazine box etc mixed packages shipped vacuum bags antixray proof bagsCant caught take security measures ourselvesThe cargo sent 100 securely wish regular customerWhat xray proof bagsFrom trials comparisons checks found nothing compares xray proof bagsA heavy coating blended alloys synthetics layered become superior choice storage requirementsXrayproof heat sealable bags provide greatest protection retain preserve smellsThey completely UV Proof oxygen proof gas proof water proof antistatic proof even xray proof Vendor Information Vendor Name hardy55 Total Sales Member Since 08Account Type Verified Customer protection Escrow Yes Gram Fishscale Cocaine AAA Quality Product Code Cocaine Availability Stock Qty Add Cart Information Us Delivery Information Privacy Policy Terms Conditions Customer Service Contact Us Returns Site Map Vendor Vendor Account Vendor Register Verify Vendor Account Account Account Order History Wish List Venus Market 2021,none
23,http://ly75dbzixy7hlp663j32xo4dtoiikm6bxb53jvivqkpo6jwppptx3sad.onion/5-Gram-Fishscale-Cocaine,Gram Fishscale Cocaine Currency Euro Pound Sterling US Dollar Vendor Account Account Register Login Wish List 0 Shopping Cart Checkout items shopping cart empty Categories Digital Electronic Products 8 Phone 3 Computer 5 Hacking Service 3 Show Digital Pills Adderall 2 Ritalin 2 Xanax 4 Oxycodone 3 Tramadol 2 Suboxone 1 Morphine 1 Methadone 2 Diazepam 4 Valium 4 Alprazolam 2 Captagon 1 Targin 1 Hydrocodone 1 YABA 2 Testosteron Enanthate 2 Show Pills Stimulants Cocaine 7 MDMA 6 Ecstasy XTC 9 Meth 6 Fentanyl 2 Ketamine 4 GHB 1 Potassium Cyanide 2 Show Stimulants Cannabis Weed 10 Hash 10 Kush 10 Vape 3 Capsules 1 Show Cannabis Psychedelic LSD 3 DMT 2 Show Psychedelic Money Transfers Western Union Transfer 4 Paypal Transfer 4 MoneyGram Transfers 4 Show Money Transfers Credit Card CCCVV 5 Show Credit Card Gift Cards Amazon Gift Cards 0 eBay Gift Cards 0 iTunes Gift Cards 0 Steam Gift Cards 0 Google Play Store Gift Cards 0 Show Gift Cards Counterfeits Money Weapons Guns Pistols 3 Rifles 1 Ammo Bullet 3 Show Weapons Guns Links Onion 0 Market 0 Marketplace 0 Dir Onion Dir 0 Drugs 0 Bitcoin 0 Escrow Service 0 Search Engine 0 Darknet Market 0 DeepWeb Market 0 Venus Market 0 Show Links Venus Marketplace Welcome Venus Marketplace Venus Marketplace established 2018 among best marketplaces Darknet ranks high search engines browse products place orders website keeps records encrypted hashes gives importance seller buyer security Escrow service available refund seller doesnt ship products Products calculated dollars Payments made Bitcoin Shipping countries Cargo content confidential secure Website Vendors Products 100 verified 25 Discount Express Cargo purchases Coupon Code VM250 Gram Fishscale Cocaine Description Vendor Information Venus Market verified product 100 Real Product Please read descriptionEscrow ServiceWe offer full refund via Venus Market Escrow system item reach encounter problems itemProduct shipping descriptionProducts magazine box etc mixed packages shipped vacuum bags antixray proof bagsCant caught take security measures ourselvesThe cargo sent 100 securely wish regular customerWhat xray proof bagsFrom trials comparisons checks found nothing compares xray proof bagsA heavy coating blended alloys synthetics layered become superior choice storage requirementsXrayproof heat sealable bags provide greatest protection retain preserve smellsThey completely UV Proof oxygen proof gas proof water proof antistatic proof even xray proof Vendor Information Vendor Name hardy55 Total Sales Member Since 08Account Type Verified Customer protection Escrow Yes Gram Fishscale Cocaine Product Code Cocaine Availability Stock Qty Add Cart Information Us Delivery Information Privacy Policy Terms Conditions Customer Service Contact Us Returns Site Map Vendor Vendor Account Vendor Register Verify Vendor Account Account Account Order History Wish List Venus Market 2021,none
24,http://ly75dbzixy7hlp663j32xo4dtoiikm6bxb53jvivqkpo6jwppptx3sad.onion/3-Gram-Ultraclean-Cocaine,Gram Ultraclean 100 Pure Cocaine Currency Euro Pound Sterling US Dollar Vendor Account Account Register Login Wish List 0 Shopping Cart Checkout items shopping cart empty Categories Digital Electronic Products 8 Phone 3 Computer 5 Hacking Service 3 Show Digital Pills Adderall 2 Ritalin 2 Xanax 4 Oxycodone 3 Tramadol 2 Suboxone 1 Morphine 1 Methadone 2 Diazepam 4 Valium 4 Alprazolam 2 Captagon 1 Targin 1 Hydrocodone 1 YABA 2 Testosteron Enanthate 2 Show Pills Stimulants Cocaine 7 MDMA 6 Ecstasy XTC 9 Meth 6 Fentanyl 2 Ketamine 4 GHB 1 Potassium Cyanide 2 Show Stimulants Cannabis Weed 10 Hash 10 Kush 10 Vape 3 Capsules 1 Show Cannabis Psychedelic LSD 3 DMT 2 Show Psychedelic Money Transfers Western Union Transfer 4 Paypal Transfer 4 MoneyGram Transfers 4 Show Money Transfers Credit Card CCCVV 5 Show Credit Card Gift Cards Amazon Gift Cards 0 eBay Gift Cards 0 iTunes Gift Cards 0 Steam Gift Cards 0 Google Play Store Gift Cards 0 Show Gift Cards Counterfeits Money Weapons Guns Pistols 3 Rifles 1 Ammo Bullet 3 Show Weapons Guns Links Onion 0 Market 0 Marketplace 0 Dir Onion Dir 0 Drugs 0 Bitcoin 0 Escrow Service 0 Search Engine 0 Darknet Market 0 DeepWeb Market 0 Venus Market 0 Show Links Venus Marketplace Welcome Venus Marketplace Venus Marketplace established 2018 among best marketplaces Darknet ranks high search engines browse products place orders website keeps records encrypted hashes gives importance seller buyer security Escrow service available refund seller doesnt ship products Products calculated dollars Payments made Bitcoin Shipping countries Cargo content confidential secure Website Vendors Products 100 verified 25 Discount Express Cargo purchases Coupon Code VM250 Gram Ultraclean 100 Pure Cocaine Description Vendor Information Venus Market verified product 100 Real Product Please read descriptionEscrow ServiceWe offer full refund via Venus Market Escrow system item reach encounter problems itemProduct shipping descriptionProducts magazine box etc mixed packages shipped vacuum bags antixray proof bagsCant caught take security measures ourselvesThe cargo sent 100 securely wish regular customerWhat xray proof bagsFrom trials comparisons checks found nothing compares xray proof bagsA heavy coating blended alloys synthetics layered become superior choice storage requirementsXrayproof heat sealable bags provide greatest protection retain preserve smellsThey completely UV Proof oxygen proof gas proof water proof antistatic proof even xray proof Vendor Information Vendor Name DAGO37 Total Sales Member Since 13Account Type Verified Customer protection Escrow Yes Gram Ultraclean 100 Pure Cocaine Product Code Cocaine Availability Stock Qty Add Cart Information Us Delivery Information Privacy Policy Terms Conditions Customer Service Contact Us Returns Site Map Vendor Vendor Account Vendor Register Verify Vendor Account Account Account Order History Wish List Venus Market 2021,none
25,http://hmuidcgzsjlcsxe6rdluskevjtgynhupixpb7g5czmjpuftlhrl42bid.onion/product/6hwaGvSZWMJsFAI4ImYfOyc6KXun0VTT,Buy 10peruvian cocaine free xanax 0514g worldwide shipping Listings View Cart 0 Search Vendor Area FAQ Support Center Drugs 14312Show 14312Benzos 1504Ecstasy 1352Opiods 1055Psychedelics 1684Cannabis 3099Stimulants 3294Dissociatives 777Steroids 405Prescription 900Common Raw Drugs 24default 0Rcs China Suppliers 46Drugs Precursors 33Weight Scale 3Drugs Paraphernalia 6Custom Orders 18Physical Drop 30Civil Softwares 393Show 393Malware 69Bootkits 6Hacked Social Network Database 8Backdoors 9Keyloggers 11Wireless Trackers 1Screen Scrapers 4Mobile forensics tools 2WiFi Jammers 1Tutorials 2223Show 2223eBooks 961Theft 42Carding 192Mining 28Gambling 28Worms 10Dump 102Viruses 19Drugs Production 43Trojans 19Botnets 10Cameras Photography 4Security Technology 4Computers 6Art 1Bribery 1Confidential info 13Show 13Digital 5066Show 5066Cards CVV 329Hacks 374Porn 1780SSN 150Device drivers 17Application software 119Accounts 276Documents 447False Documents 139Exploit kit 27Drop Bank 50Surgical masks 1Security 50System software 56Utilities 29Software forensics tools 2Cash Crypto 4Detectors 1Private Security Guards 1Forgery 138Show 138Network Services 93Show 93VPN 42Hosting 25SOCKS 24Currency 296Show 296Counterfeiting 191Crypto Cash 24Endtoend Encrypted Phones 2Gold 28Show 28Other Jewelry 10Yellow Gold 1Database 280Show 280Email Databases 89Phone Databases 22Messaggers Database 4Hacked Sites Databases 21Logs 24Ransomware 22Surveillance 3Show 3Jewely 2Show 2Watches 2Leaked Documents 12Show 12Tobacco 4Show 4Offshore services 15Show 15Foreign partnerships 2Vendors Equipment 1Show 1Digital Forensics 18Show 18Spy listening Bugging 20day 7Show 7Computer forensics tools 1Intelligence 17Show 17Spam 15HUMINT 1Private Security 10Show 10Covid19 Outbreak 1Show 1Money Laundering 0Show 0Racketeering 2Show 2APT 1Show 1Camgirls 0Show 0Alcohol 1Show 1Electronics 8Show 8Mobile Phones 6Sound Vision 1Shill Marketing 1Show 1Illegal Gambling 1Show 1Diamond Trade 0Show 0Media Influence 2Show 2Corruption 2Show 2Chem Equipment 0Show 0Countersurveillance 0Show 0 BTC 207918USD XMR 12458USD 10peruvian cocaine free xanax 0514gPriceUSDSellerupsndownsSeller locationUnited KingdomShips sellerEuropeShips productWorldwideCategoryStimulantsQuantity stock99972Dead dropNoAvailabilityAvailable05G 1st Class Royal Mail Stealth USD1G 1st Class Royal Mail Stealth USD15G 1st Class Royal Mail Stealth USD2G 1st Class RM USD35G 1st Class RM USD7G 1st Class RM USD14G 1st Class RM 1USDAdd cartView cartDescriptionRefund PolicyWe welcome existing customers look forward serving new customers Dark0de reputation high quality cocaine customer satisfaction see us grow well like always thank customers business listing choice 05g 28g 10high quality preuvian cocaine ship free Xanax orders order greater 2g free viagra plus xanax included ORDERS 2G GET FREE XANAX VIAGRA Stealth priority well known take great care ensure maintained levels Quality product must way work try get hold best refuse anything like think see competitive given service quality offering please enjoy purchase let us know anything questions Customer satisfaction foundation vast amount offline customers online safe Take careNo refunds reships Please contact us problems best resolve within reasonComments 18t Delivery took days vendors faults area live post takes piss getting gear good strong making jittery paranoid clean stuff purchase agains Super fast stealth delivery amazon sticker nice touch Fire product missus enjoyed k NDD usualk NDD NICE GEAR RECOMMENDED THANKS JILLS USE AGAINk NDD NICE GEAR RECOMMENDED THANKS JILLS USE AGAINs came back says everything need know Quality product super fast shippingp Top drawer every level NDD great comms really good product even little extra thrown wont wasting money time anywhere else man around cheees bros Super quick delivery nice stuff Spot onk NICE COKE NDD RELIABLE VENDOR RECOMMENDED TOP BINSk NICE COKE NDD RELIABLE VENDOR WELL RECOMMENDEDh second order happy good gear fast shippingk nicest bit gear iv long time NDD legit vendor appreciate extras got loyal customer percent recommendedp NDD usual gear good ever cheers brok NO1 VENDOR NDD HIGHLY RECOMMENDED BEST COKE AROUND MESSING AROUND GET PAY FAST DELIVERY GREAT COMMUNICATION THANKS LOOKING BACK SOONp NDD arrived Saturday morning sent last post Friday bang alwaysp Bang alwaysNDD cant stress enough quality worke Thought would give guys try usual source wasnt around Im glad Quick delivery good stealth money really decent gear Many thanksp Spot always bro NDDRelated productsupsndownsfree sample uk uk 10quality OFFERING FREE SAMPLES AVAILABLE TIME ROUND ONE PER CUSTOMER PLEASE ask pay shipping part listing welcome existing customers lo United Kingdom Europe USD View stonerdefrancecocaïne colombie 1g Cocaine de colombie 09 excellente qualité tester bsolument France Europe USD View fedex3g high quality cocaine 90 3G High Quality Cocaine 90 Free WWShipping Product Information First Hand Colombian Cocaine High Quality 90 AAA Good Taste COVID19 Potential Delays Shipping Netherlands Worldwide USD View methbusters1gr cocaine fishscale columbian extreme potent AGREED TERMS CONDITIONS PURCHASE PRODUCT Topnotch Quality Colombian Cocaine Imported Columbia Labtested 93 CUTS Top Notch Quality wont find better quality Germany Europe USD View newamsterdam5gr columbian cocaine fishscale pure uncut COLUMBIAN COCAINE PURE UNCUT COKE IMPORTED COLUMBIA LABTESTED 88 BEST 2CB PILLS DARKMARKETS ADRESS FORMAT FULL NAME STREET HOUSE NUMBER CITY STATE Netherlands Europe USD View thebosseu5 grams purest cocaine darknet ever tried purest cocaine world chance Watch Extremely powerfull Best cocaine planet BULK ORDERS PLEASE SEND US MESSAGE orders shi Belgium Worldwide USD View,none
