index,link,text,marker
45,http://pornhubvybmsymdol4iibwgwtkpwmeyd6luq2gxajgjzfjvotyt5zhyd.onion/gif/38204131,Dickforlily boy Girl straight Sex couple fantasy young Lust oui hot Porn Gif Pornhubcom OK looking Upload Photos Videos Upgrade Login Sign Home Porn Videos Categories Live Cams Pornstars Meet Fuck Community Photos GIFs Discover Videos Recommended Hottest Viewed Top Rated Popular Homemade Explore Playlists Channels Random Pornhub Premium Newest Viewers Choice Hottest 11HD Fitness Blonde Teen Loves Creampie Shinaryen 567K views 90 Yesterday 8HD Pinay Couple Enjoys Cozy Night Sweaters impitis 16M views 85 days ago Hottest Recommended 1HD Terminator Resistance Jennifer Sex Scene Nude Mod NaughtyGaming 159K views 85 years ago 7HD Hot morning threesome girlfriend short version Marie Hardon 353K views 91 months ago Recommended Playlists videos Play View Playlist Homemade 59favorites 100 htownswing 126K views videos Play View Playlist WifeGF telling stories 83favorites 100 freak_h 89K views Playlists Channels Moms Teach Sex Rank Limit Rank Channels Trending Searches abbie maley mackenzie jones sheena ryder anouk maze astrid wett gentstudent britni kitten shaiden rogue Discover Categories Popular Alphabetical Number Videos Gay Categories Trending Searches abbie maley mackenzie jones sheena ryder anouk maze astrid wett gentstudent britni kitten shaiden rogue Japanese Mature Hentai Anal Teen 18 MILF Ebony Amateur Lesbian Cartoon Threesome Big Tits Public Transgender OldYoung Big Dick Female Orgasm Creampie Gangbang Masturbation See Discover Pornstars Verified Amateurs Pornstars Male Actors Top Trending James Deen Videos 15B Views Sara Luvv Videos 184M Views Popular Kendra Lust Videos 368M Views Stella Barey Videos 67M Views Viewed Lena Paul Videos 498M Views Melanie Hicks Videos 777M Views Popular Filters Fake Tits Natural Tits Small Tits Huge Tits Red Heads Blondes Brunettes Piercings Tattooed Asian Arab Latin Black Indian White 18 Teens MILFs Mature Discover Community Model Contests Community Feed Top Members Newest Verified Girls Newest Verified Couples Newest Verified Guys Popular Verified Models Online Members Member Search Contests Popular Viewers Choice December SweetDarling FoxyElf papaxmama Arrilast AmateurHomeGirls Flame Jade See Viewed November Leolulu Cory Chase October Danika Mori Jordi El Nino Polla September littlebuffbabe Angela White See Popular Verified LuckyLaney lucylou05 LilMissCumSponge RosePetal32 Ahsoka Tano Goodegirl75 See Popular New Angel Wicky aoidick1124 Sweetieline dutchxthin ViolettOFmaster ShirotoMaskSuperm See Discover Photos Gifs Porn GIFs Top Rated GIFs Viewed GIFs Photo Albums Top Rated Albums Viewed Albums Upload Photos Make GIF Top Rated Gifs Riding cumshot succubus ass Latina top Top Rated Viewed Gifs HotRanet Sentada Carry Light yummy pussy filled cum keeps riding Viewed Top Rated Albums little slut Photos Cosplaying Cutie Photos Top Rated Viewed Albums PlaysKitty hot amateur babe Photos 99 Sara Anne Photos 100 Viewed Popular Tags Tits Ass Pussy Amateur Dick Hot Teen Hentai Sex Boobs Babe Cum Blonde Blowjob Anal Black Brunette Asian MILF Cumshot leaving Pornhubcom ADS PREMIUM PORN HANDLE WELCOME BEST PORN EXPERIENCE EVER FINALLY PORN EXPERIENCE DESERVE Ads Exclusive Content High Quality HD Cancel Anytime Offering exclusive content available Pornhubcom Super affordable 999month Start Free Week Pornhub Premium Go Back leaving Pornhubcom Free day premium access Ads Exclusive Content HD Videos Cancel Anytime Start Watch exclusive video pornhub premium Luckily FREE day access Watch hd video never see ads Claim day free access Watch 1080p video pornhub premium Luckily FREE day access Watch hd video upgrading today get one week free access Ads Exclusive Content HD Videos Cancel Anytime Claim day free access signing today get one week free access Ads Exclusive Content HD Videos Cancel Anytime Claim day free access Offering exclusive content available Pornhubcom DickForLily Boy Girl Straight Sex Couple Fantasy Young Lust Oui Hot Gif 92 votes GIF HTML5 13views Twitter Reddit StumbleUpon Blogger Photo Page Reddit ready Forum BB code GIF link Direct link HTML image Embed codeiframe srchttpswwwpornhubcomembedgif38204131 frameborder0 scrollingno width1280 height720 stylewebkitbackfacevisibility hidden webkittransform scale1iframe video BF CAME BACK ARMY TORE PANTIES FUCKED HARD CUM TITS Tags dickforlily gifs boy girl straight sex fantasy young lust couple best tits gifs amazing pussy lips naughty girl oui hot infatuation gifs Created einaudi_too Comments 1 Login Sign post comment Popular Comments Recent Comments FoxyAleksa weeks ago COOL Reply dateAdd commentMessage Related GIFs View listItem use cookies optimize site functionality give best possible experience Learn OK Ads Traffic Junky Information Sitemap Terms Conditions Privacy Policy DMCA Work Us Content Partners Advertise Webmasters Model Program Press Support Help Content Removal Contact Support FAQ Trust Safety Parental Controls Feedback Discover Pornhub Blog Insights Blog Sexual Wellness Center Mobile Visually Impaired Language English Deutsch Français Español Italiano Português Polski Русский 日本語 Dutch Czech 中文简体 Pornhubcom 2021,bad
46,http://pornhubvybmsymdol4iibwgwtkpwmeyd6luq2gxajgjzfjvotyt5zhyd.onion/users/ttboy248/friends,ttboy248s Friends Free Porn Videos Sex Movies Porno XXX Porn Tube Pussy Porn OK looking Upload Photos Videos Upgrade Login Sign Home Porn Videos Categories Live Cams Pornstars Meet Fuck Community Photos GIFs Discover Videos Recommended Hottest Viewed Top Rated Popular Homemade Explore Playlists Channels Random Pornhub Premium Newest Viewers Choice Hottest 11HD Fitness Blonde Teen Loves Creampie Shinaryen 567K views 90 Yesterday 8HD Pinay Couple Enjoys Cozy Night Sweaters impitis 16M views 85 days ago Hottest Recommended 1HD Terminator Resistance Jennifer Sex Scene Nude Mod NaughtyGaming 159K views 85 years ago 7HD Hot morning threesome girlfriend short version Marie Hardon 353K views 91 months ago Recommended Playlists videos Play View Playlist Homemade 59favorites 100 htownswing 126K views videos Play View Playlist WifeGF telling stories 83favorites 100 freak_h 89K views Playlists Channels Moms Teach Sex Rank Limit Rank Channels Trending Searches abbie maley mackenzie jones sheena ryder anouk maze astrid wett gentstudent britni kitten shaiden rogue Discover Categories Popular Alphabetical Number Videos Gay Categories Trending Searches abbie maley mackenzie jones sheena ryder anouk maze astrid wett gentstudent britni kitten shaiden rogue Japanese Mature Hentai Anal Teen 18 MILF Ebony Amateur Lesbian Cartoon Threesome Big Tits Public Transgender OldYoung Big Dick Female Orgasm Creampie Gangbang Masturbation See Discover Pornstars Verified Amateurs Pornstars Male Actors Top Trending James Deen Videos 15B Views Sara Luvv Videos 184M Views Popular Kendra Lust Videos 368M Views Stella Barey Videos 67M Views Viewed Lena Paul Videos 498M Views Melanie Hicks Videos 777M Views Popular Filters Fake Tits Natural Tits Small Tits Huge Tits Red Heads Blondes Brunettes Piercings Tattooed Asian Arab Latin Black Indian White 18 Teens MILFs Mature Discover Community Model Contests Community Feed Top Members Newest Verified Girls Newest Verified Couples Newest Verified Guys Popular Verified Models Online Members Member Search Contests Popular Viewers Choice December SweetDarling FoxyElf papaxmama Arrilast AmateurHomeGirls Flame Jade See Viewed November Leolulu Cory Chase October Danika Mori Jordi El Nino Polla September littlebuffbabe Angela White See Popular Verified LuckyLaney lucylou05 LilMissCumSponge RosePetal32 Ahsoka Tano Goodegirl75 See Popular New Angel Wicky aoidick1124 Sweetieline dutchxthin ViolettOFmaster ShirotoMaskSuperm See Discover Photos Gifs Porn GIFs Top Rated GIFs Viewed GIFs Photo Albums Top Rated Albums Viewed Albums Upload Photos Make GIF Top Rated Gifs Riding cumshot succubus ass Latina top Top Rated Viewed Gifs HotRanet Sentada Carry Light yummy pussy filled cum keeps riding Viewed Top Rated Albums little slut Photos Cosplaying Cutie Photos Top Rated Viewed Albums PlaysKitty hot amateur babe Photos 99 Sara Anne Photos 100 Viewed Popular Tags Tits Ass Pussy Amateur Dick Hot Teen Hentai Sex Boobs Babe Cum Blonde Blowjob Anal Black Brunette Asian MILF Cumshot leaving Pornhubcom ADS PREMIUM PORN HANDLE WELCOME BEST PORN EXPERIENCE EVER FINALLY PORN EXPERIENCE DESERVE Ads Exclusive Content High Quality HD Cancel Anytime Offering exclusive content available Pornhubcom Super affordable 999month Start Free Week Pornhub Premium Go Back leaving Pornhubcom Free day premium access Ads Exclusive Content HD Videos Cancel Anytime Start Watch exclusive video pornhub premium Luckily FREE day access Watch hd video never see ads Claim day free access Watch 1080p video pornhub premium Luckily FREE day access Watch hd video upgrading today get one week free access Ads Exclusive Content HD Videos Cancel Anytime Claim day free access signing today get one week free access Ads Exclusive Content HD Videos Cancel Anytime Claim day free access Offering exclusive content available Pornhubcom ttboy248 San Francisco United States 1subscribers 2friends 2videos watched Stream Videos Playlists Photos Add Friend Subscribe Recent Friendships Recent Friendships Recent Users Username Friends Showing friends sloppycouple89 Subscribe Add Friend Report User hayleyHalo Subscribe Add Friend Report User mylittlesecretsxo Subscribe Add Friend Report User kaaylovelacexo Subscribe Add Friend Report User Keri Love Subscribe Add Friend Report User 1forallandallfor1 Subscribe Add Friend Report User singsong72 Subscribe Add Friend Report User KhloeKink Subscribe Add Friend Report User Creamysquirtlover Subscribe Add Friend Report User Claudia_mystic Subscribe Add Friend Report User Valentina Nappi Subscribe Add Friend Report User elsadingo Subscribe Add Friend Report User WPR Subscribe Add Friend Report User Slaaneshi Subscribe Add Friend Report User so_close Subscribe Add Friend Report User drgordonfreeman09 Subscribe Add Friend Report User queenanna Subscribe Add Friend Report User Nightsong Subscribe Add Friend Report User Marlen doll Subscribe Add Friend Report User xcassandrax Subscribe Add Friend Report User Leina Vit Subscribe Add Friend Report User tono2989 Subscribe Add Friend Report User SmellsLikeUpSexy Subscribe Add Friend Report User marceloturn Subscribe Add Friend Report User DaisiMae Subscribe Add Friend Report User Littlealexx69 Subscribe Add Friend Report User heidiL Subscribe Add Friend Report User SkyleneClouds Subscribe Add Friend Report User collegecutie23 Subscribe Add Friend Report User love4girls Subscribe Add Friend Report User namizo Subscribe Add Friend Report User smashpuss_237 Subscribe Add Friend Report User BELLASEXXYASS Subscribe Add Friend Report User montanalover1990 Subscribe Add Friend Report User EbonyLuver13 Subscribe Add Friend Report User bobbukbuk Subscribe Add Friend Report User brenda1217 Subscribe Add Friend Report User jahsiah45 Subscribe Add Friend Report User yourgoals Subscribe Add Friend Report User babbbs Subscribe Add Friend Report User Latia Del Riviero Subscribe Add Friend Report User Bryci Subscribe Add Friend Report User fuckmyfacedaddy Subscribe Add Friend Report User LustingStar Subscribe Add Friend Report User Xemsx69 Subscribe Add Friend Report User mariabrink14 Subscribe Add Friend Report User sitonmyface85 Subscribe Add Friend Report User LittleHer Subscribe Add Friend Report User BigTittyTabby Subscribe Add Friend Report User Sluttymama1992 Subscribe Add Friend Report User TakiandJ Subscribe Add Friend Report User Selena Banks Subscribe Add Friend Report User HoneyIverson Subscribe Add Friend Report User yellowbull Subscribe Add Friend Report User H0neyB Subscribe Add Friend Report User iMrStrokes Subscribe Add Friend Report User Subscribe Add Friend Report User Naughtysoulmates Subscribe Add Friend Report User Diane Andrews Subscribe Add Friend Report User Jooyunmonea Subscribe Add Friend Report User braziliantranny Subscribe Add Friend Report User AznCassanova Subscribe Add Friend Report User Cutechocolatebunny Subscribe Add Friend Report User Olivia Angel Subscribe Add Friend Report User Obeymenow Subscribe Add Friend Report User bbwarse2worship Subscribe Add Friend Report User Thickyminaj Lilprincess679 Subscribe Add Friend Report User CherCandi Subscribe Add Friend Report User SuziQ13 Subscribe Add Friend Report User GabbaVonKush Subscribe Add Friend Report User bicuriousfem Subscribe Add Friend Report User Mrs Mischief Subscribe Add Friend Report User DaNiceone Subscribe Add Friend Report User TastyTiffyHTX Subscribe Add Friend Report User raychisonfire Subscribe Add Friend Report User BMC2 Subscribe Add Friend Report User yin_yang1997 Subscribe Add Friend Report User missladysuckscock Subscribe Add Friend Report User clairex Subscribe Add Friend Report User blairpromo Subscribe Add Friend Report User VerenaCG Subscribe Add Friend Report User HornyCrystal Subscribe Add Friend Report User AshleyTX22 Subscribe Add Friend Report User daniisbloed OMGAmateurs Subscribe Add Friend Report User Vanessa Cox Subscribe Add Friend Report User evyreed Subscribe Add Friend Report User RayneLea Subscribe Add Friend Report User PUSH_505 Subscribe Add Friend Report User ConPassion Subscribe Add Friend Report User kandk8385 Subscribe Add Friend Report User diosaera Subscribe Add Friend Report User Lexi loveeee Subscribe Add Friend Report User ChocolateKen Subscribe Add Friend Report User LexiLambeaux Subscribe Add Friend Report User yazzydee420 Subscribe Add Friend Report User eveass Subscribe Add Friend Report User mallorythewhore Subscribe Add Friend Report User AppleRosePanda Subscribe Add Friend Report User Load Gender Male Last Login years ago Relationship Status Single Interested Girls Hometown Los Angeles CA City San Francisco Country United States Occupation Professional pussy eater Profile Views 9Videos Watched 2Achievements 28View Playlists 1View videos Play View Playlist favorites 5favorites 60 ttboy248 views Pornstar Subscriptions 227View Cameron Dee Mya Minx Emma Lovett Sylvia Chrystall Belle Knox Pamela Sanchez Luna Leve Delirious Hunter Cam Model Subscriptions 5View BBW big tits love twerk tease make cum Emirose Offline Naughty Milf full energy ready hot action Alhana Offline newest way connect fans Stop say hi Brickbabe Offline Im girl mom warned call sex kitten RachelStarr Offline 6x award winning webcam model seen tv short films EmmaLovett Offline Subscribers 1038View jordangeorge1998 isthiscameraon40pa jackson7375 uummm2 Janelle26xo almendra_y_christ voy101 MarleeXO420 Subscriptions 2596View ourdirtylilsecret SuCMaiKhoC fuckmyfacedaddy rose1026 brenda1217 Xemsx69 rin_miya Sluttymama1992 Channel Subscriptions 94View Perv Therapy Rank Sis Swap Rank Made Porn Rank Hijab Hookup Rank Perv Doctor Rank FreeUse Fantasy Rank Report User use cookies optimize site functionality give best possible experience Learn OK Ads Traffic Junky Information Sitemap Terms Conditions Privacy Policy DMCA Work Us Content Partners Advertise Webmasters Model Program Press Support Help Content Removal Contact Support FAQ Trust Safety Parental Controls Feedback Discover Pornhub Blog Insights Blog Sexual Wellness Center Mobile Visually Impaired Language English Deutsch Français Español Italiano Português Polski Русский 日本語 Dutch Czech 中文简体 Pornhubcom Notice Leaving Pornhub page youre trying access part Pornhub safety privacy Pornhub account remember never enter password site pornhubcom pornhubpremiumcom Continue external site Go Back Warning Link May Unsafe page trying access official Pornhub site may dangerous safety privacy link disabled Close,bad
47,http://pornhubvybmsymdol4iibwgwtkpwmeyd6luq2gxajgjzfjvotyt5zhyd.onion/users/starboypink,StarBoyPinks Profile Pornhubcom OK looking Upload Photos Videos Upgrade Login Sign Home Porn Videos Categories Live Cams Pornstars Meet Fuck Community Photos GIFs Discover Videos Recommended Hottest Viewed Top Rated Popular Homemade Explore Playlists Channels Random Pornhub Premium Newest Viewers Choice Hottest 11HD Fitness Blonde Teen Loves Creampie Shinaryen 567K views 90 Yesterday 8HD Pinay Couple Enjoys Cozy Night Sweaters impitis 16M views 85 days ago Hottest Recommended 1HD Terminator Resistance Jennifer Sex Scene Nude Mod NaughtyGaming 159K views 85 years ago 7HD Hot morning threesome girlfriend short version Marie Hardon 353K views 91 months ago Recommended Playlists videos Play View Playlist Homemade 59favorites 100 htownswing 126K views videos Play View Playlist WifeGF telling stories 83favorites 100 freak_h 89K views Playlists Channels Moms Teach Sex Rank Limit Rank Channels Trending Searches abbie maley mackenzie jones sheena ryder anouk maze astrid wett gentstudent britni kitten shaiden rogue Discover Categories Popular Alphabetical Number Videos Gay Categories Trending Searches abbie maley mackenzie jones sheena ryder anouk maze astrid wett gentstudent britni kitten shaiden rogue Japanese Mature Hentai Anal Teen 18 MILF Ebony Amateur Lesbian Cartoon Threesome Big Tits Public Transgender OldYoung Big Dick Female Orgasm Creampie Gangbang Masturbation See Discover Pornstars Verified Amateurs Pornstars Male Actors Top Trending James Deen Videos 15B Views Sara Luvv Videos 184M Views Popular Kendra Lust Videos 368M Views Stella Barey Videos 67M Views Viewed Lena Paul Videos 498M Views Melanie Hicks Videos 777M Views Popular Filters Fake Tits Natural Tits Small Tits Huge Tits Red Heads Blondes Brunettes Piercings Tattooed Asian Arab Latin Black Indian White 18 Teens MILFs Mature Discover Community Model Contests Community Feed Top Members Newest Verified Girls Newest Verified Couples Newest Verified Guys Popular Verified Models Online Members Member Search Contests Popular Viewers Choice December SweetDarling FoxyElf papaxmama Arrilast AmateurHomeGirls Flame Jade See Viewed November Leolulu Cory Chase October Danika Mori Jordi El Nino Polla September littlebuffbabe Angela White See Popular Verified LuckyLaney lucylou05 LilMissCumSponge RosePetal32 Ahsoka Tano Goodegirl75 See Popular New Angel Wicky aoidick1124 Sweetieline dutchxthin ViolettOFmaster ShirotoMaskSuperm See Discover Photos Gifs Porn GIFs Top Rated GIFs Viewed GIFs Photo Albums Top Rated Albums Viewed Albums Upload Photos Make GIF Top Rated Gifs Riding cumshot succubus ass Latina top Top Rated Viewed Gifs HotRanet Sentada Carry Light yummy pussy filled cum keeps riding Viewed Top Rated Albums little slut Photos Cosplaying Cutie Photos Top Rated Viewed Albums PlaysKitty hot amateur babe Photos 99 Sara Anne Photos 100 Viewed Popular Tags Tits Ass Pussy Amateur Dick Hot Teen Hentai Sex Boobs Babe Cum Blonde Blowjob Anal Black Brunette Asian MILF Cumshot leaving Pornhubcom ADS PREMIUM PORN HANDLE WELCOME BEST PORN EXPERIENCE EVER FINALLY PORN EXPERIENCE DESERVE Ads Exclusive Content High Quality HD Cancel Anytime Offering exclusive content available Pornhubcom Super affordable 999month Start Free Week Pornhub Premium Go Back leaving Pornhubcom Free day premium access Ads Exclusive Content HD Videos Cancel Anytime Start Watch exclusive video pornhub premium Luckily FREE day access Watch hd video never see ads Claim day free access Watch 1080p video pornhub premium Luckily FREE day access Watch hd video upgrading today get one week free access Ads Exclusive Content HD Videos Cancel Anytime Claim day free access signing today get one week free access Ads Exclusive Content HD Videos Cancel Anytime Claim day free access Offering exclusive content available Pornhubcom StarBoyPink London Canada subscriber friend videos watched Stream Videos Playlists Photos Add Friend Subscribe Login Sign post Post Video Photo Playlist Gifs View Activity View Activity Posts View View Videos Photos Playlists Posts Achievements StarBoyPink subscribed users Yesterday cydstvincent StarBoyPink subscribed users week ago Johnny Castle StarBoyPink subscribed pornstars week ago Rank Tt Boy Rank Rod Fontana Rank Mr Pete Rank Johnny Castle StarBoyPink favorited videos week ago 24HD Big Tit Blonde MILF Gets Big Ass Fucked KBeech 451K views 74 years ago 16Talk Dirty Scene Dreamland Video 629K views 76 years ago 32Amateur Auditions Scene Notorious 59K views 81 years ago StarBoyPink favorited videos month ago 1Horny red head gay fun mate Bel Ami Online 177K views 93 years ago StarBoyPink favorited videos month ago 36HD Catcher Raw Scene Factory Video 168K views 88 years ago 38HD Catcher Raw Scene Factory Video 277K views 84 years ago StarBoyPink favorited videos month ago 28Hungry Seed Scene Factory Video 101K views 76 years ago 18Deep Throat Cum Scene Factory Video 221K views 79 years ago 33Deep Throat Cum Scene Factory Video 114K views 82 years ago StarBoyPink subscribed pornstars month ago Rank Dallas Preston StarBoyPink subscribed users month ago Dallas Preston StarBoyPink added new videos playlist month ago trans 11Hot Sex Trans Man Jock Pussy 18M views 78 years ago 27My Dream Shemale Scene Final 886K views 86 years ago 21Sluts Nuts Scene Trans Sex Films 618K views 76 years ago StarBoyPink subscribed users months ago AlphaMaleXXL StarBoyPink unlocked new achievement year old account months ago Thumbs Thumbs StarBoyPink subscribed users months ago Dustin Daring StarBoyPink subscribed users months ago Jake Trousersnake Silica7 StarBoyPink subscribed users months ago andy peyton StarBoyPink subscribed pornstars months ago Rank Robby Echo StarBoyPink subscribed users months ago ellilovesu StarBoyPink subscribed pornstars months ago Rank Fausto Moreno StarBoyPink subscribed pornstars months ago Rank David Luger StarBoyPink subscribed pornstars months ago Rank Jason Steel Load Gender None Last Login Yesterday Relationship Status Single City London Country Canada Profile Views Videos Watched Achievements 17View Playlists 5View videos Play View Playlist Breeders 0favorites 0 StarBoyPink views videos Play View Playlist trans 0favorites 0 StarBoyPink views videos Play View Playlist Handy Boys 0favorites 0 StarBoyPink views videos Play View Playlist Jack Hammer 0favorites 0 StarBoyPink views Pornstar Subscriptions 166View Alan Marcelo Alex Legend Rob Diesel Enzo Lorenzo Billy Hart Marc Rose Jon Dough Jessy Jones Friends 1View bubblebumbutt Subscribers 1View KishaSPB Subscriptions 65View cydstvincent Johnny Castle Dallas Preston AlphaMaleXXL Dustin Daring Valdemar Hot Silica7 Jake Trousersnake Channel Subscriptions 26View Sinful Gay Teens Rank Factory Video Rank See Fuck Rank JM Productions Rank Hot Guys Fuck Rank Doctor Twink Rank Report User Youre subscribe Fan Club Becoming Fan supporting model continue creating amazing content may even get additional exclusive content would listed Plus chosen include Report Perks FANCLUB_PRICE Become Fan PRICE_DISCLAIMER prices include VAT charge appear statement PROBILLERCOM 855232All purchases final US unless otherwise stated See terms conditions Enter last digits credit card associated account FANCLUB_PRICE Become Fan PRICE_DISCLAIMER prices include VAT charge appear statement PROBILLERCOM 855232All purchases final US unless otherwise stated See terms conditions Login Signup Logging Remember computer recommended public shared computers FANCLUB_PRICE Become Fan PRICE_DISCLAIMER prices include VAT TwoStep Verification Logging text message code sent Enter code Verify Didnt receive code Resend Dont phone Contact Support signing agree Terms Conditions FANCLUB_PRICE Become Fan PRICE_DISCLAIMER prices include VAT sure want stop becoming Fan dont want leave Yes please let leave restart purchase leave Amazing Youre big Fan actually wanted sign 2nd time Congratulations youre fan dont worry arent charging want support send tip Send tip Fan Club currently disabled Fan Club Please check back future become Fan Ok Understood Fanclub membership Card Number Card Number required MM YY Expiry Date invalid CVC Security Code CVC required First Name First Name required Last Name Last Name required ZipPostal Zip Code required Saved Total PRICE_DISCLAIMER Please note charges US unless otherwise specified charges appear statement discretely Probillercom 8552329555 prices include VAT completing transaction certify years older accept Privacy Policy Terms Conditions Contact customer support PROBILLERCOM use cookies optimize site functionality give best possible experience Learn OK Ads Traffic Junky Information Sitemap Terms Conditions Privacy Policy DMCA Work Us Content Partners Advertise Webmasters Model Program Press Support Help Content Removal Contact Support FAQ Trust Safety Parental Controls Feedback Discover Pornhub Blog Insights Blog Sexual Wellness Center Mobile Visually Impaired Language English Deutsch Français Español Italiano Português Polski Русский 日本語 Dutch Czech 中文简体 Pornhubcom Notice Leaving Pornhub page youre trying access part Pornhub safety privacy Pornhub account remember never enter password site pornhubcom pornhubpremiumcom Continue external site Go Back Warning Link May Unsafe page trying access official Pornhub site may dangerous safety privacy link disabled Close,bad
