index,link,text,marker
0,http://onionwsoiu53xre32jwve7euacadvhprq2jytfttb55hrbo3execodad.onion/2017/03/21/two-dutch-brothers-arrested-ordering-explosives-undercover-fbi-agent/,Two Dutch Brothers Arrested Ordering Explosives Undercover FBI Agent Onion Web Explore Popular Posts Access Darknet buy Dark web Tour Darkweb Markets Mustread Dont Get Scammed PGP Keys Encrypted Messages use Monero buy online Darknet VS Darkweb Difference Topics ViewallTopics Dark web Drugs Bitcoin Leaks Altcoins Trading Markets Hacking Security DeepDotWeb Guides Reviews Interviews Arrests Popular Spaces Onion Web Darknet Dummies Dr Greenthumb Wheres Mind Doggystyle Reviews Rich 30s High Jones Discover MustVisit DarkRise Darknet Doesnt Fail Darkguard Verify URL dReviews dDarknetStars Recon Vendor Database Reviews Coming soon Dread DiscoverAll Markets Ranking Darknet Marketplaces Darknet Forums Darknet Shops Dead Sites Actions Contact SubmitmyStory AddaSite Donate PGP Mirrors Canary Related Log Sign Account Spaces Topics Contact Us Two Dutch Brothers Arrested Ordering Explosives Undercover FBI Agent DeepDotWeb DeepDotWeb Mar Two brothers 22yearold Ali 19yearold Yusuf arrested Netherlands ordering grams Semtex plastic explosive dark web explosive mostly used commercial blasting demolition certain military applications However Semtex became popular tool terrorists paramilitary groups since extremely difficult detect recentlyAccording official court documents two brothers ordered grams explosives dark web provided home address Amersfoort deliveryAlis trial could expected start Tuesday Yusuf still pretrial detention men suspects case investigation still ongoing prosecution claims two brothers planning attack visit AmsterdamThe suspects ordered explosives three detonators September dark net vendor residing United States brothers communicated via marketplaces chat platform seller agreed dangerous goods delivered via ordinary parcel service home address However Ali Yusuf know seller undercover FBI agent two suspects placed order vendor Bureau agent immediately alerted Dutch law enforcement authorities transferred details transaction including type explosives chat messages delivery details parcelSince seller undercover agent sent fake explosives two suspects delivered home address Amersfoort Despite fact defendants receive real Semtex still prosecuted crimes Soon brothers received package Dutch law enforcement authorities arrested searched house investigators found firearm cash believe belong AliThe Public Prosecutor OM initially suspected two defendants planning terrorist attack However received professional advice expert withdrew chargegrams Semtex little amount explosives much arms expert Ton Hartink said statement blow car pieces small truck cannot blow whole Schiphol Airport exampleDefense reacted swiftly experts statement possibility terrorist attackMy client already indicated innocence never would terrorism fixed immediately also adopted start magistrate Cem Polat said defending Ali main suspect caseThe Dutch OM updated suspects accusations recently longer charge preparatory acts terrorist attack violation explosive laws country However remains question whether evidence stand place trial Although since FBI interfered whole transaction could get evidence rejected judgeThe defense suspects incitement case since agent Federal Bureau Investigation actively offered illicit goods defendants played along brothers approached Polat claimed FBI agent personally sold Semtex three detonators defendants true evidence gathered Bureau could rejected court According lawyer would explain agency could transfer details transaction messages Dutch authorities quicklyIn America method would legal Netherlands rules different Polat said case talk incitementAccording Public Prosecutor evidence suggesting brothers would order explosives internet another sourceWhat know course know OM said statementThe way prosecution could charge two defendants conspiracy commit terrorist attacks would get strong evidence brothers ordering explosives sources Previous article Research Reveals Australia Emerging Leader Darknet Next article 1Investigations Started Customer Author DeepDotWeb Without doubt predecessor TheOnionWeb DeepDotWeb news site dedicated events surrounding dark web featuring interviews reviews darknet markets Tor hidden services legal actions privacy bitcoin related news Articles Donate Bitcoin 1NDqCHu3C8rjgfJs34TgZ8BKa2VsuduRMC Monero 46UwFaceGmLheF9qRq6EjSAmuJF2P5KVfXinVM4NEr6DJhxAWW2j2D79BUTe1HMnTTNt3cbz6QKUEEhmnaZVrMzMKaAtgCW Comments Write comment March 21 9am hhyyhhyyhhyy people stupid right brain would order guns explosives darknet lol got chance getting local corer Reply comment reply comment read guidelines X Comment text Post Comment March 21 5am HkZ Ali Yusuf yep two Dutch brothers sure nothing see refugees welcome Reply comment reply comment read guidelines X Comment text Post Comment March 22 3am FD Yup definitely typical Dutch boys playing toys Reply comment reply comment read guidelines X Comment text Post Comment Write Comment view comments Read write comment Read guidelines Comment text Post Comment Advertise Darknet Sites Featured Sites Torrez 100 CannaHome 100 Abacus Market 97 Markets Revolution Market 98 Vice City 100 Dark0de 95 Cannazon 74 ASAP Asean 100 Cartel 86 Archetyp Market 97 Tor2door 100 Monopoly 94 Versus 98 Tor Market NZ 100 HYDRA RU 76 Vendor Shops new shit 99 WeAreAmsterdam 95 CharlieUK 100 French Connection 100 ThePirateIsland 93 TomJerry 100 Medicine Man UK 100 SmokersCo 100 Auspride 100 Digital Thrift Shop Pl 100 HeinekenExpress 100 o3shop RU 100 Social Dread 92 Majestic Garden 86 HUB 57 Deutschland im Deep Web DE 85 Cebulka PL 90 Services News Directories LARGEST Markets December TOP number products Full Ranking Torrez Dark0de Versus ASAP Asean Cartel Bitcoin Today High Low Monero Today High Low Latest Comments Authentik2900 Site à éviter commande de c faite chez eux jamais reçu une arnaque TomJerrys profile mawosx low contact waiting days parcel 50g coco contact pr WeAreAmsterdams profile foster6la biggest greatest Torrezs profile Fidel Dam Im cannabis plug left Cannazons profile 14characters Looking make Make Money Looking Job Post Find Job Deep Web krazydversa ey ross aim chile espero que algun dia encuentres la libertad fr Life Box kotorfan21 anyone know actual Nonscams registeredreal passports Newbies Spaces space MahNemzJeff loyal Torguard user going years hands TorGuard VPN Review FUCKOFF MOTHER SCAM WEBSITE DarkFox Markets profile oshit Allowing users finalize orders withdraw funds White House Markets profile Tag Cloud Bitcoin Darknet Dark Web Drug Sentenced Arrested Man News Tor Drugs Silk Road Prison Market German years Price Busted Cybercrime Net Markets Cannabis Bitcoin Monero Forum Bitcoin,bad
1,http://rhkqkwzdpwj3zwlzirzsatolyw7chmvtyfrjukom64cfk54zabi5ooqd.onion/index.php?PHPSESSID=3p1ms4cbnoe5u9pb7sl40jq5k8&topic=68.msg154,SELLER NEWUSED FIRE ARMSAMMUNITIONS EXPLOSIVES Free Zone Community Open Discussion Forum Welcome Guest Please login register Hour Day Week Month Forever Login username password session length News Home Help Search Login Register Free Zone Community General Category General Discussion SELLER NEWUSED FIRE ARMSAMMUNITIONS EXPLOSIVES previous next Print Pages 1 Go Author Topic SELLER NEWUSED FIRE ARMSAMMUNITIONS EXPLOSIVES Read times thomsondeals Sr Member Posts SELLER NEWUSED FIRE ARMSAMMUNITIONS EXPLOSIVES October 11 2021 0830pm Contact us onthomsondeals0007protonmailcomWe top legit suppliers fairly used brand new Firearms Firearms comes along magasins Box tools also provide ammunitionswe specialized 9mm guns asThe Glock 30SFThe Glock 42 Glock 22 Glock 21 Glock 27 Glock 19 Glock 20 Glock 17we also specialized various gunsSig Sauer Ak 47BerretaRugerwe alot stockwe deal serious clients games recent pictures gundont contact us request pictures order also send pictures serious clientsalso discount bulk orders onlyContact Infos Contact us onthomsondeals0007protonmailcomTelegramlegitplugcompany Logged thomsondeals Sr Member Posts SELLER NEWUSED FIRE ARMSAMMUNITIONS EXPLOSIVES Reply November 02 2021 1129am Hello youre interested products services hit infos Contact us onthomsondeals0007protonmailcomGeneral supportthomsongeneraldeals0007protonmailcomText4603566535WhatsApp5305868494TELEGRAMlegitplugcompanyWickr ID Legitplug0008Try us Best legit transaction Thanks Logged Print Pages 1 Go previous next Free Zone Community General Category General Discussion SELLER NEWUSED FIRE ARMSAMMUNITIONS EXPLOSIVES SMF 2 SMF 2021 Simple Machines XHTML RSS WAP2 Page created seconds queries,bad
2,http://onionwsoiu53xre32jwve7euacadvhprq2jytfttb55hrbo3execodad.onion/2018/08/05/more-details-revealed-in-the-dublin-explosives-case/,Details Revealed Dublin Explosives Case Onion Web Explore Popular Posts Access Darknet buy Dark web Tour Darkweb Markets Mustread Dont Get Scammed PGP Keys Encrypted Messages use Monero buy online Darknet VS Darkweb Difference Topics ViewallTopics Dark web Drugs Bitcoin Leaks Altcoins Trading Markets Hacking Security DeepDotWeb Guides Reviews Interviews Arrests Popular Spaces Onion Web Darknet Dummies Dr Greenthumb Wheres Mind Doggystyle Reviews Rich 30s High Jones Discover MustVisit DarkRise Darknet Doesnt Fail Darkguard Verify URL dReviews dDarknetStars Recon Vendor Database Reviews Coming soon Dread DiscoverAll Markets Ranking Darknet Marketplaces Darknet Forums Darknet Shops Dead Sites Actions Contact SubmitmyStory AddaSite Donate PGP Mirrors Canary Related Log Sign Account Spaces Topics Contact Us Details Revealed Dublin Explosives Case DeepDotWeb DeepDotWeb Aug According information recently revealed trial Irelands notorious Special Criminal Court United States Federal Bureau Investigation reportedly posed firearm explosive dealers attempt attract buyers posed significant threats national security lives others September 2016 undercover FBI agents received message individual wanted handguns grenades plastic explosivesDeepDotWeb covered story Gardai forces Dublin revealed FBI played essential role investigating three suspected Irish Republican Army members allegedly attempted purchase weapons darknet time Gardai revealed minor details either attempt preserve potential FBI undercover investigator darknet simply due lack information reached Dublin Gardai spokesperson timeHowever following recent arrest police apprehended defendants guns drawn crowd people outside hospital subsequent nonjury court proceeding prosecutor revealed several pieces information shed light questions raised initial press announcement majority unknown information surrounded FBIs involvement case Gardai initially announced FBI monitoring darknet potential threatsThe phrase monitoring darknet often meant something completely different passive act monitoring One recent example manifested case former GP attempting hire hitman Crimebay Chechen Mob man according court records allegedly used fake murderforhire site attempt financial advisor murdered UKs National Crime Agency announced caught man monitoring activity site Although casual observer might believe law enforcement simply watched site wouldbe murderers experience know variant watching monitoring site would allow law enforcement collect intel without either seizing server running murderforhire site gaining entry backdoorSince NCA statement revealed one comments accurately described investigation former GP Gardai revealed FBI learned suspected IRA member reached darknet vendor Alphabay left piece information vital story ran Alphabay vendor account advertised explosivesThose skeptical FBIs methods investigating darknet vendors likely knew FBI somehow backdoored Alphabay watch customers specific explosives vendor recent trial court heard FBI passively observed suspected IRA member attempting buy explosives Alphabay instead FBI witness revealed weapons account controlled undercover FBI agent startAlthough news surprise many role played FBI much impact case public led believe Previous article Young Drug Buyers Arrested Austrian Investigation Next article NCA Fentanyl Investigation Goes UK Dealers Product Author DeepDotWeb Without doubt predecessor TheOnionWeb DeepDotWeb news site dedicated events surrounding dark web featuring interviews reviews darknet markets Tor hidden services legal actions privacy bitcoin related news Articles Donate Bitcoin 1NDqCHu3C8rjgfJs34TgZ8BKa2VsuduRMC Monero 46UwFaceGmLheF9qRq6EjSAmuJF2P5KVfXinVM4NEr6DJhxAWW2j2D79BUTe1HMnTTNt3cbz6QKUEEhmnaZVrMzMKaAtgCW Comments Write comment Write Comment view comments Read write comment Read guidelines Comment text Post Comment Advertise Darknet Sites Featured Sites Torrez 100 CannaHome 100 Abacus Market 97 Markets Revolution Market 98 Vice City 100 Dark0de 95 Cannazon 74 ASAP Asean 100 Cartel 86 Archetyp Market 97 Tor2door 100 Monopoly 94 Versus 98 Tor Market NZ 100 HYDRA RU 76 Vendor Shops new shit 99 WeAreAmsterdam 95 CharlieUK 100 French Connection 100 ThePirateIsland 93 TomJerry 100 Medicine Man UK 100 SmokersCo 100 Auspride 100 Digital Thrift Shop Pl 100 HeinekenExpress 100 o3shop RU 100 Social Dread 92 Majestic Garden 86 HUB 57 Deutschland im Deep Web DE 85 Cebulka PL 90 Services News Directories LARGEST Markets December TOP number products Full Ranking Torrez Dark0de Versus ASAP Asean Cartel Bitcoin Today High Low Monero Today High Low Latest Comments Authentik2900 Site à éviter commande de c faite chez eux jamais reçu une arnaque TomJerrys profile mawosx low contact waiting days parcel 50g coco contact pr WeAreAmsterdams profile foster6la biggest greatest Torrezs profile Fidel Dam Im cannabis plug left Cannazons profile 14characters Looking make Make Money Looking Job Post Find Job Deep Web krazydversa ey ross aim chile espero que algun dia encuentres la libertad fr Life Box kotorfan21 anyone know actual Nonscams registeredreal passports Newbies Spaces space MahNemzJeff loyal Torguard user going years hands TorGuard VPN Review FUCKOFF MOTHER SCAM WEBSITE DarkFox Markets profile oshit Allowing users finalize orders withdraw funds White House Markets profile Tag Cloud Bitcoin Darknet Dark Web Drug Sentenced Arrested Man News Tor Drugs Silk Road Prison Market German years Price Busted Cybercrime Net Markets Cannabis Bitcoin Monero Forum Bitcoin,bad
3,http://onionwsoiu53xre32jwve7euacadvhprq2jytfttb55hrbo3execodad.onion/2018/11/16/dublin-man-sentenced-to-prison-in-alphabay-explosives-case/,Dublin Man Sentenced Prison Alphabay Explosives Case Onion Web Explore Popular Posts Access Darknet buy Dark web Tour Darkweb Markets Mustread Dont Get Scammed PGP Keys Encrypted Messages use Monero buy online Darknet VS Darkweb Difference Topics ViewallTopics Dark web Drugs Bitcoin Leaks Altcoins Trading Markets Hacking Security DeepDotWeb Guides Reviews Interviews Arrests Popular Spaces Onion Web Darknet Dummies Dr Greenthumb Wheres Mind Doggystyle Reviews Rich 30s High Jones Discover MustVisit DarkRise Darknet Doesnt Fail Darkguard Verify URL dReviews dDarknetStars Recon Vendor Database Reviews Coming soon Dread DiscoverAll Markets Ranking Darknet Marketplaces Darknet Forums Darknet Shops Dead Sites Actions Contact SubmitmyStory AddaSite Donate PGP Mirrors Canary Related Log Sign Account Spaces Topics Contact Us Dublin Man Sentenced Prison Alphabay Explosives Case DeepDotWeb DeepDotWeb Nov Dublin man sentenced five years prison membership unlawful organization connection Alphabay explosives case codefendants earlier court appearance found guilty charge ultimately left courtroom free menMs Justice Isobel Kennedy Special Criminal Court sentenced Jonathan Hawthorn 45 five years prison membership unlawful organisation styling Irish Republican Army hearing July 2018 threejudge court found Hawthorn guilty Irish Republican Army membership court allowed codefendantsJames Geraghty 61 Donal OCeallaigh 33to leave courtroom without conviction even though court acknowledged men role purchase importation plastic explosives United StatesThe case began Federal Bureau Investigation received message customer Alphabay inquiring listings Semtex buyer FBI agent told law enforcement Ireland using account handle MeatCleaver contact weapons explosives vendor account Alphabay darkweb marketplace vendor account MeatCleaver later learned served honeypot Federal Bureau Investigation used account catch potentially dangerous offenders used Alphabay search firearms various explosive devices Even back many people knew majority easily accessible gun dealers darkweb actually law enforcement agents hiding behind seized original accountsAfter reaching deal undercover FBI Special Agent MeatCleaver asked Special Agent ship package Mr Gerathy address belonged Geraghty Dolphins Barn FBI notified law enforcement Ireland gave time prepare case people living house associating Geraghty set surveillance nearby vantage points spotted three men various times inside Geraghtys house Although Geraghty lived Dolphins Barn address men spent significant amount time house Geraghty outside house wellMeatCleaver according information provided FBI ordered plastic explosive Semtex handgun FSoviet fragmentation grenade rounds ammunition buyer also asked obtaining explosives vendor account advertised Alphabay vendor profile Special Agent running account told unsuspecting buyer shipped products package toys children information along everything else undercover agent told MeatCleaver forwarded law enforcement IrelandSpecial units law enforcement Dublin prepared arrival dummy package opened checked package anything else needed remove lacked anything could add prepared controlled delivery shipping service DHL took package Geraghtys house Law enforcement officers placed strategic positions could photograph person received package see windows watch one individuals inside house open packageWhen law enforcement officers delivered package Hawthorn answered door signed package opened minutes later OCeallaigh Geraghty present time men saw Hawthorn receive package open Hawthorn removed fake explosives ammunition firearm placed bag left house Later day police arrested three men outside hospital Hawthorn bag person contained fake explosives pistol caught weapons helped conviction court heard Hawthorns refusal answer questions considered judgement OCeallaigh Geraghty worked court answered questions authorities throughout ordealMs Justice Isobel Kennedy sentenced Hawthorn five years prison considered sentencing maximum sentence allowed decided knew would detrimental impact family Previous article Another Drug Smuggler Arrested Johnny Cash Case Ger Next article Europol report Internet Organised Crime Threat Assessmen Author DeepDotWeb Without doubt predecessor TheOnionWeb DeepDotWeb news site dedicated events surrounding dark web featuring interviews reviews darknet markets Tor hidden services legal actions privacy bitcoin related news Articles Donate Bitcoin 1NDqCHu3C8rjgfJs34TgZ8BKa2VsuduRMC Monero 46UwFaceGmLheF9qRq6EjSAmuJF2P5KVfXinVM4NEr6DJhxAWW2j2D79BUTe1HMnTTNt3cbz6QKUEEhmnaZVrMzMKaAtgCW Comments Write comment Write Comment view comments Read write comment Read guidelines Comment text Post Comment Advertise Darknet Sites Featured Sites Torrez 100 CannaHome 100 Abacus Market 97 Markets Revolution Market 98 Vice City 100 Dark0de 95 Cannazon 74 ASAP Asean 100 Cartel 86 Archetyp Market 97 Tor2door 100 Monopoly 94 Versus 98 Tor Market NZ 100 HYDRA RU 76 Vendor Shops new shit 99 WeAreAmsterdam 95 CharlieUK 100 French Connection 100 ThePirateIsland 93 TomJerry 100 Medicine Man UK 100 SmokersCo 100 Auspride 100 Digital Thrift Shop Pl 100 HeinekenExpress 100 o3shop RU 100 Social Dread 92 Majestic Garden 86 HUB 57 Deutschland im Deep Web DE 85 Cebulka PL 90 Services News Directories LARGEST Markets December TOP number products Full Ranking Torrez Dark0de Versus ASAP Asean Cartel Bitcoin Today High Low Monero Today High Low Latest Comments Authentik2900 Site à éviter commande de c faite chez eux jamais reçu une arnaque TomJerrys profile mawosx low contact waiting days parcel 50g coco contact pr WeAreAmsterdams profile foster6la biggest greatest Torrezs profile Fidel Dam Im cannabis plug left Cannazons profile 14characters Looking make Make Money Looking Job Post Find Job Deep Web krazydversa ey ross aim chile espero que algun dia encuentres la libertad fr Life Box kotorfan21 anyone know actual Nonscams registeredreal passports Newbies Spaces space MahNemzJeff loyal Torguard user going years hands TorGuard VPN Review FUCKOFF MOTHER SCAM WEBSITE DarkFox Markets profile oshit Allowing users finalize orders withdraw funds White House Markets profile Tag Cloud Bitcoin Darknet Dark Web Drug Sentenced Arrested Man News Tor Drugs Silk Road Prison Market German years Price Busted Cybercrime Net Markets Cannabis Bitcoin Monero Forum Bitcoin,bad
