index,link,text,marker
65,http://pornhubvybmsymdol4iibwgwtkpwmeyd6luq2gxajgjzfjvotyt5zhyd.onion/users/cityboy12345678,Cityboy12345678s Profile Pornhubcom OK looking Upload Photos Videos Upgrade Login Sign Home Porn Videos Categories Live Cams Pornstars Meet Fuck Community Photos GIFs Discover Videos Recommended Hottest Viewed Top Rated Popular Homemade Explore Playlists Channels Random Pornhub Premium Newest Viewers Choice Hottest 11HD Fitness Blonde Teen Loves Creampie Shinaryen 567K views 90 Yesterday 8HD Pinay Couple Enjoys Cozy Night Sweaters impitis 16M views 85 days ago Hottest Recommended 23FUCK MACHINES Scene JM Productions 110K views 81 years ago 0HD Weedman gave credit ass return GoodDeal NastyNola 17K views 100 years ago Recommended Playlists videos Play View Playlist SHELTER Gameplay 47favorites 100 MissKitty2K 368K views videos Play View Playlist Like Big Butts 79favorites 100 GerManOneX 59K views Playlists Channels Mofos Rank Property Sex Rank Channels Trending Searches abbie maley mackenzie jones sheena ryder anouk maze astrid wett gentstudent britni kitten shaiden rogue Discover Categories Popular Alphabetical Number Videos Gay Categories Trending Searches abbie maley mackenzie jones sheena ryder anouk maze astrid wett gentstudent britni kitten shaiden rogue Japanese Mature Hentai Anal Teen 18 MILF Ebony Amateur Lesbian Cartoon Threesome Big Tits Public Transgender OldYoung Big Dick Female Orgasm Creampie Gangbang Masturbation See Discover Pornstars Verified Amateurs Pornstars Male Actors Top Trending James Deen Videos 15B Views Sara Luvv Videos 184M Views Popular Kendra Lust Videos 368M Views Stella Barey Videos 67M Views Viewed Lena Paul Videos 498M Views Melanie Hicks Videos 777M Views Popular Filters Fake Tits Natural Tits Small Tits Huge Tits Red Heads Blondes Brunettes Piercings Tattooed Asian Arab Latin Black Indian White 18 Teens MILFs Mature Discover Community Model Contests Community Feed Top Members Newest Verified Girls Newest Verified Couples Newest Verified Guys Popular Verified Models Online Members Member Search Contests Popular Viewers Choice December SweetDarling FoxyElf papaxmama Arrilast AmateurHomeGirls Flame Jade See Viewed November Leolulu Cory Chase October Danika Mori Jordi El Nino Polla September littlebuffbabe Angela White See Popular Verified CherryBlossom2712 LittleBaddieGirl Saphira Shimmer Kat Val LilMissCumSponge SexyBabe Love See Popular New aoidick1124 Daddydumz Indian_cumprincess Sweetieline French Majestix ViolettOFmaster See Discover Photos Gifs Porn GIFs Top Rated GIFs Viewed GIFs Photo Albums Top Rated Albums Viewed Albums Upload Photos Make GIF Top Rated Gifs Riding cumshot succubus ass Latina top Top Rated Viewed Gifs HotRanet Sentada Carry Light yummy pussy filled cum keeps riding Viewed Top Rated Albums little slut Photos Cosplaying Cutie Photos Top Rated Viewed Albums PlaysKitty hot amateur babe Photos 99 Sara Anne Photos 100 Viewed Popular Tags Tits Ass Pussy Amateur Dick Hot Teen Hentai Sex Boobs Babe Cum Blonde Blowjob Anal Black Brunette Asian MILF Cumshot leaving Pornhubcom ADS PREMIUM PORN HANDLE WELCOME BEST PORN EXPERIENCE EVER FINALLY PORN EXPERIENCE DESERVE Ads Exclusive Content High Quality HD Cancel Anytime Offering exclusive content available Pornhubcom Super affordable 999month Start Free Week Pornhub Premium Go Back leaving Pornhubcom Free day premium access Ads Exclusive Content HD Videos Cancel Anytime Start Watch exclusive video pornhub premium Luckily FREE day access Watch hd video never see ads Claim day free access Watch 1080p video pornhub premium Luckily FREE day access Watch hd video upgrading today get one week free access Ads Exclusive Content HD Videos Cancel Anytime Claim day free access signing today get one week free access Ads Exclusive Content HD Videos Cancel Anytime Claim day free access Offering exclusive content available Pornhubcom Cityboy12345678 subscribers friends videos watched Stream Videos Photos Add Friend Subscribe Login Sign post Post Video Photo Playlist Gifs View Activity View Activity Posts View View Videos Photos Playlists Posts Achievements Cityboy12345678 subscribed users week ago Theenutmonster Cityboy12345678 subscribed users week ago SweetsKM bbcbackshots wbloe Cityboy12345678 subscribed pornstars week ago Rank Abella Danger Rank Naja Star Cityboy12345678 unlocked new achievement MissMister Popularity week ago Thumbs Thumbs Cityboy12345678 subscribed users weeks ago DaddysLilBaby Cityboy12345678 subscribed pornstars weeks ago Rank Lela Star Cityboy12345678 subscribed pornstars weeks ago Rank Romy Indy Cityboy12345678 subscribed pornstars weeks ago Rank Lala Ivey Cityboy12345678 subscribed users weeks ago Lala Ivey Cityboy12345678 subscribed pornstars weeks ago Rank Avery Jane Cityboy12345678 subscribed pornstars month ago Rank Moriah Mills Cityboy12345678 subscribed users month ago Mia Mercy Moriah Mills Cityboy12345678 subscribed pornstars month ago Rank Katana Kombat Cityboy12345678 subscribed users month ago Katana Kombat Cityboy12345678 subscribed users month ago Mo Wetta Cityboy12345678 subscribed users month ago candygirl107 Lovely RoseQ Cityboy12345678 subscribed pornstars month ago Rank Sky Pierce Cityboy12345678 subscribed users month ago Sky Pierce Cityboy12345678 unlocked new achievement Sophomore months ago Thumbs Thumbs Cityboy12345678 subscribed users months ago Baevibes HedonistLovers Load Gender Male Last Login Yesterday Interested Girls Profile Views Videos Watched Achievements 7View Pornstar Subscriptions 14View Sky Pierce Destiny Mira Olivia Jayy Gianna Dior Katana Kombat Moriah Mills Bethany Benz Michelle Anderson Friends 18View Theenutmonster Naja Star misslexa Khloea Marie Thot_Box Romy Indy DireDesires Katana Kombat Subscribers 6View Theenutmonster AndreaSizzling74 Khloea Marie Romy Indy Fijii pornbox Kadidenise Subscriptions 42View Theenutmonster wbloe bbcbackshots SweetsKM Naja Star misslexa Abella Danger DaddysLilBaby Report User Youre subscribe Fan Club Becoming Fan supporting model continue creating amazing content may even get additional exclusive content would listed Plus chosen include Report Perks FANCLUB_PRICE Become Fan PRICE_DISCLAIMER prices include VAT charge appear statement PROBILLERCOM 855232All purchases final US unless otherwise stated See terms conditions Enter last digits credit card associated account FANCLUB_PRICE Become Fan PRICE_DISCLAIMER prices include VAT charge appear statement PROBILLERCOM 855232All purchases final US unless otherwise stated See terms conditions Login Signup Logging Remember computer recommended public shared computers FANCLUB_PRICE Become Fan PRICE_DISCLAIMER prices include VAT TwoStep Verification Logging text message code sent Enter code Verify Didnt receive code Resend Dont phone Contact Support signing agree Terms Conditions FANCLUB_PRICE Become Fan PRICE_DISCLAIMER prices include VAT sure want stop becoming Fan dont want leave Yes please let leave restart purchase leave Amazing Youre big Fan actually wanted sign 2nd time Congratulations youre fan dont worry arent charging want support send tip Send tip Fan Club currently disabled Fan Club Please check back future become Fan Ok Understood Fanclub membership Card Number Card Number required MM YY Expiry Date invalid CVC Security Code CVC required First Name First Name required Last Name Last Name required ZipPostal Zip Code required Saved Total PRICE_DISCLAIMER Please note charges US unless otherwise specified charges appear statement discretely Probillercom 8552329555 prices include VAT completing transaction certify years older accept Privacy Policy Terms Conditions Contact customer support PROBILLERCOM use cookies optimize site functionality give best possible experience Learn OK Ads Traffic Junky Information Sitemap Terms Conditions Privacy Policy DMCA Work Us Content Partners Advertise Webmasters Model Program Press Support Help Content Removal Contact Support FAQ Trust Safety Parental Controls Feedback Discover Pornhub Blog Insights Blog Sexual Wellness Center Mobile Visually Impaired Language English Deutsch Français Español Italiano Português Polski Русский 日本語 Dutch Czech 中文简体 Pornhubcom Notice Leaving Pornhub page youre trying access part Pornhub safety privacy Pornhub account remember never enter password site pornhubcom pornhubpremiumcom Continue external site Go Back Warning Link May Unsafe page trying access official Pornhub site may dangerous safety privacy link disabled Close,bad
66,http://pornhubvybmsymdol4iibwgwtkpwmeyd6luq2gxajgjzfjvotyt5zhyd.onion/users/daddyboy100,Daddyboy100s Profile Pornhubcom OK looking Upload Photos Videos Upgrade Login Sign Home Porn Videos Categories Live Cams Pornstars Meet Fuck Community Photos GIFs Discover Videos Recommended Hottest Viewed Top Rated Popular Homemade Explore Playlists Channels Random Pornhub Premium Newest Viewers Choice Hottest 11HD Fitness Blonde Teen Loves Creampie Shinaryen 567K views 90 Yesterday 8HD Pinay Couple Enjoys Cozy Night Sweaters impitis 16M views 85 days ago Hottest Recommended 23FUCK MACHINES Scene JM Productions 110K views 81 years ago 0HD Weedman gave credit ass return GoodDeal NastyNola 17K views 100 years ago Recommended Playlists videos Play View Playlist SHELTER Gameplay 47favorites 100 MissKitty2K 368K views videos Play View Playlist Like Big Butts 79favorites 100 GerManOneX 59K views Playlists Channels Mofos Rank Property Sex Rank Channels Trending Searches abbie maley mackenzie jones sheena ryder anouk maze astrid wett gentstudent britni kitten shaiden rogue Discover Categories Popular Alphabetical Number Videos Gay Categories Trending Searches abbie maley mackenzie jones sheena ryder anouk maze astrid wett gentstudent britni kitten shaiden rogue Japanese Mature Hentai Anal Teen 18 MILF Ebony Amateur Lesbian Cartoon Threesome Big Tits Public Transgender OldYoung Big Dick Female Orgasm Creampie Gangbang Masturbation See Discover Pornstars Verified Amateurs Pornstars Male Actors Top Trending James Deen Videos 15B Views Sara Luvv Videos 184M Views Popular Kendra Lust Videos 368M Views Stella Barey Videos 67M Views Viewed Lena Paul Videos 498M Views Melanie Hicks Videos 777M Views Popular Filters Fake Tits Natural Tits Small Tits Huge Tits Red Heads Blondes Brunettes Piercings Tattooed Asian Arab Latin Black Indian White 18 Teens MILFs Mature Discover Community Model Contests Community Feed Top Members Newest Verified Girls Newest Verified Couples Newest Verified Guys Popular Verified Models Online Members Member Search Contests Popular Viewers Choice December SweetDarling FoxyElf papaxmama Arrilast AmateurHomeGirls Flame Jade See Viewed November Leolulu Cory Chase October Danika Mori Jordi El Nino Polla September littlebuffbabe Angela White See Popular Verified CherryBlossom2712 LittleBaddieGirl Saphira Shimmer Kat Val LilMissCumSponge SexyBabe Love See Popular New aoidick1124 Daddydumz Indian_cumprincess Sweetieline French Majestix ViolettOFmaster See Discover Photos Gifs Porn GIFs Top Rated GIFs Viewed GIFs Photo Albums Top Rated Albums Viewed Albums Upload Photos Make GIF Top Rated Gifs Riding cumshot succubus ass Latina top Top Rated Viewed Gifs HotRanet Sentada Carry Light yummy pussy filled cum keeps riding Viewed Top Rated Albums little slut Photos Cosplaying Cutie Photos Top Rated Viewed Albums PlaysKitty hot amateur babe Photos 99 Sara Anne Photos 100 Viewed Popular Tags Tits Ass Pussy Amateur Dick Hot Teen Hentai Sex Boobs Babe Cum Blonde Blowjob Anal Black Brunette Asian MILF Cumshot leaving Pornhubcom ADS PREMIUM PORN HANDLE WELCOME BEST PORN EXPERIENCE EVER FINALLY PORN EXPERIENCE DESERVE Ads Exclusive Content High Quality HD Cancel Anytime Offering exclusive content available Pornhubcom Super affordable 999month Start Free Week Pornhub Premium Go Back leaving Pornhubcom Free day premium access Ads Exclusive Content HD Videos Cancel Anytime Start Watch exclusive video pornhub premium Luckily FREE day access Watch hd video never see ads Claim day free access Watch 1080p video pornhub premium Luckily FREE day access Watch hd video upgrading today get one week free access Ads Exclusive Content HD Videos Cancel Anytime Claim day free access signing today get one week free access Ads Exclusive Content HD Videos Cancel Anytime Claim day free access Offering exclusive content available Pornhubcom Daddyboy100 United Kingdom 2subscribers 4friends 8videos watched Stream Videos Playlists Photos Add Friend Subscribe Login Sign post Post Video Photo Playlist Gifs View Activity View Activity Posts View View Videos Photos Playlists Posts Achievements Daddyboy100 favorited videos Yesterday 16HD Muscular Nathan Bronson rimmed fucking Sophia Grace Eye Guy 127K views 81 year ago 16HD Brujita Lolo FIRST THREESOME always fantasized cocks Pepe Porn 44K views 78 month ago 18HD wants know pussy take cocks FaKings 687K views 89 month ago Daddyboy100 subscribed pornstars Yesterday Rank Mike Mancini Rank Rene Iglesias Daddyboy100 subscribed users Yesterday Mike Mancini Rene Iglesias Tony69Karol Daddyboy100 subscribed pornstars days ago Rank Donnie Rock Daddyboy100 favorited photos days ago GIF 100 Views Daddyboy100 favorited videos days ago 10HD Busty BBW mature gets pounded two young guys Homegrown Video 38K views 58 year ago 10HD Amateur slut Melanie gets filled two dicks Homegrown Video 11K views 90 month ago 17HD Good Morning Sadie Quinn DVP Creampie SadieQuinn 225K views 91 months ago Daddyboy100 subscribed pornstars week ago Rank Michael Stefano Daddyboy100 favorited videos week ago 14HD ChicasLoca Lullu Gun Slutty German Babe Hardcore Outdoor Pussy Fuck MamacitaZ 207K views 93 months ago 8HD Hot Cougar Melissa Ria Gets Double Railed Two Horny Young Men Smut Puppet 489K views 90 year ago 10HD French mature anal fucked office French Girls Work 309K views 83 year ago Daddyboy100 favorited photos weeks ago 100 Views 100 Views Daddyboy100 subscribed pornstars weeks ago Rank Arad Winwin Rank Max Cortes Daddyboy100 subscribed pornstars weeks ago Rank Max Dior Daddyboy100 favorited photos weeks ago 100 Views Daddyboy100 favorited photos month ago 100 Views Daddyboy100 subscribed pornstars month ago Rank Lourdes Noir Daddyboy100 subscribed pornstars month ago Rank Marcus Pollack Rank Baby Nicols Rank Andy Stone Daddyboy100 favorited photos month ago 100 Views Daddyboy100 favorited photos month ago 100 Views 26K 100 Views 11K 100 Views 100 Views 100 Views 100 Views 100 Views 100 Views 100 Views Daddyboy100 subscribed pornstars month ago Rank Trevor Harris Rank Bryce Star Rank Andrew Powers Daddyboy100 favorited photos month ago 100 Views 100 Views 100 Views Daddyboy100 favorited photos month ago 100 Views 24K 98 Views 15K 100 Views 16K 100 Views 100 Views Load like give head rim Love give creampies girls guys Gender None Last Login hours ago Relationship Status Taken Interested Guys Girls Hometown Exeter Country United Kingdom Turn Ons Tight butts Profile Views 10Videos Watched 8Achievements 22View Pornstar Subscriptions 598View Max Felicitas Kate Truu Princess Leia Danika Mori Jordi El Nino Polla Jaxon Radoc Madeincanarias Jay Bank Cam Model Subscriptions 5View sexy slim guy strong dick Id like meet EvgeniiGor Offline HeaRtBrEak kiD Aka Lil Dude Wit Da Big Black Dick THE_8HBK Offline Guy Next Door USA Fulfilling fantasies online since 2005 AlexMeadows Offline hottest dildo riding daddy bear interwebs B1g_Sexy Offline Kim Equinoxx porn star love play Kimiequinoxx Offline Friends 4060View Rene Iglesias Landscaper2010 FaKz MaxDickons BrodyVonMiller MIKIMOUSE34 pornczcom luv2jack2 Subscribers 2469View Landscaper2010 MIKIMOUSE34 luv2jack2 RealityAcid karlos1993 Pornusername15 joejoeyyyy il0vebigtits55 Subscriptions 10065View Tony69Karol Rene Iglesias Mike Mancini certyaa10 LoveMelonn FaKz PaulHrick222 MaxDickons Channel Subscriptions 1270View Seks Cam Rank LATIN AMATEUR Rank Eye Guy Rank FTM Men Rank Girls Hunter Rank Homegrown Video Rank Report User Youre subscribe Fan Club Becoming Fan supporting model continue creating amazing content may even get additional exclusive content would listed Plus chosen include Report Perks FANCLUB_PRICE Become Fan PRICE_DISCLAIMER prices include VAT charge appear statement PROBILLERCOM 855232All purchases final US unless otherwise stated See terms conditions Enter last digits credit card associated account FANCLUB_PRICE Become Fan PRICE_DISCLAIMER prices include VAT charge appear statement PROBILLERCOM 855232All purchases final US unless otherwise stated See terms conditions Login Signup Logging Remember computer recommended public shared computers FANCLUB_PRICE Become Fan PRICE_DISCLAIMER prices include VAT TwoStep Verification Logging text message code sent Enter code Verify Didnt receive code Resend Dont phone Contact Support signing agree Terms Conditions FANCLUB_PRICE Become Fan PRICE_DISCLAIMER prices include VAT sure want stop becoming Fan dont want leave Yes please let leave restart purchase leave Amazing Youre big Fan actually wanted sign 2nd time Congratulations youre fan dont worry arent charging want support send tip Send tip Fan Club currently disabled Fan Club Please check back future become Fan Ok Understood Fanclub membership Card Number Card Number required MM YY Expiry Date invalid CVC Security Code CVC required First Name First Name required Last Name Last Name required ZipPostal Zip Code required Saved Total PRICE_DISCLAIMER Please note charges US unless otherwise specified charges appear statement discretely Probillercom 8552329555 prices include VAT completing transaction certify years older accept Privacy Policy Terms Conditions Contact customer support PROBILLERCOM use cookies optimize site functionality give best possible experience Learn OK Ads Traffic Junky Information Sitemap Terms Conditions Privacy Policy DMCA Work Us Content Partners Advertise Webmasters Model Program Press Support Help Content Removal Contact Support FAQ Trust Safety Parental Controls Feedback Discover Pornhub Blog Insights Blog Sexual Wellness Center Mobile Visually Impaired Language English Deutsch Français Español Italiano Português Polski Русский 日本語 Dutch Czech 中文简体 Pornhubcom Notice Leaving Pornhub page youre trying access part Pornhub safety privacy Pornhub account remember never enter password site pornhubcom pornhubpremiumcom Continue external site Go Back Warning Link May Unsafe page trying access official Pornhub site may dangerous safety privacy link disabled Close,bad
67,http://pornhubvybmsymdol4iibwgwtkpwmeyd6luq2gxajgjzfjvotyt5zhyd.onion/gif/38204091,Boy Girl rahyndee James standing Fuck straight Sex fantasy young Lust Porn Gif Pornhubcom OK looking Upload Photos Videos Upgrade Login Sign Home Porn Videos Categories Live Cams Pornstars Meet Fuck Community Photos GIFs Discover Videos Recommended Hottest Viewed Top Rated Popular Homemade Explore Playlists Channels Random Pornhub Premium Newest Viewers Choice Hottest 11HD Fitness Blonde Teen Loves Creampie Shinaryen 567K views 90 Yesterday 8HD Pinay Couple Enjoys Cozy Night Sweaters impitis 16M views 85 days ago Hottest Recommended 23FUCK MACHINES Scene JM Productions 110K views 81 years ago 0HD Weedman gave credit ass return GoodDeal NastyNola 17K views 100 years ago Recommended Playlists videos Play View Playlist SHELTER Gameplay 47favorites 100 MissKitty2K 368K views videos Play View Playlist Like Big Butts 79favorites 100 GerManOneX 59K views Playlists Channels Mofos Rank Property Sex Rank Channels Trending Searches abbie maley mackenzie jones sheena ryder anouk maze astrid wett gentstudent britni kitten shaiden rogue Discover Categories Popular Alphabetical Number Videos Gay Categories Trending Searches abbie maley mackenzie jones sheena ryder anouk maze astrid wett gentstudent britni kitten shaiden rogue Japanese Mature Hentai Anal Teen 18 MILF Ebony Amateur Lesbian Cartoon Threesome Big Tits Public Transgender OldYoung Big Dick Female Orgasm Creampie Gangbang Masturbation See Discover Pornstars Verified Amateurs Pornstars Male Actors Top Trending James Deen Videos 15B Views Sara Luvv Videos 184M Views Popular Kendra Lust Videos 368M Views Stella Barey Videos 67M Views Viewed Lena Paul Videos 498M Views Melanie Hicks Videos 777M Views Popular Filters Fake Tits Natural Tits Small Tits Huge Tits Red Heads Blondes Brunettes Piercings Tattooed Asian Arab Latin Black Indian White 18 Teens MILFs Mature Discover Community Model Contests Community Feed Top Members Newest Verified Girls Newest Verified Couples Newest Verified Guys Popular Verified Models Online Members Member Search Contests Popular Viewers Choice December SweetDarling FoxyElf papaxmama Arrilast AmateurHomeGirls Flame Jade See Viewed November Leolulu Cory Chase October Danika Mori Jordi El Nino Polla September littlebuffbabe Angela White See Popular Verified CherryBlossom2712 LittleBaddieGirl Saphira Shimmer Kat Val LilMissCumSponge SexyBabe Love See Popular New aoidick1124 Daddydumz Indian_cumprincess Sweetieline French Majestix ViolettOFmaster See Discover Photos Gifs Porn GIFs Top Rated GIFs Viewed GIFs Photo Albums Top Rated Albums Viewed Albums Upload Photos Make GIF Top Rated Gifs Riding cumshot succubus ass Latina top Top Rated Viewed Gifs HotRanet Sentada Carry Light yummy pussy filled cum keeps riding Viewed Top Rated Albums little slut Photos Cosplaying Cutie Photos Top Rated Viewed Albums PlaysKitty hot amateur babe Photos 99 Sara Anne Photos 100 Viewed Popular Tags Tits Ass Pussy Amateur Dick Hot Teen Hentai Sex Boobs Babe Cum Blonde Blowjob Anal Black Brunette Asian MILF Cumshot leaving Pornhubcom ADS PREMIUM PORN HANDLE WELCOME BEST PORN EXPERIENCE EVER FINALLY PORN EXPERIENCE DESERVE Ads Exclusive Content High Quality HD Cancel Anytime Offering exclusive content available Pornhubcom Super affordable 999month Start Free Week Pornhub Premium Go Back leaving Pornhubcom Free day premium access Ads Exclusive Content HD Videos Cancel Anytime Start Watch exclusive video pornhub premium Luckily FREE day access Watch hd video never see ads Claim day free access Watch 1080p video pornhub premium Luckily FREE day access Watch hd video upgrading today get one week free access Ads Exclusive Content HD Videos Cancel Anytime Claim day free access signing today get one week free access Ads Exclusive Content HD Videos Cancel Anytime Claim day free access Offering exclusive content available Pornhubcom Boy Girl Rahyndee James Standing Fuck Straight Sex Fantasy Young Lust Gif 100 votes GIF HTML5 1views Twitter Reddit StumbleUpon Blogger Photo Page Reddit ready Forum BB code GIF link Direct link HTML image Embed codeiframe srchttpswwwpornhubcomembedgif38204091 frameborder0 scrollingno width1280 height720 stylewebkitbackfacevisibility hidden webkittransform scale1iframe video BANGBROS Rahyndee Sean Lawless Go Hiking Orgasm Trail Tags rahyndee james standing fuck gifs boy girl gifs straght sex best tits amazing pussy lips fantasy young lust mmm naughty girl babe hot gifs Pornstars Rahyndee James Sean Lawless Thank suggestions team reviewing Created einaudi_too Comments 0 Login Sign post comment dateAdd commentMessage Related GIFs View listItem use cookies optimize site functionality give best possible experience Learn OK Ads Traffic Junky Information Sitemap Terms Conditions Privacy Policy DMCA Work Us Content Partners Advertise Webmasters Model Program Press Support Help Content Removal Contact Support FAQ Trust Safety Parental Controls Feedback Discover Pornhub Blog Insights Blog Sexual Wellness Center Mobile Visually Impaired Language English Deutsch Français Español Italiano Português Polski Русский 日本語 Dutch Czech 中文简体 Pornhubcom 2021,bad
