index,link,text,marker
15,http://2azus2ydchjmz5l5fcjmhew4elucd72wwwaqpswni3wiyb3gvqjpfeid.onion/revelations-assa-traore-est-litteralement-financee-par-les-banquiers-juifs-rotschild/,Révélations Assa Traoré est littéralement financée par les banquiers juifs Rothschild Démocratie Participative Démocratie Participative Guide Racial des Villes Les dernières actualités Décryptage Monde Guerre raciale Démocratie Participative 卐 Le site le plus censuré dEurope 卐 Démocratie Participative Guide Racial des Villes Les dernières actualités Décryptage Monde Guerre raciale Home Décryptage Révélations Assa Traoré est littéralement financée par les banquiers juifs Rothschild Révélations Assa Traoré est littéralement financée par les banquiers juifs Rothschild Captain Harlock Démocratie Participative Juin Sitôt quon portait le scalpel dans un abcès de cette sorte découvrait comme un ver dans un corps en putréfaction un petit youtre tout ébloui par cette lumière subite Adolf Hitler Mein Kampf Lorsque des ferments danarchie et de déchéance sociale se manifestent il ne faut jamais chercher très longtemps pour dénicher le juif Linsurrection raciale antiblanche menée par Assa Traoré avec lappui des médias juifs vient de trouver son explication Causeur Lhistoire est désormais connue de la France entière Le juillet 2016 un jeune homme nommé Adama Traoré décède à la gendarmerie de Persan Val dOise à la suite dun contrôle didentité mouvementé le jour de son vingtquatrième anniversaire Figure de proue du comité Vérité pour Adama sa demisœur Assa Traoré se bat depuis bientôt quatre ans pour que les gendarmes ayant procédé à son interpellation soient mis en examen ce que les juges dinstruction nont pas considéré comme justifié Assa Traoré répète souvent quelle appris le décès dAdama alors quelle se trouvait en Croatie pour déplacement professionnel Cest exact mais à préciser En tant quéducatrice spécialisée elle encadrait avec une collègue un groupe de sept adolescents en voyage à Rabac une station balnéaire de la côte Adriatique Une semaine de vacances offerte à des jeunes défavorisés ce qui cadre mal bien sûr avec le discours martelé par le comité Adama sur les populations raciséesabandonnéespersécutées des cités Le nom de lemployeur dAssa Traoré cadre encore plus mal avec ce discours Il sagit dune fondation issue dun réseau qui venait en aide sous loccupation à des jeunes ayant de réelles raisons de courir pour échapper aux contrôles didentité lOeuvre de protection des enfants juifs Opej Créée en 1945 lOpej est désormais un acteur du social avec délégation de service public Elle soccupe de tous les enfants en difficulté sans distinction de confession Son nom complet est OpejBaron Edmond de Rothschild car il bénéficie du soutien généreux de la fondation Rothschild Assa Traoré publié au Seuil en mars un livretémoignage écrit avec Elsa Vigoureux du Nouvel Observateur À aucun moment elle névoque ces détails Elle remercie la fondation Opej pour sa compréhension et son soutien en dernière page sans développer le sigle Selon nos informations ce soutien nétait pas seulement moral Assa Traoré nest pas retournée travailler après le décès de son demifrère Elle sest mise en arrêt maladie Un arrêt qui sest prolongé nous atelle précisé jusquen août 2017 Elle est restée salariée de lOpej sans solde assuretelle jusquen décembre 2019 La nature exacte de sa maladie ne regarde quelle mais nimporte qui peut facilement vérifier quelle fait preuve durant ces douze mois dun allant formidable enchaînant les meetings les déplacements et les interviews Elle reçoit Libération pour un portrait publié en septembre 2016 Le octobre suivant elle répond à Jeune Afrique Le novembre portevoix en main elle anime un petit cortège place de la République à Paris Le novembre elle se manifeste au conseil municipal de BeaumontsurOise pour réclamer la vérité Le décembre elle met en ligne ses vœux en vidéo sur Médiapart à linvitation du site En janvier 2017 elle tient la vedette dans lémission La Clique de Mouloud Achour En 2018 même énergie elle parle à Bastamag et Reporterre elle se déplace en banlieue Elle fait un entretien croisé avec Angela Davis publié par la revue Ballast en janvier 2019 Elle est en Une des Inrocks en avril et annonce quelle relance sa ligne de vêtements dans la rubrique Où est le cool En avril 2019 elle publie un second livre chez Stock avec luniversitaire Geoffroy de Lagasnerie Elle termine lannée comme vedette dune soirée de soutien réunissant lécrivain Edouard Louis léconomiste Thomas Porcher lexfootballeur Vikash Dhorasoo la chanteuse Camélia Jordana la militante Rokhaya Diallo etc Tout ceci estil bien conforme avec le repos que suppose un arrêtmaladie La question semble embarrasser au plus haut point lOpej Oui elle travaillait chez nous mais nous avons reçu des directives du siège et nous ne devons pas en parler nous répondu lOpej de Sarcelles Au siège le directeur général Johan Zittoun répond que les salariés sont soumis au secret professionnel le plus strict ce qui les empêche de divulguer la moindre information concernant le personnel Il invoque limpérieuse nécessité de préserver les travailleurs sociaux afin quils restent concentrés sur leur mission quotidienne Zittoun veut rester discret Mais il lui serait tout de même difficile de dissimuler son affreux faciès de vampire juif Mission Assa Traoré nauraitelle pas plutôt bénéficié dun arrêt de travail complaisamment prolongé Les sommes en jeu ne sont pas de celles qui bouleversent les grands équilibres de lassurancemaladie Un salarié arrêté nest pas indemnisé à 100 très longtemps et une éducatrice spécialisée ne gagne pas des fortunes Sur le plan juridique néanmoins il un hiatus Un salarié arrêté est censé rester chez lui et se reposer En septembre 2016 la cour dappel de Paris confirmé la condamnation dun salarié de la RATP qui avait fait campagne pour les municipales à la Courneuve pendant un arrêt maladie Sur le plan symbolique enfin ce passage de la biographie dAssa Traoré détonne Le comité Vérité pour Adama regorge de militants antisionistes dénonçant le racisme structurel de lÉtat français Ils affectionnent les raccourcischocs en voici un leur égérie bénéficié de la générosité de lÉtat en question pendant des années avec le concours des Rothschild Ils sont partout Assa Traoré est littéralement salariée par la banque juive pour recruter des mercenaires nègres en vue de linsurrection raciale antiblanche quelle planifie dans lombre Cet article paru dans le site Causeur de la juive Elisabeth Lévy nest rien dautre quun rappel à lordre formel adressé à lactiviste Assa Traoré suite aux slogans antisémites scandés par ses soutiens lors de la manifestation de samedi dernier Place de la République Sales juifs crient des manifestants antiracistes ulcérés par une banderole de GénérationIdentitaire pour les victimes de racisme antiblancs racismenantiblancs immigration remigration adamatraore affairetraore justicepouradama pictwittercomzO4OGJeVtU Valeurs actuelles ن Valeurs June 13 Les juifs entendent se servir de ces nègres comme arme biologique contre le prolétariat blanc sous la bannière de lantiracisme Mais lincident de la semaine dernière corroboré une tendance de fond ce mouvement est largement influencé par lantisionisme arabomusulman Une ligne rouge pour les suprémacistes juifs qui financent Traoré Certains nétaient pas venus pour manifester contre le racisme Ils étaient venus manifester leur antisémitisme Cest hallucinant de voir encore et toujours ces activistes prendre le chemin obsessionnel de la haine des juifs Tout ceci est proprement effrayant pictwittercomYVL6cXvS5l Licra _LICRA_ June 13 Le deal est donc le suivant soit Traoré rentre dans le rang prêche la lutte contre lantisémitisme tout en appelant à la guerre raciale contre les Blancs soit sa nouvelle vie de diva de banlieue cessera du jour au lendemain Cette négresse ne devrait pas mettre longtemps à sexécuter Tout cela nest quun jeu de dupes orchestré par les juifs Ils financent linsurrection nègre dune part et prennent le contrôle de lopposition au même moment Ce vendredi à midi lISSEP_Lyon organisera une conférence à distance MarionMarechal échangera avec GWGoldnadel sur le thème suivant Après SOS racisme le nouveau racisme antifrançais Nous vous attendons nombreux sur notre page Facebook httpstcoWl8lTuUUSV pictwittercom1E3u9vWBT1 ISSEP ISSEP_Lyon June 18 Tout ceci évidemment rendu possible grâce à une femme blanche pathologiquement obsédée par lenvie de montrer sa chatte Lantiracialiste Marion Auque Nous sommes entrés dans une spirale folle et dangereuse Ne croyez pas que les universités et grandes écoles françaises seront épargnées par ces délires Depuis longtemps déjà ces idéologies racialistes ont contaminé lenseignement supérieur httpstcoigyYW3qJ2A Marion Maréchal MarionMarechal June 13 Il faudrait être aveugle pour ne pas voir le juif à loeuvre Je peux vous dire une chose vous êtes peutêtre antisémite mais cest encore très en deçà du niveau dantisémitisme nécessaire Commentez larticle sur EELB Related Articles FIFA Arab Cup victoire de lAlgérie les bougnoules font les bougnoules sur les Champs heure ago Sans masque Attali ordonne à une goya de remettre correctement son masque vidéo heures ago nuances de marron voici la nouvelle Miss Fronsse heures ago Ecoutez Démocratie Participative S06E43 browser support audio element Soutenez Democratie Participative Nous écrire dempartctemplarcom Les goyim savent faitesles taire Guide pour utiliser MONERO Le livre du moment Projet bourguignon découvrez létat séparatiste blanc cliquez ici DP incensurable sur TOR Guide Les Démocrates décorés de la Croix de Fer Textes doctrinaux de la révolution raciste Mentions Propriété de David Johnson Jr citoyen américain Démocratie Participative est un site US dexpression française placé sous la protection du Premier Amendement de la Constitution des ÉtatsUnis dAmérique Démocratie Participative rassemble les hommes et les femmes soucieux de défendre et promouvoir les valeurs démocratiques et humanistes conformément à lidéal de justice sociale qui lanime Démocratie Participative sengage pour la paix et la nonviolence Powered WordPress Designed TieLabs Copyright 2021 Rights Reserved,bad
16,http://gsxbcjvcrdl66ycimkwra2nxzwvy2idef4twi7elojuzm5ztt5abqyid.onion/node/88648,HH ACHTUNG NAZI Antifaschistinnen besuchten den NPDKader Karel Haunschild deindymediaorg Direkt zum Inhalt deindymediaorg dont hate media become media Openposting Tutorials Terminkalender Gruppenstatements Übersetzungskoordination Videos Editorialliste Linkliste Archiv Über uns Mission Statement Moderation Unterstützen Kontakt Mailinglisten Tor nutzen Tor HH ACHTUNG NAZI Antifaschistinnen besuchten den NPDKader Karel Haunschild von anonym 14 2337Themen AntifaRegionen Hamburg Seit einiger Zeit versuchen organisierte Neonazis der NPD im Verbund mit vermeindlichen Wutbürgerinnen und der Hamburger AFD ihre rasstischen und menschenverachtenden Parolen auf die Straße zu bringen Ob auf den sog MerkelmussWeg Kundgebungen des letzten Jahres oder jüngst den HygieneDemos versuchen die Faschistinnen auf der Straße Fuß zu fassen Dabei sind sie aufgrund des Gegenprotestes vieler tausender Antifaschistinnen immer wieder kläglich gescheitert Eines aber bleibt wichtig die Menschenfeinde dürfen niemals glauben Hamburg unbeobachtet zu sein Ihre Aktivitäten ihre Gesichter ihre Namen und ihre Adressen bleiben nicht unerkannt Wehret den Anfängen Ein nazifreies Hamburg ist jawohl das Mindeste Gedenken alle Opfer rechten Terrors Kein vergeben kein Vergessen Wer ist Karel Haunschild Karel Haunschild ist seit Jahren fester Bestandteil der Hmaburger NeonaziSzene Als stellvertrender Kreisvorsitzender der NPDHamburg ist er neben Lennart Schwarzbach das Gesicht neonazistischer Parteistrukturen Er kandidierte beid er Bürgerschaftswahl für den Bezirk Wandsbek und bei der Europawahl für die NPDHamburg Neben dem Verusch parlamentarisch Fuß zu fassen trat Karel Haunschild außerdem mehrfach bei den sog Schutzstreifen Erscheinung Als Nazis versuchten 1 Mai dieses Jahres erfolglos HamburgHarburg zu marschieren war Karel Haunschild maßbeglich der Organisation beteiligt der Zeit nach dem 1 Mai nahm Karel Haunschild mindestens zweimal bei den verschwörungstheoretischen HygieneDemos der Hamburger Innenstadt teil Auch außerhalb Hamburgs ist Karel Haunschild aktiv den letzten Jahren war er mehrfach auf Veranstaltungen der bundesweiten extremen Rechten Unter anderem war Karel Haunschild bei der sog Wintersonnenwendfeier eines bundesweiten NaziNetzwerks im niedersächsischen Eschede sowie beim neonazistischen Sommerfest im Thingaus Grevesmühlen Darüberhinaus ist er zusammen mit Lennart Schwarzbach und anderen norddeutschen Neonazis regelmäßiger Teilnehmer bundesweiter Naziaufmärsche Werdet aktiv und zeigt ihr von Nazis eurer Nachbarinnenschaft haltet Sonntagabend wurde dem Neonazi und NPDKader Karel Haunschild von Antifaschistinnen ein Besuch der Fabriciusstraße HH abgestattet Dabei wurden die Menschen der Nachbarinnenschaft darauf hingewiesen dass ein bundesweit aktiver Neonazi unter ihnen zu Hause ist Dabei gilt Hamburg ist kein Nazi sicher Bilder webadresse httpwwwLizenz des Artikels und aller eingebetteten Medien Creative Commons bysa Weitergabe unter gleichen Bedingungen Verstoß gegen Moderationskriterien melden,bad
17,http://ik4kzum3ocg6dhx4jhzteko4jzijmxnwsbkcqenf33as3i74i3mcb3id.onion/iib/48513c34,ChaosChild 28ChaosChild 28 previousgallerynext,bad
18,http://darkzzx4avcsuofgfez5zq75cqc4mprjvfqywo45dfcaxrwqg6qrlfid.onion/post/lka-raids-15-houses-in-child-porn-bust/,LKA Berlin Raids Houses Child Porn Bust DarknetliveMonero needs help OSPEAD Fortifying Monero Statistical Attack ccsgetmoneroorgDarknetlive HomeArrestsMarketsCryptoForumsOnionsShopsHomePostsLKA Berlin Raids Houses Child Porn BustLKA Berlin Raids Houses Child Porn Bustmin Published Jun using words announcement Berlins Criminal Police Office revealed officers participated widescale raid search several individuals suspected downloading child abuse content also searched properties electronic devices cellphones laptops devices searched housesIn addition announcement Berlin LKA released somewhat ominous tweet involved child pornography related crimesAnnouncementHeres announcementBecause suspicion possession dissemination child pornography State Office Criminal Investigation carried search warrants Berlin searches carried districts ofPankowReinickendorfCharlottenburgWilmersdorfMitteTempelhofSchönebergTreptowKoepenickMarzahnHellersdorfand LichtenbergAnother search followed state Brandenburg apartment Lichtenberg investigators surprised 58yearold wjo watching child pornography raidAnother 58yearold suspect Reinickendorf confessed immediately saying abused children filmed abuse taken police station action released police officers involved operation seized cell phones computers hard disks another additional storage devices CDs DVDs investigation ongoingShare Telegram Gab Mastodon Email Reddit TwitterNewerOlder DarknetLivepgp mirrors donate canary bible rss,bad
19,http://nitter7bryz3jv7e3uekphigvmoyoem4al3fynerxkj22dmoxoq553qd.onion/matrixdotorg/status/1419820122143961093,Matrix matrixdotorg Oh hello could native fullmesh Matrix video conferencing horizon last featuring 3x3 matrix arobertlong demos brainchild nitter nitter Matrix matrixdotorg Jul Oh hello could native fullmesh Matrix video conferencing horizon last featuring 3x3 matrix arobertlong demos brainchild 12AM Jul 27 James Baicoianu bai0 Jul Replying matrixdotorg arobertlong bird enthusiast trobblet Jul Replying matrixdotorg element_hq arobertlong Wait native matrix mean actually syncs video streams normal matrix protocol syncs JSON files Matrix matrixdotorg Jul negotiates video streams using normal matrix json sync protocol actual media still WebRTC goes direct clients replies Mahmoud Abduljawad محمود عبدالجواد mahmoud_ajawad Jul Replying matrixdotorg arobertlong Someone using firefox amazing Containers plugin 1,bad
20,http://ik4kzum3ocg6dhx4jhzteko4jzijmxnwsbkcqenf33as3i74i3mcb3id.onion/iib/423ed018,ChaosChild 189ChaosChild 189 previousgallerynext,bad
21,http://darkzzx4avcsuofgfez5zq75cqc4mprjvfqywo45dfcaxrwqg6qrlfid.onion/post/man-caught-after-losing-usb-drive-filled-with-child-pornography/,Child Porn Found Mans Lost USB Drive DarknetliveMonero needs help OSPEAD Fortifying Monero Statistical Attack ccsgetmoneroorgDarknetlive HomeArrestsMarketsCryptoForumsOnionsShopsHomePostsChild Porn Found Mans Lost USB DriveChild Porn Found Mans Lost USB Drivemins Published Jul using words engineer Charenton France sentenced months prison suspended sentence someone found USB drive plugged computer discovered pictures videos depicting child pornographyAt sentencing hearing partner described loving caring job brand consultant lived apartment near Bois de Vincennes people never saw man time alone confessed crazed sessions masterbation illegal pictures videos discovered darknetHe identified investigation police Charenton 34yearold man sentenced July court Créteil 18month suspended sentence government supervision duration sentenceThe investigation began February technician building Charenton found USB drive elevator home took look drives contents plugging computer surprised drive contained child porn videosThe technician took drive police Investigators discovered professional documents drive name name convicted defendant working large company police obtained address later searched house found several hundred videosOnce police custody suspect told authorities everything wanted know admitted searched darknet sites find child pornography downloaded saved USB drive However court went easy due desire get socalled treatment addictionShare Telegram Gab Mastodon Email Reddit TwitterNewerOlder DarknetLivepgp mirrors donate canary bible rss,bad
22,http://ik4kzum3ocg6dhx4jhzteko4jzijmxnwsbkcqenf33as3i74i3mcb3id.onion/iib/b6556e99,ChaosChild 91ChaosChild 91 previousgallerynext,bad
23,http://stormer5v52vjsw66jmds7ndeecudq444woadhzr2plxlaayexnh6eqd.onion/youtube-rewind-surpasses-child-pornography-to-become-the-most-hated-thing-on-the-internet/,YouTube Rewind Surpasses Child Pornography Become Hated Thing Internet Daily Stormer Featured Stories World US Society Insight Daily Stormer Censored Publication History Featured Stories World US Society Insight YouTube Rewind Surpasses Child Pornography Become Hated Thing Internet Andrew Anglin December 13 Andrew Anglin Daily Stormer December 13 Well YouTube finally crown hated thing ever internet years annual yearinreview Rewind video ousting longrunning champion child pornography Released December 6th YouTube registered nearly ten million dislikes video rough People really really hate official production Google corporation people hate much Well cant say go ahead show whats speculate Firstly worth mentioning guy Smith person recognized video black man flying school bus fat Chinese woman blue hair man blue hair woman homosexual blue hair frightened black female fat blonde woman black guy Two homosexuals person Asiatic people eating foods hysterical woman scientist yelling Asian people Homosexuals molesting dog cartoon apparently representative Ku Klux Klan Said KKK cartoon love dance black man wearing different colored shoes Late night talk show hosts people Smith recognized video hidden chair confused woman color Asiatic man white girlfriend Syndrome happy father homosexual man cat Trannies black woman cancer Pakistani extremist homosexual Pinoy latinx lover graduation day plastic surgery Asiatic female fat white girl Asiatic working mother Syrian refugee child Pakistani origin Honduran refugee poverty followed dreams Islamic African woman Islamo Malay harshfaced 40yearold ginger female Said ginger females posse negro man sportsball Three flowered homosexuals front orb sign Fortnite Fortnite video Someone making brick apparently people internet like one things Truly definitive wild ride assuredly represents everything society rapidly becoming sure level hate given something fully embodies direction society bodes well directing direction may well people would prefer society going direction looked like say one man perhaps 76408people agree Hit video top page click dislike like one things Thanks remember one Related Articles Australia Rules Sites Held Legally Responsible Public Comments Sections September 9 ProtonMail Turns IP Addresses French Cops Activist Arrested September 7 Big Tech Wants Build Matrix Throw People Calls Metaverse September 1 FreeRicky Demographic Countdown shekels plz goyim readerfunded site censored publication history Send Monero today Disclaimer Daily Stormer opposed violence seek revolution education masses information available people systemic change inevitable unavoidable Anyone suggesting promoting violence comments section immediately banned permanently Copyright Daily Stormer 2021 Rights Reserved Watch Daily Stormer Status page future updates case domain seizure,bad
