index,link,text,marker
0,http://deeeepv4bfndyatwkdzeciebqcwwlvgqa6mofdtsvwpon4elfut7lfqd.onion/,DeepLink Onion Directory DeepLink Onion Directory Home Add Site Contact DeepLink moving OnionVersion Address Please sure bookmark right addresshttpdeeeepv4bfndyatwkdzeciebqcwwlvgqa6mofdtsvwpon4elfut7lfqdonion Categories Onions Market Hacking Hosting Forums Blog Link List Wiki Communication Social Financial Services Adult Search Engines Private Sites Others Best Financial Market Prepaid CC VISAMasterCard Cloned CC Gift Cards VISAAmazon PayPalWestern Union Transfers cards come PINs instructions httplhsfyiluf5mpybtbud26blpgwou4av7pacfm4coyepcfer5usfjkccydonion 48321Cash CARDS sell demanded products deepweb US Europe specialized years experience field httpwhje5cahjivo6s4ox36xrpea5gavgd45uekgaxlkocjlcxcwkedn2ladonion 37751Light Money Trusted Financial Market Prepaid Cloned Gift Cards Money Transfers via PayPal Western Union http2aoiednvwdnc4w2r32yoydojuu7a4jc6dtiu7bnxikhlirvjm7jxevidonion 5111Hacker Community Hire Advanced Trustable Hackers Darknet httpugdbp6mw657tljzmymg2u7xv3uhtmbcpgiiimtbsfqcv47kicisen7idonion 5200TOR LINK LIST easiest way find information Tor network working links trusted sites http5n4qdkw2wavc55peppyrelmb2rgsx7ohcb2tkxhub2gyfurxulfyd3idonion 5468 Bitcoin Private Key Shop Best Seller Market httpcznfdaeaqujhfz33ki4evpaz7a3vy7qgapdbjejrvgursnu27x4gxoidonion 4866Manticore BEST CARDING SERVICES PREPAID CARDS VISAMasterCard MONEY TRANSFERS VIA PAYPAL WESTERN UNION httpwumsyv4676p4gdrofwz5w3a74aajexxq4kss2wx42umymdy5uxxranydonion 4903Bitcoin Mixer largest fastest Trusted Bitcoin mixer Deep Web httpjaslzi3nsom7amtlzb575turfv2tytgv2v7j3ywgg5vso5citxmbwdidonion 4103RE Apple Store Original Apple products products original packaging warranty cardsFree express shipping worldwide httpq43zqapcisjhrqsk2otzc27leujaenmameigsiwbhcgawflczdifs3qdonion 4769Dark Escrow job sweat small stuff Well make sure sale safeguarded fraud focus business httpfit3thui7rw263htdkfwz4kw6cvxpmt2akcswbatksc5svdreajn6ridonion 5112Porn Hacker sell fresh hacked accounts popular porn sites spend money subscriptions Order account us save Money httppyys2twibiumogafwhtoeyy7awjqaydc3nh3lyyva7fcgbldqt7sjtqdonion 3797HIDDEN WIKI FRESH Hidden Wiki FRESH easiest way find information Tor network working links trusted sites httpwikiw2godl6vm5amb4sij47rwynnrmqenwddykzt3fwpbx6p34sgb7ydonion 4981Deep Search Powerful Search Engine TOR httpsearch7tdrcvri22rieiwgi5g46qnwsesvnubqav2xakhezv4hjzkkadonion 2918Top Onions Top Onions Link List httptoponiibv4eo4pctlszgavni5ajzg7uvkd7e2xslkjmtcfqesjlsqpidonion 4956ORIGINAL CREDITCARDCENTER CreditCard Vendor Since Prepaid VISA Amex MasterCards Western Union PayPal Moneytransfer within min 24Support Escrow httpcccenterjb27ubnmonion 5032Darknetlive Darknet News httpdarkzzx4avcsuofgfez5zq75cqc4mprjvfqywo45dfcaxrwqg6qrlfidonion 2651Bitcoin Generator Exploit Bitcoin Generator Exploit innovative fastest Bitcoin Generator online designed offered free use httpxf3d3baglf7rj73iab5fjaadumgyq6ra2fptdxbtxfvix2h6u2lnayadonion 1399Tor66 Nocookies notracking pure search httptor66sewebgixwhcqfnp5inzp5x5uohhdy3kvtnyfxc2e5mxiuh34iidonion 29212020DeepLink Hidden Links Markets Directory Total Hits 16334,bad
1,http://uquusqsaaad66cvub4473csdu4uu7ahxou3zqc35fpw5d4ificedzyqd.onion/threads/kelly-lenza-lividlipids-softbodytendermind-ass_child-photopotamus.68478/page-331,Kelly Lenza LividLipids softbodytendermind ass_child photopotamus Page Kiwi Farms Menu Forums New posts Search forums Chat Autism Thunderdome Beauty Parlor Detractor Central ECelebs Whats new Featured content New posts Latest activity Members Current visitors Log Register Whats new Search Search Everywhere Threads forum thread Search titles Search Advanced search New posts Search forums Menu Log Register Navigation Install app Install options Contact us Close Menu Forums Lolcow Salon Deathfats thought would sleep like usually abused substances JavaScript disabled better experience please enable JavaScript browser proceeding using date browser may display websites correctlyYou upgrade use alternative browser Kelly Lenza LividLipids softbodytendermind ass_child photopotamus Radical body liberationist Intentionally Repulsive Uber woke 40something SJW influencer wannabe doxed former therapist getting WLS later accidentally doxed Thread starter Punkinsplice Start date Apr 17 Whichever one stole bag breast milk staff room fridge please return Nobodys mad want back Chat Benet_Bandito284 minutes ago telling truth Minuit minutes ago Extra Dainty Gorl sounds awesome little cave Easy Peasy minutes ago view giving lost highway vibes Extra Dainty Gorl minutes ago Minuit yes hides pillows fun dont check get greeted like 15lb scared claws try go nap Grape Chia minutes ago holy shit day reckon think bagel cream cheese folgers Minuit minutes ago Time bed wonderful evening ladies Bitchboy95 minutes ago Easy Peasy really good soundtrack Luxury Villa Cat Advocate minutes ago getting worked mad talking Grape Chia minutes ago Minuit nightnight Luxury Villa Cat Advocate minutes ago number hours streamed quality guize Extra Dainty Gorl minute ago afraid awkward silence im sorry sounds like shes taking talking points BP chat Benet_Bandito284 minute ago usually goes Sir GeorgeEtienne Carter Pkwy Nads Grape Chia minute ago Luxury Villa Cat Advocate DEFINITELY cant read chat right Extra Dainty Gorl minute ago COULD LEAST CREDIT US CHINNY Minuit minute ago Extra Dainty Gorl oh nooo doesnt learn sad cute hilarious time sorry must always shock know wouldnt able sleep afterwards Luxury Villa Cat Advocate minute ago Grape Chia EVEN COULD WOULD NEVER SHES SAFE YAKNOW Minuit minute ago Grape Chia Grape Chia moment ago Luxury Villa Cat Advocate HAHAHAHAHAHHA MENTIONS Luxury Villa Cat Advocate moment ago Grape Chia fucking lol amazing isnt Benet_Bandito284 moment ago cause degrees things tend FREEZE Prev Go page Go Go page Go Next First Prev Go page Go Next Last Next Highlight Thomas Eugene Paris Sexy Howdy Doody sort way kiwifarmsnet Joined Feb 20 Nov 26 6I call shenanigans said shes preorthopedics appt appointment give lots content Orthopaedic surgeons experience absolute worst pointing stresses obesity places body damage causesin Kellys language Fatphobics Plus surgeries perform commonly often quite strict BMI limits place good reason wonder Kelly preempted appointment sending one antifatphobia letters warning said specialist Click expand orthopedic surgeons often lowest BMI physicians usually joyful movement athletic pursuits like talking Kelly going soooo triggered gives little frisson picture ensuing chimpout Reactions Clotso Coof Actually Christian Bale Cereal Killer others Visible Belly Outline send Hell sexually kiwifarmsnet Joined Jan 31 Nov 26 6Thomas Eugene Paris said orthopedic surgeons often lowest BMI physicians usually joyful movement athletic pursuits like talking Kelly going soooo triggered gives little frisson picture ensuing chimpout Click expand going wonderful theyre going say multiple times needs lose weight ___ x ray orthopedics problem pretty much lessened massive casing fat crushing skeleton joints Physical therapy gets surgery going joy Reactions Clotso Coof suck ass Diet Coke Life others BElanna dead yet True Honest Fan kiwifarmsnet Joined Jul 12 Nov 26 6DefCon Dumb said Long CoVD dont know anyone read many articles including peer reviewed papers seen many interviews believe real people Bravo doctorsclinics starting running basic panels tests New emergent illnesses especially capacity chronic sadly often jumped Munchies sooner establish proper diagnostic parameters rule comorbidities MAY share symptoms better tailor proper treatment regime patient mention offload clearly suffering specific illness Kelly preemptively whine doctor shes blue shed reeing nonstop treated incorrectly doctor took word anything rather run proper tests Click expand Also Im going avoid powerleveling Kelly ever needs cancer treatment shes gonna rude awakening Oncology zero fucks give feelings comes treatment options Reactions Clotso Coof Donut Coma Pineapple Fox others Reepicheep True Honest Fan kiwifarmsnet Joined Dec 1 Nov 26 6Reactions Clotso Coof Pina Colada Oracle others Cripple kiwi faggot enabler kiwifarmsnet Joined Apr 30 Nov 26 6Reepicheep said View attachment View attachment 2752683View attachment Click expand Talk trying check every box celebrated Thanksgiving Im still good white Talk condescending Native Id offended whitey stuffing keeping maw shut Plus nourishment always important thing people claim food making fat Normal people dont think food much Reactions Pina Colada Oracle Pineapple Fox others BIG DADDY kiwifarmsnet Joined Oct 29 Nov 26 6To fly wall wokescold tried give thanksgiving family dinner everyone else wanted catch watch football Reactions Pina Colada Pineapple Fox Cereal Killer others Mealy Mouth Spittle True Honest Fan kiwifarmsnet Joined Jan 4 Nov 26 6Kelly dripping white supremacy end day Girl thats meat sweats Thanksgiving pig really Thanksgiving holding different day doesnt change anything like saying arent really celebrating Hitlers birthday youre going pigging swastika themed cake April instead April 20th could Thanksgiving donate money would spend food local Native American tribe know Kelly isnt giving one day year fatties arent shamed shoving huge amounts food gullets Somebody needs start antiThanksgiving campaign talks Native Americans tune nature would NEVER overconsume food way white Americans Gluttony epitome WHITE SUPREMACY overeating point obesity much part capitalistic society places emphasis white folks access unlimited food POC work low wages provide white people fair share worlds food supply want see Kellys head explode choose HAES white people evil Reactions Clotso Coof Pina Colada Pineapple Fox others Uncanny Valley kiwifarmsnet Joined Jun 13 Nov 26 6Reepicheep said View attachment View attachment 2752683View attachment Click expand made wojape instead cranberry sauce Boy Kelly really destroyed Colonialism one Reactions Pina Colada Oracle babyTAP others vanilla_pepsi_head Stone Cold Steve Autism kiwifarmsnet Joined Aug 10 Nov 26 6For pearl clutching hear SJW types Thanksgiving celebrating Native genocide whatever Ive never actually heard Native American say fucking word indicating solitary fuck give lardass Americans want excuse oink Turducken candied yams November dont doubt Id willing bet ones loudest trufflepigging around grievances skew towards greatgreatgrandad sorta looked like mightve Cherokee supposedly type Native Also way appropriate Native cuisine context ebil white mans MURDER FESTIVAL Kelly fucking bigot Reactions Clotso Coof Pina Colada Oracle others Thomas Eugene Paris Sexy Howdy Doody sort way kiwifarmsnet Joined Feb 20 Nov 26 6Visible Belly Outline said going wonderful theyre going say multiple times needs lose weight ___ x ray orthopedics problem pretty much lessened massive casing fat crushing skeleton joints Physical therapy gets surgery going joy Click expand Mmmm thinking getting owned fit jock getting day know shes going get social media afterward talk big game used muh fat activism TrUe FaCtS totally take make see error shitlord ways Im sure actual interaction consist saying okay crying office Reactions Pina Colada Bunny Law Thank others Crepidodera fulvicornis Make Flea Beetles Green True Honest Fan kiwifarmsnet Joined Mar 2 Nov 26 6Mealy Mouth Spittle said want see Kellys head explode choose HAES white people evil Click expand Awfully naïve thinking Mx ethical consumption capitalism bother lol would cognitive dissonance Reactions Bunny Law peetz cum sock Thank others Reepicheep True Honest Fan kiwifarmsnet Joined Dec 1 Nov 26 Highlight 6Reactions wimzi Clotso Coof Lychee Queen others Visible Belly Outline send Hell sexually kiwifarmsnet Joined Jan 31 Nov 26 6Reepicheep said View attachment Click expand emotional incest cross actual incest disturbing add caption extra oh sweet fuck factor Reactions Pina Colada sharktopuss Chickenpox others vanilla_pepsi_head Stone Cold Steve Autism kiwifarmsnet Joined Aug 10 Nov 26 6Reepicheep said View attachment Click expand usually refrain reaction images almost literally reaction scrolled Kellys gross chinny potato face angle Im used one scroll BWAAH Reactions Pina Colada Oracle Donut Coma others Trombonista Super Scription Data Forum Staff Global Moderator True Honest Fan kiwifarmsnet Joined Feb 3 Nov 26 6Reepicheep said View attachment View attachment 2752683View attachment Click expand sprupemaci think Kelly might also drunk much last night Reactions Pina Colada Pineapple Fox babyTAP others beanbag hurry Got sick ALR pic look cat instead True Honest Fan kiwifarmsnet Joined Mar 20 Nov 27 6How could Jerry possibly resist Lets think hard hope doesnt pump another poor child oven Reactions Pina Colada MrHoneyBadger VinegarPussy others Cripple kiwi faggot enabler kiwifarmsnet Joined Apr 30 Nov 27 6Reepicheep said View attachment Click expand Eh could believe kid picked could liked pattern andor texture kids wouldnt get sexual aspect cut though likely lack trying Kellys part another thing post online caption Kelly Reactions Pina Colada Cereal Killer MrHoneyBadger others Crepidodera fulvicornis Make Flea Beetles Green True Honest Fan kiwifarmsnet Joined Mar 2 Nov 27 6Reepicheep said View attachment Click expand JESUS CHRIST Reactions Clown Baby Pina Colada MrHoneyBadger others HexBawxUno Everyday Bro Fat Girl Flow kiwifarmsnet Joined Jun 20 Nov 27 6Trombonista said sprupemaci think Kelly might also drunk much last night Click expand dont remember seeing Kelly talk getting drunk like say Tess Anna Reactions Lies Unlimited vlcsr RonRiot trans punx fucking shut kiwifarmsnet Joined Jun 6 Nov 27 6Reepicheep said View attachment Click expand Someone needs photoshop two frowning Kelly faces onto tits Im choosing believe year old based hates rather grisly alternative Reactions Pina Colada Anne Hyroe MrHoneyBadger others Prev Go page Go Go page Go Next First Prev Go page Go Next Last must log register reply Similar threads Gacha Life Community Anti Gacha Life Community Kid lords edge holy crusade tear battlefield takes place Token Weeaboo May 24 Community Watch Replies Views 60K Jun 7 Untrue Dishonest Poll Amberlynn Reid pound pathological liar UHaul lesbian moving next livein maidnursegirlfriend PiggyPie Aug 19 Deathfats Replies 54K Views 20M Today 5AM dfranki723 Jude Valentin Judy Valentin MermaidRoyal MermaidQueenJude MerQueenJude Twitch Streaming Clout Chaser Sometimes woman Obese let plight Sep 7 Deathfats Replies 16K Views 3M Today 3PM Husbando Collector Forums Lolcow Salon Deathfats Style chooser Change width Contact us Terms rules Privacy policy Help RSS Support Forum website made possible contributions viewers like Thank BTC bc1qvghgzdewy7tar78uy29ypqjwaur3ueecknln69 LTC ME4ivwAUSTRd2qvMdYd1VMu3oWyrdowUHb ETH BAT 0x354c260Ef39E3782FAa5B9712D160636b7ECC5d5 XMR 438fUMciiahbYemDyww6afT1atgqK3tSTX25SEmYknpmenTR6wvXDMeco1ThX2E8gBQgm9eKd1KAtEQvKzNMFrmjJJpiino OXEN LOKI LWoKwqEjM5qjVt1UgDCCaYWYiWwvBpn7AFHRbByioSG1aBoSvaiJC7S9nftmGCm6iW9WrQhYgLNofg2Sh88shuFUJCeqmyX ADA addr1qxp4yslzpphahvmszsqja5n6m7zzg8czaum6ywehzykwgk3u0hkwm7dv5y2jzg40ejut0h2urua3kh08sdxwv6sq0vcqfrzzzr Kinesis AU AG GDCXUWZWVA72BOBI67VFT243BSGX32ZIS3JS677CZW4R7VO2CG5IJWJB Community platform XenForo 2010XenForo Ltd Lolcow LLC adult website Minors must discontinue accessing site Live free die Hosted Hosting Primary kiwifarmsnet kiwifarmstop kiwifarmsru uquuzyqdonion others kiwifarmsis kiwifarmstw kiwifarmshk kiwifarmsnl,bad
2,http://7ldoieonv5rqpkg5rupe5ee7td4iy3ba5gizmgsgyzk6piecm3uraeid.onion?Comment-les-intox-sur-Rothschild-alimentent-l-antisemitisme-089,Comment les intox sur Rothschild alimentent lantisémitisme bassechaineinfo Barre doutil PUBLIER PRÉSENTATION INSCRIPTION CONNEXION Navigation principale bassechaineinfo Infos locales Analyse et Histoire Brèves À lire ailleurs Réseau Mutu Close Recherche dans le site À lire ailleurs Antifascisme Antiracisme Comment les intox sur Rothschild alimentent lantisémitisme Publié le avril Maj le 1er mai Depuis plusieurs semaines nous avons vu le nom de la famille Rothschild sur des pancartes lors de manifestations de Gilets jaunes Étant donné tous les agios quils nous prennent il est évident que nous naimons pas vraiment les banquiers mais nous ne souhaitons pas instrumentaliser la haine de la finance à des fins racistes Historiquement la figure du banquier juif souvent été utilisée par le discours anticapitaliste du XIXe siècle et charrie avec elle de nombreux symboles antisémites Dans le cas de la famille Rothschild de quoi parleton Un article du site Agitations La famille Rothschild est un grand nom de la bourgeoisie daffaire juive Originaire du Saint Empire lAllemagne actuelle la famille se divise en cinq branches allemande anglaise française autrichienne et italienne au début du XIXe siècle Plus conservatrice que la branche anglaise la famille française ne simplique que peu dans les affaires politiques elle est très rapidement remarquée du fait de son ascension sociale fulgurante et dune politique paternaliste qui lamène à faire du mécénat et à investir dans des œuvres caritatives Tout au long du XIXe siècle la branche française devient un grand nom de la haute banque parisienne et du développement industriel notamment dans les chemins de fer Aujourdhui la famille ne pèse plus beaucoup dans les grandes richesses internationales la plupart des branches sétant éteintes le plus souvent du fait des politiques dextermination nazies et fascistes il ne reste plus que les Rothschild français et anglais En France si linstitution Rothschild reste assez puissante elle perdu de son importance depuis le XIXe siècle parmi les plus riches de ce monde ne retrouve que Benjamin Rothschild à la 1250e place et à la 21e place française en cumulant la richesse de toute la branche française finalement loin derrière les grandes familles industrielles Arnault Dassault Mulliez etc Sil ne sagit pas de défendre la place dune famille bourgeoise qui longtemps tenu des positions réactionnaires nous essayons par lanalyse des trois intox suivantes de voir comment la mythologie qui entoure la famille Rothschild mobilise plusieurs formes dantisémitisme Fake news n Rothschild financé Hitler Le janvier à linitiative de fascistes lyonnais tentant de récupérer le mouvement des Gilets jaunes un groupe dune trentaine de personnes est allé bloquer la banque Rothschild avec comme slogan La banque Rothschild finançait Hitler aujourdhui cest Macron Bien que laction ne semble pas avoir eu beaucoup dampleur elle été relayée avec enthousiasme par beaucoup dindividus venus dhorizons très différents tant ce mythe reste tenace Si aucune banque Rothschild na financé Hitler dautres institutions financières comme JP Morgan ont bien financé le parti fasciste italien et le parti nazi allemand Il sagissait pour la banque américaine de sassurer des remboursements des dettes de guerre datant de la Première Guerre mondiale mais ces motivations peuvent aussi sexpliquer pour des raisons idéologiques En effet lanticommunisme et surtout lantisémitisme 1 ont poussé de nombreuses élites industrielles et financières à soutenir des organisations fascistes dans un contexte où le mouvement ouvrier des années 1920commençait à menacer les intérêts du capital Lantisémitisme en effet joué un rôle prépondérant dans la concentration dune partie du capital financier et industriel occidental Ainsi à la fin du XIXe siècle la banque JP Morgan était à la tête dun très large conglomérat regroupant les familles WASP Blancs anglosaxons et protestants des USA et du RoyaumeUni mais aussi de vieilles familles daristocrates français qui ne cachaient pas leur antisémitisme Mêlée à de nombreux scandales dont le soutien discret au régime nazi la banque JP Morgan sest illustrée par son refus de restituer les biens juifs spoliés sous le régime de Vichy Aussi lors de la création de lÉtat dIsraël en 1948 la banque participa au boycott arabe 2 et profita au passage de la manne des pétrodollars Si depuis les années 1960 le racisme dans les institutions financières semble se résorber note toutefois une rivalité persistante entre banques protestantes et banques juives Durant le krach de 2008 la banque JP Morgan en effet joué un rôle dans la faillite de la banque Lehman Brothers Fake news n Les Rothschild possèdent des banques centrales Une autre intox qui beaucoup circulé été mobilisée par la banque BNP Paribas dans un récent article 3 depuis retiré Selon elle les Rothschild posséderaient lintégralité des banques centrales des États à lexception de qui auraient pour caractéristique commune dêtre opposées aux ÉtatsUnis des pays comme Cuba la Corée du Nord le Soudan ou lAfghanistan par exemple Il faut dabord comprendre que les banques centrales sont des institutions publiques chargées de contrôler la monnaie Elles peuvent parfois prêter à des banques privées mais ça ne concerne pas lessentiel de leurs activités Les banques Rothschild à savoir les groupes Rothschild Co issus de la banque ParisOrléans où travaillé Macron ainsi que le groupe Edmond de Rothschild sont deux banques commerciales bien distinctes dont les activités vont de la gestion financière aux fusionsacquisitions Elles ne peuvent donc posséder de banques centrales Par exemple en France la Banque de France est sous la tutelle du Premier ministre qui nomme son gouverneur Aux ÉtatsUnis la FED est sous le contrôle à la fois du gouvernement et du Congrès mais aussi de banques fédérales régionales Enfin la puissance des banques Rothschild est largement surestimée les deux groupes précédemment cités sont présents respectivement dans et pays pour un nombre demployées estimés à environ travailleureuses largement en deçà dune banque comme la BNP ou JP Morgan environ chacune en termes de bénéfices retrouve à peu près les mêmes proportions millions de dollars annuels contre milliards pour JPM Fake news n La loi PompidouRothschild La dernière intox repose sur une mécompréhension dune loi de sur la banque de France soidisant responsable de la dette publique du pays À lorigine circonscrite à lextrême droit cette rumeur gagne en popularité à partir de la crise de et est désormais relayée par la gauche et même la gauche radicale En plein débat sur les dettes publiques cette rumeur considère quavant lÉtat français pouvait emprunter à taux dintérêt nul auprès de la Banque de France alors quavec cette nouvelle loi il serait obligé demprunter à des banques privées dont la banque Rothschild Plusieurs points sont ici à préciser Dun point de vue formel cette loi nopère pas de grands changements mais ne fait que reformuler le statut de la Banque de France en vigueur depuis 1936 En réalité la Banque de France pouvait avant et après 1973 financer lÉtat selon des conventions et des plafonds régulés par le Parlement ou dautres institutions publiques telles que la Caisse des Dépôts LÉtat toujours dû emprunter sur les marchés quil sagisse de particuliers lexemple le plus connu concerne les emprunts de guerre dinstitutions publiques ou de banques privées Pour chacun de ces acteurs les taux doivent être suffisamment intéressants pour que ses débiteurs trouvent également un avantage Il sagissait avant tout de mesures visant à lutter contre linflation Dune manière générale considère que la libéralisation de la politique monétaire ne parvient pas à simposer en France dans les années 1970 mais bien plutôt à partir du tournant de la rigueur opéré par Mitterrand en 1983 puis en suite au traité de Maastricht qui abroge cette fameuse loi de 1973 En revanche ce qui change avec les années 1970 cest lentrée de la France dans la crise et donc la nécessité pour les capitalistes de restructurer le modèle économique du pays Sensuit un certain nombre dattaques contre le compromis social régnant jusquelà baisse des salaires directs et indirects baisse de la fiscalité des entreprises pour compenser la faible rentabilité des capitaux et donc dans lensemble moins de rentrées dargent pour lÉtat Notes 1 Le marxisme est associé au judaïsme du fait quune grosse partie de ses penseurs Marx Luxembourg etc sont dorigine juive 2 Boycott des produits israéliens en initié par la ligue arabe 3 Rédigé dans le journal de BNP Paribas par Webedia en février selon eux Le monde datant larticle à février 2019 À lire aussi Dissolution de lalvarium enfin Le conseil des ministre dissout lalvarium le mercredi novembre Sommesnous pour autant débarrassées des fafs angevines Bien sûr que non mais prend quand même Publié novembre PrésentationDémo Antifa Le Jeu aux Nuits Bleues PrésentationDémo du jeu coopératif Antifa Le Jeu par ses créateurtrices le collectif La Hordre ce samedi novembre à la librairie Les Nuits Bleues Publié novembre Publiez sur bassechaineinfo Le site est ouvert à la publication La proposition darticle se fait à travers linterface privée du site Le lien cidessus mène aux informations pour comprendre comment accéder et procéder Pour nous contacter bassechaine chez riseupnet bassechaineinfo À propos Présentation Publier Crédits Propulsé par Spip Secouru et inspiré par Riseup Connexion Se connecter Autres RSS,bad
