index,link,text,marker
6,http://onionwsoiu53xre32jwve7euacadvhprq2jytfttb55hrbo3execodad.onion/2019/01/06/switzerland-four-men-arrested-for-using-dark-web-child-porn-forum/,Switzerland Four Men Arrested Using Dark Web Child Porn Forum Onion Web Explore Popular Posts Access Darknet buy Dark web Tour Darkweb Markets Mustread Dont Get Scammed PGP Keys Encrypted Messages use Monero buy online Darknet VS Darkweb Difference Topics ViewallTopics Dark web Drugs Bitcoin Leaks Altcoins Trading Markets Hacking Security DeepDotWeb Guides Reviews Interviews Arrests Popular Spaces Onion Web Darknet Dummies Dr Greenthumb Wheres Mind Doggystyle Reviews Rich 30s High Jones Discover MustVisit DarkRise Darknet Doesnt Fail Darkguard Verify URL dReviews dDarknetStars Recon Vendor Database Reviews Coming soon Dread DiscoverAll Markets Ranking Darknet Marketplaces Darknet Forums Darknet Shops Dead Sites Actions Contact SubmitmyStory AddaSite Donate PGP Mirrors Canary Related Log Sign Account Spaces Topics Contact Us Switzerland Four Men Arrested Using Dark Web Child Porn Forum DeepDotWeb DeepDotWeb Jan Authorities Switzerland arrested four suspected members dark web child abuse forum Elysium Europol coordinating investigation German authorities FedpolIn 2017 German Federal Criminal Police Office raided home owned operator Germanys largest child pornography forum dark web arrested forum owner seized encrypted computers hosting server Since arrest German Federal Criminal Police Office branches law enforcement Germany Austria arrested members Elysium used logs seized server pieces revealing information track physical child abusers first Even though forum German speakers law enforcement around world started receiving information Elysium server Working information police forces various countries arresting small number Elysium membersLooking arrest data Elysium members lived Germany Austria investigation members forum Since German man owned operated forum forum appealed pedophiles living Germanspeaking countries number suspects Germanspeaking countries surprising However Germanspeakers live Germany every forum user spoke German German Federal Criminal Police Office recognized significant case German authorities forum first known German child pornography forum dark web majority forums users lived Germany Switzerland one target countries hosts massive number German speakers German one countrys native languagesThe Federal Office Police Fedpol received information Europol four suspected Elysium members living Switzerland Europol received information German law enforcement recent dark web cases involving international criminals Europol facilitated investigations different countries worked Federal Criminal Police Office Central Office Suppression Cybercrime since start investigation Elysium members provided analysis coordination exchange operational information German authorities announced addition Germany Austria Europol coordinated arrests Elysium members Italy New Zealand AustraliaFlorian Näf spokesperson Federal Office Police told reporters Europol forwarded information suspects Fedpol Fedpol turn forwarded information Cantonal Police Canton Zurich Canton Bern Canton Aargau Cantonal Police three cantons searched several residences December 2018 looking pedophiles However Fedpol spokesperson want identify suspected Elysium members police involved investigation time announcement spokesperson announced specific charges suspects allegedly committed explained Europol sent information identified four suspects members seized dark web forumThe spokesperson said increasing number criminals switching surface web dark web illegal activity Näf said pedophiles using dark web one concerning problems number convictions related possession distribution child pornography increased 40 less ten years spokesperson explained many pedophiles live Switzerland participate sharing child abuse content anonymity provided dark web prevents investigators catching suspects Thats number unreported cases connection darknet offenses high Näf saidIn Germany four socalled staff members forum appeared court least Prosecutors accused one man running forum another man allegedly built forum two men allegedly moderated forum One alleged moderators also physically abused daughter another Elysium member hearings expected run March 2019 Previous article German Man Sentenced Selling Stolen Identities Next article Bitcoin price weekly analysis 7Author DeepDotWeb Without doubt predecessor TheOnionWeb DeepDotWeb news site dedicated events surrounding dark web featuring interviews reviews darknet markets Tor hidden services legal actions privacy bitcoin related news Articles Donate Bitcoin 1NDqCHu3C8rjgfJs34TgZ8BKa2VsuduRMC Monero 46UwFaceGmLheF9qRq6EjSAmuJF2P5KVfXinVM4NEr6DJhxAWW2j2D79BUTe1HMnTTNt3cbz6QKUEEhmnaZVrMzMKaAtgCW Comments Write comment Write Comment view comments Read write comment Read guidelines Comment text Post Comment Advertise Darknet Sites Featured Sites Torrez 100 CannaHome 100 Abacus Market 97 Markets Revolution Market 98 Vice City 100 Dark0de 95 Cannazon 74 ASAP Asean 100 Cartel 86 Archetyp Market 97 Tor2door 100 Monopoly 94 Versus 98 Tor Market NZ 100 HYDRA RU 76 Vendor Shops new shit 99 WeAreAmsterdam 95 CharlieUK 100 French Connection 100 ThePirateIsland 93 TomJerry 100 Medicine Man UK 100 SmokersCo 100 Auspride 100 Digital Thrift Shop Pl 100 HeinekenExpress 100 o3shop RU 100 Social Dread 92 Majestic Garden 86 HUB 57 Deutschland im Deep Web DE 85 Cebulka PL 90 Services News Directories LARGEST Markets December TOP number products Full Ranking Torrez Dark0de Versus ASAP Asean Cartel Bitcoin Today High Low Monero Today High Low Latest Comments Authentik2900 Site à éviter commande de c faite chez eux jamais reçu une arnaque TomJerrys profile mawosx low contact waiting days parcel 50g coco contact pr WeAreAmsterdams profile foster6la biggest greatest Torrezs profile Fidel Dam Im cannabis plug left Cannazons profile 14characters Looking make Make Money Looking Job Post Find Job Deep Web krazydversa ey ross aim chile espero que algun dia encuentres la libertad fr Life Box kotorfan21 anyone know actual Nonscams registeredreal passports Newbies Spaces space MahNemzJeff loyal Torguard user going years hands TorGuard VPN Review FUCKOFF MOTHER SCAM WEBSITE DarkFox Markets profile oshit Allowing users finalize orders withdraw funds White House Markets profile Tag Cloud Bitcoin Darknet Dark Web Drug Sentenced Arrested Man News Tor Drugs Silk Road Prison Market German years Price Busted Cybercrime Net Markets Cannabis Bitcoin Monero Forum Bitcoin,bad
7,http://supportvojao2z6taveolgpvgcz5k4v7smwgjcuzz5ahs5ctnscuejyd.onion/index.php?PHPSESSID=f3cac0f555252dbe4c3acf67ea7bbe70&topic=16938.0,fictional CPChild erotica increase population pedophiliahebephilia Home Help Login Register News Big ups newest Community Hero LikelyHuman PSC never media sharing communityPlease keep Tor Browser Bundle package uptodate Current version 1102And remember practice good OpSec Pedo Support Community Discussion Personal Experience Advice Pedo Chat Pedo Debate fictional CPChild erotica increase population pedophiliahebephilia previous next Print Pages 1 Author Topic fictional CPChild erotica increase population pedophiliahebephilia Read times KinoMiu Emerging Member Posts Karma Age Preference 7Gender Preference Girls fictional CPChild erotica increase population pedophiliahebephilia June 2020 0952 want start first debate talking fictional CPChild erotica Personally would define fictional CPChild erotica CPChild erotica involve real children Lets say loliconshotacon mangasdoujinshi fictional Madeup sexlove stories also category dont forget great girllove boylove poemsMost might already know countries slightly acceptance towards pedohebephilia fantasy countries loliconshotacon manga girlboy love stories legally processed made discussedIn countries group politic parties Internet citizens criticized prevalence culture totally understand Recently noticed upward trend people around luckily Im one countries cannot tell exactly Im w advocate illegalization fictional CPChild erotica admit fictional arts praising child sexuality indeed reduce sexual crime towards real children think long term culture encourage younger generation addict CP ignoring current social normFor example lets say legalization fictional CPerotica much chance people read girlloveboylove poem find interests children young person start explore pornography find lolicon manga perfectly suit herhim heres question think fictional CPChild erotica increase population pedophiliahebephilia kind regulations neededLastlysorry bad English anything unclear Logged KinoMiu Emerging Member Posts Karma Age Preference 7Gender Preference Girls fictional CPChild erotica increase population pedophiliahebephilia Reply June 2020 1050 ideasFirstly major psychology think people less tendency pedophilia hebephilia interests need moment aroused somehow believe social constructionism considering lolita boom Japan 1980s1990s yes think CPChild erotica potentially increase population pedophiliahebephiliaBut like posts stated many negative stereotype us pedophiliahebephilia mean harmful children defined nowadays However fiction works depicting pure positive loves also lots works theme raping hurtcore stuff think hard regulate fictional hurtcore works Since real children involved production works defining fictional children harmed ambiguous creators many ways avoid punished draw hurtcore manga last page draw happy face show enjoys hurtcore playThere interesting things done Japanese society publishers Japan used interesting law requires every pornographic manga note characters years old Even publishers note work encouraging crime story fiction related real person event age consent Japan 13 sexing minor rape crime 13is obscene crime Regarding positive child love fiction however believe key possible acceptance pedophiliahebephilia future true groups support censoring works also happy see emerge younger much nonaggressive group loliconshotacon mutual understanding stay positive see future partly acceptance pedophilia Logged rocks Staff Team PSC Knight Posts 9Karma Ive heard worse reasons start drinking Age Preference 4Gender Preference Boys Girls fictional CPChild erotica increase population pedophiliahebephilia Reply June 2020 2321 dont think would increase pedo population much opinion true pedophilia attraction prepubescent children innate learned child erotica isnt going turn nonpedos pedos allow access type material pedo population may repressing true feelings may awoken latent desires may confuse becoming pedo likely urge always waiting outlet Logged never bad cant get worse Andy Established Member Posts Karma Age Preference 714 Gender Preference Girls fictional CPChild erotica increase population pedophiliahebephilia Reply June 2020 0738 dont think fictional cp would increase population like rocks hidden desire may always fictional cp brings surface Personaly enjoy Logged Midamoto Staff Team PSC Legend Posts 4Karma Row row row boat gently stream Age Preference 5Gender Preference Girls fictional CPChild erotica increase population pedophiliahebephilia Reply June 2020 2117 Quote rocks June 2020 232133I dont think would increase pedo population much opinion true pedophilia attraction prepubescent children innate learned child erotica isnt going turn nonpedos pedos allow access type material pedo population may repressing true feelings may awoken latent desires may confuse becoming pedo likely urge always waiting outletThisYou said Theyre essentially scared people discovering accepting sexuality find ridiculous dont solve problem hiding head sand Pedophiles exist theyre going go away youve taken legal outlet whatever Im one making laws think vast majority lolicons completely innocuous whole charade another one step stigmatizationSorry one nonaggressive lolicons aggressive words may would never dream taking away peoples freedoms baseless prejudice Logged see overwhelming beauty invisible anyone else mark artist madman silicon Established Member Posts Karma Age Preference 6Gender Preference Girls fictional CPChild erotica increase population pedophiliahebephilia Reply June 2020 0817 side argument fictional materials cause uptick pedophiles relies theory pedophilic tendencies inborn unchanging rather result environmental factors Though attraction seems present earliest remember family members mention child toddler always comfortable kids younger time dont recall traumatic sexual experiences often argued present pedophiles still cant rule possibility external factors could influence minorattracted behaviorEither way think major glaring issue enough research topic make legal amends illegalization simulated ontopic material solely based emotion perceived common sense hopefully actual goodwill rather substantial evidence Logged Print Pages 1 previous next Pedo Support Community Discussion Personal Experience Advice Pedo Chat Pedo Debate fictional CPChild erotica increase population pedophiliahebephilia SMF 2 SMF 2017 Simple Machines Logo Original Concept created ChairmanWebsite Design Coding PSC Staff TeamPedo Support Community est 2011,bad
8,http://ik4kzum3ocg6dhx4jhzteko4jzijmxnwsbkcqenf33as3i74i3mcb3id.onion/iib/afde94db,ChaosChild 98ChaosChild 98 previousgallerynext,bad
9,http://yd43paeb65fcuykc4skel6ra2r4qluqicuxjr4wqxgrsn6ti3mlrczad.onion/node/159,Problems Research AdultChild Sexual Interaction Activism Archive Skip main content Activism Archive User account menu Show User account menu Hide User account menu Submit new content us Log Main navigation Show Main navigation Hide Main navigation Home People Articles Site archives Links Research Media Proposals Tags Subject Authors Categories Forum Search Problems Research AdultChild Sexual Interaction Submitted Sasha Sun 1117 22Authors Eric Vern L Bullough Bonnie Bullough Links httpwwwiptforensicscomjournalvolume8j8_2_1htmen1 Description ABSTRACT Although adultchild sexual behaviors occurred many different cultures throughout history little serious research adultchild sexual interactions Barriers performing research include legal restrictions along fact researchers attempting understand explain adultchild sexual interaction risk labeled pedophiles Despite crucial find ways research persons resist adopting todays standards attitudes Year Content type article Language English Tags history culture Add new comment456 views Related content Cancel culture universities Attraction minors Sexuality age consent Brazilian law Critical Look Age Consent Laws Church Mafia,bad
10,http://stormer5v52vjsw66jmds7ndeecudq444woadhzr2plxlaayexnh6eqd.onion/child-labor-laws-are-designed-to-cripple-human-independence/,Child Labor Laws Designed Cripple Human Independence Daily Stormer Featured Stories World US Society Insight Daily Stormer Censored Publication History Featured Stories World US Society Insight Child Labor Laws Designed Cripple Human Independence Andrew Anglin July 27 Heres another sacred cow needs slaughtering RT Brazilian politician landed hot water calling loosening child labor laws pointing Olympic silver medal brought home 13yearold skateboarder Rayssa Leal Critics roundly condemned idea Sostenes Cavalcante Democratas Party deputy Rio de Janeiro took Twitter Monday propose revision Brazils child labor statute bars anyone age holding job suggesting Leals silver medal showed younger kids capable employed Brazilian children aged cannot work skater Rayssa Leal silver medal Olympics said adding Hey thought Congratulations Olympic medalist urging revision Statute Children Adolescents another tweet later Monday Cavalcante cited excerpt labor law sets minimum working age saying would like see particular article changed skateboard girl really good Frankly dont even understand possible guess legit prodigy yeah taboos around child labor around womens oppression slavery Holocaust colonialism hoaxes assume child workers abused point banning children working possible abuse child worker like banning knives possible stab someone Throughout history children worked know fact would preferred work school real reason child labor laws exist state wants children indoctrinated cant happen theyre learning trade locked indoctrination center behavior modified basic freedoms taken children given freedoms responsibilities mature faster become healthier adults Ive reading early America people would send 8yearold boys overnight journeys alone horses 13 children often getting married people supposed develop maturity society go school basically years wonder people comfortable government mommy Theyve never developed kind personal independence thought right Brazilian said thing skateboard chick Ive meaning discuss length topic infantilization Western man need reinstitute child labor probably one thing really agree Elon Musk Related Articles Watch Massive March Support Bolsonaro Brazils Independence Day Police Use Pepper Spray September 8 Brazil Bolsonaro Tells People March Show Support Rumors Say Hes Planning Coup September 7 Brazil Bolsonaro Tells Everyone Buy Rifle Ahead Election August 29 FreeRicky Demographic Countdown shekels plz goyim readerfunded site censored publication history Send Monero today Disclaimer Daily Stormer opposed violence seek revolution education masses information available people systemic change inevitable unavoidable Anyone suggesting promoting violence comments section immediately banned permanently Copyright Daily Stormer 2021 Rights Reserved Watch Daily Stormer Status page future updates case domain seizure,bad
11,http://2azus2ydchjmz5l5fcjmhew4elucd72wwwaqpswni3wiyb3gvqjpfeid.onion/la-campagne-de-zemmour-integralement-financee-par-des-banquiers-juifs-de-chez-rothschild/,La campagne de Zemmour intégralement financée par des banquiers juifs de chez Rothschild Démocratie Participative Démocratie Participative Guide Racial des Villes Les dernières actualités Décryptage Monde Guerre raciale Démocratie Participative 卐 Le site le plus censuré dEurope 卐 Démocratie Participative Guide Racial des Villes Les dernières actualités Décryptage Monde Guerre raciale Home Décryptage La campagne de Zemmour intégralement financée par des banquiers juifs de chez Rothschild La campagne de Zemmour intégralement financée par des banquiers juifs de chez Rothschild Captain Harlock Démocratie Participative septembre Après la juive séfarade Sarah Knafo qui gère sa campagne nous en savons plus sur les réseaux financiers de Zemmour Vous serez surpris dapprendre que ce sont des banquiers juifs de chez Rothschild France Bleu Cest une simple boîte aux lettres fixée derrière une porte bleue légèrement défraichie dans le hall dun immeuble situé au 18 rue du FaubourgPoissonnière dans le 10e arrondissement de Paris Rien ne permet de deviner que dans ce bâtiment entouré de bars et de restaurants se trouve le siège officiel de lassociation Les Amis dÉric Zemmour qui finance la précampagne du possible candidat Il existe bien un indice que même les habitants de limmeuble nont pas su décoder Sur cette boîte est écrit LES AMIS DERIC ZE Depuis fin avril 2021 cest pourtant bien là quatterrissent les chèques envoyés par les sympathisants qui veulent faire un à lassociation en compte environ vingtcinq qui tous les trois jours en moyenne sont emportés par le trésorier des amis dÉric Zemmour et déposés à la banque Cette boîte correspond à un appartement situé au 2e étage du bâtiment Mais lorsquon arrive sur le palier en sortant de lascenseur étroit et que lon frappe à la porte personne ne répond remarque alors un deuxième indice audessus de la poignée sont placardés des panneaux faisant référence à une société répondant au nom de Checkmyguest une startup spécialisée dans le conseil aux entreprises qui souhaitent reconvertir des locaux commerciaux en logements et qui propose à la location à Paris près de appartements haut de gamme Renseignements pris lappartement du deuxième étage appartient à une société nommée Société Poissonnière Une SAS société par actions simplifiée qui été créée le octobre par actionnaires parmi lesquels deux dentistes de Créteil et surtout leur cousin Julien Madar Cest ce dernier qui mis la boite aux lettres à disposition de léquipe dÉric Zemmour Âgé de ans il est le Directeur Général de Checkmyguest Ancien banquier daffaire chez Rothschild où il sétait spécialisé dans la fusionacquisition pendant son année de césure il dabord étudié à luniversité de Columbia à New York Après cela il créé une association dinvestisseurs club deal avec un ami également banquier chez Rothschild avant de rejoindre Checkmyguest une jeune pousse quil avait aidée il quelques années en levant millions deuros de fonds Startups banques daffaires levées de fonds jeunesse Ce profil rappelle certains de ceux des lieutenants qui entouraient Emmanuel Macron lors de sa campagne en 2017 Mais ce jeune loup roule pour la droite radicale quincarne Éric Zemmour Un proche du potentiel candidat à la présidentielle nous le confirme Cest Julien Madar qui soccupe de la partie financement Cest ce juiflà Que du classique Lorsquil rencontre la cellule investigation de Radio France dans un café près des ChampsElysées le patron de Checkmyguest insiste un peu embarrassé société na strictement rien à voir avec cette boite aux lettres Mes associés ne sont dailleurs pas au courant cest une initiative personnelle Il nous explique alors comment il est devenu le monsieur finance de Zemmour Je connais bien un très proche dÉric Zemmour Il est venu voir en avril dernier avant le dépôt en préfecture de lassociation des amis dÉric Zemmour et il demandé si je pouvais lui fournir une boite aux lettres pour recevoir les chèques Comme je suis propriétaire de ce logement et que cest société qui en assure la gestion je savais que cette boite aux lettres ne servait jamais puisque les touristes qui louent lappartement nen ont aucune utilité et nont de toute façon pas la clé La réception des dons aurait pu se faire chez le président sur le départ de lassociation de financement du parti des amis de Zemmour Ambroise Sabatier Mais Ambroise Sabatier habite près de Lyon précise Julien Madar Cest loin avait besoin dun endroit dans le centre de la capitale Cest donc dans le 10e arrondissement de Paris que Julien Madar reçoit les chèques et il fait plus que ça Jaide Éric Zemmour sur la fiscalité de linvestissement ajoutetil mais aussi sur les startups Je lui présente également des gens Il nest pas le seul à laccompagner dans cette recherche de fonds Cest aussi le cas de PaulMarie Coûteau le directeur du magazine Nouveau Conservateur et ami dÉric Zemmour depuis 1993 Après avoir participé à la campagne de Marine Le Pen en il rejoint le polémiste de CNews et affirme avec optimisme Je ne rentrerai pas dans les détails mais rassurezvous il de largent Même son de cloche de la part dAntoine Diers porteparole des amis de Zemmour et autre homme clé de ce dispositif Le directeur de cabinet LR du maire du PlessisRobinson nous confirme lenvoi de chèques Certains envoient des dons de à euros travaille aussi sur un prêt bancaire Lassociation est sollicitée par des financiers en costume et baskets Stan Smith qui nont pas un look de droite Selon lui il aurait une cellule de financement dune dizaine de personnes menée par un banquier daffaires Ce banquier seraitil Jonathan Nadler qui lui aussi travaillé pour Rothschild avant dêtre embauché par JP Morgan Julien Madar ne dément pas Jonathan Nadler gère la cellule économique Je discute avec lui Selon un proche dÉric Zemmour les rôles seraient en fait bien répartis Julien Madar dirigerait la partie opérationnelle du financement de ce qui sapparente à une précampagne tandis que Jonathan Nadler se concentrerait plutôt sur le programme économique Jusquici ces deux hommes le faisaient en toute discrétion la question des finances reste taboue dans lentourage dÉric Zemmour Ils préfèrent rester dans lombre et laisser la lumière médiatique aux réseaux traditionnels de financements de la droite nationale Notamment à lentrepreneur ultralibéral et identitaire Charles Gave qui pourrait quant à lui faire profiter Éric Zemmour de son carnet de chèques et de son réseau londonien Z comme ZOG Commentez larticle sur EELBsu Related Articles FIFA Arab Cup victoire de lAlgérie les bougnoules font les bougnoules sur les Champs heures ago Sans masque Attali ordonne à une goya de remettre correctement son masque vidéo heures ago nuances de marron voici la nouvelle Miss Fronsse heures ago Ecoutez Démocratie Participative S06E43 browser support audio element Soutenez Democratie Participative Nous écrire dempartctemplarcom Les goyim savent faitesles taire Guide pour utiliser MONERO Le livre du moment Projet bourguignon découvrez létat séparatiste blanc cliquez ici DP incensurable sur TOR Guide Les Démocrates décorés de la Croix de Fer Textes doctrinaux de la révolution raciste Mentions Propriété de David Johnson Jr citoyen américain Démocratie Participative est un site US dexpression française placé sous la protection du Premier Amendement de la Constitution des ÉtatsUnis dAmérique Démocratie Participative rassemble les hommes et les femmes soucieux de défendre et promouvoir les valeurs démocratiques et humanistes conformément à lidéal de justice sociale qui lanime Démocratie Participative sengage pour la paix et la nonviolence Powered WordPress Designed TieLabs Copyright 2021 Rights Reserved,bad
