index,link,text,marker
16,http://caqvml3czygopl7h6i6uoykx6crncokd5cwubopugzzyb4xjztns3mqd.onion,Patron NL Darknet Cocaine Store Operating following markets Empire Wallstreet Patron Cocaine ProductsFAQ Last update 202002Patron PriceList 28g Cocaine btc 56g Cocaine btc 112g Cocaine btc 500g Cocaine btc 1000g Cocaine btc FAQ LAB TESTED COCAINE 92 sell best quality merchandise send worse quality better quality others thing everyone whether ordered ten times big orders small Patron Weve business years lot feedback DNMs provide highest quality cocaine secure stealth shipping respect clients provide bonuses Buyers Guide 1Transfer amount according choice escrow wallet 3HiaX4MT2t2yTBEejYUkSCEeGY9S5XCpxU Qrcode 2SEND ORDER AMOUNT ADDRESS wickrcallaoport Shipping Guide SHIPPING NETHERLANDS GERMANY BELGIUM Shipping time estimates 3days sure clearly written address Name Address City Postcode Country Reship Policy experience usually inside EU problems postal deliveries claims made good customer inside EU good reasons provided would discuss reshipping customers outside EUs 30 amount order canwill reshipped accept cash Western Union payment methods bitcoin accept cryptocurrency markets vend Wall Street Empire Patron Cocaine 2020,bad
17,http://dkkjmle6ghk6is5gg7zuf3e5ombwpvutcmasmrpnl6i7udx3ganrtaad.onion,BUY COCAINE ONLINE WELCOME COCAINE STORE SHIP WORLDWIDE SHIPPING VARYS COUNTRY COUNTRY Pure Skinny Cocaine Pure Skinny FishScale Cocaine really untouched pure Weight strongest purest come across EVER PRICES Gram Gram 91 BTC Uncut Crack Cocaine Uncut Crack Cocaine Uncut Crack Cocaine Belgium pure uncut crack Belgium pure uncut crack PRICES Gram Gram 107 BTC Preuvian Flake Cocaine Preuvian Flake Cocaine Preuvian Flake Cocaine Canadian preuvian flake cocaine Canadian preuvian flake cocaine PRICES Gram Gram 106 BTC Norway Cocaine Norway Cocaine Norway High Quality Cocaine taste smell really nice PRICES Gram Gram 137 BTC High Quality Cocaine High Quality Cocaine High Quality Cocaine best coke ever bought darknet PRICES Gram Gram 111 BTC Pure Fish Scale Cocaine Pure Fish Scale Cocaine Pure Fish Scale Cocaine Australian pure hq fish scale cocaine PRICES Gram Gram 420 BTC order WANT BUY Ordering simple PAY VIA BITCOIN STEP Check product want note price STEP Write email drugs001torbox3uiot6wchzonion,bad
18,http://fc3ryhftqfgwyroq7pt63f7jif4jknfrmd3pbdwm4sz3myelf4wfz7qd.onion,Cocaine Drugs cookies javascript trace protect privacy drugsshopperdnmxorg Home QuestionAnswer Cart Contact Escrow Category Cannabis Seeds Cannabis Cocaine Ecstasy LSD Meth RECOMMENDED ITEMS Pure Love Cannabis 20g Feminized Mix X20 Seeds Cannabis Columbia Cocaine 1g Pills Ecstasy Blue Android 200220mg Tabs LSD 200ug Gram Crystal Meth HQ CRYSTAL DRUGS SHOP HOME,bad
19,http://lmoneylmwki7lv4vtijsqr23p6odzpyaw3uffsbm6f5e3osy3wkrfvad.onion,Light Money Discount FAQ Proofs Contact GO LIVE FREE DELIVERY World Exspress Shipping ANONIMITY safety 100 SUPPORT 24We always happy help MANUAL Detailed manual every order SERVICE SPEED Minimum lead time order ESCROW Money back guarantee Welcome world LIGHTMONEY offer large selection dark cash transactions lowest price find credit cards great balance Reliability products tested specialists fully consistent description sure honesty seller Delivery Fast free exspress shipping worldwide ship goods within hours payment Support Technical support always happy hear questions online 24also check FAQ VISA Work World Wide Digit PIN Code Included Best Stores Online Shopping ATMs withdrawals BUY VISA Work World Wide Digit PIN Code Included Best Stores Online Shopping ATMs withdrawals BUY VISA Work World Wide Digit PIN Code Included Best Stores Online Shopping ATMs withdrawals BUY MasterCard Work World Wide Digit PIN Code Included Best Stores Online Shopping ATMs withdrawals BUY MasterCard Work World Wide Digit PIN Code Included Best Stores Online Shopping ATMs withdrawals BUY MasterCard Work World Wide Digit PIN Code Included Best Stores Online Shopping ATMs withdrawals BUY American Express Work World Wide Digit PIN Code Included Best Stores Online Shopping ATMs withdrawals BUY American Express Work World Wide Digit PIN Code Included Best Stores Online Shopping ATMs withdrawals BUY American Express Work World Wide Digit PIN Code Included Best Stores Online Shopping ATMs withdrawals BUY IMPORTANT INFORMATION buying check correctness data entered transfer funds third parties wallets indicated payment cells case problems open dispute mail lightmoneyprotonmailcom success rate close 100 however card blocked first three days use receive replacement additional balance Please try deceive us always check status card case blacklisted Happy shopping Thank cooperation Enable JavaScript start order dangerous anonymity Reliability PayPal Safely Fast transfer Easy 100 guarantee blocking personal account BUY PayPal Safely Fast transfer Easy 100 guarantee blocking personal account BUY PayPal Safely Fast transfer Easy 100 guarantee blocking personal account BUY Western Union Safely Fast transfer Easy MTCN number tracking receiving transfers BUY Western Union Safely Fast transfer Easy MTCN number tracking receiving transfers BUY Western Union Safely Fast transfer Easy MTCN number tracking receiving transfers BUY MoneyGram Safely Fast transfer Easy Reference number used receive cash specified office BUY Card Transfer Safely Fast transfer Easy 100 guarantee blocking personal account BUY Payeer Safely Fast transfer Easy 100 guarantee blocking personal account BUY Welcome Easy Safe eGifts wanted buy something long time waiting discounts help make purchases enjoyable Thanks electronic gifts make purchases world sites much profitable Safely 100 Egifts tracked Funds credited resource account site convenient need wait Egifts delivered immediately payment Email address specify placing order Support 24The support service quickly solve problem Fast activation Egifs buy dream right Amazon Gift Safe fast Easy Code sent specified email address BUY Ebay Safe fast Easy Code sent specified email address BUY Asos Safe fast Easy Code sent specified email address BUY Evidence Reviews Open Proof us FAQ Proofs Contact Product Prepaid Card Money Transfer eGifts Proofs Delivery Contact lightmoneyprotonmailcom price Use EscrowCoin transactions protected EscrowCoincom,bad
20,http://2a2a2abbjsjcjwfuozip6idfxsxyowoi3ajqyehqzfqyxezhacur7oyd.onion,Empire Market Best darknet market Credit Card Cloned Carding Hacking Drugs Dumps Paypal Hack Free Bitcoin Money Counterfeit Cash Buy Gun Gift Passport Visa Mastercard Amex Verified Trusted Bitcoins Escrow Top Hidden Wiki Onion Links Forum Skip content Empire Market Best darknet market Credit Card Cloned Carding Hacking Drugs Dumps Paypal Hack Free Bitcoin Money Counterfeit Cash Buy Gun Gift Passport Visa Mastercard Amex Verified Trusted Bitcoins Escrow Top Hidden Wiki Onion Links Forum Shop FAQ Escrow Shipping Bitcoin Vendor News Total items View Cart products cart BOOKMARK SAVE URL http2a2a2abbjsjcjwfuozip6idfxsxyowoi3ajqyehqzfqyxezhacur7oydonion 12132021 Special offer Use code checkout get discount COVID EMPIRE MARKET VENDOR MONTH BTC Bitcoin wallet New items added TODAY Counterfeits Credit Cards Documents Drugs Gadgets Gift Cards Guns Money Transfers EVERY TRADE PROTECTED ESCROW LEARN iPhone Pro Max 512GB Rated based customer ratings COVIDVACCINE CARD CERTIFICATE registered WORLDWIDE w QRCODE Sale Product sale Rated based customer ratings PreShredded USD CASH Sale Product sale 21Rated based customer ratings USDEURCADAUDGBPANY Stress free virtual physical CC Private method WORLDWIDE Sale Product sale Rated based customer ratings SALE LB GRAMS Bubba Kush Fire Sale Product sale Rated based customer ratings Hacking Services network Sale Product sale Rated based customer ratings x MasterCard Prepaid 3100 2700 Sale Product sale Rated based customer ratings USD Cash App money transfer cashapp flip Sale Product sale Rated based customer ratings PayPal Transfer 2500 Rated based customer ratings Become vendor darkweb market JOIN US Tracking Tracking given day purchase found receipt confirmation email receive Physical shipment vendors ship package within hour receiving notification payment Escrow DHL UPS ship MondayFriday holidays Vendors ship FEDEX MonSat delivery service mention checkout process ask want special FEDEX DHL UPS MAIL packages mailed day Packaging Labeling Small orders shipped inside magazines binders Large orders shipped boxes labeling appear like Ebay Amazoncom package Additional stealth precautions taken dont publicly share Please let us know special requirements Items via Emai Gift Cards CreditDebit Cards Transfersetc Items sent via email require identity information name address etc enter random characters alternative Client receives response within hrs case mass digital goods orders receiving order may take 5hrs advise patient respond accordingly Recent Commentsseller COVIDVACCINE CARD CERTIFICATE registered WORLDWIDE w QRCODEDes COVIDVACCINE CARD CERTIFICATE registered WORLDWIDE w QRCODEanony BTC Bitcoin wallet limited stock VENDOR MONTH seller x Visa Prepaid 3100 2700my cup runith PreShredded USD CASHFrenk x Visa Prepaid 3100 2700seller PreShredded USD CASHPeter PreShredded USD CASHAnonymous PreShredded USD CASHCUNTGOBBLER PreShredded USD CASHAnonymous PreShredded USD CASHStealth PreShredded USD CASHJokster PreShredded USD CASHseller SIG Sauer P250 MM Threaded Barrelcapxx SIG Sauer P250 MM Threaded BarrelShopCounterfeits 12 Credit Cards 18 Documents 22 Drugs 50 Gadgets 47 Gift Cards 14 Guns 36 Money Transfers 18 30 Vendor month BTC Bitcoin wallet limited stock Hot right PreShredded USD CASH InfoHow pay Read Shipping FAQSupport empiresupportairmailcc Copyright Empire Market Right Reserved Theme NewStore ThemeFarmer X,bad
21,http://deepmexzsejpzqid3k7knaas2p73dko6kxgpou7oey7vqtmrhopjyqyd.onion,Forbidden Forbidden nginx,bad
22,http://torbuyxpe6auueywlctu4wz6ur3o5n2meybt6tyi4rmeudtjsysayqyd.onion,TorBuy ESCROW SUPPORT FORUM STATUS ORDER Login Registration Carding Electronics Gift card Hacking Money counterfeits Money transfers Escrow Support Forum Status Order Carding Electronics Gift card Hacking Info Money counterfeits Money transfers Anonim secure ESCROW Guaranteed Reliability Support touch 24Trusted Vendors Seller control TOP VENDORS PURPLE Carding Online selling1367 View Shop WEBSTERN Money transfers Online selling814 View Shop PayPal mania Money transfers Online selling1232 View Shop Oliver FOX Money transfers Online selling705 View Shop FASTGFT Gift card Online selling407 View Shop SHADOW APPLE Electronics Online selling866 View Shop QUICK MAGIC Money transfers Online selling577 View Shop TonceHack Hacking Offline selling216 View Shop Stop Game Electronics Online selling681 View Shop Show vendors HOT SALE sale Visa Prepaid Card PURPLE sale MSI GP75 Leopard RTX Stop Game sale MacBook Air 13inch MacStock sale USD WEBSTERN sale iPhone SHADOW APPLE sale 5 Winger sale ASUS ROG Zephyrus S17 RTX Super Stop Game sale aMZN FASTGFT sale Huawei P40 Pro L Android sale Samsung Galaxy S10 L Android sale Intel Core i58600K Stop Game sale XBOX ONE X Stop Game sale PS4 PRO 1TB Stop Game sale Visa Cloned Card 2500PARALECT Sold sale Visa Cloned Card 2500PARALECT 24x7 Free Support Traffic Encryption Bitcoin Mixer Real Reviews CONTACT US torbuydnmxorg INFORMATION Support Center Ording Tracking Escrow Forume COMPANY Become Vendor use Bitcoin buy Bitcoin CATEGORY Carding Electronics Gift Card Haking Money counterfeits Money transfers TORBUY decentralized trading state Send message Модуль вебформ установлен item added cart Checkout Loyalty program New Buyer 0Purchases Discount 0 Regular Buyer 4Purchases Forum Access Discount 5 VIP Buyer 12 Forum Access VIP Support Discount 10,bad
23,http://dwzsbmxatitqrid3ptthlzmigkcrmfkdt7pwh7ej7yukjgbnybuf4rid.onion,ECash Paypal Western Union Credit Cards ProductsBuyer Guide Support LoginRegister ECash Nr1 Shop ProductsBuyer Guide Support LoginRegister British pound Canadian dollar Euro United States dollar Shopping Cart x Cart empty Please wait Leave search box empty find products enter search term find specific product Sort bySorted Product Name Product NameProduct PriceOrdering Results Latest Products Ebay Gift Card 150 Sales price 5000Discount Price kg Product details Ebay Gift Card 300 Sales price 7500Discount Price kg Product details Amazon gift Card 300 USA Sales price 7500Discount Price kg Product details Top ten Products Amazon gift Card EURO Sales price 8455Discount Price kg Product details Amazon gift Card 300 EURO Sales price 8455Discount Price kg Product details Amazon gift Card 150 EURO Sales price 4509Discount Price kg Product details Products Neteller Money Transfer 1000 Sales price 7500Discount Price kg Product details Neteller Money Transfer 2000 Sales price 14000Discount Price kg Product details Neteller Money Transfer 500 Sales price 5000Discount Price kg Product details Paypal Transfer 1000 Sales price 7500Discount Price kg Product details Paypal Transfer 2500 Sales price 14000Discount Price kg Product details Paypal Transfer 500 Sales price 5000Discount Price kg Product details Steam Gift Card EUR Sales price 4509Discount Price kg Product details Steam Gift Card USA 150 Sales price 5000Discount Price kg Product details Western Union Transfer 1000 Sales price 7500Discount Price kg Product details Western Union Transfer 2000 Sales price 14000Discount Price kg Product details Western Union Transfer 500 Sales price 5000Discount Price kg Product details purchase seller months sometimes delay ALWAYS delivers Anonymous Fast reliable One real legit shops guy never lets Anonymous One Tried meney different sellers first time found one doenst let Anonymous Tried meney waited like houres importantly received Anonymous Took Fast Delivery orders shipped within max 12houres Bitcoin accepted Fast Support team responds asap questions,bad
24,http://ujuwmruwekgs7ekzlpzrmvkgj7bmsykrcqbmhup3hinpm7lhl2howbqd.onion,Choose Better telling whether onion site scam Categories Cloned Cards Paypal Accounts Gift Cards Electronics Counterfeit Money Fixed Matches Hacking Services Fake passportsIDs Escrow Services Need Help choosebettersafemailnet Choose Better buy something onion site dont want get scammed could help already tested lot sites know scams Note dont sell gadgets cards fixed matches etc share informations legit services scams deep web money choosebettersafemailnet start exploring website surely find many interesting things Scam links presented free category Choose category Cloned Cards help checked many cloned cards sellers scam legit lists scam one legit one Learn Buy Paypal Accounts found Paypal transfers well WU MoneyGram scam found legit paypal accounts sellers Learn Buy Gift Cards gift cards sellers checked many lists scam legit Learn Buy Electronics people lounder money selling expensive original gadgets people try scam people Check lists Learn Buy Counterfeit Money Everybody knows counterfeits myth checked many counterfeits sellers create scam legit lists Learn Buy Fixed Matches believe fixed matches best way earn money involving criminal fixed matches sellers legit Learn Buy Hacking Services Hackers demanded nowadays Thats many scammers provide hacking service Check lists hackers Learn Buy Fake passportsIDs need fake ID surely try buy one deep web Check scam list buy legit list fake ID sellers Learn Buy Escrow Services Unfortunately deep web escrow services scam list legit clearnet escrow services Learn Buy Confirmed scam categories Bitcoin multipliers reason sell Bitcoin Bitcoin excuses Prepaid cards reason sell money money NB legit sellers cloned cards WU MoneyGram transfers reason sell real money real money NB legit paypal accounts sellers Categories never check Drugs Narcotics pure evil Also dangerous check Guns People use weapon kill people dangerous check Adult categories kids protected Checking category would disgusting Frequently Asked Questions check general check sellers test purchases add seller legit list get stuff Also accept customers feedbacks strong proofs scam cases links different categories one seller could provide different services instance cards gift cards paypal case add seller different categories scam categories mean Confirmed scam categories sellers scammers Sad true CATEGORIES totally scam legit sellers list Bitcoin multipliers Prepaid Cards Preshredded money Western Union transfers MoneyGram transfers SCAM Note prepaid cards cloned cards Cloned cards exist trust Choose Better best make sure service soe picks Check unmoderated comments People could add anything want Check score Onion Scanner Try find negative reviews deep web bet wont find place order choose categories want buy buy via bitcoin payment gate contact us choosebettersafemailnet buy via another crypto refund guarantee havent received refund requests yet face troubles sellers provided contact us refund loss Instant delivery blockchain confirmations Support 24Contact us hours day Secure Payments 100 anonymous payments Free updates find new legit sellers Email choosebettersafemailnet Choose Better Cloned Cards Paypal Accounts Gift Cards Electronics Counterfeit Money Fixed Matches Hacking Services Fake passportsIDs Escrow Services Accept Payment Via Choose Better 2021,bad
