index,link,text,marker
25,http://22222ask5k2lowak6okzehjjbbbadrmgc2m2vnaj2uiofhn4rxjds6id.onion,TorLinks onion Link List Hidden Wiki Deep Web Onion Urls Onionland Tor linklist TorLinks onion Link List Commercial Links Introduction Financial Services Commercial Goods Drugs Domain Services Erotic NonCommercial Links Services Hacking Email Erotic Forums Blogs Social Others NonEnglish TorLinks moderated replacement Hidden Wiki serves link url list Tor hidden services Feel free copy deep web link list directory website make others aware darknet regulary update Tor onion sites site ads Introduction PointsNonCommercial Links Ahmiafi Clearnet search engine Tor Hidden Services DuckDuckGo Hidden Service searches clearnet Torlinks TorLinks moderated replacement Hidden Wiki Link dir Onion links dir deep web search engine Hidden Wiki mirror Hidden Wiki days old users edit main page Evil Tor search engine indexes hidden services Tor Selfdefense Surveillance Guide Tips Tools Howtos Safer Online Communications clearnet Λ ads Financial ServicesCommercial Links Best Financial Market Prepaid cards VISAMasterCard Cloned Cards Gift Cards VISAAmazonPayPal PayPalWestern Union Transfers Green Machine Forum type marketplace oldest experienced vendors around Get paypals CCs etc Light Money Discount service Prepaid Cards Money Transfers Gift Cards Premium cards Oldest cc vendor Top quality Us Eu credit cards Financial Oasis slew products darker side finance netAuth Automatic system buy Paypal accounts credit cards instantly email Socks5 included Capital Ventures Offering high quality prepaid products great deal Paypal Baazar Paypal accounts sale Cash Machine Phished PayPal Neteller Skrill BoA Wells fargo bank Accounts Paysafecards US EU Credit cards available Global Carding Forum Escrow Accepted CashApp Western Union Moneygram Paypal Zelle Amazon Ebay Wire OffShore Bank VCC CC Pin Queen Galaxy Female Carding Shop Since 2011 CashApp Western Union Moneygram Amazon Wire Transfer Prepaid Debit Credit Bitcards trusted credit cards store darknet returning customers KryptoPayPal PayPal Cashout Service Get account balance back Bitcoin TOP Cards Credit Cards Trusted Vendor unionFast shipping CCard Shop Physical credit cards High balance available order Paypal bitcoins payment method USJUD Counterfeits EUR USD Western Union money trusted escrow accepted trusted seller Financial Market Prepaid cards VISAMasterCard Cloned Cards Gift Cards VISAAmazonPayPal PayPalWestern Union Transfers Escrow Accepted BlackWhite Cards High Quality PrePaid Debit Cards PIN Good Customer Service Best Deals Real currency Finest bills market Passes known tests Random serials topnotch currency Cards World Get Financial Freedom Today PPCC Money vault 24automated PayPal Credit card shop New stock every day Safe cashout Cash Cards Oldest seller old HW Fresh stock 999 safe Worldwide cashout Express shipping Escrow Horizon Store Automated carding storeFast replies 90 cards valid Black Store Bank cards store fresh stock instant delivery Every deal protected Escrow service Queens Cash Buy PreShredded USD EURO Currency fraction value SELL REAL CASH Millioner Private Club Without registrationLimited time Credit cards PayPal Gift Cards Ebay Steam Amazon CC Fullz Western Union Undetectable Counterfeits Λ ads Commercial ServicesCommercial Links Fast Money beautiful shop clients need Prepaid Cards PayPal accounts PayPal Western Union MoneyGram transfers bestseller experienced carders CC Fullz Guns Dark Market Guns market buy guns full auto assault rifles pistols grenade launchers etc Protonix Market Place Best dark web link buy Credit Cards PayPal transfer WU Bank accounts Counterfeiting Center use new technology bills printed using cotton fiber 8099 originally sourced common white linen rag wood fiber 13 titanium white 235 weight total wood fiber polyamide epichlorohydrin 052 weight total cotton fiber aluminum chloride polyamide epichlorohydrin melamine formaldehyde resin animal glue Empire Market Vendor CStore Electronics purchased carded giftcards Everything Brand new Full escrow accepted Apple Palace low priced Apple Products Gold Diamonds Genuine Gold Diamonds Rhino Horn shipped Germany USA Football Money Fixed football games info HackingTeam Hacking Service Team EuroGuns european arms dealer USfakeIDs High quality USA Fake Drivers Licenses Fake Passport ID sale Website selling qualitative EUUSAUSCAN fake passports ID cards drivers licenses Samsungstore Samsung tablets smartphones notebooks escrow Kamagra Bitcoin Viagra cheaper Apples4Bitcoin Cheap Apple products Bitcoin Onion Identity Services Selling Passports IDCards Bitcoins Apple World Carded iPhones iPads Macbooks iMacs consoles shipping worldwide Amazon Cards Bring dreams reality amazing Amazon gift cards Mobile Store Factory unlocked iphones smartphones Cards Credit cards high balance Low Balance CCs Get cheap low balance cards Bitcoin Fortune Buy New Bitcoin Miners discount EasyPayPal Trusted PayPal onion shop big history Good prices Empire Market popular favorite dark web market Everything need Guaranteed stealth shipping worldwide Λ ads DrugsCommercial Links Drug Market Anonymous marketplace kinds drugs Greenroad Biggest marketplace full working escrow WeedCo WeedCigarettes Prix BasLow Price EuCanna First Class Cannabis Healthcare Medical Grade Cannabis Buds Rick Simpson Oil Ointments CannabisUK UK Cannabis vendor selling organic weed DeDope German Weed Shop Weed Hash Germany BitPharma EU vendor cocaine speed mdma psychedelics subscriptions Brainmagic Best psychedelics darknet NLGrowers Coffee Shop grade Cannabis netherlands Pot Shop Weed Pot Shop Trading longer year Steroid King steroids need Wacky Weed Hi Quality Green Wacky Prices Λ ads Domain ServicesCommercial Links OnionName Choose desired domain name prefix order onion domain starting mBTC letters Λ EroticCommercial Links Darkscandals Real rape humiliation forced videos much extreme videos Pack video files packs Λ ads ServicesNonCommercial Links Tor link lists search engines Hidden Wiki Wiki style link list TOR Link DIR small list onion links DIR Simple onion website list TORCH Tor Search Engine claims index around Million pages TORMAX Another search engine Hosting TorVPS Shells Free torified shell accounts used onion hosting IRC etc SporeStack APIdriven VPS hosting Bitcoin Clearnet hidden Tor hosting HomeHosting system administrator set private home server Prometheus_Hidden_Services Payed hosting provides Virtual Private Server VPS Linux Darknet design Web design HTML CSS PHP plus graphics design things Daniels Hosting Free hosting Λ ads HackingNonCommercial Links HeLL Forum HeLL Reloaded back RelateList New era intelligence CODE GREEN Ethical hacktivism better world Join us participate modern world protests Hack Canada America joke Canada punchline Oldish hacking site hosts archives Hack Place Site several books resources software development pentesting hacking fight censorship Reporters Without Borders project aims combat censorship promote flow news information Λ EmailNonCommercial Links Protonmail Swiss based email service encrypts emails locally browser Free paid accounts Mail2Tor Mail2Tor free anonymous email service made protect privacy TorBox hidden mailbox service accessible TOR without connection public internet Eludein Eludein privacy based email service BitcoinMonero exchange BitMessage Connects bitmessage email services Registration available using clearweb link TorGuerrillaMail Disposable Temporary EMail Address Chat strangers Talk random users anonymously CTemplar First ever high end fully encrypted tor email service Shielded Securityfocused mailbox hosting customizable ONION domain name Payment smart escrow multisig contracts Lightning Network transactions Ableonion Random chat tor users ads Books OnionWarez Warez forum Tor Library GB pdf chm djvu Design Russebertene Example rendezvous points page Thomas Paines Common Sense Federalist papers Destination Unknown Small selection Searchlores Cryptonomicon Thelema LiberaTor Making weapons military training related subjects Free Bibliotheca Alexandrina English Spanish German books Laughing Nihilist Drugs writing Mister Collection writings art selected texts deeply personal views philosophy existence ParaZite Collection forbidden files howtos pdf txt etc Λ ads EroticNonCommercial Links Fappening Onion Compilation Leaked celebrity nudes Darkscandals Real rape humiliation forced videos much extreme videos Pack video files packs Λ ForumsNonCommercial Links Stock Insiders Oldest Largest Insider Trading Forum community exchanging Insider Information Publicly Traded Companies Intel Exchange Know need know something Ask share underground intelligence gathering network DNM Avengers Darknet drug forum reviews marketplace discussion OnionLand Discussion forum Darkweb markets related topics Dread Reddit like website Λ ads BlogsNonCommercial Links Tor Metrics Welcome Tor Metrics primary place learn interesting facts Tor network largest deployed anonymity network date something measured safely youll find Superkuh Much information spectrogram wireless radio Beneath VT Exploring Virginia Techs steam tunnels beyond Tor CP Free clean Tor Tor users CP Go Beyond blog politics potatoes technology Tor etc Λ SocialNonCommercial Links Connect Connect collective recognizes promotes anticapitalism antiracism antifascism antisexism antimililtarism antiwhatthefuckever refusal authoritarianism hierarchies Galaxy3 Galaxy3 new Social Networking experience darknet Torbook Facebook Tor Share memories connect others make friends Facebook real Facebooks Onion domain Claim keep logs Trust peril Whistleblowing WikiLeaks WikiLeaks DeepWeb mirror famous Wikileaks website Doxbin pastebin personally identifiable information SecureDrop opensource whistleblower submission system managed Freedom Press Foundation Λ OthersNonCommercial Links DuckDuckGo metasearch engine heavy filtering IIT Underground Information photos steam tunnels roofs Illinois Institute Technology Λ ads NonEnglishNonCommercial Links Finnish Suomi Sipulilauta chan Silkkitie Silkkitie Blue Quarters Forum Discussion forum French French Freedom Zone Malwares Hacking Dev Esoterisme Elitisme Aristocratie French Deep Web administered moderate French board 1er forum francophone German Deutsch Konkret das linke Magazin Archiv MadIRC Deutscher IRCChannel Italian Italiano BlackHost small website developed Italian programmer New System Disorder Italian Hackers Community Stay Tuned IDC Reloaded Italian DarkNet Community Polish Polski Teczkohen powrot obrazkowego forum tematyce stalking Polska Cebulka Najstarsze dzialajace polskie forum Spanish CebollaChan CebollaChan el torchan en Castellano TorPez Foro de seguridad informatica entre otras cosas Swedish Svenska MoralNu Vad ar moral KognitionsKyrkan Spiritual stuff Λ ads report missing broken links scams please Contact us Disclaimer site provides links Tor hidden services way responsible content sites host infrastructure2022,bad
26,http://5n4qdkw2wavc55peppyrelmb2rgsx7ohcb2tkxhub2gyfurxulfyd3id.onion,TOR LINKS Best Onion Link Collection __ __ __ __ wwwtorlinksinfo Top Onion SitesMarkets Carding Transfer Escrow Links Email Hosting Hacking Search SCAM Add Onion Serivce Advertising Disclaimer Hidden WIKI FRESH Hidden Wiki FRESH easiest way find information Tor network working links trusted sites CP ORIGINAL CREDITCARDCENTER CreditCard Vendor Since Prepaid VISA Amex MasterCards Western Union PayPal Moneytransfer within min 24Support Escrow Payment Deep Money Transfer Deep Money Transfer Reliable Transfers TOR Ultra Fast Processing Multi Escrow Safely easily purchase goods services unknown untrusted sellers stores bitcoin currency reliable Escrowservice ALPHA CARDS Top Vendor Since Prepaid VISAMasterCards Experts Western Union Transfer PayPal Transfers minimum fee high quality transfers Online DeepLink Onion Directory Onion DIR Apple Store top Apple products Crypto Hacking Group Wallet Recovery Phrases easily anonymous integrable binance Trust Wallet App Hacked Wallets PlasticSharks CLONED VISA CARDS CLONED MASTERCARDS PAYPAL LOGIN INFORMATION Magnate Black Carding Service Prepared cards VISAMasterCard work 24to provide best money service darknetBest prices guarantee clean deal Deep Search Powerful Search Engine TOR Mr Green Make 137651within months Deep Web Covid19 Vaccination record Digital COVID Certificates contains QR code digital signature protect falsification Onion Links Uncensored Onion Links Collection Buy Real Money BUY Money Smart Safe Way Stay away counterfeit methods send jail Page 4,bad
27,http://wiki6dtqpuvwtc5hopuj33eeavwa6sik7sy57cor35chkx5nrbmmolqd.onion,Trust wiki Sections categories Search engines Marketplaces Anonymous services Buy Cryptocurrency Email services Forums Hosting Scam List Social Networks Torrent Media VPN Add link Advesting Donation Report us Sections categories Search engines Marketplaces Anonymous services Buy Cryptocurrency Email services Forums Hosting Scam List Social Networks Torrent Media VPN Add link Advesting Donation Report us Search engines Tordex One best search engines Everything interests found safely anonymously realm Quite young search engine excellent selection sites Ahmia Ahmia searches hidden services Tor network Abuse material allowed Ahmia Torch oldest search service world Tor OnionLand Convenient fast search service Lighter Powerful site indexing nice interface V2 Service available VisiTor One first stable search engines Tor network Sentor quick easy use search service Torch Tordex updated stable version Torch Bobby new highquality search service site database constantly updated Marketplaces TorBuy Safe Tor Marketplace Light Money One reliable fastest Discount Services sale Prepaid Cards Money Transfers Gift Cards Tor network Robot Money Automated website money transfers card data Goldman Financial Services Financial service provides paid services fast money transfers BuyMoney Fully automatic order fulfillment system Bitcoin Monero payments Richi friendly community financial services Darknet Quick Money community anonymous financial hackers requests handled operator option track order Forums Dread popular forum DarkNet news Deutschland Germany deep web DNMAvengers Questions everyone Questions everything TorForum Helpful articles discussions Dark Web markets Hidden Answers popular board answers questions Limit French Zone Alternative Dread Runion Runion Russian forum created people heightened sense justice anonymity security freedom highest priority among aspects communication Hosting Kaizushi Offers hosting PHPDjangoRails secure grsecSELinux system currently offering shell accounts shared server hosting VPS hosting Impreza Host time host site onion network Kowloon Hosting Services Stealth TOR hosting PHP MySQL Control panel MB GB Free Trial Accounts TorPress Free WordPress hosting darknet CYRUSERV Hosting service emphasis security open business Freedom Hosting Reloaded Free anonymous hosting PHP MySQL Support SporeStack Accountless APIdriven VPS hosting Bitcoin Bitcoin Cash Bitcoin SV Monero Njalla confidential domain VPS work Purchase card cryptocurrency Responsive technical support Image Hosting image hosting Dark Web Studio First web studio Tor Email services DNMX Secure anonymous dark net email service cares privacy Protonmail Swiss based email service encrypts emails locally browser Free paid accounts UPD Warning Blocking suspicious accounts Mail2Tor New Tor Mail Server clear web Nevertheless working properly post written delayed emails secMail secMail complete mail service allows send receive emails without violating privacy Offline Guerrilla Mail Disposable Temporary EMail Address Eludein privacy based email service BitcoinMonero exchange TorBox hidden mailbox service accessible TOR without connection public internet CTemplar First ever high end fully encrypted tor email service Onion Mail Onion Mail manage emails normal network onion network personal data required create account emails encrypted PGP public key Social Networks Facebook real Facebooks Onion domain Claim keep logs Trust peril Galaxy3 revival old Galaxy community Ableonion Chat Chat anything Freedom speech without limits RiSEUP Communication VPN Safety ProPublica Journalism Public Interest uncensored Scihub Scientific articles digital paradise scientific research Scam List Empire Market Fake Nothing real Empire Torch Fake sites listed site also fake scammers Xmatches information matches Bitcards Buyers never receive goods Deep Money Transfer security protocols nothing Tor network Lots complaints Tor Onions 12 sites presented fakes Lots peoples watermarks emails evidence Tor Links 11 Advertising dangerous well fraudulent sites CC KINGDOM Proofs stolen Empire vendors order never delivered Cash God Lots complaints payment one answers DeepLink Onion Directory Every site hidden directory fake Dangerous Cash Cards Clone Nobody fulfills orders Belongs DeepLink Onion Directory administration Best Financial Market Clone real owners gone business Belongs DeepLink Onion Directory administration Top onion Big fraud fake catalog Goldman Financial Services Another fake site promoted scam directory Trust Market Cheap copy several sites one Content stolen markets Happy Market stolen copy site name change Orders fulfilled Robot Money Fake original site fulfills orders Fast Card service site large list scammers Orders fulfilled Financial Service project assembled several sites Simple Cash Orders never fulfilled SALE SHOP Lots complaints IMPERIAL Fake original site unavailable Top wiki Big fraud fake catalog Dangerous Global Tor Links Extensive network links fake great danger Tor Scam List Fake site Listed scam sites verified markets Dangerous Multi Escrow money received Hidden Wiki Fake Nothing legitimate Hidden Wiki entire list sites fraudulent Best Financical Market Imperial Old scam Deep Market Another old dangerous site Negative reviews throughout Internet every forum Scam 100 Hidden Marketplace Scam sellers goods stolen markets Orders never executed Black Market Site created foreign markets related legal markets Big Scam Hidden Wiki Fresh Dangerous list Recommended markets fraud 100 scam wiki VPN Nord VPN 60 Country3600 ServersOnion VPNAnti Dos Server UltaFast TV Server Dedicated IP Server Standerd VPN Server Day Money Back Guarantee Express VPN 94 Country1700 Servers Day Money Back Guarantee IPVanish 60 Country1000 Servers Day Money Back Guarantee RusVPN CountryServers Day Money Back Guarantee CyberGhost VPN simple reliable service anonymity Torrent Media TorrentGalaxy Download thousands terabytes absolutely free safe Rutor Russianlanguage torrent programs books games films SuprBuy popular torrent forum oniontv Various video content government censorship Buy Cryptocurrency Bitcoinorg main information portal find necessary information buying Bitcoin also choose wallet use bitcoin Paxful Buy sell Bitcoin worldwide Multiple payment methods Free bitcoin wallet much right Paxful Localbitcoins Service facilitates overthecounter trading local currency bitcoins AgoraDesk Ability Buy Sell Bitcoin Monero LocalMoneroco Marketplace sale purchase Monero xmrguide helpful tutorial setting working Monero Anonymous services Letters Anonymous Online platform people submit letters anonymously Send Anonymous Email Free service anonymous letters Without registering Calyx Institute Jabber Internet security tools Mobile Internet CalyxOS Digital services Privacy Research Educational Programs SeedVault Keybase Secure messaging filesharing PGP Suite simple easytouse clientside PGP tool Tor2Web Proxy secure browse onion Deep Web links service serves online browser browsing links securely anonymously oniontorprojectorg list onion resources Tor Project SecureDrop SecureDrop open source whistleblower submission system media organizations install accept documents anonymous sources MEGATor MegaTor supersimple anonymous file sharing service thats available normal internet Best free decently fast PrivacyTools Anonymity Yes Extensive directory antisurveillance tools services educational materials,bad
28,http://hxuzjtocnzvv5g2rtg2bhwkcbupmk7rclb6lly3fo4tvqkk5oyrv3nid.onion,DNMX Anonymous Email Provider Login Email Email Password Login Register DNMX DNMX Dark Net Mail Exchange free use email service works like Gmail yMail dont care never ask information reveal identity dark net trust Dont Dont trust service dark net strongly recommend use PGP encryption sending sensitive information encrypt servers make best effort secure site never trust us iMap PoP3 support would make easy users send spam available service buy advertising Ad cost month Banner size 468x60 Please use TorDex advertising service place ad TOS,bad
29,http://tordexpmg4xy32rfp4ovnz7zq5ujoejwq2u26uxxtkscgo5u3losmeid.onion,Uncensored Index Tor Onion Sites TorDex HOME DIRECTORY ADVERTISING WEBMASTERS CONTACT Uncensored Dark Net Search Engine 2017TorDex Sitemap Home Advertising Webmasters Contact Top Searches hidden wiki paypal accounts forums porn Directory Best Marketplaces Best Wikis Best Email Services Best Search Engines Services DNMX Email Realm Search Torch Search,bad
30,http://orealmvxooetglfeguv2vp65a3rig2baq2ljc7jxxs4hsqsrcemkxcad.onion,Uncensored Tor Search Engine OurRealm Advertising Search beyond censorship Search Carding Forum Porn Bitcoin western union Hidden Wiki Copyright OurRealm Search orealmvxooetglfeguv2vp65a3rig2baq2ljc7jxxs4hsqsrcemkxcadonion,bad
31,http://z4odvem6bfypjqmwhsgtdaqtkkwgbxhe63dzq2lpnrmnmb6bgoafirad.onion,Xhacker xHacker Services Hacking Education Contact xHacker independent security researcher Hacking social engineering business since 2008 never real job time get really good spent half life studying researching hacking engineering web technologies worked people Silk Road Im also offering services everyone enough cash Technical Skills Web HTML PHP SQL APACHE CC Java Javascript Python 0day Exploits Highly personalized trojans Bots DDOS attacks Spear Phishing Attacks get passwords selected targets Hacking Web Technologies Fuzzing NOSQLi XSS LDAP Xpath Social Engineering Services independent security researcher Hacking social engineering business since 2004 never real job time get really good spent half life studying researching hacking engineering web technologies worked people Silk Road Im also offering services everyone enough cash Ill Ill anything money Im pussy want perform illegal shit work government targets Ill examples Hacking web servers computers smartphones Malware development operating system Economic espionage corporate espionage Getting private information someone Change grades schools universities Password recovery much Prices Im make bucks Im shit eastern europe country happy scam people bucks Im proffessional computer expert could earn 50bucks hour legal job stop reading dont serious problem worth spending cash Prices depend lot problem want solve minimum amount smaller jobs USD pay anonymously using Bitcoin Learn prices Services page Payment conditions wont start work without payment guarantee ways pay Via bitcoin directly 50 50 upon completion Via Bitcoin 100 escrow Escrow conditions Escrow protects time money okay use escrow security conditions Clearnet escrow services Escrow accept Bitcoin payments Escrow allow illegal deals Usually find terms using page going offer escrow service always choice choose exact escrow service going use going check escrow allows illegal deals Please xhackersafemailnet2015 Xhacker,bad
