index,link,text,marker
0,http://drugsxeuauw4xt6eoqwztfkpa2ul5453q4ao4kqrtedhfoy6jmui5ryd.onion,Buy Pure drugs Online Buy drugs Online Buy Cocaine USA Order Cocaine Sale Order Cocaine Sale Buy Pure Cocaine Online Buy drugs Online Buy drugs USA Search Search Shop account RULES Order Status CONTACT FAQ Cart SALE Sale Add wishlist Quick View PSYCHEDELICSMeth Methamphetamine 1Select options Sale Add wishlist Quick View PSYCHEDELICSKetamine Select options Sale Add wishlist Quick View PSYCHEDELICSHeroin 1Select options Sale Add wishlist Quick View PSYCHEDELICScocaine 1Select options FAN FAVORITES Sale Add wishlist Quick View PSILOCYBINGolden teacher 1Select options Sale Add wishlist Quick View PSYCHEDELICSMeth Methamphetamine 1Select options Sale Add wishlist Quick View PSILOCYBINPenis envy mushroom 1Select options Sale Add wishlist Quick View PSILOCYBINmdma ecstasy 1Select options Filter Showing results Sort popularity Sort average rating Sort latest Sort price low high Sort price high low DMT 3 DreamPlus Drugs 8 DreanSteam 1 LSD 2 PSILOCYBIN 6 PSYCHEDELICS 4 Sale Add wishlist Quick View PSILOCYBINGolden teacher 1Select options Sale Add wishlist Quick View PSYCHEDELICSMeth Methamphetamine 1Select options Sale Add wishlist Quick View PSILOCYBINPenis envy mushroom 1Select options Sale Add wishlist Quick View PSILOCYBINmdma ecstasy 1Select options Sale Add wishlist Quick View PSILOCYBINLiberty caps 1Select options Sale Add wishlist Quick View PSYCHEDELICSKetamine Select options Sale Add wishlist Quick View PSYCHEDELICSHeroin 1Select options Sale Add wishlist Quick View PSYCHEDELICScocaine 1Select options Sale Add wishlist Quick View DMTNN DMT 1Select options Sale Add wishlist Quick View PSILOCYBINPcp powder Select options Sale Add wishlist Quick View PSILOCYBINAyahuasca Select options Sale Add wishlist Quick View DMT5meo DMT 1Select options Sale Add wishlist Quick View DMT4AcO DMT 1Select options Sale Add wishlist Quick View DreanSteamcocaine 5Select options Add wishlist Quick View DreamPlus DrugsBLUE CRYSTAL METH 2Select options Add wishlist Quick View DreamPlus DrugsPURE MDMA 95 1Select options Sale Add wishlist Quick View LSDLiquid LSD 22Select options Add wishlist Quick View DreamPlus DrugsECSTASY PILLS Select options Add wishlist Quick View DreamPlus DrugsCHINA WHITE HEROIN 2Select options Add wishlist Quick View DreamPlus DrugsCRACK COCAINE 98 2Select options Add wishlist Quick View DreamPlus DrugsPOWDER COCAINE 95 2Select options Sale Add wishlist Quick View LSDLSD Tabs Select options Sale Add wishlist Quick View DreamPlus DrugsFIRE OG KUSH 1Select options Add wishlist Quick View DreamPlus DrugsWHITE CRYSTAL METH 1Select options Filter price Filter Price Product categoriesDMT 3 DreamPlus Drugs 8 DreanSteam 1 LSD 2 PSILOCYBIN 6 PSYCHEDELICS 4 Packing shed Recent CommentsJohn BLUE CRYSTAL METHRixiean Penis envy mushroomKai ECSTASY PILLSJohn KetamineEdward LSD TabsProducts Rated Meth Methamphetamine 1Rated Ketamine Rated Heroin 1Rated cocaine 1Rated Penis envy mushroom 1Rated Pcp powder Rated mdma ecstasy 1Rated Liberty caps 1Rated Golden teacher 1Rated Ayahuasca Rated NN DMT 1Use Crypto encourage crypto payments discracyPlace order get directly followed contacting customer support Discretion Policy keep customers secured customer information received categorized confidential discretely handled undisclosed third party company stay safe specified insurance policy protects us ship products discretely top shelf stealth prevents radar detection large orders guarantee order division smaller safer package sizes lower risks Copyright Order Cocaine Sale Rights Reserved Shop Account Search Search Search Wishlist Sign Create Account Username email Password Login Lost password CLOSE Filter price Filter Price Product categoriesDMT 3 DreamPlus Drugs 8 DreanSteam 1 LSD 2 PSILOCYBIN 6 PSYCHEDELICS 4 Packing shed Recent CommentsJohn BLUE CRYSTAL METHRixiean Penis envy mushroomKai ECSTASY PILLSJohn KetamineEdward LSD TabsProducts Rated Meth Methamphetamine 1Rated Ketamine Rated Heroin 1Rated cocaine 1Rated Penis envy mushroom 1Rated Pcp powder Rated mdma ecstasy 1Rated Liberty caps 1Rated Golden teacher 1Rated Ayahuasca Rated NN DMT 1X Shopping cart close,bad
1,http://mvxlviep56dotiks7adsyfnfouqpoye5x3vpgabxrfxtjwv6h7n7yaid.onion,Drugs deep web tor Deepweb Tor cookies javascript trace protect privacy drugsshopperdnmxorg Home QuestionAnswer Cart Contact Escrow Category Cannabis Seeds Cannabis Cocaine Ecstasy LSD Meth RECOMMENDED ITEMS Pure Love Cannabis 20g Feminized Mix X20 Seeds Cannabis Columbia Cocaine 1g Pills Ecstasy Blue Android 200220mg Tabs LSD 200ug Gram Crystal Meth HQ CRYSTAL DRUGS SHOP HOME,bad
2,http://6ewotpaeih7g6gphvesr5td3p4fqtniwzhlxfjszemvbi7zg75ceyzid.onion,Market Ecstasy Cocaine LSD Meth Seeds Cannabis drugsshopperdnmxorg Cart0 Home Catalog QuestionAnswer Cart Escrow Contact Category Cannabis Seeds Cannabis Cocaine Ecstasy LSD Meth RECOMMENDED ITEMS Pure Love Cannabis 20g Add cart Feminized Mix X20 Seeds Cannabis Add cart Columbia Cocaine 1g Add cart Pills Ecstasy Blue Android 200220mg Add cart Tabs LSD 200ug Add cart Gram Crystal Meth HQ CRYSTAL Add cart DRUGS SHOP HOME,bad
3,http://4p6i33oqj6wgvzgzczyqlueav3tz456rdu632xzyxbnhq4gpsriirtqd.onion,Peoples Drug Store Darkwebs Best Online Drug Supplier Buy cocaine speed xtc mdma heroin peoples drug store pay Bitcoin Login Register FAQs us Products PEOPLES DRUG STORE pride offering best quality products competitive prices making every effort go beyond comes customer satisfactionChoose category clicking following Heroin Cocaine Ecstasy Speed Cannabis Prescriptions Bitcoins Services WANNA MAKE FREE BTC Tell others shop earn 5 every purchase make Simply give following link httpwwwpeoplesdrugstoreorgrefYOURUSERNAME original httpnewpdsuslmzqazvronionrefYOURUSERNAME Replace YOURUSERNAME actual username site get earnings directly wallet SW Asian Heroin Heroin offer comes direct importer middle man whitelight beige color take great pride fact cut product whatsoever ensure source either would much prefer offer high quality product repeat customers Whats difference heroin people know get asked often enough decided add information onto listing commonly found forms Heroin Nograde Heroin PUREST form Heroin white powder easily dissolved water thus readily injected Nograde Heroin tancoloured granular product often referred brown rock difference color Noand Nogrades result impurities introduced remaining manufacturing process Nograde commonly heated vapors inhaled injected dissolved citrus instead water keep simple think like Heroin water soluable MUCH pure desireable among IV users people sniff whereas people prefer smoke However Heroin smoked well usually adding cafeine another adulterant make burn slower ProductPriceQuantity Pack 10x1cc BD Insulin Syringes10 USD X HALF GRAM HEROIN050gUSD X GRAND OPENING SPECIAL FULL WEIGHED GRAM HEROIN10gUSD X SW ASIAN HEROIN 2x FULL WEIGHED GRAMS USD X GRAND OPENING SPECIALFULL GRAMS HEROINUSD X Peoples Drug Store Darkwebs Best Online Drug Supplier,bad
4,http://bitphards4ayjjotcisqggok57wllh7xsva5qhks7zxlj2jmxax47wyd.onion,BitPharma biggest european onion drug store Cocaine Bitcoins Psychedelics Bitcoins Prescriptions Bitcoins Viagra Bitcoins Products FAQs Register Login StimulantsUncut Cocaine Speed ProductPriceQuantity 1g pure Cocaine0 X 2g pure Cocaine0 X 5g pure Cocaine0 X 25g pure Cocaine0 X 10g pure Speed0 X 50g pure Speed0 X 100g pure Speed0 X 2g pure Crystal Meth0 X 10g pure Crystal Meth0 X 50g MDMA Crystals0 X PsychedelicsFirst class psychedelics reagent tested ProductPriceQuantity x LSD Blotter 200yg Hofmann0 X x LSD Blotter 200yg Hofmann0 X x LSD Blotter 200yg Hofmann0 X 1g pure synthetic Mescaline0 X 10g pure synthetic Mescaline0 X 1g DMT freebase pure0 X 10g DMT freebase pure0 X 100g Ketamine Crystals0 X PrescriptionOriginal prescriptions freshly imported ProductPriceQuantity x Generic Viagra 100mg0 X x Generic Viagra 100mg0 X x Generic Cialis 20mg0 X x Original Kamagra 100mg0 X x Xanax 2mg0 X x 10mg Valium Diazepam X x capsules Tramadol 150mgcapsule0 X x 30mg Oxycodone Oxycodone Hydrochloride X x 30mg Oxycodone Oxycodone Hydrochloride X,bad
5,http://7bw24ll47y7aohhkrfdq2wydg3zvuecvjo63muycjzlbaqlihuogqvyd.onion,BitPharma biggest european onion drug store Cocaine Bitcoins Psychedelics Bitcoins Prescriptions Bitcoins Viagra Bitcoins Products FAQs Register Login StimulantsUncut cocaine speed shipping germany france every day best stealth packaging market shipping worldwide ProductPriceQuantity 1g pure Cocaine75 EUR X 2g pure Cocaine130 EUR X 5g pure Cocaine250 EUR X 25g pure Cocaine950 EUR X 10g pure Speed90 EUR X 50g pure Speed390 EUR X 100g pure Speed650 EUR X 5g pure Crystal Meth120 EUR X 10g pure Crystal Meth200 EUR X 50g pure Crystal Meth800 EUR X 50g MDMA Crystals140 EUR X 100g MDMA Crystals220 EUR X PsychedelicsFirst class psychedelics reagent tested ProductPriceQuantity x LSD Blotter 200yg Hofmann130 EUR X x LSD Blotter 200yg Hofmann200 EUR X x LSD Blotter 200yg Hofmann380 EUR X 1g pure synthetic Mescaline80 EUR X 10g pure synthetic Mescaline750 EUR X 1g DMT freebase pure110 EUR X 10g DMT freebase pure850 EUR X 50g Ketamine Crystals450 EUR X 100g Ketamine Crystals780 EUR X PrescriptionOriginal prescriptions freshly imported ProductPriceQuantity x Generic Viagra 100mg100 EUR X x Generic Viagra 100mg350 EUR X x Generic Cialis 20mg100 EUR X x Original Kamagra 100mg100 EUR X x Xanax 2mg215 EUR X x Xanax 2mg350 EUR X x capsules Tramadol 150mgcapsule95 EUR X x 80mg Oxycodone Oxycodone HydrochlorideEUR X x 80mg Oxycodone Oxycodone HydrochlorideEUR X,bad
6,http://drugszus4tg3ompbp7lpnnbkjfzctmfjhornjnmr5csi5vkvhqyznwqd.onion,Peoples Drug Store Darkwebs Best Online Drug Supplier Buy cocaine speed xtc mdma heroin peoples drug store pay Bitcoin Login Register FAQs us Products PEOPLES DRUG STORE pride offering best quality products competitive prices making every effort go beyond comes customer satisfaction WANNA MAKE FREE BTC Tell others shop earn 3 every purchase make Simply give following link httpwwwdrugszus4tg3ompbp7lpnnbkjfzctmfjhornjnmr5csi5vkvhqyznwqdonionrefYOURUSERNAME Replace YOURUSERNAME actual username site get earnings directly wallet sell Heroin Cocaine Ecstasy Speed Cannabis Prescriptions ______________________________________________ SW Asian Heroin Heroin offer comes direct importer middle man Heroin high quality popular sought brand whitelight beige color take great pride fact cut product whatsoever ensure source either would much prefer offer high quality product repeat customers Whats difference heroin people know get asked often enough decided add information onto listing commonly found forms Heroin Nograde Heroin PUREST form Heroin white powder easily dissolved water thus readily injected Nograde Heroin tancoloured granular product often referred brown rock difference color Noand Nogrades result impurities introduced remaining manufacturing process Nograde commonly heated vapors inhaled injected dissolved citrus instead water keep simple think like Heroin water soluable MUCH pure desireable among IV users people sniff whereas people prefer smoke However Heroin smoked well usually adding cafeine another adulterant make burn slower ProductPriceQuantity HALF GRAM HEROIN050gX FULL WEIGHED GRAM HEROIN10gX SW ASIAN HEROIN 2x FULL WEIGHED GRAMS X FULL GRAMS HEROIN4X Cocaine85 Crack Peoples Drug Store pride HIGH QUALITY amazing HIGH PURITY COCAINE like Heroin get cocaine DIRECT importer usually Peru sometime Columbia always get product given us right kilogram bricks come ABSOLUTELY POSITIVE cut stepped locally way policy NEVER cut add kind adulterant products rest assured cocaine buy us pure left boat South America cross ocean ProductPriceQuantity FULL WEIGHED GRAM COCAINE 10gX Full Gram Crack Cocaine 10gX 2xFULL GRAMS COCAINEX QUARTER OZ COCAINE 70gX HALF OZ COCAINE140gX Ecstasy Peoples Drug Store offers absolute best Ecstasy related items PURE MDMA CRYSTALS Various Ecstasy Pills Speed Pills psychedelics ProductPriceQuantity MDMA Crystals 84 UNCUT Grams 35gX MDMA Crystals 84 UNCUT Half Ounce 140gX MDMA Crystals 84 UNCUT Full Ounce 280gX Speed Right Ice Speed Pills Concerta Methylphenidate 18mg 54mg available ProductPriceQuantity 1x Ice Speed PillX 2x Ice Speed PillsX 5x Ice Speed PillsX Concerta Methylphenidate 18mgX Concerta Methylphenidate 54mgX Cannabis offering Top Quality Hash Oil AMAZINGLY UNBEATABLE PRICES offering High Grade Marijuana near future Bulk Orders available Contact us interested ProductPriceQuantity 1x Vial HASH OIL 07gX 2X Vials HASH OILX 10x Vials HASH OIL 70gX Prescription Many items including Percocet 5mg Oxycodoone325mg APAP Valium 10mg Clonazepam 2mg Xanax 05mg GREAT Discount Prices Coming Soon ProductPriceQuantity MethaqualoneQuaaludes Capsule 300mgX Methaqualone Powder Quaaludes GramX Concerta Methylphenidate 54mgX 8MG SUBOXONEX 8MG SUBOXONE sublingualX Peoples Drug Store Darkwebs Best Online Drug Supplier,bad
7,http://deepshop7gc3klzod5ljwm2ozde3ppk4soznaxzb7u4wvx45kozovbqd.onion,Deep Shop Drug market Cocaine Ecstasy Cannabis Prescriptions infoyourmailcom London Street 569 DH6 SE London United Kingdom Cocaine Ecstasy Cannabis Prescriptions Email deepshopdnmxcom Categories Amphetamine 4Cannabis 9Cocaine 5DMT 1Hard Drugs 24Heroin 3LSD 4MDMA 2Meth 7Opium 5Soft Drugs 16 Popular searches Women Modern Men Watches New Sale Menu Home Order Tracking PAYMENT DELIVERY SHIPPING PACKAGING Delivery Time US Contact us Shop Showing 1of results Default sorting Sort popularity Sort latest Sort price low high Sort price high low 1G High quality Crystal Meth Add cart APVPΑPVPAlphaPVP CAS Select options Afghan Kush Cannabis Select options Alaskan Thunder Fuck Cannabis Select options Asteroid OG Cannabis Select options Black Label Kush Cannabis Select options Blue Dragon Cannabis Select options Blueberry Cheese Cannabis Select options Buy mcg LSD Tablets Online Sale LSD Tablets Select options Buy Abstral Fentanly Powder 98 Select options Buy Amphetamine Sulphate Select options Buy Anadrol Oxymetholone Add cart Buy Bolivian Fishscale Cocaine Select options Buy Bromadol HCl Powder Online BDPC Sale Select options Buy Colombian Uncut Cocaine Select options Buy crystal methxanax online Select options Buy Crystal Methamphetamine Select options Buy Crystal Methamphetamine Online Select options Buy Crystal Methamphetamine Pure 95 Select options Buy Fentanyl Powder Online Select options Filter price Filter Price CartSearch Products Search Product categoriesHard Drugs Amphetamine Cocaine Heroin Meth Opium Soft Drugs Cannabis DMT LSD MDMA Products Buy LSD Powder Online LSD Powder Sale Buy LSD Blotters Online Buy mcg LSD Tablets Online Sale LSD Tablets LSD Liquid Online 25mg10ml Sale LSD Drops Buy JWHPowder Online AMFor Sale Proudly powered WordPress Theme Envo eCommerce,bad
8,http://dhlg5y66e7bncrgeoo2zfl4usg6k64yslapnzkzh7ehk3645fwmmczqd.onion,Buy Cocaine Online USA Europe Australia Asia Cocaine Sale Skip content Home Shop Shipping Return Testimonials English Arabic Bosnian Bulgarian Catalan Chinese Simplified Chinese Traditional Croatian Danish Dutch English Finnish French German Irish Italian Japanese Korean Norwegian Polish Portuguese Russian Scottish Gaelic Spanish Swedish Turkish Ukrainian Cart products cart Buy Cocaine Online buy Cocaine Online Order Cocaine Buy Original High Quality Cocaine Buy Peruvian Cocaine Buy Bolivian Cocaine Buy Colombian Cocaine Buy Cracked Cocaine Buy Powder Cocaine Online Buy Volkswagen Cocaine Online Buy Bio Cocaine Online Buy weed Online Cocaine Cocaine also known coke strong stimulant frequently used recreational drug commonly snorted inhaled smoke dissolved injected vein Mental effects may include intense feeling happiness sexual arousal loss contact reality agitation Cocaine highly addictive drug ups levels alertness attention energy made coca plant native South America Buy Abortion Medications Online Formula C17H21NO4 IUPAC ID methyl 1R2R3S5S3 benzoyloxy8methyl8azabicyclo321 octane2carboxylate Drug class CNS stimulant Local anesthetic names Benzoylmethylecgonine coke blow crack freebase form Onset action seconds minutes Metabolism liver CYP3A4 Common Name COCAINE Aunt Nora Bernice Binge Blow C Charlie Coke Dust Flake Mojo Nose candy Paradise Sneeze Sniff Snow Toot White Buy weed online Hear Clients saying Cocaine Genius Testimonials Ordered Coke Wrong Place guarantee 100 Delivery specified location maximum days order confirmed Experience shown Genius coke round Globe Guarantee 100 Discrete Shipping Cocaine Genius products vacuum sealed shipping never afraid purchasing us since never trace anything years order payment receive tracking number Minutes later hence check progress product location Quality Cocaine Cocaine Genius Assures best qualities types Cocaine since product commercialize website warehouse containing Cocaine work Cocaine manufacturers producers satisfy client meet goals buying top quality cocaine online Cocaine Genius Offers 24Client Support Cocaine Genius Management team put place Customer service online 24just help client case difficulties clear doubts satisfy clients want buy cocaine online USA Buy Cocaine Australia Buy Cocaine Canada Buy Cocaine France others want buy Cocaine United Kingdom Whole Europe Asia well looking buy cocaine using Bitcoin Order Original Cocaine Online Colombian CocaineRated 7Select options Cocaine PowderRated 8Select options Bolivian CocaineRated 9Select options Bio CocaineRated 7Select options Crack CocaineRated 9Select options Peruvian CocaineRated 9Select options Volkswagen CocaineRated 8Select options Accept Bitcoin Payment Method Dont know Bitcoin simplified Bitcoin cryptocurrency used pay merchants online anonymously without trace coming going remain hidden internet purchase items Bitcoin best means payment get Bitcoin Crack Cocaine Sale Buy Cocaine Powder Online Order Volkswagen Cocaine Online Pure Peruvian Cocaine Sale Bolivian Cocaine Sale Colombian Cocaine Sale Peruvian Cocaine Sale Buy Bio Cocaine Buy ADHD pills Online Buy weed online Buy Weed online Bolivian CocaineRated 9Select options Cocaine PowderRated 8Select options Volkswagen CocaineRated 8Select options Peruvian CocaineRated 9Select options Crack CocaineRated 9Select options Colombian CocaineRated 7Select options Bio CocaineRated 7Select options dispensed Cocaine ethically tested approved USA LABORATORY long years existence growth offer efficient solution search kinds cocaine Discrete mailing Tracking Number packages triple sealed silicon paper shipped discrete packages Customers 100 SATISFIED Contact Us Email Us cocshopmailfencecom Opening Hours MonFri pm Sat Sun 9am4pm always standby team help online 24h7d Locate Us Products Bolivian Cocaine Rated 9Cocaine Powder Rated 8Volkswagen Cocaine Rated 8Peruvian Cocaine Rated 9Crack Cocaine Rated 9Home Shop Shipping Return Testimonials Copyright Cocaine Genius Home Shop Shipping Return Testimonials Login Cart products cart Checkout Open chat,bad
9,http://4p6i33mixqpyksqh24ihlneto2gz3ekzc2xwytqz3vwtmhmhpenairqd.onion,Peoples Drug Store Darkwebs Best Online Drug Supplier Buy cocaine speed xtc mdma heroin peoples drug store pay Bitcoin Login Register FAQs us Products PEOPLES DRUG STORE pride offering best quality products competitive prices making every effort go beyond comes customer satisfactionChoose category clicking following Heroin Cocaine Ecstasy Speed Cannabis Prescriptions Bitcoins Services WANNA MAKE FREE BTC Tell others shop earn 5 every purchase make Simply give following link httpwwwpeoplesdrugstoreorgrefYOURUSERNAME original httpnewpdsuslmzqazvronionrefYOURUSERNAME Replace YOURUSERNAME actual username site get earnings directly wallet SW Asian Heroin Heroin offer comes direct importer middle man Heroin high quality popular sought brand whitelight beige color take great pride fact cut product whatsoever ensure source either would much prefer offer high quality product repeat customers Whats difference heroin people know get asked often enough decided add information onto listing commonly found forms Heroin Nograde Heroin PUREST form Heroin white powder easily dissolved water thus readily injected Nograde Heroin tancoloured granular product often referred brown rock difference color Noand Nogrades result impurities introduced remaining manufacturing process Nograde commonly heated vapors inhaled injected dissolved citrus instead water keep simple think like Heroin water soluable MUCH pure desireable among IV users people sniff whereas people prefer smoke However Heroin smoked well usually adding cafeine another adulterant make burn slower ProductPriceQuantity Pack 10x1cc BD Insulin Syringes10 USD X HALF GRAM HEROIN050gUSD X GRAND OPENING SPECIAL FULL WEIGHED GRAM HEROIN10gUSD X SW ASIAN HEROIN 2x FULL WEIGHED GRAMS USD X GRAND OPENING SPECIALFULL GRAMS HEROINUSD X Peoples Drug Store Darkwebs Best Online Drug Supplier,bad
10,http://xf2gry25d3tyxkiu2xlvczd3q7jl6yyhtpodevjugnxia2u665asozad.onion,Peoples Drug Store Darkwebs Best Online Drug Supplier Buy cocaine speed xtc mdma heroin peoples drug store pay Bitcoin Login Register FAQs us Products PEOPLES DRUG STORE pride offering best quality products competitive prices making every effort go beyond comes customer satisfactionChoose category clicking following Heroin Cocaine Ecstasy Speed Cannabis Prescriptions Bitcoins Services WANNA MAKE FREE BTC Tell others shop earn 5 every purchase make Simply give following link httpwwwpeoplesdrugstoreorgrefYOURUSERNAME original httpnewpdsuslmzqazvronionrefYOURUSERNAME Replace YOURUSERNAME actual username site get earnings directly wallet SW Asian Heroin Heroin offer comes direct importer middle man whitelight beige color take great pride fact cut product whatsoever ensure source either would much prefer offer high quality product repeat customers Whats difference heroin people know get asked often enough decided add information onto listing commonly found forms Heroin Nograde Heroin PUREST form Heroin white powder easily dissolved water thus readily injected Nograde Heroin tancoloured granular product often referred brown rock difference color Noand Nogrades result impurities introduced remaining manufacturing process Nograde commonly heated vapors inhaled injected dissolved citrus instead water keep simple think like Heroin water soluable MUCH pure desireable among IV users people sniff whereas people prefer smoke However Heroin smoked well usually adding cafeine another adulterant make burn slower ProductPriceQuantity Pack 10x1cc BD Insulin Syringes10 USD X HALF GRAM HEROIN050gUSD Sold GRAND OPENING SPECIAL FULL WEIGHED GRAM HEROIN10gUSD X SW ASIAN HEROIN 2x FULL WEIGHED GRAMS USD X GRAND OPENING SPECIALFULL GRAMS HEROINUSD X Peoples Drug Store Darkwebs Best Online Drug Supplier,bad
11,http://ib62tqf55t7f34ay7fhspcgk2a43pjkwquegwkhcewivratwg2oy3mad.onion,Drugs Cocaine Ecstasy LSD Meth Cannabis Seeds Cannabis drugsshopperdnmxorg Cart0 Home Catalog QuestionAnswer Cart Contact Escrow Category Cannabis Seeds Cannabis Cocaine Ecstasy LSD Meth RECOMMENDED ITEMS Pure Love Cannabis 20g Add cart Feminized Mix X20 Seeds Cannabis Add cart Columbia Cocaine 1g Add cart Pills Ecstasy Blue Android 200220mg Add cart Tabs LSD 200ug Add cart Gram Crystal Meth HQ CRYSTAL Add cart DRUGS SHOP HOME,bad
12,http://cym2srasnxvv6ugawjf53x2csox32whhr64shhyj5ba2fubmx2uhoiad.onion,DRUGS WEED HEMP METH LSD COCAINE CANNABIS cookies javascript trace protect privacy drugsshopperdnmxorg Home QuestionAnswer Cart Contact Escrow Category Cannabis Seeds Cannabis Cocaine Ecstasy LSD Meth RECOMMENDED ITEMS Pure Love Cannabis 20g Feminized Mix X20 Seeds Cannabis Columbia Cocaine 1g Pills Ecstasy Blue Android 200220mg Tabs LSD 200ug Gram Crystal Meth HQ CRYSTAL DRUGS SHOP HOME,bad
13,http://dse6rlfwpgdohd33ulg623rpzy3zv5y5whfw23jznd3xu4o47vy6xmqd.onion,Best Drugs Cocaine Ecstasy LSD Meth Cannabis Seeds Cannabis cookies javascript trace protect privacy drugsshopperdnmxorg Home QuestionAnswer Cart Contact Escrow Category Cannabis Seeds Cannabis Cocaine Ecstasy LSD Meth RECOMMENDED ITEMS Pure Love Cannabis 20g Feminized Mix X20 Seeds Cannabis Columbia Cocaine 1g Pills Ecstasy Blue Android 200220mg Tabs LSD 200ug Gram Crystal Meth HQ CRYSTAL DRUGS SHOP HOME,bad
14,http://zd7xmdr6mtk7hsv2yudumurgaxd36g7tmba7t32beebvv6asf5ddzvqd.onion,Market Drugs Cocaine LSD Cannabis cookies javascript trace protect privacy drugsshopperdnmxorg Home QuestionAnswer Cart Contact Escrow Category Cannabis Seeds Cannabis Cocaine Ecstasy LSD Meth RECOMMENDED ITEMS Pure Love Cannabis 20g Feminized Mix X20 Seeds Cannabis Columbia Cocaine 1g Pills Ecstasy Blue Android 200220mg Tabs LSD 200ug Gram Crystal Meth HQ CRYSTAL DRUGS SHOP HOME,bad
15,http://uzgfg7sn2bbo2rnpkam36dyuibrznwjslyai3awv2vucqkoi7jhgupid.onion,Best drug stores buy Cocaine Ecstasy LSD Meth cheap cannabis buy marijuana hashish kush Seeds Cannabis cookies javascript trace protect privacy drugsshopperdnmxorg Home QuestionAnswer Cart Contact Escrow Category Cannabis Seeds Cannabis Cocaine Ecstasy LSD Meth RECOMMENDED ITEMS Pure Love Cannabis 20g Feminized Mix X20 Seeds Cannabis Columbia Cocaine 1g Pills Ecstasy Blue Android 200220mg Tabs LSD 200ug Gram Crystal Meth HQ CRYSTAL DRUGS SHOP HOME,bad
