index,link,text,marker
9,http://wclekwrf2aclunlmuikf2bopusjfv66jlhwtgbiycy5nw524r6ngioid.onion/hlink/buy-genuine-fake-documents-and-certificates-onli/,Forbidden Forbidden dont permission access resource Additionally Forbidden error encountered trying use ErrorDocument handle request,bad
10,http://u5lyidiw4lpkonoctpqzxgyk6xop7w7w3oho4dzzsi272rwnjhyx7ayd.onion/real-and-fake-documents-for-sale/,Real fake documents sale Hidden Reviews Skip content Menu Links Blog Catalogue Chat EMail Forum News Search Engine ShopsStoresMarkets Add Link Contact Rules Blockchain Login Advertising Real fake documents sale Real fake documents sale March 30 2021ShopsStoresMarkets0 reviews Comments URL httpdocsdrcwsi3y4gv4onion Buy Drivers License Passport ID Card SSD Fake Money IELTS TOEFL Visa Birth Certificate school Diplomas Marriage Certificate us greencard ssn many documents Close Comments Make Featured options Please read Rules posting comment Leave Reply Cancel replyYour email address published Required fields marked Comment Name Email Website Rating Pay attention account status Every official link owner account highlighted Link Owner tag accounts without tag pretending official must taken cautious Edit description Expand Link Title Description Buy Drivers License Passport ID Card SSD Fake Money IELTS TOEFL Visa Birth Certificate school Diplomas Marriage Certificate us greencard ssn many documents Main URL Mirror URLs Captcha SUGGEST EDITS Search Link Search Search Recently Added Links ShopsStoresMarkets Buy Cocaine Delivery Escrow accepted CocaWay Shop Buy HQ Cocaine city Worldwide delivery Delivered reship Good price Many satisfied Cryptonium Best crypto wallets real balance BTC ETH LTC wallets News Bitcoin private key finder hack Best software ever RETRIEVING BITCOIN PRIVATE KEY ANONYMOUS ACCESS FUNDS MAIN Discussed ShopsStoresMarkets Drak CC ShopsStoresMarkets Hidden Cards ShopsStoresMarkets UnderMarket ShopsStoresMarkets Black MarketCC ShopsStoresMarkets GiftHub ShopsStoresMarkets Deepsy ShopsStoresMarkets SETESCROW Update Notes User Levels Advertising Might Interest ShopsStoresMarkets CC Paypal transfer Shop CC Paypal transfer Shop ShopsStoresMarkets Gift cards Amazon gift cards 75 discount Fresh stock Everyday updates Social Media Hacker Hire Advanced Trustable Social Media Hackers Darknet Hacking WhatsApp Viber Banner exchange Copyright Hidden Reviews,bad
11,http://u5lyidiw4lpkonoctpqzxgyk6xop7w7w3oho4dzzsi272rwnjhyx7ayd.onion/real-and-fake-documents-for-sale/,Real fake documents sale Hidden Reviews Skip content Menu Links Blog Catalogue Chat EMail Forum News Search Engine ShopsStoresMarkets Add Link Contact Rules Blockchain Login Advertising Real fake documents sale Real fake documents sale March 30 2021ShopsStoresMarkets0 reviews Comments URL httpdocsdrcwsi3y4gv4onion Buy Drivers License Passport ID Card SSD Fake Money IELTS TOEFL Visa Birth Certificate school Diplomas Marriage Certificate us greencard ssn many documents Close Comments Make Featured options Please read Rules posting comment Leave Reply Cancel replyYour email address published Required fields marked Comment Name Email Website Rating Pay attention account status Every official link owner account highlighted Link Owner tag accounts without tag pretending official must taken cautious Edit description Expand Link Title Description Buy Drivers License Passport ID Card SSD Fake Money IELTS TOEFL Visa Birth Certificate school Diplomas Marriage Certificate us greencard ssn many documents Main URL Mirror URLs Captcha SUGGEST EDITS Search Link Search Search Recently Added Links ShopsStoresMarkets Buy Cocaine Delivery Escrow accepted CocaWay Shop Buy HQ Cocaine city Worldwide delivery Delivered reship Good price Many satisfied Cryptonium Best crypto wallets real balance BTC ETH LTC wallets News Bitcoin private key finder hack Best software ever RETRIEVING BITCOIN PRIVATE KEY ANONYMOUS ACCESS FUNDS MAIN Discussed ShopsStoresMarkets Drak CC ShopsStoresMarkets Hidden Cards ShopsStoresMarkets UnderMarket ShopsStoresMarkets Black MarketCC ShopsStoresMarkets GiftHub ShopsStoresMarkets Deepsy ShopsStoresMarkets SETESCROW Update Notes User Levels Advertising Might Interest ShopsStoresMarkets unique_opportunities Selling Cloned Credit Cards ShopsStoresMarkets Fresh Fullz Daily middle man market scams fullz fresh source ShopsStoresMarkets EasyVisa V3 Trusted CC onion shop big history Good prices Operated EasyServices Banner exchange Copyright Hidden Reviews,bad
12,http://oniondirsl37g3uwoesuwvg6nufnsnibpfo7x7ukbydtdsgdpanjxjqd.onion/Vote?Id=122196&vote=neg,Vote Onion Site Real fake documents sale Onion Link Directory Home Add Search moving OnionV3 addressPlease sure bookmark right address Read Categories Market Hacking Hosting Forums Blog Link List Communication Social Financial Services Search Engines Real fake documents sale Apply real register Passport Visa Driving LicenseID CARDSmarriage certificatesdiplomas etc Email realdocumentsprotonmailcom Telegram Realdocsonline httpdocsmetno3maevnkonion Vote Onion Site LikeDisLike Comment Captcha Image Captcha Voting Results 2021120622Good 2021121941good 2021120132Good 20211106042021112216202110165720210619362021060213Best 2021060511202105030229,bad
13,http://2i2fcldw45pcp5j6i62kjntr2vw4e677vqla3pg5g3tmyw6l5rgjxfqd.onion/product/buy-fake-documents/,Forbidden Forbidden nginx1213,bad
14,http://picochanwvqfa2xsrfzlul4x4aqtog2eljll5qnj5iagpbhx2vmfqnid.onion/meta/2219,error PicochanmainmodlogboardsoverboardthemepolmetatechaartsrtgfascistThread FoundCannot display thread Post thread exist,bad
15,http://q72fiiwvwcic33kmuwgighbbauukoi74uhybr6jcgxaukul6g2bev2id.onion/node/956,Real fake documents sale Jar Jar Binks Top100 Skip main content Skip search Login linksLoginRegister Search form Search Jar Jar Binks Top100 Add bookmark Register add link bookmarks Jar Jar Binks Top100 hereHome Real fake documents saleDR Real fake documents sale link Real fake documents saleBuy Drivers License Passport ID Card SSDCovidvaccination card Fake Money IELTS TOEFL Visa Birth Certificate school Diplomas Marriage Certificate us greencard ssn many documents Email Darknetdocumentshopprotonmailcom top100 market commerciallesson ENpaid content free content reads blok sale mailto jarjarhostprotonmailcom Tags lesson DE EN ES FI FR JP PL PT RU SE UA Recent content Best Pedo Video childrens Pedo Kids porn Loli pics sex Child anallolafree Little Cams Pedo Webcams Child Adult Webcams Live Sex girls Porn Chat kidslolafree Lolita video free Sex child Pedo baby boyslolafree Porn Videos girls child kids boys zoo XPLAY Pedo lolalolafree CHILDREN VIDEOS Porn girls lola CP kidslolafree ad_salexxxloader Covidvaccination record card shop3online health pass QR codes Vaccine card covid certificate vaccine passport CovidVaccinshop3online health pass QR codes Vaccine card covid certificate vaccine passport CovidVaccinshop3online health pass QR codes Vaccine card covid certificate vaccine passport CovidVaccinshop3online Disclaimer link service Register add link bookmarks Disclaimer site provides links Tor hidden services responsibility linked content hosting,bad
16,http://rhkqkwzdpwj3zwlzirzsatolyw7chmvtyfrjukom64cfk54zabi5ooqd.onion/index.php?PHPSESSID=3p1ms4cbnoe5u9pb7sl40jq5k8&action=printpage;topic=41.0,Print Page BUY 100 LOOKING REAL FAKE DOCUMENTS COUNTERFEIT PAPER BILLS CURRENCIES Free Zone Community General Category General Discussion Topic started thomsondeals October 11 2021 0804pm Title BUY 100 LOOKING REAL FAKE DOCUMENTS COUNTERFEIT PAPER BILLS CURRENCIES Post thomsondeals October 11 2021 0804pm BUY 100 LOOKING REAL FAKE DOCUMENTS COUNTERFEIT PAPER BILLS CURRENCIESWe team professionals many years experience producing fake passportsand identity documents best producers false documents withmore million documents circulating worldWe offer original high qualities truefalse passports drivers licenses ID cards stamps birth certificates fake international diplomasand products number countries like USA Australia Belgium Brazil NorwayCanada Italy Finland France Germany Israel Mexico Netherlands South Africa Spain United KingdomThis list completeFor additional information place order justContact us email phoneBUY FAKE PASSPORTS UK United Kingdom AMERICAN CANADIANFALSE IDENTITY CARDS ONLINE UNITED STATES DRIVING LICENCEBUY FAKE BIRTHBUY FAKE DRIVING LICENCEContact us onthomsondeals0007protonmailcomGeneral supportthomsongeneraldeals0007protonmailcomText4603566535WhatsApp5305868494TELEGRAMlegitplugcompanyWickr ID Legitplug0008Feel free contact email call time privacySECTIONSBUY FAKE PASSPORTSBuy fake passports USA United StatesBuy fake Australian passports AustraliaBuy Belgian fake passports BelgiumBuy fake Brazilian passport BrazilBuy Canadian fake passports CanadaBuy fake passports Finland FinlandBuy fake French passports FranceBuy German fake passports GermanyBuy fake passports Dutch NetherlandsBuy fake Israeli passports IsraelBuy fake passports UK United KingdomBuy fake Spanish passports SpainBuy fake Mexican passports MexicoBuy South African fake passports South AfricaBuy fake Swiss passports SwitzerlandBuy fake German passports GermanyBuy Chinese fake passports ChinaBuy fake Spanish passports SpainBuy false Austrian passports AustriaBuy fake Japanese passports JapanBuy fake passports Ukraine UkraineBuy fake passports cambodiens CambodiaBuy fake passports UK United KingdomBuy fake passports USABuy fake passports Romanian RomaniaBuy fake passports Polish PolandBuy fake Bulgarian passports BulgariaBuy fake Moroccan passport MoroccoBuy fake passports chypre CyprusBuy fake passports Norwegian NorwayBuy Portuguese fake passports PortugalBuy fake passports Lithuanian LithuaniaBuy Russian fake passports RussiaBuy Hungarian fake passports HungaryBuy Australian fake passports AustraliaBuy fake passports Brazilian BrazilBuy fake Italian passports ItalyBuy fake passports Jamaica JamaicaBuy fake South Korean passports Korah SouthBuy fake passports Croatian CroatiaBuy fake passports Denmark DanmarkBuy fake passports Malta MaltaBuy fake passports Polish PolandBuy fake passports Swedish SwedenBUY FAKE IDENTITY CARDSBuy fake IDs USA United StatesBuy fake ID cards Australian AustraliaBuy fake ID cards Belgian BelgiumBuy fake Brazilian ID cards BrazilBuy false Canada Canadian identification cardsBuy fake ID cards Finnish FinlandBuy fake IDs French FranceBuy fake German identity cards GermanyBuy fake IDs Dutch NetherlandsBuy fake Israeli identity cards IsraelBuy fake ID cards UK United KingdomBuy fake IDs Spanish SpainBuy fake Mexican ID cards MexicoBuy fake South African identity cards South AfricaBuy fake ID cards Swiss SwitzerlandBuy fake IDs German GermanyBuy fake Chinese ID cards ChinaBuy fake IDs Spanish SpainBuy fake ID cards Austrian AustriaBuy fake ID Japanese JapanBuy fake ID cards Ukraine UkraineBuy fake ID cards cambodiens CambodiaBuy fake ID cards UK United StatesBuy fake identification cards USABuy fake ID cards Romanian RomaniaBuy fake IDs Polish PolandBuy false Bulgarian identity cards BulgariaBuy fake ID cards Moroccan MoroccoBuy fake ID cards chypre CyprusBuy fake ID cards Norwegian NorwayBuy fake IDs Portuguese PortugalBuy fake ID cards Lithuanian LithuaniaBuy fake ID cards Russian RussiaBuy fake ID cards Hungarian HungaryBuy fake IDs Australian AustraliaBuy fake identification cards Brazilian BrazilBuy fake Italian identity card ItalyBuy fake Jamaican identity cards JamaicaBuy fake ID cards South Korea South KoreaBuy fake ID cards Croatian CroatiaBuy fake IDs Denmark DanmarkBuy fake IDs Malta MaltaBuy fake IDs Polish PolandBuy fake ID cards Swedish SwedenBUY FAKE DRIVING LICENCEBuy fake driving license Australia AustraliaBuy fake Canadian drivers license CanadaBuy fake French driving license FranceBuy fake Dutch driving license Netherlands HollandBuy fake German driving license GermanyBuy fake UK driving license United KingdomBuy fake driving license Cameroon CameroonBuy fake Chinese driving license ChinaBuy fake driving license Switzerland SwitzerlandBuy fake driving license cambodiens CambodiaBuy fake Australian drivers license AustraliaBuy fake driving license Russian RussiaBuy fake Canadian drivers license CanadaBuy fake driving license french FranceBuy fake international driving permitsBuy fake Japanese drivers license JapanBuy fake driving license Ukrainian UkraineBuy fake driving licenses Austria AustrianBuy fake UK driving licenseBuy fake driving license USABuy fake driving license Spanish SpainBuy fake driving license Portuguese PortugalBuy fake driving license Hungarian HungaryBuy fake Mexican drivers license MexicoBuy fake Belgian driving licenses BelgiumBuy fake driving license Greek GreeceBuy fake driving license Romanian RomaniaBuy fake driving license Lithuanian LithuaniaBuy fake driving license Polish PolandBuy fake driving license Bulgarian BulgariaBuy fake Australian drivers license AustralianBuy fake Canadian drivers license CanadaBuy fake French driving license FranceBuy fake German driving license GermanyBuy fake UK driving license United KingdomBuy fake driving license Norwegian NorwayBuy fake driving license Brazilian BrazilBuy fake driving license Italian ItalyBuy fake driving license Jamaica JamaicaBuy fake driving licenses south Korean KoreaBuy fake driving license Croatian CroatiaBuy fake Danish driving license DanmarkBuy fake driving license Malta MaltaBuy fake driving license Polish PolandBuy fake driving license Swedish SwedenBUY FAKE PASSPORTS DIPLOMATICBuy fake Chinese diplomaticBuy fake diplomatic passports GreekBuy fake diplomatic UK United KingdomBuy fake diplomatic LithuanianBuy fake Canadian diplomatic passportsBuy fake diplomatic BulgarianBuy fake diplomatic PortugueseBuy fake diplomatic PolishBuy fake diplomatic passportsBuy fake passport Diplomatic USA United StatesBuy fake Australian diplomaticBuy fake diplomatic BelgianBuy fake Brazilian diplomatic passports BrazilBuy fake Canadian diplomatic passports CanadaBuy fake Finnish diplomatic passports FinlandBuy fake diplomatic passports French FranceBuy fake German diplomatic passports GermanyBuy fake diplomatic Dutch Netherlands NetherlandsBuy fake Israeli diplomatic passportsBuy fake British diplomatic passports UKBuy fake Spanish diplomatic passports SpainBuy fake Mexican diplomatic passports MexicoBuy fake South African diplomaticBuy fake diplomatic NorwegianBuy fake Brazilian diplomatic passportsBuy fake diplomatic ItalianBuy fake diplomatic JamaicanBuy fake South Korean diplomatic passportsBuy fake diplomatic CroatianBuy fake diplomatic DanishBuy fake diplomatic MalteseBuy fake diplomatic PolishBuy fake diplomatic SwedishBuy camouflage passportsBuy duplicate passportFake driver USA United States saleFalse Australian passports saleFake Belgian passports saleBrazilian fake passports Brazil saleBuy get fake passport identity cardSell online Canada Britain new INFRINGEMENTlicenses driving licenses birth certificates diplomasBUY FAKE DEGREES INTERNATIONALBuy fake diplomas CameroonBuy Chinese fake diplomasBuy Swiss fake diplomasBuy fake diplomas cambodiensBuy fake Australian graduatesBuy Russian fake diplomasBuy Canadian fake diplomasBuy fake diplomas frenchBuy fake international diplomasBuy fake diplomas JapaneseBuy Ukrainian fake diplomasBuy fake diplomas AustrianBuy fake diplomas UKBuy fake diplomas USABuy fake Spanish graduatesBuy Portuguese fake diplomasBuy Hungarian fake diplomasBuy fake Mexican diplomasBuy Belgian fake diplomasBuy fake diplomas GreekBuy fake diplomas RomanianBuy fake diplomas LithuanianBuy fake diplomas polonaissBuy fake Bulgarian diplomasBuy fake Italian graduatesBuy fake South African graduatesBuy fake diplomas IsraeliBuy fake diplomas NorwegianBuy fake diplomas BrazilianBuy fake Italian graduatesBuy fake diplomas JamaicanBuy fake South Korean graduatesBuy fake diplomas CroatianBuy fake diplomas DanishBuy fake diplomas MalteseBuy fake diplomas PolishBuy fake diplomas SwedishDo hesitate contact us email call time need required privacyDO HESITATE CONTACT EMAIL CALL TIME INFORMATIONAND PLACE ORDER DIFFERENT FALSE PASSPORTS VISAS IDENTITY CARDSDRIVERS LICENSE BIRTH MANY DOCUMENTSBUY BEST QUALITY FAKE PASSPORT ID CARD counterfeit moneythomsondeals0007protonmailcomWe best Unique producer HIGH QUALITY Undetectable counterfeit Banknotes fake documents billion products circulating around world offer original highquality counterfeit currency NOTES fake documentsShipping United StatesWe use latest technology produce notes looks 100 identical real noteThis thus implies security feutures present reale notes present note make team made Quality techinicians USRussiaKorea China etc offer high quality counterfeit NOTES currenciesContact us followingContact us onthomsondeals0007protonmailcomGeneral supportthomsongeneraldeals0007protonmailcomText4603566535WhatsApp5305868494TELEGRAMlegitplugcompanyWickr ID Legitplug0008TELEGRAM CHANNEL httpstmecounterfeitsdarkmarketEUR EuroUSD US DollarDNR DINARGBP British PoundINR Indian RupeeAUD Australian DollarCAD Canadian DollarAED Emirati DirhamZAR RandCHF Swiss FrancCNY Chinese Yuan RenminbiMYR Malaysian RinggitTHB Thai BahtNZD New Zealand DollarSAR Saudi Arabian RiyalQAR Qatari RiyalContact us followingContact us onthomsondeals0007protonmailcomGeneral supportthomsongeneraldeals0007protonmailcomText4603566535WhatsApp5305868494TELEGRAMlegitplugcompanyWickr ID Legitplug0008TELEGRAM CHANNEL httpstmecounterfeitsdarkmarket Title BUY 100 LOOKING REAL FAKE DOCUMENTS COUNTERFEIT PAPER BILLS CURRENCIES Post thomsondeals November 02 2021 1057am Hello youre interested products services hit infos Contact us onthomsondeals0007protonmailcomGeneral supportthomsongeneraldeals0007protonmailcomText4603566535WhatsApp5305868494TELEGRAMlegitplugcompanyWickr ID Legitplug0008Try us Best legit transaction Thanks SMF 2 SMF 2021 Simple Machines,bad
17,http://darkn5g756epq6t6fkqdo3mvkxlvwjtgabsbh3x47yhqg3uguiy5z5yd.onion/market/221,Buy real fake documents online DarkWay DarkWay World Show menu Hide menu Sign Registration Aachen AixenProvence Amiens Angers Arizona Augsburg Beijing 北京 Berlin Besancon Bielefeld Bochum Bonn Bordeaux Braunschweig Bremen Caen California Chemnitz Chongqing 重庆 ClermontFerrand Cologne Dijon Dortmund Dresden Duisburg Dusseldorf Essen Florida Frankfurt main Galle Gelsenkirchen Georgia Grenoble Hamburg Hanover Illinoi Indiana Kaohsiung 高雄 Karlsruhe Keel Le Havre Le Mans Leipzig Lille Limoges Lyon Mainz Mannheim Marseille Massachusetts Metz Monchengladbach Montpellier Mulhouse Munich Nancy Nantes New Delhi New Jersey New York Nice Nimes North Carolina Nuremberg Ohio Orleans Paris Reims Rennes Rouen SaintEtienne Shanghai 上海 Strasbourg Stuttgart Taipei 台北 Texas Tianjin 天津 Toulon Toulouse Tours Villeurbanne Virginia Washington Wiesbaden Wuppertal Мюнстер XMR USD Categories Electronics iphone ipad macbook Documents Weapon PayPal Transfers Hacking DOSS Services Carding manuals Cloned Credit Cards Fake money Job Software Database Drugs Sales Information Products shops Open shop Rules PLACEMENT BANNERS Buy real fake documents online 0 deals TOP store Still Showcase Store Reviews Claims Contribution store owner Buy real fake documents online CANCEL Submit Store Buy Drivers License Passport ID Card SSD Fake Money IELTS TOEFL Visa Birth Certificate school Diplomas Marriage Certificate us greencard ssn many documents new message CANCEL Submit,bad
18,http://u5lyidiw4lpkonoctpqzxgyk6xop7w7w3oho4dzzsi272rwnjhyx7ayd.onion/real-and-fake-documents-online-for-sale/,Real fake documents online sale Hidden Reviews Skip content Menu Links Blog Catalogue Chat EMail Forum News Search Engine ShopsStoresMarkets Add Link Contact Rules Blockchain Login Advertising Real fake documents online sale Real fake documents online sale April 9 2021ShopsStoresMarkets0 reviews Comments URL httpdocsmetno3maevnkonion Apply real register Passport Visa Driving LicenseID CARDSmarriage certificatesdiplomas etc Email realdocumentsprotonmailcom Telegram Realdocsonline Close Comments Make Featured options Please read Rules posting comment Leave Reply Cancel replyYour email address published Required fields marked Comment Name Email Website Rating Pay attention account status Every official link owner account highlighted Link Owner tag accounts without tag pretending official must taken cautious Edit description Expand Link Title Description Apply real register Passport Visa Driving LicenseID CARDSmarriage certificatesdiplomas etc Email realdocumentsprotonmailcom Telegram Realdocsonline Main URL Mirror URLs Captcha SUGGEST EDITS Search Link Search Search Recently Added Links ShopsStoresMarkets Buy Cocaine Delivery Escrow accepted CocaWay Shop Buy HQ Cocaine city Worldwide delivery Delivered reship Good price Many satisfied Cryptonium Best crypto wallets real balance BTC ETH LTC wallets News Bitcoin private key finder hack Best software ever RETRIEVING BITCOIN PRIVATE KEY ANONYMOUS ACCESS FUNDS MAIN Discussed ShopsStoresMarkets Drak CC ShopsStoresMarkets Hidden Cards ShopsStoresMarkets UnderMarket ShopsStoresMarkets Black MarketCC ShopsStoresMarkets GiftHub ShopsStoresMarkets Deepsy ShopsStoresMarkets SETESCROW Update Notes User Levels Advertising Might Interest ShopsStoresMarkets Apple Premium Reseller secret Apples devices popular Chat Peek Facebook Peek FAcebook ShopsStoresMarkets Magna vendor sells dollar euro banknotes Banner exchange Copyright Hidden Reviews,bad
19,http://u5lyidiw4lpkonoctpqzxgyk6xop7w7w3oho4dzzsi272rwnjhyx7ayd.onion/real-and-fake-documents-online-for-sale/,Real fake documents online sale Hidden Reviews Skip content Menu Links Blog Catalogue Chat EMail Forum News Search Engine ShopsStoresMarkets Add Link Contact Rules Blockchain Login Advertising Real fake documents online sale Real fake documents online sale April 9 2021ShopsStoresMarkets0 reviews Comments URL httpdocsmetno3maevnkonion Apply real register Passport Visa Driving LicenseID CARDSmarriage certificatesdiplomas etc Email realdocumentsprotonmailcom Telegram Realdocsonline Close Comments Make Featured options Please read Rules posting comment Leave Reply Cancel replyYour email address published Required fields marked Comment Name Email Website Rating Pay attention account status Every official link owner account highlighted Link Owner tag accounts without tag pretending official must taken cautious Edit description Expand Link Title Description Apply real register Passport Visa Driving LicenseID CARDSmarriage certificatesdiplomas etc Email realdocumentsprotonmailcom Telegram Realdocsonline Main URL Mirror URLs Captcha SUGGEST EDITS Search Link Search Search Recently Added Links ShopsStoresMarkets Buy Cocaine Delivery Escrow accepted CocaWay Shop Buy HQ Cocaine city Worldwide delivery Delivered reship Good price Many satisfied Cryptonium Best crypto wallets real balance BTC ETH LTC wallets News Bitcoin private key finder hack Best software ever RETRIEVING BITCOIN PRIVATE KEY ANONYMOUS ACCESS FUNDS MAIN Discussed ShopsStoresMarkets Drak CC ShopsStoresMarkets Hidden Cards ShopsStoresMarkets UnderMarket ShopsStoresMarkets Black MarketCC ShopsStoresMarkets GiftHub ShopsStoresMarkets Deepsy ShopsStoresMarkets SETESCROW Update Notes User Levels Advertising Might Interest Search Engine Ahmia Search Tor Hidden Service ShopsStoresMarkets Para Bellum Trusted weapon shop Europe Turkey Kazakhstan Search Engine GoDark Search TOP WEB SITES Verified easiest safest way find right website Banner exchange Copyright Hidden Reviews,bad
