index,link,text,marker
0,http://fplyp4yi6wb4dgfsfczhqclqeg3yej7yp2opybqb23se5egjosje7vqd.onion,Milkway Market Buy Sell Cannabis pills MDMA Guns Bullets Counterfiet Fake documents illegal products Become Vendor Email milkwayescrowshopprotonmailcom Contact Home Shop Categories bulletsammunition Cannabis Carfentanil powder CBD Cocaine counterfeit money Dabs Drivers licenses Edibles Exotic Carts fake ducuments fake passports Fentanyl powder Guns Heroin Ketamine MDMA Pills softwares Vapes Weed Pages Ordering Support Login Milkway Market Buy Sell Cannabis pills MDMA Guns Bullets Counterfiet Fake documents illegal products New Drivers licenses united states drivers license New Drivers licenses Finland Drivers license New Drivers licenses France Drivers license New bulletsammunition SELLIER BELLOT CREEDMOOR AMMUNITION Rds New bulletsammunition Hornady Precision Hunter Creedmoor ELDX Grain Rounds New bulletsammunition Norma Bondstrike 65mm Creedmoor Polymer Tip Grain Rounds New bulletsammunition Hornady Match 65mm Creedmoor ELD Match Grain Rounds New bulletsammunition SELLIER BELLOT CREEDMOOR AMMUNITION Rds New counterfeit money United States Dollars New counterfeit money Euro New Guns Springfield Loaded 45ACP New Guns Ruger GP100 Magnum 6 Barrel 6Rd New Guns Bergara BRidge Bushmaster 20 4B14S506 New Guns Bergara BTimber 243WIN 22 Barrel 4B14S003 New Guns IWI New Guns IWI New Guns Buy POF ROGUE 308WIN 125 BARREL 20New Guns Howa HS Precision Creedmoor Bolt Action Rifle 22 Barrel Rounds Synthetic Stock GreenBlack New Guns Diamondback Firearms DB15 ARNATO Semi Auto Rifle 16 Barrel Rounds MLOK Hand Guard Matte New Guns Sauer Sohn S100 Classic PRC Bolt Action Rifle 245 Barrel Rounds Beachwood Stock Blued New Guns Browning XBolt Pro LR Creedmoor Bolt Action Rifle 26 Threaded Barrel Rounds Composite Carbon Fiber Stock Burnt Bronze Cerakote Finish New Guns Glock Gen 3 SemiAutomatic 9mm 401 Barrel 15Rounds New Guns Weatherby Mark V Camilla Subalpine Bolt Action Rifle Wby Mag 24 Barrel Rounds Gore Optifade Subalpine Composite Stock Cerakote FDE New Guns Glock 43X SemiAutomatic 9mm 341 Barrel Black 10Rounds New Guns Glock 19X SemiAutomatic 9mm 402 Barrel Coyote Brown 19Rounds New Guns Glock Gen5 SemiAutomatic 9mm 402 Barrel 15Rounds New Weed Weed New Carfentanil powder Carfentanil powder New MDMA MDMA New MDMA Macaw New Ketamine ketamine New Heroin Heroin New Dabs EVOD Twist New Dabs Yocan Evolve Plus Vaporizer New Vapes Banana OG Hybrid New Vapes Kingpen Gelato Hybrid New Exotic Carts Exotic Carts New Exotic Carts BUY SUNSET SHERBET CO2 OIL CARTRIDGE New Edibles BUY MOUNTAIN MAN PEANUT BUTTER CUP New Edibles BUY CARROT CAKE COOKIE New Edibles Cannabis Lollipops New Edibles Cannabis Infused Choco Peanut Cup New Cocaine Cocaine New Cocaine Buy Crystal Meth New Cocaine Meth ice New CBD Cibdol CBD Oil New CBD Organic CBD Oil New CBD CBD Oil New Pills MDMA 250mg New Pills MDMA 350mg New Pills MDMA 450mg New Pills ADDERALL 30MG New Pills ADDERALL XR New Pills Oxycodone 30mg New Pills fhj New Cannabis Acapulco Gold New Cannabis Afghani Kush New Cannabis AK New Cannabis Amnesia New Cannabis Blackberry Kush New Cannabis Blueberry Kush New Cannabis Girl Scout Cookies New Cannabis Gorilla Glue New Cannabis Lemon OG New Cannabis Northern Lights New Cannabis Runtz New Cannabis Cookies Carts New Cannabis OG Kush Contact Us Phone Email milkwayescrowshopprotonmailcom Information Account Shop Cart Whishlist Product Categories Cannabis Pills CBD Cocaine Edibles Exotic Carts Useful Links Ordering Payment Methods Rights Reserved Milkway Market Buy Sell Cannabis pills MDMA Guns Bullets Counterfiet Fake documents illegal products,bad
1,http://dvb2k2zyddfhss6vn5hz4g4htpwfrk4qi4uhe3ypux522pl3hzshc6id.onion,Drugs Guns Fake documents Hitmen expected much kygunco Become Vendor Email impactguns75gmailcom Contact 1469 324Home Shop Categories bulletsammunition Cannabis Carfentanil powder CBD Cocaine counterfeit money Dabs Edibles Exotic Carts fake passports Fentanyl powder Guns Heroin Ketamine MDMA Pills softwares Vapes Weed Pages Ordering Support Login Drugs Guns Fake documents Hitmen expected much kygunco New bulletsammunition SELLIER BELLOT CREEDMOOR AMMUNITION Rds New bulletsammunition Hornady Precision Hunter Creedmoor ELDX Grain Rounds New bulletsammunition Norma Bondstrike 65mm Creedmoor Polymer Tip Grain Rounds New bulletsammunition Hornady Match 65mm Creedmoor ELD Match Grain Rounds New bulletsammunition SELLIER BELLOT CREEDMOOR AMMUNITION Rds New Guns Springfield Loaded 45ACP New Guns Ruger GP100 Magnum 6 Barrel 6Rd New Guns Bergara BRidge Bushmaster 20 4B14S506 New Guns Bergara BTimber 243WIN 22 Barrel 4B14S003 New Guns IWI New Guns IWI New Guns Buy POF ROGUE 308WIN 125 BARREL 20New Guns Howa HS Precision Creedmoor Bolt Action Rifle 22 Barrel Rounds Synthetic Stock GreenBlack New Guns Diamondback Firearms DB15 ARNATO Semi Auto Rifle 16 Barrel Rounds MLOK Hand Guard Matte New Guns Sauer Sohn S100 Classic PRC Bolt Action Rifle 245 Barrel Rounds Beachwood Stock Blued New Guns Browning XBolt Pro LR Creedmoor Bolt Action Rifle 26 Threaded Barrel Rounds Composite Carbon Fiber Stock Burnt Bronze Cerakote Finish New Guns Glock Gen 3 SemiAutomatic 9mm 401 Barrel 15Rounds New Guns Weatherby Mark V Camilla Subalpine Bolt Action Rifle Wby Mag 24 Barrel Rounds Gore Optifade Subalpine Composite Stock Cerakote FDE New Guns Glock 43X SemiAutomatic 9mm 341 Barrel Black 10Rounds New Guns Glock 19X SemiAutomatic 9mm 402 Barrel Coyote Brown 19Rounds New Guns Glock Gen5 SemiAutomatic 9mm 402 Barrel 15Rounds New Weed Weed New Carfentanil powder Carfentanil powder New MDMA MDMA New MDMA Macaw New Ketamine ketamine New Heroin Heroin New Dabs EVOD Twist New Dabs Yocan Evolve Plus Vaporizer New Vapes Banana OG Hybrid New Vapes Kingpen Gelato Hybrid New Exotic Carts Exotic Carts New Exotic Carts BUY SUNSET SHERBET CO2 OIL CARTRIDGE New Edibles BUY MOUNTAIN MAN PEANUT BUTTER CUP New Edibles BUY CARROT CAKE COOKIE New Edibles Cannabis Lollipops New Edibles Cannabis Infused Choco Peanut Cup New Cocaine Cocaine New Cocaine Buy Crystal Meth New Cocaine Meth ice New CBD Cibdol CBD Oil New CBD Organic CBD Oil New CBD CBD Oil New Pills MDMA 250mg New Pills MDMA 350mg New Pills MDMA 450mg New Pills ADDERALL 30MG New Pills ADDERALL XR New Pills Oxycodone 30mg New Pills Buy Bali Kratom Capsules online New Pills Buy Captagon Pills online New Pills Buy Ecstacy yellow illuminati pills New Pills Buy Yellow UPS 220mg mdma pills New Pills YabaWY pills sale New Pills Buy Zopiclone 75mg Actavis New Cannabis Acapulco Gold New Cannabis Afghani Kush New Cannabis AK New Cannabis Amnesia New Cannabis Blackberry Kush New Cannabis Blueberry Kush New Cannabis Girl Scout Cookies New Cannabis Gorilla Glue New Cannabis Lemon OG New Cannabis Northern Lights New Cannabis Runtz New Cannabis Cookies Carts New Cannabis OG Kush Contact Us Phone 1469 324Email impactguns75gmailcom Information Account Shop Cart Whishlist Product Categories Cannabis Pills CBD Cocaine Edibles Exotic Carts Useful Links Ordering Payment Methods Rights Reserved Drugs Guns Fake documents Hitmen expected much kygunco,bad
2,http://docsf4g7m6tvi2trwuk7hksflsynscxz6ej7zn2rdiur2wg3c4waxlqd.onion,Real fake Documents sale Darknet Documents online Telegram Realdocsonline Email realdocumentsprotonmailcom Skip content Real fake Documents sale Darknet Documents online Telegram Realdocsonline Email realdocumentsprotonmailcom Home DRIVERS LICENSE BUY CANADIAN ID CARD ONLINE BUY REAL USA DRIVERS LICENSE ONLINE BUY UK REGISTERED DRIVERS LICENSE ONLINE BUY UK REGISTERED DRIVERS LICENSE ONLINE Buy Country drivers license Online Passports BUY GERMAN PASSPORT ONLINE GENUINE CANADIAN PASSPORT SALE USA PASSPORTS SALE BUY UK PASSPORT ONLINE ID CARDS BUY UK ID CARD ONLINE BUY GERMAN ID CARD ONLINE BUY CANADIAN ID CARD ONLINE BUY USA ID CARD ONLINE RESIDENCE PERMIT BUY USA RESIDENCE PERMIT ONLINE BUY UK RESIDENCE PERMIT BUY CANADIAN RESIDENCE PERMIT ONLINE BUY GERMAN RESIDENCE PERMIT ONLINE COUNTERFEIT BANKNOTES BUY POUNDS COUNTERFEIT BANKNOTES ONLINE BUY DOLLAR COUNTERFEIT BANKNOTES ONLINE BUY COUNTERFEIT EUROS NOTE ONLINE SERVICE BUY CERTIFICATES ONLINE BUY VISA ONLINE BUY SOCIAL SECURITY CARD BUY US GREEN CARD ONLINE BIRTH DEATH Certificate Online Buy SSD Chemical Solution Online DOCUMENTS SALE ONLINE Buy Drivers License Passport ID Card SSD Fake Money IELTS TOEFL Visa Birth Certificate school Diplomas Marriage Certificate us greencard ssn many documents Check WELCOME DOCUMENTS SALE ONLINE Apply real register Passport Visa Driving LicenseID CARDSmarriage certificatesdiplomas etc Check DRIVERS LICENSE produce great enlisted drivers licenses EU USA CA different nations register data information base framework CERTIFICATES DIPLOMAS TRANSCRIPTS produce High quality Authentic Degrees Diplomas additionally Registered Degrees Unregistered Degrees Diplomas COUNTERFEIT BANKNOTES also produce high quality undetectable counterfeit banknotes major currencies CORE VALUES provide best services SAFE SECURED School Diplomas Marriage Certificate us greencard ssn many documents QUALITY REGISTERED DOCUMENTS offer original highquality Registered unregistered passportsdrivers licensesID cardsstampsVisa School Diplomas products number countries likeUSAAustralia BelgiumBrazilCanadaItalianFinlandFranceGermanyIsraelMexico NetherlandsSouth AfricaSpainUnited Kingdom etc ORDER UNIVERSAL DOCUMENTS NEED PASSPORTS ID card Social security card Drivers Licenses Canada Cards United States Cards Student Cards International Cards Private Cards Adoption Certificates Baptism Certificates Birth Certificates Death Certificates Divorce Certificates Marriage Certificates Custom Certificates High School Diplomas GED Diplomas Home School Diplomas Documents Online REGISTERED PASSPORTS Produce register Passports database European American Australian USA many countries world SOCIAL SECURITY CARDS Purchase genuine legitimate enrolled Social Security number SSN us today US residents likewise give UK National Insurance number NIN RESIDENCE PERMITS VISAS Produce Real enrolled Residence Permit Cards inform anyone needs sort regarding records look discover us assist getting archives IELTS TOEFL CERTIFICATES Produce Real enrolled IELTS TOEFL ESOL without sitting test around assist getting records simple help save valuable years whats time Testimonials clients say Ordering Buy Passports Online breezeI posting review also dont get bad reviews coming since got German License last month UK drivers license week Daughter guess competitors told Nevertheless UI website clean easy navigate Filtering options easy find exactly need brilliant Beginning end Buy Passports Online order even Return processes science mark customer service amazing John Clay best Thank muchExcellent service every time Wouldnt hesitate recommend ordered real documents many times time taken new client needs satisfied documents always legit registered Best darknet Harris guys legendary guys great amazing support service couldnt ask better Thank Cloe QUICK CONTACT INFO Real fake docs leading second valid passport citizenship specialists years industry Contact us personal confidential consultation UNKOWN realdocumentsprotonmailcom Realdocsonline Archives Search Go Copyright Powered Darknet Documents Real fake docs sale contact us,bad
3,http://onionwsoiu53xre32jwve7euacadvhprq2jytfttb55hrbo3execodad.onion/2016/10/03/uk-fears-sale-fake-documents-dark-net-aid-terror-country/,UK Fears Sale Fake Documents Dark Net Could Aid Terror Country Onion Web Explore Popular Posts Access Darknet buy Dark web Tour Darkweb Markets Mustread Dont Get Scammed PGP Keys Encrypted Messages use Monero buy online Darknet VS Darkweb Difference Topics ViewallTopics Dark web Drugs Bitcoin Leaks Altcoins Trading Markets Hacking Security DeepDotWeb Guides Reviews Interviews Arrests Popular Spaces Onion Web Darknet Dummies Dr Greenthumb Wheres Mind Doggystyle Reviews Rich 30s High Jones Discover MustVisit DarkRise Darknet Doesnt Fail Darkguard Verify URL dReviews dDarknetStars Recon Vendor Database Reviews Coming soon Dread DiscoverAll Markets Ranking Darknet Marketplaces Darknet Forums Darknet Shops Dead Sites Actions Contact SubmitmyStory AddaSite Donate PGP Mirrors Canary Related Log Sign Account Spaces Topics Contact Us UK Fears Sale Fake Documents Dark Net Could Aid Terror Country DeepDotWeb DeepDotWeb Oct UKs fight terror got little bit harder University East London found investigation Forged documents like passports drivers licenses utility bills found sale dark net Researchers believe make easier terrorists enter country Universitys study revealed easy get documentsThe UK Security Services announced recruiting hundreds staff deal increasing threat comes advancement digital technologyThe report called Mining Dark Web Drugs Fake IDs Dr Andres Baravalle Dr Sin Lee Wee Mr Mauro Sanchez Lopez report precedes Europols published report Changes modus operandi Islamic State terrorist attacks highlighted increase digital resources ISThere evidence level technical knowledge available religiously inspired terrorist groups allowing make use internet social media invisible intelligence law enforcement agencies Europols report readsThere evidence level technical knowledge available religiously inspired terrorist groups allowing make use internet social media invisible intelligence law enforcement agencies Europols report readsThe level ease shoppers able pick documents described researchers scaryIts easy get username start buying Dr Lee stated months lurking long dead Agora MarketplaceDr Baravalle saidA teenage computer enthusiastic example would able find touch organized criminals easily research scans photos passports sale physical passports also offeredThe report shows scans selling seven Euros also found drugs weapons easily accessibleA physical UK passport bought cheaply Euros scanned passports purchased little seven bought bulk wide range countries choose Baravalle continuedThese reports follow giant security breach Yahoo led discovery million user accounts compromised Yahoo blames statesponsored hacking group stealing million accounts 2014 course hacked Yahoo accounts sale dark netAt first Yahoo investigating hack million users investigation found million originally expected Yahoo stated enough user credentials stolen allow hackers create fake identities Previous article Romanian Hacker Gets Prison Time Major US Hacking Schem Next article Authorities Push Legislation Aims End Shipping Author DeepDotWeb Without doubt predecessor TheOnionWeb DeepDotWeb news site dedicated events surrounding dark web featuring interviews reviews darknet markets Tor hidden services legal actions privacy bitcoin related news Articles Donate Bitcoin 1NDqCHu3C8rjgfJs34TgZ8BKa2VsuduRMC Monero 46UwFaceGmLheF9qRq6EjSAmuJF2P5KVfXinVM4NEr6DJhxAWW2j2D79BUTe1HMnTTNt3cbz6QKUEEhmnaZVrMzMKaAtgCW Comments Write comment October 6 11am angelina jolie British government dangerous terrorist British lords politicians even pedos httpwwwmirrorcouknewsuknewswestminsterpaedophileringtoptoryReply comment reply comment read guidelines X Comment text Post Comment October 5 7am RgV gee whiz wonder whats bigger problem fake ids bought online thousands third world pieces shit entering country Reply comment reply comment read guidelines X Comment text Post Comment October 5 12am Reason Yup UK doesnt fear millions africans pakis aliens mostly muslim danger country watch kid might order illegal documents online euros months wages many european countriesOh wait actually months wages even less europe thanks massive migrationSo terrorists wont get papers weapons everything liaison local mosque arab neighborhood theyll prefer mail orderOne day brits wake hear someone say country theyll say oh alright lets go monitor dark web fake documents Reply comment reply comment read guidelines X Comment text Post Comment October 3 11am Einstein took couple fellas PhDs determine Jesus wept Reply comment reply comment read guidelines X Comment text Post Comment Write Comment view comments Read write comment Read guidelines Comment text Post Comment Advertise Darknet Sites Featured Sites Torrez 100 CannaHome 100 Abacus Market 97 Markets Revolution Market 98 Vice City 100 Dark0de 95 Cannazon 74 ASAP Asean 100 Cartel 86 Archetyp Market 97 Tor2door 100 Monopoly 94 Versus 98 Tor Market NZ 100 HYDRA RU 76 Vendor Shops new shit 99 WeAreAmsterdam 95 CharlieUK 100 French Connection 100 ThePirateIsland 93 TomJerry 100 Medicine Man UK 100 SmokersCo 100 Auspride 100 Digital Thrift Shop Pl 100 HeinekenExpress 100 o3shop RU 100 Social Dread 92 Majestic Garden 86 HUB 57 Deutschland im Deep Web DE 85 Cebulka PL 90 Services News Directories LARGEST Markets December TOP number products Full Ranking Torrez Dark0de Versus ASAP Asean Cartel Bitcoin Today High Low Monero Today High Low Latest Comments Authentik2900 Site à éviter commande de c faite chez eux jamais reçu une arnaque TomJerrys profile mawosx low contact waiting days parcel 50g coco contact pr WeAreAmsterdams profile foster6la biggest greatest Torrezs profile Fidel Dam Im cannabis plug left Cannazons profile 14characters Looking make Make Money Looking Job Post Find Job Deep Web krazydversa ey ross aim chile espero que algun dia encuentres la libertad fr Life Box kotorfan21 anyone know actual Nonscams registeredreal passports Newbies Spaces space MahNemzJeff loyal Torguard user going years hands TorGuard VPN Review FUCKOFF MOTHER SCAM WEBSITE DarkFox Markets profile oshit Allowing users finalize orders withdraw funds White House Markets profile Tag Cloud Bitcoin Darknet Dark Web Drug Sentenced Arrested Man News Tor Drugs Silk Road Prison Market German years Price Busted Cybercrime Net Markets Cannabis Bitcoin Monero Forum Bitcoin,bad
