index,link,text,marker
4,http://rhkqkwzdpwj3zwlzirzsatolyw7chmvtyfrjukom64cfk54zabi5ooqd.onion/index.php?PHPSESSID=3p1ms4cbnoe5u9pb7sl40jq5k8&topic=41.0,BUY 100 LOOKING REAL FAKE DOCUMENTS COUNTERFEIT PAPER BILLS CURRENCIES Free Zone Community Open Discussion Forum Welcome Guest Please login register Hour Day Week Month Forever Login username password session length News Home Help Search Login Register Free Zone Community General Category General Discussion BUY 100 LOOKING REAL FAKE DOCUMENTS COUNTERFEIT PAPER BILLS CURRENCIES previous next Print Pages 1 Go Author Topic BUY 100 LOOKING REAL FAKE DOCUMENTS COUNTERFEIT PAPER BILLS CURRENCIES Read times thomsondeals Sr Member Posts BUY 100 LOOKING REAL FAKE DOCUMENTS COUNTERFEIT PAPER BILLS CURRENCIES October 11 2021 0804pm BUY 100 LOOKING REAL FAKE DOCUMENTS COUNTERFEIT PAPER BILLS CURRENCIESWe team professionals many years experience producing fake passportsand identity documents best producers false documents withmore million documents circulating worldWe offer original high qualities truefalse passports drivers licenses ID cards stamps birth certificates fake international diplomasand products number countries like USA Australia Belgium Brazil NorwayCanada Italy Finland France Germany Israel Mexico Netherlands South Africa Spain United KingdomThis list completeFor additional information place order justContact us email phoneBUY FAKE PASSPORTS UK United Kingdom AMERICAN CANADIANFALSE IDENTITY CARDS ONLINE UNITED STATES DRIVING LICENCEBUY FAKE BIRTHBUY FAKE DRIVING LICENCEContact us onthomsondeals0007protonmailcomGeneral supportthomsongeneraldeals0007protonmailcomText4603566535WhatsApp5305868494TELEGRAMlegitplugcompanyWickr ID Legitplug0008Feel free contact email call time privacySECTIONSBUY FAKE PASSPORTSBuy fake passports USA United StatesBuy fake Australian passports AustraliaBuy Belgian fake passports BelgiumBuy fake Brazilian passport BrazilBuy Canadian fake passports CanadaBuy fake passports Finland FinlandBuy fake French passports FranceBuy German fake passports GermanyBuy fake passports Dutch NetherlandsBuy fake Israeli passports IsraelBuy fake passports UK United KingdomBuy fake Spanish passports SpainBuy fake Mexican passports MexicoBuy South African fake passports South AfricaBuy fake Swiss passports SwitzerlandBuy fake German passports GermanyBuy Chinese fake passports ChinaBuy fake Spanish passports SpainBuy false Austrian passports AustriaBuy fake Japanese passports JapanBuy fake passports Ukraine UkraineBuy fake passports cambodiens CambodiaBuy fake passports UK United KingdomBuy fake passports USABuy fake passports Romanian RomaniaBuy fake passports Polish PolandBuy fake Bulgarian passports BulgariaBuy fake Moroccan passport MoroccoBuy fake passports chypre CyprusBuy fake passports Norwegian NorwayBuy Portuguese fake passports PortugalBuy fake passports Lithuanian LithuaniaBuy Russian fake passports RussiaBuy Hungarian fake passports HungaryBuy Australian fake passports AustraliaBuy fake passports Brazilian BrazilBuy fake Italian passports ItalyBuy fake passports Jamaica JamaicaBuy fake South Korean passports Korah SouthBuy fake passports Croatian CroatiaBuy fake passports Denmark DanmarkBuy fake passports Malta MaltaBuy fake passports Polish PolandBuy fake passports Swedish SwedenBUY FAKE IDENTITY CARDSBuy fake IDs USA United StatesBuy fake ID cards Australian AustraliaBuy fake ID cards Belgian BelgiumBuy fake Brazilian ID cards BrazilBuy false Canada Canadian identification cardsBuy fake ID cards Finnish FinlandBuy fake IDs French FranceBuy fake German identity cards GermanyBuy fake IDs Dutch NetherlandsBuy fake Israeli identity cards IsraelBuy fake ID cards UK United KingdomBuy fake IDs Spanish SpainBuy fake Mexican ID cards MexicoBuy fake South African identity cards South AfricaBuy fake ID cards Swiss SwitzerlandBuy fake IDs German GermanyBuy fake Chinese ID cards ChinaBuy fake IDs Spanish SpainBuy fake ID cards Austrian AustriaBuy fake ID Japanese JapanBuy fake ID cards Ukraine UkraineBuy fake ID cards cambodiens CambodiaBuy fake ID cards UK United StatesBuy fake identification cards USABuy fake ID cards Romanian RomaniaBuy fake IDs Polish PolandBuy false Bulgarian identity cards BulgariaBuy fake ID cards Moroccan MoroccoBuy fake ID cards chypre CyprusBuy fake ID cards Norwegian NorwayBuy fake IDs Portuguese PortugalBuy fake ID cards Lithuanian LithuaniaBuy fake ID cards Russian RussiaBuy fake ID cards Hungarian HungaryBuy fake IDs Australian AustraliaBuy fake identification cards Brazilian BrazilBuy fake Italian identity card ItalyBuy fake Jamaican identity cards JamaicaBuy fake ID cards South Korea South KoreaBuy fake ID cards Croatian CroatiaBuy fake IDs Denmark DanmarkBuy fake IDs Malta MaltaBuy fake IDs Polish PolandBuy fake ID cards Swedish SwedenBUY FAKE DRIVING LICENCEBuy fake driving license Australia AustraliaBuy fake Canadian drivers license CanadaBuy fake French driving license FranceBuy fake Dutch driving license Netherlands HollandBuy fake German driving license GermanyBuy fake UK driving license United KingdomBuy fake driving license Cameroon CameroonBuy fake Chinese driving license ChinaBuy fake driving license Switzerland SwitzerlandBuy fake driving license cambodiens CambodiaBuy fake Australian drivers license AustraliaBuy fake driving license Russian RussiaBuy fake Canadian drivers license CanadaBuy fake driving license french FranceBuy fake international driving permitsBuy fake Japanese drivers license JapanBuy fake driving license Ukrainian UkraineBuy fake driving licenses Austria AustrianBuy fake UK driving licenseBuy fake driving license USABuy fake driving license Spanish SpainBuy fake driving license Portuguese PortugalBuy fake driving license Hungarian HungaryBuy fake Mexican drivers license MexicoBuy fake Belgian driving licenses BelgiumBuy fake driving license Greek GreeceBuy fake driving license Romanian RomaniaBuy fake driving license Lithuanian LithuaniaBuy fake driving license Polish PolandBuy fake driving license Bulgarian BulgariaBuy fake Australian drivers license AustralianBuy fake Canadian drivers license CanadaBuy fake French driving license FranceBuy fake German driving license GermanyBuy fake UK driving license United KingdomBuy fake driving license Norwegian NorwayBuy fake driving license Brazilian BrazilBuy fake driving license Italian ItalyBuy fake driving license Jamaica JamaicaBuy fake driving licenses south Korean KoreaBuy fake driving license Croatian CroatiaBuy fake Danish driving license DanmarkBuy fake driving license Malta MaltaBuy fake driving license Polish PolandBuy fake driving license Swedish SwedenBUY FAKE PASSPORTS DIPLOMATICBuy fake Chinese diplomaticBuy fake diplomatic passports GreekBuy fake diplomatic UK United KingdomBuy fake diplomatic LithuanianBuy fake Canadian diplomatic passportsBuy fake diplomatic BulgarianBuy fake diplomatic PortugueseBuy fake diplomatic PolishBuy fake diplomatic passportsBuy fake passport Diplomatic USA United StatesBuy fake Australian diplomaticBuy fake diplomatic BelgianBuy fake Brazilian diplomatic passports BrazilBuy fake Canadian diplomatic passports CanadaBuy fake Finnish diplomatic passports FinlandBuy fake diplomatic passports French FranceBuy fake German diplomatic passports GermanyBuy fake diplomatic Dutch Netherlands NetherlandsBuy fake Israeli diplomatic passportsBuy fake British diplomatic passports UKBuy fake Spanish diplomatic passports SpainBuy fake Mexican diplomatic passports MexicoBuy fake South African diplomaticBuy fake diplomatic NorwegianBuy fake Brazilian diplomatic passportsBuy fake diplomatic ItalianBuy fake diplomatic JamaicanBuy fake South Korean diplomatic passportsBuy fake diplomatic CroatianBuy fake diplomatic DanishBuy fake diplomatic MalteseBuy fake diplomatic PolishBuy fake diplomatic SwedishBuy camouflage passportsBuy duplicate passportFake driver USA United States saleFalse Australian passports saleFake Belgian passports saleBrazilian fake passports Brazil saleBuy get fake passport identity cardSell online Canada Britain new INFRINGEMENTlicenses driving licenses birth certificates diplomasBUY FAKE DEGREES INTERNATIONALBuy fake diplomas CameroonBuy Chinese fake diplomasBuy Swiss fake diplomasBuy fake diplomas cambodiensBuy fake Australian graduatesBuy Russian fake diplomasBuy Canadian fake diplomasBuy fake diplomas frenchBuy fake international diplomasBuy fake diplomas JapaneseBuy Ukrainian fake diplomasBuy fake diplomas AustrianBuy fake diplomas UKBuy fake diplomas USABuy fake Spanish graduatesBuy Portuguese fake diplomasBuy Hungarian fake diplomasBuy fake Mexican diplomasBuy Belgian fake diplomasBuy fake diplomas GreekBuy fake diplomas RomanianBuy fake diplomas LithuanianBuy fake diplomas polonaissBuy fake Bulgarian diplomasBuy fake Italian graduatesBuy fake South African graduatesBuy fake diplomas IsraeliBuy fake diplomas NorwegianBuy fake diplomas BrazilianBuy fake Italian graduatesBuy fake diplomas JamaicanBuy fake South Korean graduatesBuy fake diplomas CroatianBuy fake diplomas DanishBuy fake diplomas MalteseBuy fake diplomas PolishBuy fake diplomas SwedishDo hesitate contact us email call time need required privacyDO HESITATE CONTACT EMAIL CALL TIME INFORMATIONAND PLACE ORDER DIFFERENT FALSE PASSPORTS VISAS IDENTITY CARDSDRIVERS LICENSE BIRTH MANY DOCUMENTSBUY BEST QUALITY FAKE PASSPORT ID CARD counterfeit moneythomsondeals0007protonmailcomWe best Unique producer HIGH QUALITY Undetectable counterfeit Banknotes fake documents billion products circulating around world offer original highquality counterfeit currency NOTES fake documentsShipping United StatesWe use latest technology produce notes looks 100 identical real noteThis thus implies security feutures present reale notes present note make team made Quality techinicians USRussiaKorea China etc offer high quality counterfeit NOTES currenciesContact us followingContact us onthomsondeals0007protonmailcomGeneral supportthomsongeneraldeals0007protonmailcomText4603566535WhatsApp5305868494TELEGRAMlegitplugcompanyWickr ID Legitplug0008TELEGRAM CHANNEL httpstmecounterfeitsdarkmarketEUR EuroUSD US DollarDNR DINARGBP British PoundINR Indian RupeeAUD Australian DollarCAD Canadian DollarAED Emirati DirhamZAR RandCHF Swiss FrancCNY Chinese Yuan RenminbiMYR Malaysian RinggitTHB Thai BahtNZD New Zealand DollarSAR Saudi Arabian RiyalQAR Qatari RiyalContact us followingContact us onthomsondeals0007protonmailcomGeneral supportthomsongeneraldeals0007protonmailcomText4603566535WhatsApp5305868494TELEGRAMlegitplugcompanyWickr ID Legitplug0008TELEGRAM CHANNEL httpstmecounterfeitsdarkmarket Logged thomsondeals Sr Member Posts BUY 100 LOOKING REAL FAKE DOCUMENTS COUNTERFEIT PAPER BILLS CURRENCIES Reply November 02 2021 1057am Hello youre interested products services hit infos Contact us onthomsondeals0007protonmailcomGeneral supportthomsongeneraldeals0007protonmailcomText4603566535WhatsApp5305868494TELEGRAMlegitplugcompanyWickr ID Legitplug0008Try us Best legit transaction Thanks Logged Print Pages 1 Go previous next Free Zone Community General Category General Discussion BUY 100 LOOKING REAL FAKE DOCUMENTS COUNTERFEIT PAPER BILLS CURRENCIES SMF 2 SMF 2021 Simple Machines XHTML RSS WAP2 Page created seconds queries,bad
5,http://r722lrlb2f4gat7djrogjttel4s6eumx7l4x6nd5xa7xlzjyazgjorid.onion/real-and-fake-documents-passport/,Real fake Documents passport True money Marketplace legit vendors Cart True money Marketplace legit vendors Buy real credit cards drugs money transfer Categories BTC WALLETS 1Counterfeits BankNotes 10documents 3Drugs 7gold coinsother 6hardwares 5electronics 7dumps pins 5carding 12gift cards 4hacked PayPal Accounts 3Hacking Services 10money transfers 5physical credit cards 4 Menu Home VENDORS escrow Order Tracking Reviews AppleElectronics fake money Realfake Documents Account Help Faqs Instructions Support Real fake Documents passport Real fake Documents passport Documents producing service produce highqualitative Passports ID cards Drivers licences VISAs exitentry stamps IELTS certificates others CONTACT TELEGRAM START DEAL ESCROW ACCEPTED httpstmekuganzo PRICE LIST DEALS UK Passport 2499 UK ID 799 UK Drivers License 599 UK Residency Visa 1299 PassportIDDrivers Licensefree SIM card 3499 USA Passport 1999 USA ID 599 USA Drivers License 399 USA Residency Visa 999 USA New Identity Pack PassportIDDrivers Licensefree SIM card 2599 Australian Passport 1999 Australian ID 599 Australian Drivers License Australian Residency Visa 999 Australian New Identity Pack PassportIDDrivers Licensefree SIM card 2599 New Zealand Passport 1999 New Zealand ID 599 New Zealand Drivers License 399 New Zealand Residency Visa 999 New Zealand New Identity Pack PassportIDDrivers Licensefree SIM card 2599 Canadian Passport 2099 Canadian ID 699 Canadian Drivers License 499 Canadian Residency Visa 1099 Canadian New Identity Pack PassportIDDrivers Licensefree SIM card 2899 French Passport 2199 French ID 749 French Drivers License 549 French Residency Visa 1199 French New Identity Pack PassportIDDrivers Licensefree SIM card 3099 German Passport 1999 German ID 599 German Drivers License 399 German Residency Visa 999 German New Identity Pack PassportIDDrivers Licensefree SIM card 2599 Documents duplicate service Documents duplicates producing means clone real existing document photo select suitable documents database considering age sex nationality ect would contain real name parents person address useful information asked airport customs immigration ect Documents registration service countries offer register new documents government database produced fact official issued documents use like original ones price registered documents higher regular documents producing Visastamps affixion service provide possibility affix almost kind stampsVISAs passports fill confident affix VISAstamps document dont provide kind service separately passport producing IELTS certificates offer high qualitative English test certificates without exam Certificates original registered official database certificates issue carries band scores level choosing6590 IELTS accepted 10organisations countries includes Universities schools training colleges tertiary institutes Government departments agencies Professional industry bodies Companies employers Real fake Documents passport Shipment TimeTracking Tracking Tracking ID emailed payment typically update slowly first 12hours please discouraged Shipment Time package ship within hours receiving payment DHL UPS ship MondayFriday holidays ship FEDEX MonSat mail FEDEX packages day send us payment 2pm EST Packaging Labeling Small orders shipped inside magazines binders Large orders shipped boxes labeling appear like Ebay Amazoncom package Additional stealth precautions taken dont publicly share Please let us know special requirements Items via Email Gift Cards Transfers etc Items sent email need enter name street etc ordering enter XXX instead Usually receive answer hour later True Money Marketplace Legit Vendors secure Escrow System Proudly powered WordPress Theme Envo eCommerce,bad
6,http://sz5h6tiqkdkfl55qa3kcxgzck3xeffo6cso7sjpc7hc7sr3vghdyicqd.onion/siteinfo/883,Vote Real fake documents sale Dark Web Links Directory AdBlock detected using AdBlock Plus adblocking software need money operate site almost comes online advertising would appreciate much whitelist website AdBlocker Thank Toggle navigation LinkDir Add Link Login Register Real fake documents sale httpdocsmetno3maevnkonion Apply real register Passport Visa Driving LicenseID CARDSmarriage certificatesdiplomas etc Email realdocumentsprotonmailcom Telegram Realdocsonline sure give Rank Point Real fake documents sale Captcha Need Rank Points Get Return homepage LinkDir Us Terms Privacy,bad
7,http://agoraqxaz3pyvxsedpamwk4pg4y7ime52gmno6azba7im5i7e2bqxaad.onion/real-and-fake-documents-passport/,Real fake Documents passport agora road marketplaceverified vendors secure escrow system Skip content Account Login Register Cart Checkout TOTAL Home Vendors Escrow Account Order Tracking Reviews AppleElectronics fake money Realfake Documents Help Faqs Instructions Support Real fake Documents passport Real fake Documents passport Documents producing service contact instant reply telegram httpstmetorverified produce highqualitative Passports ID cards Drivers licences VISAs exitentry stamps IELTS certificates others CONTACT TELEGRAM START DEAL ESCROW ACCEPTED httpc6yc4kmq4tftx5ynonion PRICE LIST DEALS UK Passport 2499 UK ID 799 UK Drivers License 599 UK Residency Visa 1299 PassportIDDrivers Licensefree SIM card 3499 USA Passport 1999 USA ID 599 USA Drivers License 399 USA Residency Visa 999 USA New Identity Pack PassportIDDrivers Licensefree SIM card 2599 Australian Passport 1999 Australian ID 599 Australian Drivers License Australian Residency Visa 999 Australian New Identity Pack PassportIDDrivers Licensefree SIM card 2599 New Zealand Passport 1999 New Zealand ID 599 New Zealand Drivers License 399 New Zealand Residency Visa 999 New Zealand New Identity Pack PassportIDDrivers Licensefree SIM card 2599 Canadian Passport 2099 Canadian ID 699 Canadian Drivers License 499 Canadian Residency Visa 1099 Canadian New Identity Pack PassportIDDrivers Licensefree SIM card 2899 French Passport 2199 French ID 749 French Drivers License 549 French Residency Visa 1199 French New Identity Pack PassportIDDrivers Licensefree SIM card 3099 German Passport 1999 German ID 599 German Drivers License 399 German Residency Visa 999 German New Identity Pack PassportIDDrivers Licensefree SIM card 2599 Documents duplicate service Documents duplicates producing means clone real existing document photo select suitable documents database considering age sex nationality ect would contain real name parents person address useful information asked airport customs immigration ect Documents registration service countries offer register new documents government database produced fact official issued documents use like original ones price registered documents higher regular documents producing Visastamps affixion service provide possibility affix almost kind stampsVISAs passports fill confident affix VISAstamps document dont provide kind service separately passport producing IELTS certificates offer high qualitative English test certificates without exam Certificates original registered official database certificates issue carries band scores level choosing6590 IELTS accepted 10organisations countries includes Universities schools training colleges tertiary institutes Government departments agencies Professional industry bodies Companies employers Real fake Documents passport Shipment TimeTracking Tracking Tracking ID emailed payment typically update slowly first 12hours please discouraged Shipment Time package ship within hours receiving payment DHL UPS ship MondayFriday holidays ship FEDEX MonSat mail FEDEX packages day send us payment 2pm EST Packaging Labeling Small orders shipped inside magazines binders Large orders shipped boxes labeling appear like Ebay Amazoncom package Additional stealth precautions taken dont publicly share Please let us know special requirements Items via Email Gift Cards Transfers etc Items sent email need enter name street etc ordering enter XXX instead Usually receive answer hour later,bad
8,http://b4qy5tfoimjaqalvkxiri6g3prb5tzx4u65ttfxd4gsvu3okctnek5qd.onion/real-and-fake-documents-passport/,Real fake Documents passport Anonymous marketplace guaranted secure escrow system Skip content Anonymous marketplace guaranted secure escrow system Buy Hacked Paypal Accounts Balance Hack money transfers Toggle navigation Anonymous marketplace guaranted secure escrow system Home Vendors Escrow Account Order Tracking Reviews AppleElectronics fake money Realfake Documents Help Faqs Instructions Support Shop category BTC WALLETS 1 carding 12 Counterfeits BankNotes 10 documents 3 Drugs 7 dumps pins 5 electronics 7 gift cards 4 hacked PayPal Accounts 3 Hacking Services 10 hardwares 5 money transfers 5 services 6 physical credit cards 4 Search BTC WALLETS 1Counterfeits BankNotes 10documents 3Drugs 7other services 6hardwares 5electronics 7dumps pins 5carding 12gift cards 4hacked PayPal Accounts 3Hacking Services 10money transfers 5physical credit cards 4 Go Home Real fake Documents passport Real fake Documents passport Real fake Documents passport Documents producing service contact instant reply telegram httpstmetorverified produce highqualitative Passports ID cards Drivers licences VISAs exitentry stamps IELTS certificates others CONTACT TELEGRAM START DEAL ESCROW ACCEPTED httpc6yc4kmq4tftx5ynonion PRICE LIST DEALS UK Passport 2499 UK ID 799 UK Drivers License 599 UK Residency Visa 1299 PassportIDDrivers Licensefree SIM card 3499 USA Passport 1999 USA ID 599 USA Drivers License 399 USA Residency Visa 999 USA New Identity Pack PassportIDDrivers Licensefree SIM card 2599 Australian Passport 1999 Australian ID 599 Australian Drivers License Australian Residency Visa 999 Australian New Identity Pack PassportIDDrivers Licensefree SIM card 2599 New Zealand Passport 1999 New Zealand ID 599 New Zealand Drivers License 399 New Zealand Residency Visa 999 New Zealand New Identity Pack PassportIDDrivers Licensefree SIM card 2599 Canadian Passport 2099 Canadian ID 699 Canadian Drivers License 499 Canadian Residency Visa 1099 Canadian New Identity Pack PassportIDDrivers Licensefree SIM card 2899 French Passport 2199 French ID 749 French Drivers License 549 French Residency Visa 1199 French New Identity Pack PassportIDDrivers Licensefree SIM card 3099 German Passport 1999 German ID 599 German Drivers License 399 German Residency Visa 999 German New Identity Pack PassportIDDrivers Licensefree SIM card 2599 Documents duplicate service Documents duplicates producing means clone real existing document photo select suitable documents database considering age sex nationality ect would contain real name parents person address useful information asked airport customs immigration ect Documents registration service countries offer register new documents government database produced fact official issued documents use like original ones price registered documents higher regular documents producing Visastamps affixion service provide possibility affix almost kind stampsVISAs passports fill confident affix VISAstamps document dont provide kind service separately passport producing IELTS certificates offer high qualitative English test certificates without exam Certificates original registered official database certificates issue carries band scores level choosing6590 IELTS accepted 10organisations countries includes Universities schools training colleges tertiary institutes Government departments agencies Professional industry bodies Companies employers Real fake Documents passport Product categoriesBTC WALLETS carding Counterfeits BankNotes documents Drugs dumps pins electronics gift cards hacked PayPal Accounts Hacking Services hardwares money transfers services physical credit cards Categories aliexpress carding Amazon Carding Method cardable websites Carding basic tutorial Crack Netflix Premium Accounts CREDIT CARD RESPONSE CODES Cash cc cvv PayPal Carding Method Uncategorized Walmart Giftcard Method СARDING TUTORIAL CC Featured Vendors 636Drugs ratings found yet applestore ratings found yet bizans shop ratings found yet blackmarket ratings found yet fakeidlab ratings found yet FREEZONE ratings found yet niceshop ratings found yet PressedPills ratings found yet privatekeyshop ratings found yet RICHMAN ratings found yet Hack master ratings found yet Top rated products International Wire Bank Transfer Rated 1iPhone 11 Pro 11R Max Factory Unlocked Rated 2buy onion domain hosting Rated Hacking Course learn ethical hacking online courses Rated Uncut Fishscale Cocaine Lab tested USA stock Rated Pressed Pills Donald Trump Rated Pressed Pills Dom Perignon Rated Pressed Pills Blue Dominoes Rated real Cash Money USD Rated Google Play gift code 500 instant Delivery Rated Recent Commentspasif Counterfeit Australian Dollar BanknotePatrick UAE CC Dump atm PIN x HIGH BALANCEMason HACK OPERATING SYSTEMtesla carded Apple iPhone XSAvery Hacked Paypal account min 15000Nolan Random EU FullzCVVRyan Emv software FULL versionAadarsh Hacked US MasterCard Online banking account min 6500Richard Amazon Gift CardJamaya Undetectable fake us uk passportsProduct tags4 Digit PIN Code Japan CC FullzCVV non vbv 2020hacked paypal facebook hacking software hacker credit card Apple iPhone Unlocked apple iphone unlocked usa apple iphone unlocked new apple iphone unlocked phone apple iphone unlocked sale apple iphone xs max unlocked model number apple iphone xs unlocked best buy apple iphone xs unlocked usa atm PIN best credit card reader writer buy hacked credit card buy dark web hosting buy DDoS attack buy fullz dumps buy onion domain hosting buy onion domain name buy us fullz carded Apple iPhone Unlocked credit card reader writer DRUGS free us fullz hacked PayPal hacked paypal accounts Heroin HIGH BALANCE non vbv cards paypal accounts paypal accounts sale Pressed Pills real Cash Money usa fullz format usa fullz free usa fullz pastebin us cc fullz us dead fullz us fresh CC Fullz cvv us fullz dump us fullz format us fullz info us fullz sample Packaging Labeling Small orders shipped inside magazines binders Large orders shipped boxes labeling appear like Ebay Amazoncom package Additional stealth precautions taken dont publicly share Please let us know special requirements Items via Email Gift Cards Transfers etc Items sent email need enter name street etc ordering enter XXX instead Usually receive answer hour later Proudly powered WordPress Theme WebStore 0Cart 000,bad
