index,link,text,marker
14,http://stormer5v52vjsw66jmds7ndeecudq444woadhzr2plxlaayexnh6eqd.onion/new-leftist-plan-drug-nazis-with-magic-mushrooms-to-fight-fascism/,New Leftist Plan Drug Nazis Magic Mushrooms Fight Fascism Daily Stormer Featured Stories World US Society Insight Daily Stormer Censored Publication History Featured Stories World US Society Insight New Leftist Plan Drug Nazis Magic Mushrooms Fight Fascism Adrian Sol February 4 Adrian Sol Daily Stormer Febuary 4 mushrooms turn away American nationalism Jew liberal establishment fullpanic mode year starting see hilarious fruits phenomenon Scientists looking new innovative ways fight fascism ie AltRight Trumpism example months back scientists found link authoritarian attitudes infected parasites TOP KEK Actually sounds right Unfortunately didnt arrive obvious conclusion getting rid parasites Jews negroes would wonders agenda stem tide fascism new study claims ingesting magic mushrooms cure people authoritarian attitudes Big Think Researchers found unlikely heroes keeping world authoritarianism magic mushrooms Scientists Psychedelic Research Group Imperial College London showed psilocybin active compound psychedelic mushrooms makes people less likely embrace authoritarian views like fascism connected nature Hmmm study authored Taylor Lyons Robin L CarhartHarris leading researcher field shows psilocybin treatment lead lasting changes mindsets Treatment guess tripping shrooms treatment OK findings tentatively raise possibility given way psilocybin may produce sustained changes outlook political perspective direction increased nature relatedness decreased authoritarianism write CarhartHarris Lyons main issue ridiculous assumption feelings connectedness nature authoritarianism somehow incompatible reality soyboy commie faggotry symptom total disconnectedness natural order nature communism Somehow ants dont care bees feelings Yes even plants vicious killers Hippy types generally citydwellers whose relationship nature watching documentaries TV taking occasional hike Country folk actually connected nature virtue living usually much harder authoritarian view world election map Notice vast wilderness largely red urbanized coastlines blue coincidence Lyons CarhartHarris set understand relatively small current study involving subjects whether using psilocybin could specifically promote antiauthoritarian attitudes natureoriented feelings compared subjects major depression resistant previous treatment received two oral doses psilocybin control subjects taking psychedelic ingredient scientists checked participants started treatment week 7months found participants got psilocybin clear increase attitudes naturerelatedness week effect sustained 7months well enjoyed nature feel part wrote one subject looking thing like TV painting see theres separation distinction participants also showed marked lasting decrease authoritarian attitudes fewer depression symptoms received drug showed changes Psilocybin drug improves neuroplasticity words allows brain make new connections improving ability learn new things give old habits Naturally weakminded people also living liberalized environment also make absorb surrounding propaganda effectively could worthy study terms use therapy definitely doesnt inherent ability make people less authoritarian whatever means crazy unhinged people becoming result Trump panic Related Articles Need Build Hollow Balls Around Black Holes Throw People Matrix September 7 Killing Babies Pregnant Women Though Get Vaxxed August 26 Anthony Fauci Manage Right Consistently August 24 FreeRicky Demographic Countdown shekels plz goyim readerfunded site censored publication history Send Monero today Disclaimer Daily Stormer opposed violence seek revolution education masses information available people systemic change inevitable unavoidable Anyone suggesting promoting violence comments section immediately banned permanently Copyright Daily Stormer 2021 Rights Reserved Watch Daily Stormer Status page future updates case domain seizure,bad
15,http://pharmacy42hblqssvwizqvrwmy7oec5sfgjtr7hy6dup3t2lf2xzitqd.onion/tag/magic-mushrooms/,Tag magic mushrooms Pharmacy Pharmacy Taste Rainbow Menu Recreational Drugs Use Stimulants Hallucinogens Depressants Synthetic Drugs Club Drugs Designer Drugs Opiates Sedatives Benzodiazepines Tag magic mushrooms Magic mushrooms Comments Hallucinogens Recreational Drugs Use Also called Shrooms Philosophers Stones Mushies Magics Liberty Caps Liberties Amani Agaric Wild mushrooms hallucinogenic effects look like Many poisonous mushrooms look similar magic mushrooms easy pickers mistake People fallen severely ill even died eating poisonous mushroom Magic mushrooms Read Recent Posts Methadone Acid Cannabis Xanax Molly Categories Benzodiazepines Club Drugs Depressants Designer Drugs Hallucinogens Opiates Recreational Drugs Use Sedatives Stimulants Synthetic Drugs TagsBeans Blow Brownies Buy Cocaine Buy Cocaine C Chang Charlie Ching Cocaine Coke Cowies Crack Crystal Dizzle Dolphins E Flake Freebase Mandy MD MDMA Mitsubishis Pebbles Percy Pills Pink Superman Pot Puff Recreational use Resin Rocks Rolexs Sensi Sinsemilla Skunk Sniff Snow Stones Superman Toot Wash Weed White Xtc Herbal Lite,bad
16,http://cbtzjyzkpdj6tjw3fjy7klqvkjb4majkkn2gt73hgbvqsgunaaudkpqd.onion/product-tag/golden-teacher-mushrooms-for-sale-near-me/,golden teacher mushrooms sale near MillerMall Site Navigation Home Shop Contact COCAINE Mush Rooms Indica Sativa account Copyright Millermall Powered DarkCode English English Spanish German USD USD INR GBP Due COVID epidemic orders may processed slight delay Us account Wishlist Order Tracking deliver discretely worldwide Need help Call Us 1559 English English Spanish German USD USD INR GBP Buy weedmushroomscocaine heroin Products search products cart Free shipping order CATEGORIES TOTAL PRODUCTS Indica Sativa Hybrid Marijuana Wax Weed Cans Mush Rooms King Pen Exotics Moon Rocks Rove Cookies Carts Smart Cart Vape Glo Carts Home Shop Contact COCAINE Mush Rooms Indica Sativa account Store Search Wishlist Account HomeProducts tagged golden teacher mushrooms sale near Filter Products Sort Sort popularity Sort average rating Sort latest Sort price low high Sort price high low Show Add Wishlist Add Wishlist Golden Teacher MushroomsIn Stock 27000Select options Add Wishlist Add Wishlist Filter Products UncategorizedANXIETY MEDSCOCAINECookies CartsECSTASYExoticsGlo CartsHybrid MarijuanaIndicaKing PenMarijuana CartridgesMarijuana ConcentratesMDMAMoon RocksMuh MedicineMush RoomsPAIN KILLERSPlug n PlayPre RollsPsychedelicsRESEARCH CHEMICALSRoveRove VapeSativaSmart Cart VapeStiiizyWaxWeed CansFilter price Filter Price Product StatusIn StockOn SaleUncut Flake CocaineTop rated products Québec Gold 1Butane Hash Oil 1Exotic Carts GSC Barewoods Russian Cream Wild Rum Banana Grape Vanilla Pre Rolls Pineapple Express STIIIZY LIIL Colombian Gold BHO Wax GRAND DADDY PURPLE 1Tahoe OG Kush 1MINI SATIVA TOFFEE COOKIES 10MG KING LOUIS OG Dankwoods White Fire Pre Roll Grease Monkey marijuana Cans German Uncut HQ Cocaine 1g Buy Blue Meanies Mushrooms online Dank Vape Candy Land Cartridge Muha Meds Wifi OG Cartridge Plug DNA Train Wreck Rove Vape Waui Gold moonrocks 1Silver Haze 1Cannabis Cherry 1Exotic Carts Kosher Kush Bosswoods Grape Pre Roll Premium Jack STIIIZY LIIL Cannalope Kush BHO Wax 10g Chopped IceHash 10g Silver Haze SFV OG 1Muha Meds Nesquik Cartridge ROMULAN GRAPEFRUIT Wax Cigar Barewoods Bare OG discount first order Join newsletter get Join email subscription get updates promotions coupons Leave field empty youre human Daily products updates Free delivery order Monthly Mega Discounts Best price market MARIJUANA MUSHROOMS COCAINE HEROIN 1559 Working 8 22Download App Mobile 15 discount first purchase Copyright Millermall Powered DarkCode Terms Conditions Cookie,bad
17,http://cbtzjyzkpdj6tjw3fjy7klqvkjb4majkkn2gt73hgbvqsgunaaudkpqd.onion/product-tag/psychedelic-mushrooms/,psychedelic mushrooms MillerMall Site Navigation Home Shop Contact COCAINE Mush Rooms Indica Sativa account Copyright Millermall Powered DarkCode English English Spanish German USD USD INR GBP Due COVID epidemic orders may processed slight delay Us account Wishlist Order Tracking deliver discretely worldwide Need help Call Us 1559 English English Spanish German USD USD INR GBP Buy weedmushroomscocaine heroin Products search products cart Free shipping order CATEGORIES TOTAL PRODUCTS Indica Sativa Hybrid Marijuana Wax Weed Cans Mush Rooms King Pen Exotics Moon Rocks Rove Cookies Carts Smart Cart Vape Glo Carts Home Shop Contact COCAINE Mush Rooms Indica Sativa account Store Search Wishlist Account HomeProducts tagged psychedelic mushrooms Filter Products Sort Sort popularity Sort average rating Sort latest Sort price low high Sort price high low Show Add Wishlist Add Wishlist Amazonian Cubensis MushroomsIn Stock 27000Select options Add Wishlist Add Wishlist Add Wishlist Add Wishlist Buy Brazilian Cubensis onlineIn Stock 27000Select options Add Wishlist Add Wishlist Filter Products UncategorizedANXIETY MEDSCOCAINECookies CartsECSTASYExoticsGlo CartsHybrid MarijuanaIndicaKing PenMarijuana CartridgesMarijuana ConcentratesMDMAMoon RocksMuh MedicineMush RoomsPAIN KILLERSPlug n PlayPre RollsPsychedelicsRESEARCH CHEMICALSRoveRove VapeSativaSmart Cart VapeStiiizyWaxWeed CansFilter price Filter Price Product StatusIn StockOn SaleUncut Flake CocaineTop rated products Québec Gold 1Butane Hash Oil 1Exotic Carts GSC Barewoods Russian Cream Wild Rum Banana Grape Vanilla Pre Rolls Pineapple Express STIIIZY LIIL Colombian Gold BHO Wax GRAND DADDY PURPLE 1Tahoe OG Kush 1MINI SATIVA TOFFEE COOKIES 10MG KING LOUIS OG Dankwoods White Fire Pre Roll Grease Monkey marijuana Cans German Uncut HQ Cocaine 1g Buy Blue Meanies Mushrooms online Dank Vape Candy Land Cartridge Muha Meds Wifi OG Cartridge Plug DNA Train Wreck Rove Vape Waui Gold moonrocks 1Silver Haze 1Cannabis Cherry 1Exotic Carts Kosher Kush Bosswoods Grape Pre Roll Premium Jack STIIIZY LIIL Cannalope Kush BHO Wax 10g Chopped IceHash 10g Silver Haze SFV OG 1Muha Meds Nesquik Cartridge ROMULAN GRAPEFRUIT Wax Cigar Barewoods Bare OG discount first order Join newsletter get Join email subscription get updates promotions coupons Leave field empty youre human Daily products updates Free delivery order Monthly Mega Discounts Best price market MARIJUANA MUSHROOMS COCAINE HEROIN 1559 Working 8 22Download App Mobile 15 discount first purchase Copyright Millermall Powered DarkCode Terms Conditions Cookie,bad
18,http://cbtzjyzkpdj6tjw3fjy7klqvkjb4majkkn2gt73hgbvqsgunaaudkpqd.onion/product-tag/psychedelic-mushrooms/,psychedelic mushrooms MillerMall Site Navigation Home Shop Contact COCAINE Mush Rooms Indica Sativa account Copyright Millermall Powered DarkCode English English Spanish German USD USD INR GBP Due COVID epidemic orders may processed slight delay Us account Wishlist Order Tracking deliver discretely worldwide Need help Call Us 1559 English English Spanish German USD USD INR GBP Buy weedmushroomscocaine heroin Products search products cart Free shipping order CATEGORIES TOTAL PRODUCTS Indica Sativa Hybrid Marijuana Wax Weed Cans Mush Rooms King Pen Exotics Moon Rocks Rove Cookies Carts Smart Cart Vape Glo Carts Home Shop Contact COCAINE Mush Rooms Indica Sativa account Store Search Wishlist Account HomeProducts tagged psychedelic mushrooms Filter Products Sort Sort popularity Sort average rating Sort latest Sort price low high Sort price high low Show Add Wishlist Add Wishlist Amazonian Cubensis MushroomsIn Stock 27000Select options Add Wishlist Add Wishlist Add Wishlist Add Wishlist Buy Brazilian Cubensis onlineIn Stock 27000Select options Add Wishlist Add Wishlist Filter Products UncategorizedANXIETY MEDSCOCAINECookies CartsECSTASYExoticsGlo CartsHybrid MarijuanaIndicaKing PenMarijuana CartridgesMarijuana ConcentratesMDMAMoon RocksMuh MedicineMush RoomsPAIN KILLERSPlug n PlayPre RollsPsychedelicsRESEARCH CHEMICALSRoveRove VapeSativaSmart Cart VapeStiiizyWaxWeed CansFilter price Filter Price Product StatusIn StockOn SaleUncut Flake CocaineTop rated products Colombian Gold BHO Wax Québec Gold 1Butane Hash Oil 1Exotic Carts GSC Barewoods Russian Cream Wild Rum Banana Grape Vanilla Pre Rolls Pineapple Express STIIIZY LIIL German Uncut HQ Cocaine 1g GRAND DADDY PURPLE 1Tahoe OG Kush 1MINI SATIVA TOFFEE COOKIES 10MG KING LOUIS OG Dankwoods White Fire Pre Roll Grease Monkey marijuana Cans Gold moonrocks 1Buy Blue Meanies Mushrooms online Dank Vape Candy Land Cartridge Muha Meds Wifi OG Cartridge Plug DNA Train Wreck Rove Vape Waui Cannalope Kush BHO Wax Silver Haze 1Cannabis Cherry 1Exotic Carts Kosher Kush Bosswoods Grape Pre Roll Premium Jack STIIIZY LIIL High Quality Cocaine 1g 10g Chopped IceHash 10g Silver Haze SFV OG 1Muha Meds Nesquik Cartridge ROMULAN GRAPEFRUIT discount first order Join newsletter get Join email subscription get updates promotions coupons Leave field empty youre human Daily products updates Free delivery order Monthly Mega Discounts Best price market MARIJUANA MUSHROOMS COCAINE HEROIN 1559 Working 8 22Download App Mobile 15 discount first purchase Copyright Millermall Powered DarkCode Terms Conditions Cookie,bad
19,http://dhfk22hkwwn27obpsz22uhdyeu42b5wlkn4jlrelh75a2cgfoshkj6id.onion/product-tag/cubensis-mushrooms/,Cubensis Mushrooms Psychedelics home Skip content contact Psychedelicsshopprotonmailcom Home MAGIC MUSHROOMS MUSHROOM EDIBLES MUSHROOM TEA Extra DMT LSD Microdose MUSHROOM CAPSULES FAQs Us Contact us contact Psychedelicsshopprotonmailcom Menu AllExtraMAGIC MUSHROOMSMicrodoseMUSHROOM CAPSULESMUSHROOM EDIBLESMUSHROOM TEA Search products cart Cart products cart Home MAGIC MUSHROOMS MUSHROOM EDIBLES MUSHROOM TEA Extra DMT LSD Microdose MUSHROOM CAPSULES FAQs Us Contact us Cubensis Mushrooms Home Products tagged Cubensis Mushrooms Filter Showing single result Default sorting Sort popularity Sort average rating Sort latest Sort price low high Sort price high low BrowseExtra DMT LSD MAGIC MUSHROOMS Microdose MUSHROOM CAPSULES MUSHROOM EDIBLES MUSHROOM TEA Filter price Filter Price Quick View MAGIC MUSHROOMS B Cubensis 1Latest Genius Brain Shroom Microdose Deadhead Chemist 4 Rated Mother Nature Purecybin Microdose 4 Mens Optimal Microdose capsules 4 Memory Focus Microdose Purecybin Microdose Best Selling Beyond microdose shroom capsules Caps300mg Per Cap4 Milk Chocolate Shroom Bar 3000mg4 Milk Chocolate Orange Square Room 920 Relax microdose shroom capsules Caps300mg Per Cap4 Top Rated Mexican XP Magic Rated 1Cambodian Cubensis Rated 1Blue Meanies Cubensis Rated 1Business Information Psychedelicsshopprotonmailcom Monday Sunday 24Terms Service Shipping TIMES Orders take 1Business days ship Orders begin processing day receive accept payment day notified processing started order shipped Products Genius Brain Shroom Microdose Deadhead Chemist 4 Rated Mother Nature Purecybin Microdose 4 Mens Optimal Microdose capsules 4 Product categoriesExtra DMT LSD MAGIC MUSHROOMS Microdose MUSHROOM CAPSULES MUSHROOM EDIBLES MUSHROOM TEA Home MAGIC MUSHROOMS MUSHROOM EDIBLES MUSHROOM TEA Extra Microdose MUSHROOM CAPSULES FAQs Us Contact us Copyright psychedelics home AllExtraMAGIC MUSHROOMSMicrodoseMUSHROOM CAPSULESMUSHROOM EDIBLESMUSHROOM TEA Search Home MAGIC MUSHROOMS MUSHROOM EDIBLES MUSHROOM TEA Extra DMT LSD Microdose MUSHROOM CAPSULES FAQs Us Contact us Login Login Username email address Password Remember Log Lost password WhatsApp us info,bad
20,http://cbtzjyzkpdj6tjw3fjy7klqvkjb4majkkn2gt73hgbvqsgunaaudkpqd.onion/product-tag/buy-golden-teacher-mushrooms-near-me/,buy golden teacher mushrooms near MillerMall Site Navigation Home Shop Contact COCAINE Mush Rooms Indica Sativa account Copyright Millermall Powered DarkCode English English Spanish German USD USD INR GBP Due COVID epidemic orders may processed slight delay Us account Wishlist Order Tracking deliver discretely worldwide Need help Call Us 1559 English English Spanish German USD USD INR GBP Buy weedmushroomscocaine heroin Products search products cart Free shipping order CATEGORIES TOTAL PRODUCTS Indica Sativa Hybrid Marijuana Wax Weed Cans Mush Rooms King Pen Exotics Moon Rocks Rove Cookies Carts Smart Cart Vape Glo Carts Home Shop Contact COCAINE Mush Rooms Indica Sativa account Store Search Wishlist Account HomeProducts tagged buy golden teacher mushrooms near Filter Products Sort Sort popularity Sort average rating Sort latest Sort price low high Sort price high low Show Add Wishlist Add Wishlist Golden Teacher MushroomsIn Stock 27000Select options Add Wishlist Add Wishlist Filter Products UncategorizedANXIETY MEDSCOCAINECookies CartsECSTASYExoticsGlo CartsHybrid MarijuanaIndicaKing PenMarijuana CartridgesMarijuana ConcentratesMDMAMoon RocksMuh MedicineMush RoomsPAIN KILLERSPlug n PlayPre RollsPsychedelicsRESEARCH CHEMICALSRoveRove VapeSativaSmart Cart VapeStiiizyWaxWeed CansFilter price Filter Price Product StatusIn StockOn SaleUncut Flake CocaineTop rated products Québec Gold 1Butane Hash Oil 1Exotic Carts GSC Barewoods Russian Cream Wild Rum Banana Grape Vanilla Pre Rolls Pineapple Express STIIIZY LIIL Colombian Gold BHO Wax GRAND DADDY PURPLE 1Tahoe OG Kush 1MINI SATIVA TOFFEE COOKIES 10MG KING LOUIS OG Dankwoods White Fire Pre Roll Grease Monkey marijuana Cans German Uncut HQ Cocaine 1g Buy Blue Meanies Mushrooms online Dank Vape Candy Land Cartridge Muha Meds Wifi OG Cartridge Plug DNA Train Wreck Rove Vape Waui Gold moonrocks 1Silver Haze 1Cannabis Cherry 1Exotic Carts Kosher Kush Bosswoods Grape Pre Roll Premium Jack STIIIZY LIIL Cannalope Kush BHO Wax 10g Chopped IceHash 10g Silver Haze SFV OG 1Muha Meds Nesquik Cartridge ROMULAN GRAPEFRUIT Wax Cigar Barewoods Bare OG discount first order Join newsletter get Join email subscription get updates promotions coupons Leave field empty youre human Daily products updates Free delivery order Monthly Mega Discounts Best price market MARIJUANA MUSHROOMS COCAINE HEROIN 1559 Working 8 22Download App Mobile 15 discount first purchase Copyright Millermall Powered DarkCode Terms Conditions Cookie,bad
21,http://cbtzjyzkpdj6tjw3fjy7klqvkjb4majkkn2gt73hgbvqsgunaaudkpqd.onion/product/albino-penis-envy-mushrooms/,Albino Penis Envy Mushrooms MillerMall Site Navigation Home Shop Contact COCAINE Mush Rooms Indica Sativa account Copyright Millermall Powered DarkCode English English Spanish German USD USD INR GBP Due COVID epidemic orders may processed slight delay Us account Wishlist Order Tracking deliver discretely worldwide Need help Call Us 1559 English English Spanish German USD USD INR GBP Buy weedmushroomscocaine heroin Products search products cart Free shipping order CATEGORIES TOTAL PRODUCTS Indica Sativa Hybrid Marijuana Wax Weed Cans Mush Rooms King Pen Exotics Moon Rocks Rove Cookies Carts Smart Cart Vape Glo Carts Home Shop Contact COCAINE Mush Rooms Indica Sativa account Store Search Wishlist Account HomeMush RoomsAlbino Penis Envy Mushrooms Albino Penis Envy Mushrooms QUANTITY 2g 35g 7g 14g 28g Stock Albino Penis Envy Mushrooms one potent psilocybin cubensis strains PRICES Grams Grams Grams Grams Grams QUANTITY Choose option2g35g7g14g28g2g35g7g14g28gClear Albino Penis Envy Mushrooms quantity Add cart Add Wishlist Add Wishlist Add Wishlist Add Wishlist woosc SKU NA Category Mush Rooms Tags Albino Penis Envy Mushrooms sale Albino Penis Envy Mushrooms sale near buy Albino Penis Envy Mushrooms buy Albino Penis Envy Mushrooms online CovidInfo keep delivering Free Shipping apply orders 100 Refund Guaranteed Day Returns change mind Description Additional information Reviews 0 Description Albino Penis Envy Mushrooms one potent psilocybin cubensis strains derived famous albino penis envy shrooms variant reported highest potency bruised blue colouration Mild Experience Grams Grams Medium Experience Grams Grams Full Experience Grams Grams Mushrooms Mushrooms sale online Psilocybin mushrooms also known Magic mushrooms Magic mushrooms class mushrooms contain psilocybin naturally occurring compound induces hallucinations intense psychedelic experiences Many consume magic mushrooms embark journey selfdiscovery enlightenment others often use shrooms recreation Whatever purpose Dream Dispensary best safest mushroom selection Mushroom tea delicious way enjoy psilocybin consistent dose Enjoy organic shroom tea blends satisfy discerning tea drinkers drinking Shroom Tea youll notice onset effects quickly compared eating magic mushrooms though may experience effects slightly shorter amount time Want reap benefits magic mushrooms turned taste Mushroom Capsules best solution easy accurate dosing Available variety magic mushroom strains varieties Shroom Capsules perfect beginners experienced psychonauts alike Enjoy alone group friends recreation spiritual journey Mushroom edibles best solution easy accurate dosing Available variety flavors Shroom Edibles perfect beginners experienced psychonauts alike Enjoy alone group friends recreation spiritual journey buy mushroomsplease vistit website wwwdrdreamdispensarycom choose desired product place order customer service shall respond maxmum minutes Additional information QUANTITY 2g 35g 7g 14g 28g Reviews reviews yet first review Albino Penis Envy Mushrooms Cancel replyYour email address published Required fields marked rating Rate Perfect Good Average bad poor review Name Email Save name email website browser next time comment Related products Add Wishlist Add Wishlist Buy Brazilian Cubensis onlineIn Stock 27000Select options Add Wishlist Add Wishlist Add Wishlist Add Wishlist Buy Blue Meanies Mushrooms onlineIn Stock 27000Select options Add Wishlist Add Wishlist Add Wishlist Add Wishlist Malabar MushroomsIn Stock 27000Select options Add Wishlist Add Wishlist Add Wishlist Add Wishlist Mexican Cubensis MushroomsIn Stock 13200Select options Add Wishlist Add Wishlist discount first order Join newsletter get Join email subscription get updates promotions coupons Leave field empty youre human Daily products updates Free delivery order Monthly Mega Discounts Best price market MARIJUANA MUSHROOMS COCAINE HEROIN 1559 Working 8 22Download App Mobile 15 discount first purchase Copyright Millermall Powered DarkCode Terms Conditions Cookie,bad
