index,link,text,marker
5,http://pharmacy42hblqssvwizqvrwmy7oec5sfgjtr7hy6dup3t2lf2xzitqd.onion/recreational-drugs-use/magic-mushrooms/,Magic mushrooms Pharmacy Pharmacy Taste Rainbow Menu Recreational Drugs Use Stimulants Hallucinogens Depressants Synthetic Drugs Club Drugs Designer Drugs Opiates Sedatives Benzodiazepines Magic mushrooms Comments Also called Shrooms Philosophers Stones Mushies Magics Liberty Caps Liberties Amani Agaric Wild mushrooms hallucinogenic effects look like Many poisonous mushrooms look similar magic mushrooms easy pickers mistake People fallen severely ill even died eating poisonous mushroom Magic mushrooms often sold raw dried UK common types liberty caps Psilocybe semilanceata fly agaric Amanita muscaria Liberty caps look like small tancoloured mushroomsFly agarics look like red white spotted toadstools important know types magic mushroom stronger others example fly agaric mushroom usually potent liberty cap mushroom Liquid psilocybin another way taking magic mushrooms made extracting psilocybin naturally occurring psychedelic drug found mushrooms like liberty caps clearish pale brown colour comes vials small bottles tastesmell like Liberty caps usually eaten raw strong earthy taste rubberlike texture makes chewy dont taste like mushrooms cook home people try hide flavour putting omelette tea people take eating picking liberty caps often eaten raw dried stored People dont tend eat fly agaric mushrooms raw make feel sick drinking people make tea dried mushrooms taking drops liquid psilocybin Liquid psilocybin made extracting psilocybin naturally occurring psychedelic drug found mushrooms like liberty caps make feel strength magic mushrooms varies depending freshness season grow difficult predict strength magic mushrooms people world appears distorted take mushrooms Colours sounds objects even time seem different people get mild hallucinations also called visuals Taking mushrooms make feel gigglyeuphoricin awe people things around youenergisedexcited also make feel paranoidanxiouspanickedoverwhelmedlike vomiting feel affected much take surroundings youre comfortable well mood youre bad mood feeling worried depressed magic mushrooms might make feelings worse make people behave depends many magic mushrooms person takes person takes small dose mushrooms may even notice theyre People take larger doses mushrooms act unpredictably laugh lot become fixated certain things emotional get paranoid Duration long effects last drug stays system depends much youve taken size whether youve eaten drugs may also taken feel like youre going bad trip let friends know get help Go nice quiet spot feel safe relax long detectable Psilocybin detectable hours long drug detected depends much taken testing kit used general guide Physical health risks biggest danger health taking magic mushrooms eating poisonous mushroom mistake many types mushroom UK like fly agaric kill eaten poisonous mushrooms youll soon know youll need get medical help soon possible Always keep example mushroom youve eaten doctors identify Eating magic mushrooms make dizzysickhave diarrhoeaget stomach pains Mental health risks mental health issues magic mushrooms make worse Eating magic mushrooms make bad trip frightening unsettlingget flashbacks frightening unsettlinglose complete control youre put risk dangerous mix drugs Yes anytime mix drugs take new risks drugs riskier mix others avoid taking mushrooms tramadolcocaineamphetamines speedcannabis get addicted Magic mushrooms addictive LSD become tolerant effects quite quickly means youll need take get effect law Class Class drug means illegal give away sellPossession get years prison unlimited fine bothSupplying someone else even friends get life prison unlimited fine Like drinkdriving driving high dangerous illegal youre caught driving influence may receive heavy fine driving ban prison sentence police catch people supplying illegal drugs home club bar hostel potentially prosecute landlord club owner person concerned management premises Additional law details Drugs Act amended Misuse Drugs Act clarify fresh prepared eg dried stewed magic mushrooms containing psilocin psilocybin liberty cap Class drugs means illegal type magic mushroom give away sell Tags Agaric Wild mushrooms Amani buy mushrooms liberties Liberty Caps magic mushrooms magics mushies Philosophers Stones shrooms Post navigation Heroin Ecstasy Recent Posts Methadone Acid Cannabis Xanax Molly Categories Benzodiazepines Club Drugs Depressants Designer Drugs Hallucinogens Opiates Recreational Drugs Use Sedatives Stimulants Synthetic Drugs TagsBeans Blow Brownies Buy Cocaine Buy Cocaine C Chang Charlie Ching Cocaine Coke Cowies Crack Crystal Dizzle Dolphins E Flake Freebase Mandy MD MDMA Mitsubishis Pebbles Percy Pills Pink Superman Pot Puff Recreational use Resin Rocks Rolexs Sensi Sinsemilla Skunk Sniff Snow Stones Superman Toot Wash Weed White Xtc Herbal Lite,bad
6,http://wz6bnwwtwckltvkvji6vvgmjrfspr3lstz66rusvtczhsgvwdcixgbyd.onion/hobby/res/11168.html,hobby grow mushrooms beginners overboard sfw alt cytube leftypol b hobby tech edu games anime ent posad dead meta hobby HobbyOur hands pass skills last generation nextPosting mode Reply ReturnName 42366EmailSubjectSpoiler ImageCommentT5yKfwFudgvi68U oJ3cObk aAFlagNone4th InternationalAccelerationAK47AlbaniaAllendeAnarchaFeminismAnarchismAnarchoCapitalismAnarchoCommunismAnarchoNihilismAnarchoPrimitivismAntifaArmchairAtheismBolshevikBrocialismBurkina FasoCanadienCarlismChavismoCheChinaChristian AnarchismChristian CommunismCockshottCouncil CommunismCubaDDRDemocrapDemocratic SocialismDirect XDPRKEgalitarianismEgoismΈριστοκρατίαEurekaEurocommunismLas FARCFedFront de libération du QuébecFreudGadsdenGay NaziGentooGorroGroucho MarxismHammer SickleInternational BrigadeIRAIslamic CommunismIWWJucheKampucheaLeft CommunismLenin CapLuck IrishLuxemburgMarxMutualismNaxaliteNazbolNaziNDFPPalestinePanAfricanismPapieżPhrygian CapPiratePorkyPosadasPunkRaised FistRead Fucking BookRethuglicanSaboTabbySandinistaSendero LuminosoSlavojSnibeti SnabSocialismSoviet UnionSpurdoSSNPStalinSyndicalismTankieTechnocracyThinkTranshumanismUnited Farm WorkersViet CongYPGYugoslaviaZapatistaFile EmbedPassword file deletionNew check textboards httpsdisleftychannet Return Go bottom File 1608526654369jpg KB 768x539 __opt__aboutcom__coeus__rejpg grow mushrooms beginners Anonymous Comrade 202012Mon 0457No11168Trying get hobby ball rollingI want grow mushrooms anybody tips ways start without buying massmanufactured kitAnonymous Comrade 202012Mon 0457NoHallucinogenic mushroomsAnonymous Comrade 202012Mon 0457No11168A dog entered garden pissed bricks weeks later white mushrooms started growing itSo think piss one leg wherever want grow mushrooms anonBe sure wash eating thoughAnonymous Comrade 202012Mon 0457No11173choeseAnonymous Comrade 202012Mon 0457NoI know guy started growing kinds mushrooms psilocybin regular building pretty much everything mason jars tubs shit think mostly used shroomeryorg resource Ill ask post thread wouldnt hold breathAnonymous Comrade 202012Mon 0457NoI tried growing mushrooms buy kit Midwestgrowkits something like spores buy pretty much whatever want online would suggest finding head shop sells spores magic kind thereShaytan 202012Mon 0457Nohttpswwwyoutubecomwatchv45b2t7fqhjAt35sAnonymous Comrade 202012Mon 0457No11234Nice work ShaytanShaytan 202012Mon 0457NoFile 16085266633200jpg KB 1000x1500 poisonous mushroomsjpg File 16085266633201jpg KB 320x2268 detpsych comb 1jpg File 16085266633202jpg KB 320x2269 detpsych comb 2jpg 11235The trick mushrooms understanding exactly like growing shade away sunFungi people dont need vitamin constantly like plants instead need water food shelter get water rain dripping trees house rooftops morning dew grass residual moisture underneath dead leaves water ground get food decaying plant animal life fertile soilwoodchipsdead leaves trees prime growth get shelter prevents losing moisture example cant grow sand sunlight dries sunlight Sunlight doesnt kill drying doesThey dont fruit theres rain wind grow storms Hence covering much actually stops fruiting even though mycelium continue grow theres nothing killing Mushrooms specifically exist reproduce dont show unless chance reproduce wind carries spores water nourishes spores like cant get boner unless theres pussy hole presenting Unless youre girl cant really get wet unless think somethings gonna penetrate shroomsShaytan 202012Mon 0457NoFile 16085266636500jpg KB 320x2268 detpsych comb 3jpg File 16085266636501jpg KB 320x2722 detpsych comb 4jpg File 16085266636502jpg KB 320x2261 psych comb 1jpg Shaytan 202012Mon 0457NoFile 1608526663845jpg KB 320x1790 psych comb 2jpg 11237Shaytan 202012Mon 0457NohttpswwwyoutubecomwatchvnQ1uDfsT4yIAnonymous 202109Sun 1414NoHonestly much interesting go collect natureAnonymous 202109Mon 2321Nopftek worked growing psilocybin mostly dont need aseptic environment different kitty two mulling houseUnique IPs ReturnGo top Catalog HomePost ReplyDelete Post File Password Reason overboard sfw alt cytube leftypol b hobby tech edu games anime ent posad dead meta Tinyboard vichan lainchan 5Tinyboard Copyright 2010Tinyboard Development Groupvichan Copyright 2012vichandevellainchan Copyright 2014lainchan AdministrationAll trademarks copyrights comments images page owned responsibility respective parties Return Go top,bad
7,http://dnmnoxk5aylzyyczjwlrb7kwgb7hhleuzcv45dwrqjbmzcsdvjxn7oqd.onion/topic/4036/mykologen-ksss-magic-mushrooms/2,Forbidden Forbidden nginx1201,bad
8,http://2i2fcldw45pcp5j6i62kjntr2vw4e677vqla3pg5g3tmyw6l5rgjxfqd.onion/product/buy-teacher-mushrooms-top-quality/,Forbidden Forbidden nginx1213,bad
9,http://castlee5janmtc5h6jiorit7lzdhgfuy43po4oddgi3qpm52ljyljyyd.onion/listing/1939/ba6bdee84feba3504f4644be3c279be8/description,Evil Corp Market Magic Mushrooms 6g Powdered CURRENCY USD LOGIN REGISTER Evil Corp Market Live Feed BROWSE CATEGORIES Digital Fraud Drugs Chemicals Services Guides Tutorials Fake Counterfeit Items Hosting Security Softwares Malwares Erotica Miscellaneous Dead Drop ADVANCED SEARCH Search Terms Digital Physical Product Category Dead DropDigital FraudDrugs ChemicalsEroticaFake Counterfeit ItemsGuides TutorialsHosting SecurityMiscellaneousServicesSoftwares Malwares Price range Minimum USD maximum USD Ships WorldWideEuropian UnionWestern EuropeEastern EuropeUSA CanadaAfghanistanAlbaniaAlgeriaAmerican SamoaAndorraAngolaAnguillaAntarcticaAntigua BarbudaArgentinaArmeniaArubaAustraliaAustriaAzerbaijanBahamasBahrainBangladeshBarbadosBelarusBelgiumBelizeBeninBermudaBhutanBoliviaBosnia HerzegowinaBotswanaBouvet IslandBrazilBritish Indian Ocean TerritoryBrunei DarussalamBulgariaBurkina FasoBurundiCambodiaCameroonCanadaCape VerdeCayman IslandsCentral African RepublicChadChileChinaChristmas IslandCocos Keeling IslandsColombiaComorosCongoCongo Democratic Republic theCook IslandsCosta RicaCote dIvoireCroatia HrvatskaCubaCyprusCzech RepublicDenmarkDjiboutiDominicaDominican RepublicEast TimorEcuadorEgyptEl SalvadorEquatorial GuineaEritreaEstoniaEthiopiaFalkland Islands MalvinasFaroe IslandsFijiFinlandFranceFrance MetropolitanFrench GuianaFrench PolynesiaFrench Southern TerritoriesGabonGambiaGeorgiaGermanyGhanaGibraltarGreeceGreenlandGrenadaGuadeloupeGuamGuatemalaGuineaGuineaBissauGuyanaHaitiHeard Mc Donald IslandsHoly See Vatican City StateHondurasHong KongHungaryIcelandIndiaIndonesiaIran Islamic Republic ofIraqIrelandIsraelItalyJamaicaJapanJordanKazakhstanKenyaKiribatiKorea Democratic Peoples Republic ofKorea Republic ofKuwaitKyrgyzstanLao Peoples Democratic RepublicLatviaLebanonLesothoLiberiaLibyan Arab JamahiriyaLiechtensteinLithuaniaLuxembourgMacauMacedonia Former Yugoslav Republic ofMadagascarMalawiMalaysiaMaldivesMaliMaltaMarshall IslandsMartiniqueMauritaniaMauritiusMayotteMexicoMicronesia Federated States ofMoldova Republic ofMonacoMongoliaMontserratMoroccoMozambiqueMyanmarNamibiaNauruNepalNetherlandsNetherlands AntillesNew CaledoniaNew ZealandNicaraguaNigerNigeriaNiueNorfolk IslandNorthern Mariana IslandsNorwayOmanPakistanPalauPanamaPapua New GuineaParaguayPeruPhilippinesPitcairnPolandPortugalPuerto RicoQatarReunionRomaniaRwandaSaint Kitts NevisSaint LuciaSaint Vincent GrenadinesSamoaSan MarinoSao Tome PrincipeSaudi ArabiaSenegalSeychellesSierra LeoneSingaporeSlovakia Slovak RepublicSloveniaSolomon IslandsSomaliaSouth AfricaSouth Georgia South Sandwich IslandsSpainSri LankaSt HelenaSt Pierre MiquelonSudanSurinameSvalbard Jan Mayen IslandsSwazilandSwedenSwitzerlandSyrian Arab RepublicTaiwan Province ChinaTajikistanTanzania United Republic ofThailandTogoTokelauTongaTrinidad TobagoTunisiaTurkeyTurkmenistanTurks Caicos IslandsTuvaluUgandaUkraineUnited Arab EmiratesUnited KingdomUnited StatesUnited States Minor Outlying IslandsUruguayUzbekistanVanuatuVenezuelaVietnamVirgin Islands BritishVirgin Islands USWallis Futuna IslandsWestern SaharaYemenYugoslaviaZambiaZimbabwe Escrow FE Order DatePriceQuantityStatusOrders NumberVendor last activity Sorting AscendingDescending Search COIN RATES BTC USD BCH USD DASH USD LTC USD XMR USD ZEC USD Magic Mushrooms 6g Powdered Sold mushmedic Trust Level FEATURES Product class Physical Package Quantity left Ships Canada Ships WorldWide Views Visibility Public Ends Never Payment Escrow Total Purchase Price USD Shipping Worldwide shipping Days USD item Buy Description Feedback Refund policy Terms Conditions Product Description Special sample sale Powdered Psilocybe Cubensis Mushrooms mushrooms organically grown indoors hospital grade HEPA air filtered environment give best quality possible drying process quickly locks goodness active compounds mushroom mostly working Ecuador strain developing improving years proving great low high dose applications powdered 1 Dosage potency consistancy mix several batches together manage dosage expectations better 2 Easier consumption recommend lemon tek method simple easy make tea 3 Better shipping stealth 4 get 100 dry mushrooms 5 Easier store air tight manor product vegan friendly animal products used growing mushrooms Microdosing capsules regular microdosing needs another listing fellow mind explorers psychonauts help explore heal expand consciousness aim serve reliably quality psilocybin mushrooms years years come look forward earning trust custom ship USA AUS NZ Russia China Product Tags Magic Mushrooms6gPowderedMushMedic Active users Active vendors F Q FORUM DREAD Server Time December 1223 Online since 2021,bad
10,http://pharmacy42hblqssvwizqvrwmy7oec5sfgjtr7hy6dup3t2lf2xzitqd.onion/tag/agaric-wild-mushrooms/,Tag Agaric Wild mushrooms Pharmacy Pharmacy Taste Rainbow Menu Recreational Drugs Use Stimulants Hallucinogens Depressants Synthetic Drugs Club Drugs Designer Drugs Opiates Sedatives Benzodiazepines Tag Agaric Wild mushrooms Magic mushrooms Comments Hallucinogens Recreational Drugs Use Also called Shrooms Philosophers Stones Mushies Magics Liberty Caps Liberties Amani Agaric Wild mushrooms hallucinogenic effects look like Many poisonous mushrooms look similar magic mushrooms easy pickers mistake People fallen severely ill even died eating poisonous mushroom Magic mushrooms Read Recent Posts Methadone Acid Cannabis Xanax Molly Categories Benzodiazepines Club Drugs Depressants Designer Drugs Hallucinogens Opiates Recreational Drugs Use Sedatives Stimulants Synthetic Drugs TagsBeans Blow Brownies Buy Cocaine Buy Cocaine C Chang Charlie Ching Cocaine Coke Cowies Crack Crystal Dizzle Dolphins E Flake Freebase Mandy MD MDMA Mitsubishis Pebbles Percy Pills Pink Superman Pot Puff Recreational use Resin Rocks Rolexs Sensi Sinsemilla Skunk Sniff Snow Stones Superman Toot Wash Weed White Xtc Herbal Lite,bad
11,http://dhfk22hkwwn27obpsz22uhdyeu42b5wlkn4jlrelh75a2cgfoshkj6id.onion/product-tag/order-blue-meanies-mushrooms-on-the-darkweb/,order Blue Meanies Mushrooms darkweb Psychedelics home Skip content contact Psychedelicsshopprotonmailcom Home MAGIC MUSHROOMS MUSHROOM EDIBLES MUSHROOM TEA Extra DMT LSD Microdose MUSHROOM CAPSULES FAQs Us Contact us contact Psychedelicsshopprotonmailcom Menu AllExtraMAGIC MUSHROOMSMicrodoseMUSHROOM CAPSULESMUSHROOM EDIBLESMUSHROOM TEA Search products cart Cart products cart Home MAGIC MUSHROOMS MUSHROOM EDIBLES MUSHROOM TEA Extra DMT LSD Microdose MUSHROOM CAPSULES FAQs Us Contact us order Blue Meanies Mushrooms darkweb Home Products tagged order Blue Meanies Mushrooms darkweb Filter Showing single result Default sorting Sort popularity Sort average rating Sort latest Sort price low high Sort price high low BrowseExtra DMT LSD MAGIC MUSHROOMS Microdose MUSHROOM CAPSULES MUSHROOM EDIBLES MUSHROOM TEA Filter price Filter Price Quick View MAGIC MUSHROOMS Blue Meanies CubensisRated 1Latest Genius Brain Shroom Microdose Deadhead Chemist 4 Rated Mother Nature Purecybin Microdose 4 Mens Optimal Microdose capsules 4 Memory Focus Microdose Purecybin Microdose Best Selling Beyond microdose shroom capsules Caps300mg Per Cap4 Milk Chocolate Shroom Bar 3000mg4 Milk Chocolate Orange Square Room 920 Relax microdose shroom capsules Caps300mg Per Cap4 Top Rated Mexican XP Magic Rated 1Cambodian Cubensis Rated 1Blue Meanies Cubensis Rated 1Business Information Psychedelicsshopprotonmailcom Monday Sunday 24Terms Service Shipping TIMES Orders take 1Business days ship Orders begin processing day receive accept payment day notified processing started order shipped Products Genius Brain Shroom Microdose Deadhead Chemist 4 Rated Mother Nature Purecybin Microdose 4 Mens Optimal Microdose capsules 4 Product categoriesExtra DMT LSD MAGIC MUSHROOMS Microdose MUSHROOM CAPSULES MUSHROOM EDIBLES MUSHROOM TEA Home MAGIC MUSHROOMS MUSHROOM EDIBLES MUSHROOM TEA Extra Microdose MUSHROOM CAPSULES FAQs Us Contact us Copyright psychedelics home AllExtraMAGIC MUSHROOMSMicrodoseMUSHROOM CAPSULESMUSHROOM EDIBLESMUSHROOM TEA Search Home MAGIC MUSHROOMS MUSHROOM EDIBLES MUSHROOM TEA Extra DMT LSD Microdose MUSHROOM CAPSULES FAQs Us Contact us Login Login Username email address Password Remember Log Lost password WhatsApp us info,bad
12,http://dhfk22hkwwn27obpsz22uhdyeu42b5wlkn4jlrelh75a2cgfoshkj6id.onion/Shop/texas-yellow-cap-magic-mushrooms/,Texas Yellow Cap Magic Mushrooms Psychedelics home Skip content contact Psychedelicsshopprotonmailcom Home MAGIC MUSHROOMS MUSHROOM EDIBLES MUSHROOM TEA Extra DMT LSD Microdose MUSHROOM CAPSULES FAQs Us Contact us contact Psychedelicsshopprotonmailcom Menu AllExtraMAGIC MUSHROOMSMicrodoseMUSHROOM CAPSULESMUSHROOM EDIBLESMUSHROOM TEA Search products cart Cart products cart Home MAGIC MUSHROOMS MUSHROOM EDIBLES MUSHROOM TEA Extra DMT LSD Microdose MUSHROOM CAPSULES FAQs Us Contact us Home MAGIC MUSHROOMS BrowseExtra DMT LSD MAGIC MUSHROOMS Microdose MUSHROOM CAPSULES MUSHROOM EDIBLES MUSHROOM TEA Texas Yellow Cap Magic Mushrooms Rated based customer ratings 1Buy best Texas Yellow Cap Shrooms USA Buy Save grams grams grams grams magicmushroom Choose option14 grams227 grams28 grams454 gramsClear Texas Yellow Cap Magic Mushrooms quantity Add cart SKU NA Category MAGIC MUSHROOMS Description Additional information Reviews 3 Magic Mushrooms Mix Match Buy Mushrooms Online Texas Yellow Cap Magic Mushrooms Psilocybe Cubensis Texas Yellow Cap aka TYC strain shrooms developed amateur mycologist within community strain origins Texas Orange Cap mushrooms domesticated version wild Texan Cubensis strain domesticated strains strain developed grown fast reliably staff report Texas Yellow Cap spiritual shamanic Potency average average TYC shrooms Shipping Details Free Expedited Shipping orders ship within USA tracking number Discreet vacuum sealed packaging privacy magicmushroom grams grams grams grams reviews Texas Yellow Cap Magic Mushrooms Rated jonh hill May 22 Rated tom haden October 4 Rated phil jews June 18 Add review Cancel replyYour rating Rate Perfect Good Average bad poor review Name Email Save name email website browser next time comment Related products Quick View MAGIC MUSHROOMS Blue Meanies CubensisRated 1Quick View MAGIC MUSHROOMS B Cubensis 1Quick View MAGIC MUSHROOMS Puertorican Magic Shrooms4 1Quick View MAGIC MUSHROOMS Honduras Cubensis 1Quick View MAGIC MUSHROOMS Hawaiian Cubensis 1Quick View MAGIC MUSHROOMS Brazilian Cubensis 1Quick View MAGIC MUSHROOMS Arenal Volcano Cubensis 1Quick View MAGIC MUSHROOMS Albino Penis Envy Cubensis 1Latest Genius Brain Shroom Microdose Deadhead Chemist 4 Rated Mother Nature Purecybin Microdose 4 Mens Optimal Microdose capsules 4 Memory Focus Microdose Purecybin Microdose Best Selling Beyond microdose shroom capsules Caps300mg Per Cap4 Milk Chocolate Shroom Bar 3000mg4 Milk Chocolate Orange Square Room 920 Relax microdose shroom capsules Caps300mg Per Cap4 Top Rated Mexican XP Magic Rated 1Cambodian Cubensis Rated 1Blue Meanies Cubensis Rated 1Business Information Psychedelicsshopprotonmailcom Monday Sunday 24Terms Service Shipping TIMES Orders take 1Business days ship Orders begin processing day receive accept payment day notified processing started order shipped Products Genius Brain Shroom Microdose Deadhead Chemist 4 Rated Mother Nature Purecybin Microdose 4 Mens Optimal Microdose capsules 4 Product categoriesExtra DMT LSD MAGIC MUSHROOMS Microdose MUSHROOM CAPSULES MUSHROOM EDIBLES MUSHROOM TEA Home MAGIC MUSHROOMS MUSHROOM EDIBLES MUSHROOM TEA Extra Microdose MUSHROOM CAPSULES FAQs Us Contact us Copyright psychedelics home AllExtraMAGIC MUSHROOMSMicrodoseMUSHROOM CAPSULESMUSHROOM EDIBLESMUSHROOM TEA Search Home MAGIC MUSHROOMS MUSHROOM EDIBLES MUSHROOM TEA Extra DMT LSD Microdose MUSHROOM CAPSULES FAQs Us Contact us Login Login Username email address Password Remember Log Lost password WhatsApp us info,bad
13,http://dhfk22hkwwn27obpsz22uhdyeu42b5wlkn4jlrelh75a2cgfoshkj6id.onion/Shop/texas-yellow-cap-magic-mushrooms/,Texas Yellow Cap Magic Mushrooms Psychedelics home Skip content contact Psychedelicsshopprotonmailcom Home MAGIC MUSHROOMS MUSHROOM EDIBLES MUSHROOM TEA Extra DMT LSD Microdose MUSHROOM CAPSULES FAQs Us Contact us contact Psychedelicsshopprotonmailcom Menu AllExtraMAGIC MUSHROOMSMicrodoseMUSHROOM CAPSULESMUSHROOM EDIBLESMUSHROOM TEA Search products cart Cart products cart Home MAGIC MUSHROOMS MUSHROOM EDIBLES MUSHROOM TEA Extra DMT LSD Microdose MUSHROOM CAPSULES FAQs Us Contact us Home MAGIC MUSHROOMS BrowseExtra DMT LSD MAGIC MUSHROOMS Microdose MUSHROOM CAPSULES MUSHROOM EDIBLES MUSHROOM TEA Texas Yellow Cap Magic Mushrooms Rated based customer ratings 1Buy best Texas Yellow Cap Shrooms USA Buy Save grams grams grams grams magicmushroom Choose option14 grams227 grams28 grams454 gramsClear Texas Yellow Cap Magic Mushrooms quantity Add cart SKU NA Category MAGIC MUSHROOMS Description Additional information Reviews 3 Magic Mushrooms Mix Match Buy Mushrooms Online Texas Yellow Cap Magic Mushrooms Psilocybe Cubensis Texas Yellow Cap aka TYC strain shrooms developed amateur mycologist within community strain origins Texas Orange Cap mushrooms domesticated version wild Texan Cubensis strain domesticated strains strain developed grown fast reliably staff report Texas Yellow Cap spiritual shamanic Potency average average TYC shrooms Shipping Details Free Expedited Shipping orders ship within USA tracking number Discreet vacuum sealed packaging privacy magicmushroom grams grams grams grams reviews Texas Yellow Cap Magic Mushrooms Rated jonh hill May 22 Rated tom haden October 4 Rated phil jews June 18 Add review Cancel replyYour rating Rate Perfect Good Average bad poor review Name Email Save name email website browser next time comment Related products Quick View MAGIC MUSHROOMS Amazonian Cubensis 2Quick View MAGIC MUSHROOMS Arenal Volcano Cubensis 1Quick View MAGIC MUSHROOMS Penis Envy Cubensis 1Quick View MAGIC MUSHROOMS Hawaiian Cubensis 1Quick View MAGIC MUSHROOMS Golden Teacher CubensisRated 1Quick View MAGIC MUSHROOMS Albino Penis Envy Cubensis 1Quick View MAGIC MUSHROOMS Mexican XP MagicRated 1Quick View MAGIC MUSHROOMS Blue Meanies CubensisRated 1Latest Genius Brain Shroom Microdose Deadhead Chemist 4 Rated Mother Nature Purecybin Microdose 4 Mens Optimal Microdose capsules 4 Memory Focus Microdose Purecybin Microdose Best Selling Beyond microdose shroom capsules Caps300mg Per Cap4 Milk Chocolate Shroom Bar 3000mg4 Milk Chocolate Orange Square Room 920 Relax microdose shroom capsules Caps300mg Per Cap4 Top Rated Mexican XP Magic Rated 1Cambodian Cubensis Rated 1Blue Meanies Cubensis Rated 1Business Information Psychedelicsshopprotonmailcom Monday Sunday 24Terms Service Shipping TIMES Orders take 1Business days ship Orders begin processing day receive accept payment day notified processing started order shipped Products Genius Brain Shroom Microdose Deadhead Chemist 4 Rated Mother Nature Purecybin Microdose 4 Mens Optimal Microdose capsules 4 Product categoriesExtra DMT LSD MAGIC MUSHROOMS Microdose MUSHROOM CAPSULES MUSHROOM EDIBLES MUSHROOM TEA Home MAGIC MUSHROOMS MUSHROOM EDIBLES MUSHROOM TEA Extra Microdose MUSHROOM CAPSULES FAQs Us Contact us Copyright psychedelics home AllExtraMAGIC MUSHROOMSMicrodoseMUSHROOM CAPSULESMUSHROOM EDIBLESMUSHROOM TEA Search Home MAGIC MUSHROOMS MUSHROOM EDIBLES MUSHROOM TEA Extra DMT LSD Microdose MUSHROOM CAPSULES FAQs Us Contact us Login Login Username email address Password Remember Log Lost password WhatsApp us info,bad
