index,link,text,marker
29,http://2a2a2abbjsjcjwfuozip6idfxsxyowoi3ajqyehqzfqyxezhacur7oyd.onion,Empire Market Best darknet market Credit Card Cloned Carding Hacking Drugs Dumps Paypal Hack Free Bitcoin Money Counterfeit Cash Buy Gun Gift Passport Visa Mastercard Amex Verified Trusted Bitcoins Escrow Top Hidden Wiki Onion Links Forum Skip content Empire Market Best darknet market Credit Card Cloned Carding Hacking Drugs Dumps Paypal Hack Free Bitcoin Money Counterfeit Cash Buy Gun Gift Passport Visa Mastercard Amex Verified Trusted Bitcoins Escrow Top Hidden Wiki Onion Links Forum Shop FAQ Escrow Shipping Bitcoin Vendor News Total items View Cart products cart BOOKMARK SAVE URL http2a2a2abbjsjcjwfuozip6idfxsxyowoi3ajqyehqzfqyxezhacur7oydonion 12132021 Special offer Use code checkout get discount COVID EMPIRE MARKET VENDOR MONTH BTC Bitcoin wallet New items added TODAY Counterfeits Credit Cards Documents Drugs Gadgets Gift Cards Guns Money Transfers EVERY TRADE PROTECTED ESCROW LEARN iPhone Pro Max 512GB Rated based customer ratings COVIDVACCINE CARD CERTIFICATE registered WORLDWIDE w QRCODE Sale Product sale Rated based customer ratings PreShredded USD CASH Sale Product sale 21Rated based customer ratings USDEURCADAUDGBPANY Stress free virtual physical CC Private method WORLDWIDE Sale Product sale Rated based customer ratings SALE LB GRAMS Bubba Kush Fire Sale Product sale Rated based customer ratings Hacking Services network Sale Product sale Rated based customer ratings x MasterCard Prepaid 3100 2700 Sale Product sale Rated based customer ratings USD Cash App money transfer cashapp flip Sale Product sale Rated based customer ratings PayPal Transfer 2500 Rated based customer ratings Become vendor darkweb market JOIN US Tracking Tracking given day purchase found receipt confirmation email receive Physical shipment vendors ship package within hour receiving notification payment Escrow DHL UPS ship MondayFriday holidays Vendors ship FEDEX MonSat delivery service mention checkout process ask want special FEDEX DHL UPS MAIL packages mailed day Packaging Labeling Small orders shipped inside magazines binders Large orders shipped boxes labeling appear like Ebay Amazoncom package Additional stealth precautions taken dont publicly share Please let us know special requirements Items via Emai Gift Cards CreditDebit Cards Transfersetc Items sent via email require identity information name address etc enter random characters alternative Client receives response within hrs case mass digital goods orders receiving order may take 5hrs advise patient respond accordingly Recent Commentsakon PreShredded USD CASHseller x Visa Prepaid 3100 2700seller GSG FireFly Threaded Barrel Extrasxxeaus GSG FireFly Threaded Barrel Extrasxj173 x Visa Prepaid 3100 2700smizzle PreShredded USD CASHseller COVIDVACCINE CARD CERTIFICATE registered WORLDWIDE w QRCODEDes COVIDVACCINE CARD CERTIFICATE registered WORLDWIDE w QRCODEanony BTC Bitcoin wallet limited stock VENDOR MONTH seller x Visa Prepaid 3100 2700my cup runith PreShredded USD CASHFrenk x Visa Prepaid 3100 2700seller PreShredded USD CASHPeter PreShredded USD CASHAnonymous PreShredded USD CASHShopCounterfeits 12 Credit Cards 18 Documents 22 Drugs 50 Gadgets 47 Gift Cards 14 Guns 36 Money Transfers 18 30 Vendor month BTC Bitcoin wallet limited stock Hot right PreShredded USD CASH InfoHow pay Read Shipping FAQSupport empiresupportairmailcc Copyright Empire Market Right Reserved Theme NewStore ThemeFarmer X,bad
30,http://deepmexzsejpzqid3k7knaas2p73dko6kxgpou7oey7vqtmrhopjyqyd.onion,Forbidden Forbidden nginx,bad
31,http://torbuyxpe6auueywlctu4wz6ur3o5n2meybt6tyi4rmeudtjsysayqyd.onion,TorBuy ESCROW SUPPORT FORUM STATUS ORDER Login Registration Carding Electronics Gift card Hacking Money counterfeits Money transfers Escrow Support Forum Status Order Carding Electronics Gift card Hacking Info Money counterfeits Money transfers Anonim secure ESCROW Guaranteed Reliability Support touch 24Trusted Vendors Seller control TOP VENDORS PURPLE Carding Online selling1367 View Shop WEBSTERN Money transfers Online selling814 View Shop PayPal mania Money transfers Online selling1232 View Shop Oliver FOX Money transfers Online selling705 View Shop FASTGFT Gift card Online selling407 View Shop SHADOW APPLE Electronics Online selling866 View Shop QUICK MAGIC Money transfers Online selling577 View Shop TonceHack Hacking Offline selling216 View Shop Stop Game Electronics Online selling681 View Shop Show vendors HOT SALE sale Visa Prepaid Card PURPLE sale MSI GP75 Leopard RTX Stop Game sale MacBook Air 13inch MacStock sale USD WEBSTERN sale iPhone SHADOW APPLE sale 5 Winger sale ASUS ROG Zephyrus S17 RTX Super Stop Game sale aMZN FASTGFT sale Huawei P40 Pro L Android sale Samsung Galaxy S10 L Android sale Intel Core i58600K Stop Game sale XBOX ONE X Stop Game sale PS4 PRO 1TB Stop Game sale Visa Cloned Card 2500PARALECT Sold sale Visa Cloned Card 2500PARALECT 24x7 Free Support Traffic Encryption Bitcoin Mixer Real Reviews CONTACT US torbuydnmxorg INFORMATION Support Center Ording Tracking Escrow Forume COMPANY Become Vendor use Bitcoin buy Bitcoin CATEGORY Carding Electronics Gift Card Haking Money counterfeits Money transfers TORBUY decentralized trading state Send message Модуль вебформ установлен item added cart Checkout Loyalty program New Buyer 0Purchases Discount 0 Regular Buyer 4Purchases Forum Access Discount 5 VIP Buyer 12 Forum Access VIP Support Discount 10,bad
32,http://dwzsbmxatitqrid3ptthlzmigkcrmfkdt7pwh7ej7yukjgbnybuf4rid.onion,ECash Paypal Western Union Credit Cards ProductsBuyer Guide Support LoginRegister ECash Nr1 Shop ProductsBuyer Guide Support LoginRegister British pound Canadian dollar Euro United States dollar Shopping Cart x Cart empty Please wait Leave search box empty find products enter search term find specific product Sort bySorted Product Name Product NameProduct PriceOrdering Results Latest Products Ebay Gift Card 150 Sales price 5000Discount Price kg Product details Ebay Gift Card 300 Sales price 7500Discount Price kg Product details Amazon gift Card 300 USA Sales price 7500Discount Price kg Product details Top ten Products Amazon gift Card EURO Sales price 8455Discount Price kg Product details Amazon gift Card 300 EURO Sales price 8455Discount Price kg Product details Amazon gift Card 150 EURO Sales price 4509Discount Price kg Product details Products Neteller Money Transfer 1000 Sales price 7500Discount Price kg Product details Neteller Money Transfer 2000 Sales price 14000Discount Price kg Product details Neteller Money Transfer 500 Sales price 5000Discount Price kg Product details Paypal Transfer 1000 Sales price 7500Discount Price kg Product details Paypal Transfer 2500 Sales price 14000Discount Price kg Product details Paypal Transfer 500 Sales price 5000Discount Price kg Product details Steam Gift Card EUR Sales price 4509Discount Price kg Product details Steam Gift Card USA 150 Sales price 5000Discount Price kg Product details Western Union Transfer 1000 Sales price 7500Discount Price kg Product details Western Union Transfer 2000 Sales price 14000Discount Price kg Product details Western Union Transfer 500 Sales price 5000Discount Price kg Product details purchase seller months sometimes delay ALWAYS delivers Anonymous Fast reliable One real legit shops guy never lets Anonymous One Tried meney different sellers first time found one doenst let Anonymous Tried meney waited like houres importantly received Anonymous Took Fast Delivery orders shipped within max 12houres Bitcoin accepted Fast Support team responds asap questions,bad
33,http://ujuwmruwekgs7ekzlpzrmvkgj7bmsykrcqbmhup3hinpm7lhl2howbqd.onion,Choose Better telling whether onion site scam Categories Cloned Cards Paypal Accounts Gift Cards Electronics Counterfeit Money Fixed Matches Hacking Services Fake passportsIDs Escrow Services Need Help choosebettersafemailnet Choose Better buy something onion site dont want get scammed could help already tested lot sites know scams Note dont sell gadgets cards fixed matches etc share informations legit services scams deep web money choosebettersafemailnet start exploring website surely find many interesting things Scam links presented free category Choose category Cloned Cards help checked many cloned cards sellers scam legit lists scam one legit one Learn Buy Paypal Accounts found Paypal transfers well WU MoneyGram scam found legit paypal accounts sellers Learn Buy Gift Cards gift cards sellers checked many lists scam legit Learn Buy Electronics people lounder money selling expensive original gadgets people try scam people Check lists Learn Buy Counterfeit Money Everybody knows counterfeits myth checked many counterfeits sellers create scam legit lists Learn Buy Fixed Matches believe fixed matches best way earn money involving criminal fixed matches sellers legit Learn Buy Hacking Services Hackers demanded nowadays Thats many scammers provide hacking service Check lists hackers Learn Buy Fake passportsIDs need fake ID surely try buy one deep web Check scam list buy legit list fake ID sellers Learn Buy Escrow Services Unfortunately deep web escrow services scam list legit clearnet escrow services Learn Buy Confirmed scam categories Bitcoin multipliers reason sell Bitcoin Bitcoin excuses Prepaid cards reason sell money money NB legit sellers cloned cards WU MoneyGram transfers reason sell real money real money NB legit paypal accounts sellers Categories never check Drugs Narcotics pure evil Also dangerous check Guns People use weapon kill people dangerous check Adult categories kids protected Checking category would disgusting Frequently Asked Questions check general check sellers test purchases add seller legit list get stuff Also accept customers feedbacks strong proofs scam cases links different categories one seller could provide different services instance cards gift cards paypal case add seller different categories scam categories mean Confirmed scam categories sellers scammers Sad true CATEGORIES totally scam legit sellers list Bitcoin multipliers Prepaid Cards Preshredded money Western Union transfers MoneyGram transfers SCAM Note prepaid cards cloned cards Cloned cards exist trust Choose Better best make sure service soe picks Check unmoderated comments People could add anything want Check score Onion Scanner Try find negative reviews deep web bet wont find place order choose categories want buy buy via bitcoin payment gate contact us choosebettersafemailnet buy via another crypto refund guarantee havent received refund requests yet face troubles sellers provided contact us refund loss Instant delivery blockchain confirmations Support 24Contact us hours day Secure Payments 100 anonymous payments Free updates find new legit sellers Email choosebettersafemailnet Choose Better Cloned Cards Paypal Accounts Gift Cards Electronics Counterfeit Money Fixed Matches Hacking Services Fake passportsIDs Escrow Services Accept Payment Via Choose Better 2021,bad
34,http://22222ask5k2lowak6okzehjjbbbadrmgc2m2vnaj2uiofhn4rxjds6id.onion,TorLinks onion Link List Hidden Wiki Deep Web Onion Urls Onionland Tor linklist TorLinks onion Link List Commercial Links Introduction Financial Services Commercial Goods Drugs Domain Services Erotic NonCommercial Links Services Hacking Email Erotic Forums Blogs Social Others NonEnglish TorLinks moderated replacement Hidden Wiki serves link url list Tor hidden services Feel free copy deep web link list directory website make others aware darknet regulary update Tor onion sites site ads Introduction PointsNonCommercial Links Ahmiafi Clearnet search engine Tor Hidden Services DuckDuckGo Hidden Service searches clearnet Torlinks TorLinks moderated replacement Hidden Wiki Link dir Onion links dir deep web search engine Hidden Wiki mirror Hidden Wiki days old users edit main page Evil Tor search engine indexes hidden services Tor Selfdefense Surveillance Guide Tips Tools Howtos Safer Online Communications clearnet Λ ads Financial ServicesCommercial Links Best Financial Market Prepaid cards VISAMasterCard Cloned Cards Gift Cards VISAAmazonPayPal PayPalWestern Union Transfers Green Machine Forum type marketplace oldest experienced vendors around Get paypals CCs etc Light Money Discount service Prepaid Cards Money Transfers Gift Cards Premium cards Oldest cc vendor Top quality Us Eu credit cards Financial Oasis slew products darker side finance netAuth Automatic system buy Paypal accounts credit cards instantly email Socks5 included Capital Ventures Offering high quality prepaid products great deal Paypal Baazar Paypal accounts sale Cash Machine Phished PayPal Neteller Skrill BoA Wells fargo bank Accounts Paysafecards US EU Credit cards available Global Carding Forum Escrow Accepted CashApp Western Union Moneygram Paypal Zelle Amazon Ebay Wire OffShore Bank VCC CC Pin Queen Galaxy Female Carding Shop Since 2011 CashApp Western Union Moneygram Amazon Wire Transfer Prepaid Debit Credit Bitcards trusted credit cards store darknet returning customers KryptoPayPal PayPal Cashout Service Get account balance back Bitcoin TOP Cards Credit Cards Trusted Vendor unionFast shipping CCard Shop Physical credit cards High balance available order Paypal bitcoins payment method USJUD Counterfeits EUR USD Western Union money trusted escrow accepted trusted seller Financial Market Prepaid cards VISAMasterCard Cloned Cards Gift Cards VISAAmazonPayPal PayPalWestern Union Transfers Escrow Accepted BlackWhite Cards High Quality PrePaid Debit Cards PIN Good Customer Service Best Deals Real currency Finest bills market Passes known tests Random serials topnotch currency Cards World Get Financial Freedom Today PPCC Money vault 24automated PayPal Credit card shop New stock every day Safe cashout Cash Cards Oldest seller old HW Fresh stock 999 safe Worldwide cashout Express shipping Escrow Horizon Store Automated carding storeFast replies 90 cards valid Black Store Bank cards store fresh stock instant delivery Every deal protected Escrow service Queens Cash Buy PreShredded USD EURO Currency fraction value SELL REAL CASH Millioner Private Club Without registrationLimited time Credit cards PayPal Gift Cards Ebay Steam Amazon CC Fullz Western Union Undetectable Counterfeits Λ ads Commercial ServicesCommercial Links Fast Money beautiful shop clients need Prepaid Cards PayPal accounts PayPal Western Union MoneyGram transfers bestseller experienced carders CC Fullz Guns Dark Market Guns market buy guns full auto assault rifles pistols grenade launchers etc Protonix Market Place Best dark web link buy Credit Cards PayPal transfer WU Bank accounts Counterfeiting Center use new technology bills printed using cotton fiber 8099 originally sourced common white linen rag wood fiber 13 titanium white 235 weight total wood fiber polyamide epichlorohydrin 052 weight total cotton fiber aluminum chloride polyamide epichlorohydrin melamine formaldehyde resin animal glue Empire Market Vendor CStore Electronics purchased carded giftcards Everything Brand new Full escrow accepted Apple Palace low priced Apple Products Gold Diamonds Genuine Gold Diamonds Rhino Horn shipped Germany USA Football Money Fixed football games info HackingTeam Hacking Service Team EuroGuns european arms dealer USfakeIDs High quality USA Fake Drivers Licenses Fake Passport ID sale Website selling qualitative EUUSAUSCAN fake passports ID cards drivers licenses Samsungstore Samsung tablets smartphones notebooks escrow Kamagra Bitcoin Viagra cheaper Apples4Bitcoin Cheap Apple products Bitcoin Onion Identity Services Selling Passports IDCards Bitcoins Apple World Carded iPhones iPads Macbooks iMacs consoles shipping worldwide Amazon Cards Bring dreams reality amazing Amazon gift cards Mobile Store Factory unlocked iphones smartphones Cards Credit cards high balance Low Balance CCs Get cheap low balance cards Bitcoin Fortune Buy New Bitcoin Miners discount EasyPayPal Trusted PayPal onion shop big history Good prices Empire Market popular favorite dark web market Everything need Guaranteed stealth shipping worldwide Λ ads DrugsCommercial Links Drug Market Anonymous marketplace kinds drugs Greenroad Biggest marketplace full working escrow WeedCo WeedCigarettes Prix BasLow Price EuCanna First Class Cannabis Healthcare Medical Grade Cannabis Buds Rick Simpson Oil Ointments CannabisUK UK Cannabis vendor selling organic weed DeDope German Weed Shop Weed Hash Germany BitPharma EU vendor cocaine speed mdma psychedelics subscriptions Brainmagic Best psychedelics darknet NLGrowers Coffee Shop grade Cannabis netherlands Pot Shop Weed Pot Shop Trading longer year Steroid King steroids need Wacky Weed Hi Quality Green Wacky Prices Λ ads Domain ServicesCommercial Links OnionName Choose desired domain name prefix order onion domain starting mBTC letters Λ EroticCommercial Links Darkscandals Real rape humiliation forced videos much extreme videos Pack video files packs Λ ads ServicesNonCommercial Links Tor link lists search engines Hidden Wiki Wiki style link list TOR Link DIR small list onion links DIR Simple onion website list TORCH Tor Search Engine claims index around Million pages TORMAX Another search engine Hosting TorVPS Shells Free torified shell accounts used onion hosting IRC etc SporeStack APIdriven VPS hosting Bitcoin Clearnet hidden Tor hosting HomeHosting system administrator set private home server Prometheus_Hidden_Services Payed hosting provides Virtual Private Server VPS Linux Darknet design Web design HTML CSS PHP plus graphics design things Daniels Hosting Free hosting Λ ads HackingNonCommercial Links HeLL Forum HeLL Reloaded back RelateList New era intelligence CODE GREEN Ethical hacktivism better world Join us participate modern world protests Hack Canada America joke Canada punchline Oldish hacking site hosts archives Hack Place Site several books resources software development pentesting hacking fight censorship Reporters Without Borders project aims combat censorship promote flow news information Λ EmailNonCommercial Links Protonmail Swiss based email service encrypts emails locally browser Free paid accounts Mail2Tor Mail2Tor free anonymous email service made protect privacy TorBox hidden mailbox service accessible TOR without connection public internet Eludein Eludein privacy based email service BitcoinMonero exchange BitMessage Connects bitmessage email services Registration available using clearweb link TorGuerrillaMail Disposable Temporary EMail Address Chat strangers Talk random users anonymously CTemplar First ever high end fully encrypted tor email service Shielded Securityfocused mailbox hosting customizable ONION domain name Payment smart escrow multisig contracts Lightning Network transactions Ableonion Random chat tor users ads Books OnionWarez Warez forum Tor Library GB pdf chm djvu Design Russebertene Example rendezvous points page Thomas Paines Common Sense Federalist papers Destination Unknown Small selection Searchlores Cryptonomicon Thelema LiberaTor Making weapons military training related subjects Free Bibliotheca Alexandrina English Spanish German books Laughing Nihilist Drugs writing Mister Collection writings art selected texts deeply personal views philosophy existence ParaZite Collection forbidden files howtos pdf txt etc Λ ads EroticNonCommercial Links Fappening Onion Compilation Leaked celebrity nudes Darkscandals Real rape humiliation forced videos much extreme videos Pack video files packs Λ ForumsNonCommercial Links Stock Insiders Oldest Largest Insider Trading Forum community exchanging Insider Information Publicly Traded Companies Intel Exchange Know need know something Ask share underground intelligence gathering network DNM Avengers Darknet drug forum reviews marketplace discussion OnionLand Discussion forum Darkweb markets related topics Dread Reddit like website Λ ads BlogsNonCommercial Links Tor Metrics Welcome Tor Metrics primary place learn interesting facts Tor network largest deployed anonymity network date something measured safely youll find Superkuh Much information spectrogram wireless radio Beneath VT Exploring Virginia Techs steam tunnels beyond Tor CP Free clean Tor Tor users CP Go Beyond blog politics potatoes technology Tor etc Λ SocialNonCommercial Links Connect Connect collective recognizes promotes anticapitalism antiracism antifascism antisexism antimililtarism antiwhatthefuckever refusal authoritarianism hierarchies Galaxy3 Galaxy3 new Social Networking experience darknet Torbook Facebook Tor Share memories connect others make friends Facebook real Facebooks Onion domain Claim keep logs Trust peril Whistleblowing WikiLeaks WikiLeaks DeepWeb mirror famous Wikileaks website Doxbin pastebin personally identifiable information SecureDrop opensource whistleblower submission system managed Freedom Press Foundation Λ OthersNonCommercial Links DuckDuckGo metasearch engine heavy filtering IIT Underground Information photos steam tunnels roofs Illinois Institute Technology Λ ads NonEnglishNonCommercial Links Finnish Suomi Sipulilauta chan Silkkitie Silkkitie Blue Quarters Forum Discussion forum French French Freedom Zone Malwares Hacking Dev Esoterisme Elitisme Aristocratie French Deep Web administered moderate French board 1er forum francophone German Deutsch Konkret das linke Magazin Archiv MadIRC Deutscher IRCChannel Italian Italiano BlackHost small website developed Italian programmer New System Disorder Italian Hackers Community Stay Tuned IDC Reloaded Italian DarkNet Community Polish Polski Teczkohen powrot obrazkowego forum tematyce stalking Polska Cebulka Najstarsze dzialajace polskie forum Spanish CebollaChan CebollaChan el torchan en Castellano TorPez Foro de seguridad informatica entre otras cosas Swedish Svenska MoralNu Vad ar moral KognitionsKyrkan Spiritual stuff Λ ads report missing broken links scams please Contact us Disclaimer site provides links Tor hidden services way responsible content sites host infrastructure2022,bad
35,http://5n4qdkw2wavc55peppyrelmb2rgsx7ohcb2tkxhub2gyfurxulfyd3id.onion,TOR LINKS Best Onion Link Collection __ __ __ __ wwwtorlinksinfo Top Onion SitesMarkets Carding Transfer Escrow Links Email Hosting Hacking Search SCAM Add Onion Serivce Advertising Disclaimer Hidden WIKI FRESH Hidden Wiki FRESH easiest way find information Tor network working links trusted sites CP ORIGINAL CREDITCARDCENTER CreditCard Vendor Since Prepaid VISA Amex MasterCards Western Union PayPal Moneytransfer within min 24Support Escrow Payment Deep Money Transfer Deep Money Transfer Reliable Transfers TOR Ultra Fast Processing Multi Escrow Safely easily purchase goods services unknown untrusted sellers stores bitcoin currency reliable Escrowservice ALPHA CARDS Top Vendor Since Prepaid VISAMasterCards Experts Western Union Transfer PayPal Transfers minimum fee high quality transfers Online DeepLink Onion Directory Onion DIR Apple Store top Apple products Crypto Hacking Group Wallet Recovery Phrases easily anonymous integrable binance Trust Wallet App Hacked Wallets PlasticSharks CLONED VISA CARDS CLONED MASTERCARDS PAYPAL LOGIN INFORMATION Magnate Black Carding Service Prepared cards VISAMasterCard work 24to provide best money service darknetBest prices guarantee clean deal Deep Search Powerful Search Engine TOR Mr Green Make 137651within months Deep Web Covid19 Vaccination record Digital COVID Certificates contains QR code digital signature protect falsification Onion Links Uncensored Onion Links Collection Buy Real Money BUY Money Smart Safe Way Stay away counterfeit methods send jail Page 4,bad
