index,link,text,marker
0,http://cbtzjyzkpdj6tjw3fjy7klqvkjb4majkkn2gt73hgbvqsgunaaudkpqd.onion,MillerMall Buy Mushroomsweedcocain heroin Site Navigation Home Shop Contact COCAINE Mush Rooms Indica Sativa account Copyright Millermall Powered DarkCode English English Spanish German USD USD INR GBP Due COVID epidemic orders may processed slight delay Us account Wishlist Order Tracking deliver discretely worldwide Need help Call Us 1559 English English Spanish German USD USD INR GBP Buy weedmushroomscocaine heroin Products search products cart Free shipping order CATEGORIES TOTAL PRODUCTS Indica Sativa Hybrid Marijuana Wax Weed Cans Mush Rooms King Pen Exotics Moon Rocks Rove Cookies Carts Smart Cart Vape Glo Carts Home Shop Contact COCAINE Mush Rooms Indica Sativa account Store Search Wishlist Account Specialist offersat Millamall BUY MUSHROOMSShop MILLER MALL BUY MARIJUANAShop deliver discretely worldwideOrder dont miss opportunitiesWe may delay always endevor deliver time Trending ProductsMINI PEANUT BUTTER COOKIES 10MG1900Exotic Carts Apple Fritter2500BLACK BAR BITES 10MG2500Exotic Carts Blueberry kush2500Exotic Carts Cookies Cream2500Exotic Carts Gorilla Glue2500Exotic Carts Grape Pie2500Exotic Carts GSC2500Exotic Carts LemonadeCustomer CommentThe Best MarketplaceLorem ipsum dolor sit amet consectetur adipiscing elit sed eiusmod tempor incididunt utTina McdonnellSales Manager BUY MUSHROOMS Buy Mushroom MushroomsDo miss monthly discount dealsView Add Wishlist Add Wishlist Golden Teacher MushroomsIn Stock 27000Select options Add Wishlist Add Wishlist Buy Blue Meanies Mushrooms onlineIn Stock 27000Select options Add Wishlist Add Wishlist Albino Penis Envy MushroomsIn Stock 29000Select options Add Wishlist Add Wishlist Malabar MushroomsIn Stock 27000Select options Add Wishlist Add Wishlist Arenal Volcano MushroomsIn Stock 28000Select options Add Wishlist Add Wishlist Mexican Cubensis MushroomsIn Stock 13200Select options Add Wishlist Add Wishlist Amazonian Cubensis MushroomsIn Stock 27000Select options Add Wishlist Add Wishlist Buy Brazilian Cubensis onlineIn Stock 27000Select options BUY INDICA STRAINS Shop Indica indicaDo miss current monthly offers View Add Wishlist Add Wishlist Marathon OG KushIn Stock26000Add cart Add Wishlist Add Wishlist PINK KUSHIn Stock 160000Select options Add Wishlist Add Wishlist PINEAPPLE EXPRESSIn Stock 160000Select options Add Wishlist Add Wishlist SFV OGIn Stock 165000Select options Add Wishlist Add Wishlist Tahoe OG KushIn Stock 180000Select options Add Wishlist Add Wishlist STRAWBERRY COUGHIn Stock 172000Select options Add Wishlist Add Wishlist Purple DieselIn Stock 163000Select options Add Wishlist Add Wishlist Deep PurpleIn Stock 178000Select options 80100 PURE COCAINEShop COCAINEDo miss current monthly offers View Add Wishlist Add Wishlist Peruvian Flake Cocaine Euro Stamp 1gIn Stock10000Add cart Add Wishlist Add Wishlist Premium Uncut Cocaine 1gIn Stock16000Add cart Add Wishlist Add Wishlist Pure Fish Scale CocaineIn Stock42000Add cart Add Wishlist Add Wishlist Uncut Flake Cocaine 1gIn Stock16000Add cart Add Wishlist Add Wishlist Premium Uncut Cocaine 1gIn Stock16000Add cart Add Wishlist Add Wishlist High Quality Cocaine 1gIn Stock18000Add cart Add Wishlist Add Wishlist German Uncut HQ Cocaine 1gIn Stock15000Add cart Add Wishlist Add Wishlist Synthetic Coke 1gIn Stock5000Add cart Super discount first purchaseMILLER101Use discount code checkout NEW PRODUCTSNew products updated stocks View Add Wishlist Add Wishlist Peruvian Flake Cocaine Euro Stamp 1gIn Stock10000Add cart Add Wishlist Add Wishlist Premium Uncut Cocaine 1gIn Stock16000Add cart Add Wishlist Add Wishlist Pure Fish Scale CocaineIn Stock42000Add cart Add Wishlist Add Wishlist Uncut Flake Cocaine 1gIn Stock16000Add cart Add Wishlist Add Wishlist Premium Uncut Cocaine 1gIn Stock16000Add cart Add Wishlist Add Wishlist High Quality Cocaine 1gIn Stock18000Add cart Add Wishlist Add Wishlist German Uncut HQ Cocaine 1gIn Stock15000Add cart Add Wishlist Add Wishlist Synthetic Coke 1gIn Stock5000Add cart Add Wishlist Add Wishlist High Quality Cocaine1gIn Stock12000Add cart COCAINE15 ItemsCookies Carts1 ItemsExotics12 ItemsGlo Carts1 ItemsHybrid Marijuana11 ItemsIndica16 ItemsKing Pen11 ItemsMarijuana Cartridges29 ItemsMarijuana Concentrates24 ItemsMDMA1 ItemsMoon Rocks12 ItemsMuh Medicine4 ItemsMush Rooms8 ItemsPlug n Play12 ItemsPre Rolls18 ItemsRove1 ItemsRove Vape7 ItemsSativa13 ItemsSmart Cart Vape1 ItemsStiiizy13 ItemsWax8 ItemsWeed Cans11 Items discount first order Join newsletter get Join email subscription get updates promotions coupons Leave field empty youre human Daily products updates Free delivery order Monthly Mega Discounts Best price market MARIJUANA MUSHROOMS COCAINE HEROIN 1559 Working 8 22Download App Mobile 15 discount first purchase Copyright Millermall Powered DarkCode Terms Conditions Cookie,bad
1,http://ctksd26msu6dsygtxahjogcqcflutsxrbu6r6vmgfhfcedhaviy7r7yd.onion,MushMedic Magic Mushrooms Organic Magic Mushrooms Skip navigation Skip content MushMedic Magic MushroomsOrganic Magic Mushrooms Search Search Menu HomeCart Checkout account Shop HomeCart Checkout account Shop items MushMedic Magic Mushrooms new MushMedic store built soon meantime find current store taking orders still shipping daily MushMedic Search Recent CommentsArchives Categories categories Meta Log Entries feed Comments feed WordPressorg MushMedic Magic Mushrooms Built Storefront WooCommerce Account Search Search Search Cart 0,bad
2,http://onionwsoiu53xre32jwve7euacadvhprq2jytfttb55hrbo3execodad.onion/2017/06/19/gds-2017-media-cocaine-mdma-mushrooms/,GDS Media Cocaine MDMA Mushrooms Onion Web Explore Popular Posts Access Darknet buy Dark web Tour Darkweb Markets Mustread Dont Get Scammed PGP Keys Encrypted Messages use Monero buy online Darknet VS Darkweb Difference Topics ViewallTopics Dark web Drugs Bitcoin Leaks Altcoins Trading Markets Hacking Security DeepDotWeb Guides Reviews Interviews Arrests Popular Spaces Onion Web Darknet Dummies Dr Greenthumb Wheres Mind Doggystyle Reviews Rich 30s High Jones Discover MustVisit DarkRise Darknet Doesnt Fail Darkguard Verify URL dReviews dDarknetStars Recon Vendor Database Reviews Coming soon Dread DiscoverAll Markets Ranking Darknet Marketplaces Darknet Forums Darknet Shops Dead Sites Actions Contact SubmitmyStory AddaSite Donate PGP Mirrors Canary Related Log Sign Account Spaces Topics Contact Us GDS Media Cocaine MDMA Mushrooms DeepDotWeb DeepDotWeb Jun Global Drug Survey brought results internet found interesting others instance mainstream media outletseven without prior knowledge Global Drug Surveywrote studys findings mushrooms Another one changes MDMAs average purity interested media even core research team behind GDSAs mentioned mushrooms captured attention even mainstream media clarify mushrooms reference magic mushrooms simply mushrooms containing psilocybin prodrug responsible associated trip GDS showed last 12months 02 people used psilocybin sought emergency treatment comparison almost every drug covered survey hit 1 methamphetamine reached 48Perhaps greatest risk mushrooms comes picking ingesting incorrect mushroom mistake numerous safe mushrooms psychedelic otherwise Researchers discovered roughly species mushrooms containing psilocybin within several genera toxic mushrooms uncommon One genus particular Galerina known looking much like psychedelic mushrooms Psilocybe genus perhaps poses true greatest threat mushroom usersPerhaps greatest risk mushrooms comes picking ingesting incorrect mushroom mistake numerous safe mushrooms psychedelic otherwise Researchers discovered roughly species mushrooms containing psilocybin within several genera toxic mushrooms uncommon One genus particular Galerina known looking much like psychedelic mushrooms Psilocybe genus perhaps poses true greatest threat mushroom usersOne reason mushrooms safer drugs according report could smaller dosing units single mushroom v LSD tab greater understanding many mushrooms may constitute typical dose desired effectFor complete opposite reason many news outlets covered increased purity cocaine MDMA Cocaine purity levels drastically increased 12month stretch surprise many increased purity level contributed hospitalizationsThe notion adulterants carry negative stigma amongst communities drug users often sensible reason amount cutting agent drug drug amount psychoactive ingredient question level unwanted substance directly controls true amount desired drug paid consequently makes drug weaker strongerWith cocaine example Levamisole frequently identified cutting agent 2011 82 cocaine seized DEA contained Levamisole looked similar cocaine could pass street tests users washed product overwhelming majority users Thus average cocaine user needed cocaine order reach desired effectEven shitty cocaine UK 3040 Dr Adam R Winstock wrote post increasing cocainelinked hospitalizations Get wallet pay 100gram might hitting 6070 increase purity extended across whole cocaine market purity crack cocaine parts UK hitting 80Since 2015 study found 50 increase cocaine users admitted AE GDS press release explained High quality cocaine caused increased number AE visits Dr Winstock concluded indicated need increased drug education regarding puritypotencyqualityAcross internet cocaine findings segued MDMA findings general sense cocaine MDMA findings resembled MDMA quality Ie puritystrengthpotency also increased increased time Global Drug Survey revealed worst time use MDMA generationLast years survey also found growing fears increasing potency GDS pointed ecstasy pills contained 300mg MDMA concern played roughly 25MDMA users around world took part GDS2017 12 sought emergency medical treatment EMT previous monthsAs wrote cocaine MDMA showed similar trends generally speaking throughout last 12months details caught eye Incidentally heard one members GDSs core research team specific interest MDMA findingsIn email findings stood Dr Monica Barratt couple examples increased risk emergency medical treatment following use MDMA cocaine globally risk emergency medical treatment following MDMA pronounced young females compared groupsThere suggestion without knowing people taking much therefore likely report ending needing medical treatment following use continued points importance wider access services provide purity testing people use drugsThe UK may prime example drug education paying Several UK organizations ran awareness campaigns encouraged safe use picked popularity Mixmag GDSs dont daft start half campaign possibly coincidentally UK bucked trend regard MDMA hospitalization rate UK admissions drugs dropped 12 use 07 months perhaps indicating UK users learning safely use drug press release pointed outThe darknet likely played role increased potency levels MDMA 49 users said bought crypto market frequently purchased drug darknet countries 25 drug users reported used darknet within last yearDrug crypto market results interested Dr Barratt interesting among lastyear drug users rate lastyear crypto market use obtaining drugs darknet markets stabilized rather increasing previous years wroteIm sure read much next year eg could stabilization continues Previous article Europol Seeks Help Internet Users Identify Pedoph Next article German Made Nearly 70Euros Scamming Victims F Author DeepDotWeb Without doubt predecessor TheOnionWeb DeepDotWeb news site dedicated events surrounding dark web featuring interviews reviews darknet markets Tor hidden services legal actions privacy bitcoin related news Articles Donate Bitcoin 1NDqCHu3C8rjgfJs34TgZ8BKa2VsuduRMC Monero 46UwFaceGmLheF9qRq6EjSAmuJF2P5KVfXinVM4NEr6DJhxAWW2j2D79BUTe1HMnTTNt3cbz6QKUEEhmnaZVrMzMKaAtgCW Comments Write comment Write Comment view comments Read write comment Read guidelines Comment text Post Comment Advertise Darknet Sites Featured Sites Torrez 100 CannaHome 100 Abacus Market 97 Markets Revolution Market 98 Vice City 100 Dark0de 95 Cannazon 74 ASAP Asean 100 Cartel 86 Archetyp Market 97 Tor2door 100 Monopoly 94 Versus 98 Tor Market NZ 100 HYDRA RU 76 Vendor Shops new shit 99 WeAreAmsterdam 95 CharlieUK 100 French Connection 100 ThePirateIsland 93 TomJerry 100 Medicine Man UK 100 SmokersCo 100 Auspride 100 Digital Thrift Shop Pl 100 HeinekenExpress 100 o3shop RU 100 Social Dread 92 Majestic Garden 86 HUB 57 Deutschland im Deep Web DE 85 Cebulka PL 90 Services News Directories LARGEST Markets December TOP number products Full Ranking Torrez Dark0de Versus ASAP Asean Cartel Bitcoin Today High Low Monero Today High Low Latest Comments Authentik2900 Site à éviter commande de c faite chez eux jamais reçu une arnaque TomJerrys profile mawosx low contact waiting days parcel 50g coco contact pr WeAreAmsterdams profile foster6la biggest greatest Torrezs profile Fidel Dam Im cannabis plug left Cannazons profile 14characters Looking make Make Money Looking Job Post Find Job Deep Web krazydversa ey ross aim chile espero que algun dia encuentres la libertad fr Life Box kotorfan21 anyone know actual Nonscams registeredreal passports Newbies Spaces space MahNemzJeff loyal Torguard user going years hands TorGuard VPN Review FUCKOFF MOTHER SCAM WEBSITE DarkFox Markets profile oshit Allowing users finalize orders withdraw funds White House Markets profile Tag Cloud Bitcoin Darknet Dark Web Drug Sentenced Arrested Man News Tor Drugs Silk Road Prison Market German years Price Busted Cybercrime Net Markets Cannabis Bitcoin Monero Forum Bitcoin,bad
3,http://76i2c3hn55fcj5nut3tqlboqqbbh23zvphv7lefk3vftpx6wketlanyd.onion/hobby/res/11168.html,hobby grow mushrooms beginners home rules faq overboard sfw alt leftypol siberia hobby tech edu games anime music draw AKM meta roulette cytube git GET ref booru hobby HobbyOur hands pass skills last generation nextPosting mode Reply ReturnNameH92DfvcNyFonQ EmailSubjectNX59TwZCpgR6HtD4djI3QiFlGnOLe0h c7P2zkMsx SWqV_yrvBSpoiler ImageCommentFlagNone4th InternationalAccelerationAK47AlbaniaAllendeAnarchaFeminismAnarchismAnarchoCapitalismAnarchoCommunismAnarchoNihilismAnarchoPrimitivismAntifaArmchairAtheismBolshevikBrocialismBurkina FasoCanadienCarlismChavismoCheChinaChristian AnarchismChristian CommunismCockshottCouncil CommunismCubaDDRDemocrapDemocratic SocialismDirect XDPRKEgalitarianismEgoismΈριστοκρατίαEurekaEurocommunismLas FARCFedFront de libération du QuébecFreudGadsdenGay NaziGentooGorroGroucho MarxismHammer SickleInternational BrigadeIRAIslamic CommunismIWWJucheKampucheaLeft CommunismLenin CapLuck IrishLuxemburgMarxMutualismNaxaliteNazbolNaziNDFPPalestinePanAfricanismPapieżPFLPPhrygian CapPiratePorkyPosadasPunkRAFRaised FistRead Fucking BookRethuglicanSaboTabbySandinistaSendero LuminosoSlavojSnibeti SnabSocialismSocratesSoviet UnionSpurdoSSNPStalinSyndicalismTankieTechnocracyThinkTranshumanismUnited Farm WorkersViet CongWiphalaYPGYugoslaviaZapatistaFile EmbedPassword file deletionJoin Matrix Chat IRC leftypol Rizon Please give feedback proposals new Mondays meta New roulette topic posad Paranormal horror occult New board AKM Guns weapons art war Return Go bottom File 1608526654369jpg KB 768x539 __opt__aboutcom__coeus__rejpg grow mushrooms beginners Anonymous Comrade 202012Mon 0457No11168Trying get hobby ball rollingI want grow mushrooms anybody tips ways start without buying massmanufactured kitAnonymous Comrade 202012Mon 0457NoHallucinogenic mushroomsAnonymous Comrade 202012Mon 0457No11168A dog entered garden pissed bricks weeks later white mushrooms started growing itSo think piss one leg wherever want grow mushrooms anonBe sure wash eating thoughAnonymous Comrade 202012Mon 0457No11173choeseAnonymous Comrade 202012Mon 0457NoI know guy started growing kinds mushrooms psilocybin regular building pretty much everything mason jars tubs shit think mostly used shroomeryorg resource Ill ask post thread wouldnt hold breathAnonymous Comrade 202012Mon 0457NoI tried growing mushrooms buy kit Midwestgrowkits something like spores buy pretty much whatever want online would suggest finding head shop sells spores magic kind thereShaytan 202012Mon 0457Nohttpswwwyoutubecomwatchv45b2t7fqhjAt35sAnonymous Comrade 202012Mon 0457No11234Nice work ShaytanShaytan 202012Mon 0457NoFile 16085266633200jpg KB 1000x1500 poisonous mushroomsjpg File 16085266633201jpg KB 320x2268 detpsych comb 1jpg File 16085266633202jpg KB 320x2269 detpsych comb 2jpg 11235The trick mushrooms understanding exactly like growing shade away sunFungi people dont need vitamin constantly like plants instead need water food shelter get water rain dripping trees house rooftops morning dew grass residual moisture underneath dead leaves water ground get food decaying plant animal life fertile soilwoodchipsdead leaves trees prime growth get shelter prevents losing moisture example cant grow sand sunlight dries sunlight Sunlight doesnt kill drying doesThey dont fruit theres rain wind grow storms Hence covering much actually stops fruiting even though mycelium continue grow theres nothing killing Mushrooms specifically exist reproduce dont show unless chance reproduce wind carries spores water nourishes spores like cant get boner unless theres pussy hole presenting Unless youre girl cant really get wet unless think somethings gonna penetrate shroomsShaytan 202012Mon 0457NoFile 16085266636500jpg KB 320x2268 detpsych comb 3jpg File 16085266636501jpg KB 320x2722 detpsych comb 4jpg File 16085266636502jpg KB 320x2261 psych comb 1jpg Shaytan 202012Mon 0457NoFile 1608526663845jpg KB 320x1790 psych comb 2jpg 11237Shaytan 202012Mon 0457NohttpswwwyoutubecomwatchvnQ1uDfsT4yIUninformed Retard Necrobumping Gigachad 202109Fri 1647NoFile 1630687651271jpg KB 2448x3264 142982763894623jpg Hey guys found Mushrooms growing backyard morning decided post hear opinionAccording incipient research using websites httpswwwshroomeryorg8461Whichpsilocybinmushroomsgrowwildinmyareahttpswwwmushroomexpertcompluteus_americanushtmlThese seem Pluteus americanus Please tell assessment incorrect whether consume ingest expect Ive looking resources would like hear second hand opinion youAnonymous 202109Fri 1704NoWtf mushrooms actually basedAnonymous 202109Fri 1914No19431should consume theseNooooo dont ask internetGo find real shroom guy like one much expert knowledge talk ear least hours ask ok eat itIt really hard tell good ones bad ones apart sometimes really live breathe stuff Bad ones really fuck upAnonymous 202109Fri 1928No19436seconding thismushrooms hard IDAnonymous 202109Fri 2330No1943619437Sadly know anyone like IRL guess Ill leave mushrooms dont wanna accidentally poison myselfAnonymous 202109Fri 2342No19431Do KOH could easily look alike Definitely get spore printAnonymous 202109Sun 2204NoAnonymous 202109Sun 2007NoFile 1631477256606png KB 610x610 ClipboardImagepng Dont itUnique IPs 6ReturnGo top Catalog HomePost ReplyDelete Post File Password Reason home rules faq overboard sfw alt leftypol siberia hobby tech edu games anime music draw AKM meta roulette cytube git GET ref booru Tinyboard vichan lainchan 5Tinyboard Copyright 2010Tinyboard Development Groupvichan Copyright 2012vichandevellainchan Copyright 2014lainchan AdministrationAll trademarks copyrights comments images page owned responsibility respective parties Return Go top,bad
4,http://onionwsoiu53xre32jwve7euacadvhprq2jytfttb55hrbo3execodad.onion/2017/05/29/german-grew-mushrooms-and-ordered-cannabis-from-the-dark-web/,German Grew Mushrooms Ordered Cannabis Dark Web Onion Web Explore Popular Posts Access Darknet buy Dark web Tour Darkweb Markets Mustread Dont Get Scammed PGP Keys Encrypted Messages use Monero buy online Darknet VS Darkweb Difference Topics ViewallTopics Dark web Drugs Bitcoin Leaks Altcoins Trading Markets Hacking Security DeepDotWeb Guides Reviews Interviews Arrests Popular Spaces Onion Web Darknet Dummies Dr Greenthumb Wheres Mind Doggystyle Reviews Rich 30s High Jones Discover MustVisit DarkRise Darknet Doesnt Fail Darkguard Verify URL dReviews dDarknetStars Recon Vendor Database Reviews Coming soon Dread DiscoverAll Markets Ranking Darknet Marketplaces Darknet Forums Darknet Shops Dead Sites Actions Contact SubmitmyStory AddaSite Donate PGP Mirrors Canary Related Log Sign Account Spaces Topics Contact Us German Grew Mushrooms Ordered Cannabis Dark Web DeepDotWeb DeepDotWeb May Law enforcement authorities detained man District Regen Germany ordering equipment used mushroom growing cannabis dark web cultivating magic mushroomsIn middle October 2016 customs authorities Frankfurt intercepted package containing approximately grams cannabis addressed 22yearold suspect District Regen Shortly package seized public prosecutors office Deggendorf issued warrant search house defendant law enforcement authorities searched home 22yearold found grams magic mushrooms containing psilocybin small amounts hashish narcotics confiscated officials Münich Central Office According information provided police two separate investigations started suspect One started Main Customs Office Münich investigation launched Deggendorf criminal police department latter investigating whether suspect involved violation narcotics law proceedings continued Deggendorf criminal police department law enforcement authorities interrogated suspect confessed charges cultivation consumption resale magic mushrooms According police 22yearold purchased equipment grow hallucinogenic substance dark web Investigators provide information kind equipment suspect purchase grow mushrooms However popular items grow hallucinogenic mushrooms mushroom growing kits sold clearnet normal part internet everyone knows dark web euros approximately US dollars investigations showed defendant cultivated mushrooms personal use also resold drug customers Law enforcement authorities identified customers 22yearold considering pressing charges unclear however whether defendant sold mushrooms customers sold cannabis tooOn Wednesday May 10 law enforcement authorities ordered District Court Deggendorf issue house searches customers defendant district Regen aid support staff PP Niederbayern consumer goods small quantities marijuana forbidden switchblade found investigators house suspectsAdditionally investigations uncovered customers 22yearold minors aged years fact known punishment given defendant could severe According Narcotics Act Germany cases suspects sold drugs minors sentenced minimum one year prison Police information disclosed interrogation 22yearold law enforcement authorities released suspect police custody Previous article Frankfurt 50 German Dark web Traffic Illegal Next article Germany Facing Record Levels Internet Fraud Author DeepDotWeb Without doubt predecessor TheOnionWeb DeepDotWeb news site dedicated events surrounding dark web featuring interviews reviews darknet markets Tor hidden services legal actions privacy bitcoin related news Articles Donate Bitcoin 1NDqCHu3C8rjgfJs34TgZ8BKa2VsuduRMC Monero 46UwFaceGmLheF9qRq6EjSAmuJF2P5KVfXinVM4NEr6DJhxAWW2j2D79BUTe1HMnTTNt3cbz6QKUEEhmnaZVrMzMKaAtgCW Comments Write comment Write Comment view comments Read write comment Read guidelines Comment text Post Comment Advertise Darknet Sites Featured Sites Torrez 100 CannaHome 100 Abacus Market 97 Markets Revolution Market 98 Vice City 100 Dark0de 95 Cannazon 74 ASAP Asean 100 Cartel 86 Archetyp Market 97 Tor2door 100 Monopoly 94 Versus 98 Tor Market NZ 100 HYDRA RU 76 Vendor Shops new shit 99 WeAreAmsterdam 95 CharlieUK 100 French Connection 100 ThePirateIsland 93 TomJerry 100 Medicine Man UK 100 SmokersCo 100 Auspride 100 Digital Thrift Shop Pl 100 HeinekenExpress 100 o3shop RU 100 Social Dread 92 Majestic Garden 86 HUB 57 Deutschland im Deep Web DE 85 Cebulka PL 90 Services News Directories LARGEST Markets December TOP number products Full Ranking Torrez Dark0de Versus ASAP Asean Cartel Bitcoin Today High Low Monero Today High Low Latest Comments Authentik2900 Site à éviter commande de c faite chez eux jamais reçu une arnaque TomJerrys profile mawosx low contact waiting days parcel 50g coco contact pr WeAreAmsterdams profile foster6la biggest greatest Torrezs profile Fidel Dam Im cannabis plug left Cannazons profile 14characters Looking make Make Money Looking Job Post Find Job Deep Web krazydversa ey ross aim chile espero que algun dia encuentres la libertad fr Life Box kotorfan21 anyone know actual Nonscams registeredreal passports Newbies Spaces space MahNemzJeff loyal Torguard user going years hands TorGuard VPN Review FUCKOFF MOTHER SCAM WEBSITE DarkFox Markets profile oshit Allowing users finalize orders withdraw funds White House Markets profile Tag Cloud Bitcoin Darknet Dark Web Drug Sentenced Arrested Man News Tor Drugs Silk Road Prison Market German years Price Busted Cybercrime Net Markets Cannabis Bitcoin Monero Forum Bitcoin,bad
