index,link,text,marker
0,http://deeeepv4bfndyatwkdzeciebqcwwlvgqa6mofdtsvwpon4elfut7lfqd.onion/,DeepLink Onion Directory DeepLink Onion Directory Home Add Site Contact DeepLink moving OnionVersion Address Please sure bookmark right addresshttpdeeeepv4bfndyatwkdzeciebqcwwlvgqa6mofdtsvwpon4elfut7lfqdonion Categories Onions Market Hacking Hosting Forums Blog Link List Wiki Communication Social Financial Services Adult Search Engines Private Sites Others Best Financial Market Prepaid CC VISAMasterCard Cloned CC Gift Cards VISAAmazon PayPalWestern Union Transfers cards come PINs instructions httplhsfyiluf5mpybtbud26blpgwou4av7pacfm4coyepcfer5usfjkccydonion 48331Cash CARDS sell demanded products deepweb US Europe specialized years experience field httpwhje5cahjivo6s4ox36xrpea5gavgd45uekgaxlkocjlcxcwkedn2ladonion 37761Light Money Trusted Financial Market Prepaid Cloned Gift Cards Money Transfers via PayPal Western Union http2aoiednvwdnc4w2r32yoydojuu7a4jc6dtiu7bnxikhlirvjm7jxevidonion 5112Hacker Community Hire Advanced Trustable Hackers Darknet httpugdbp6mw657tljzmymg2u7xv3uhtmbcpgiiimtbsfqcv47kicisen7idonion 5201TOR LINK LIST easiest way find information Tor network working links trusted sites http5n4qdkw2wavc55peppyrelmb2rgsx7ohcb2tkxhub2gyfurxulfyd3idonion 5469 Bitcoin Private Key Shop Best Seller Market httpcznfdaeaqujhfz33ki4evpaz7a3vy7qgapdbjejrvgursnu27x4gxoidonion 4866Manticore BEST CARDING SERVICES PREPAID CARDS VISAMasterCard MONEY TRANSFERS VIA PAYPAL WESTERN UNION httpwumsyv4676p4gdrofwz5w3a74aajexxq4kss2wx42umymdy5uxxranydonion 4903Bitcoin Mixer largest fastest Trusted Bitcoin mixer Deep Web httpjaslzi3nsom7amtlzb575turfv2tytgv2v7j3ywgg5vso5citxmbwdidonion 4103RE Apple Store Original Apple products products original packaging warranty cardsFree express shipping worldwide httpq43zqapcisjhrqsk2otzc27leujaenmameigsiwbhcgawflczdifs3qdonion 4769Dark Escrow job sweat small stuff Well make sure sale safeguarded fraud focus business httpfit3thui7rw263htdkfwz4kw6cvxpmt2akcswbatksc5svdreajn6ridonion 5112Porn Hacker sell fresh hacked accounts popular porn sites spend money subscriptions Order account us save Money httppyys2twibiumogafwhtoeyy7awjqaydc3nh3lyyva7fcgbldqt7sjtqdonion 3798HIDDEN WIKI FRESH Hidden Wiki FRESH easiest way find information Tor network working links trusted sites httpwikiw2godl6vm5amb4sij47rwynnrmqenwddykzt3fwpbx6p34sgb7ydonion 4982Deep Search Powerful Search Engine TOR httpsearch7tdrcvri22rieiwgi5g46qnwsesvnubqav2xakhezv4hjzkkadonion 2919Top Onions Top Onions Link List httptoponiibv4eo4pctlszgavni5ajzg7uvkd7e2xslkjmtcfqesjlsqpidonion 4956ORIGINAL CREDITCARDCENTER CreditCard Vendor Since Prepaid VISA Amex MasterCards Western Union PayPal Moneytransfer within min 24Support Escrow httpcccenterjb27ubnmonion 5032Darknetlive Darknet News httpdarkzzx4avcsuofgfez5zq75cqc4mprjvfqywo45dfcaxrwqg6qrlfidonion 2652Bitcoin Generator Exploit Bitcoin Generator Exploit innovative fastest Bitcoin Generator online designed offered free use httpxf3d3baglf7rj73iab5fjaadumgyq6ra2fptdxbtxfvix2h6u2lnayadonion 1399Tor66 Nocookies notracking pure search httptor66sewebgixwhcqfnp5inzp5x5uohhdy3kvtnyfxc2e5mxiuh34iidonion 29222020DeepLink Hidden Links Markets Directory Total Hits 16336,bad
1,http://s7ms6zzghga6va5vpcmf6676b4wbz6y2rpmn7w7qaiktk4fmfn3s2pad.onion,Buy Cocaine Online USA Europe Australia Asia Cocaine Sale Skip content Home Shop Shipping Return Testimonials English Arabic Bosnian Bulgarian Catalan Chinese Simplified Chinese Traditional Croatian Danish Dutch English Finnish French German Irish Italian Japanese Korean Norwegian Polish Portuguese Russian Scottish Gaelic Spanish Swedish Turkish Ukrainian Cart products cart Buy Cocaine Online buy Cocaine Online Order Cocaine Buy Original High Quality Cocaine Buy Peruvian Cocaine Buy Bolivian Cocaine Buy Colombian Cocaine Buy Cracked Cocaine Buy Powder Cocaine Online Buy Volkswagen Cocaine Online Buy Bio Cocaine Online Buy weed Online Cocaine Cocaine also known coke strong stimulant frequently used recreational drug commonly snorted inhaled smoke dissolved injected vein Mental effects may include intense feeling happiness sexual arousal loss contact reality agitation Cocaine highly addictive drug ups levels alertness attention energy made coca plant native South America Buy Abortion Medications Online Formula C17H21NO4 IUPAC ID methyl 1R2R3S5S3 benzoyloxy8methyl8azabicyclo321 octane2carboxylate Drug class CNS stimulant Local anesthetic names Benzoylmethylecgonine coke blow crack freebase form Onset action seconds minutes Metabolism liver CYP3A4 Common Name COCAINE Aunt Nora Bernice Binge Blow C Charlie Coke Dust Flake Mojo Nose candy Paradise Sneeze Sniff Snow Toot White Buy weed online Hear Clients saying Cocaine Genius Testimonials Ordered Coke Wrong Place guarantee 100 Delivery specified location maximum days order confirmed Experience shown Genius coke round Globe Guarantee 100 Discrete Shipping Cocaine Genius products vacuum sealed shipping never afraid purchasing us since never trace anything years order payment receive tracking number Minutes later hence check progress product location Quality Cocaine Cocaine Genius Assures best qualities types Cocaine since product commercialize website warehouse containing Cocaine work Cocaine manufacturers producers satisfy client meet goals buying top quality cocaine online Cocaine Genius Offers 24Client Support Cocaine Genius Management team put place Customer service online 24just help client case difficulties clear doubts satisfy clients want buy cocaine online USA Buy Cocaine Australia Buy Cocaine Canada Buy Cocaine France others want buy Cocaine United Kingdom Whole Europe Asia well looking buy cocaine using Bitcoin Order Original Cocaine Online Colombian CocaineRated 7Select options Cocaine PowderRated 8Select options Bolivian CocaineRated 9Select options Bio CocaineRated 7Select options Crack CocaineRated 9Select options Peruvian CocaineRated 9Select options Volkswagen CocaineRated 8Select options Accept Bitcoin Payment Method Dont know Bitcoin simplified Bitcoin cryptocurrency used pay merchants online anonymously without trace coming going remain hidden internet purchase items Bitcoin best means payment get Bitcoin Crack Cocaine Sale Buy Cocaine Powder Online Order Volkswagen Cocaine Online Pure Peruvian Cocaine Sale Bolivian Cocaine Sale Colombian Cocaine Sale Peruvian Cocaine Sale Buy Bio Cocaine Buy ADHD pills Online Buy weed online Buy Weed online Bolivian CocaineRated 9Select options Cocaine PowderRated 8Select options Volkswagen CocaineRated 8Select options Peruvian CocaineRated 9Select options Crack CocaineRated 9Select options Colombian CocaineRated 7Select options Bio CocaineRated 7Select options dispensed Cocaine ethically tested approved USA LABORATORY long years existence growth offer efficient solution search kinds cocaine Discrete mailing Tracking Number packages triple sealed silicon paper shipped discrete packages Customers 100 SATISFIED Contact Us Email Us cocshopmailfencecom Opening Hours MonFri pm Sat Sun 9am4pm always standby team help online 24h7d Locate Us Products Bolivian Cocaine Rated 9Cocaine Powder Rated 8Volkswagen Cocaine Rated 8Peruvian Cocaine Rated 9Crack Cocaine Rated 9Home Shop Shipping Return Testimonials Copyright Cocaine Genius Home Shop Shipping Return Testimonials Login Cart products cart Checkout Cart cart emptyReturn Shop Continue Shopping Log Remember Lost password personal data used support experience throughout website manage access account purposes described privacy policy Register Open chat,bad
2,http://2gzyxa5ihm7nsggfxnu52rck2vv4rvmdlkiu3zzui5du4xyclen53wid.onion,Tor Project Anonymity Online Close banner Privacy human right Thank helping us reach 150Friends Tor match Donate Tor Logo Menu Support Community Blog Donate English en Català ca Deutsch de Español es Français fr Magyar nyelv hu Íslenska Italiano ქართული ენა ka Português Brasil ptBR Русский ru Türkçe tr 简体中文 zhCN Download Tor Browser Browse Privately Explore Freely Defend tracking surveillance Circumvent censorship Download Tor Browser BLOCK TRACKERS Tor Browser isolates website visit thirdparty trackers ads cant follow cookies automatically clear youre done browsing browsing history DEFEND SURVEILLANCE Tor Browser prevents someone watching connection knowing websites visit anyone monitoring browsing habits see youre using Tor RESIST FINGERPRINTING Tor Browser aims make users look making difficult fingerprinted based browser device information MULTILAYERED ENCRYPTION traffic relayed encrypted three times passes Tor network network comprised thousands volunteerrun servers known Tor relays BROWSE FREELY Tor Browser free access sites home network may blocked USWe believe everyone able explore internet privacy Tor Project 501c3 US nonprofit advance human rights defend privacy online free software open networks Meet team Download Tor Browser Download Tor Browser experience real private browsing without tracking surveillance censorship Download Tor Browser mission advance human rights freedoms creating deploying free open source anonymity privacy technologies supporting unrestricted availability use furthering scientific popular understanding Jobs Blog Contact Press PrivChat Donate Subscribe Newsletter Get monthly updates opportunities Tor Project Sign Trademark copyright notices rules use third parties found FAQ English en Català ca Deutsch de Español es Français fr Magyar nyelv hu Íslenska Italiano ქართული ენა ka Português Brasil ptBR Русский ru Türkçe tr 简体中文 zhCN,bad
3,http://drugsxeuauw4xt6eoqwztfkpa2ul5453q4ao4kqrtedhfoy6jmui5ryd.onion,Buy Pure drugs Online Buy drugs Online Buy Cocaine USA Order Cocaine Sale Order Cocaine Sale Buy Pure Cocaine Online Buy drugs Online Buy drugs USA Search Search Shop account RULES Order Status CONTACT FAQ Cart SALE Sale Add wishlist Quick View PSYCHEDELICSMeth Methamphetamine 1Select options Sale Add wishlist Quick View PSYCHEDELICSKetamine Select options Sale Add wishlist Quick View PSYCHEDELICSHeroin 1Select options Sale Add wishlist Quick View PSYCHEDELICScocaine 1Select options FAN FAVORITES Sale Add wishlist Quick View PSILOCYBINGolden teacher 1Select options Sale Add wishlist Quick View PSYCHEDELICSMeth Methamphetamine 1Select options Sale Add wishlist Quick View PSILOCYBINPenis envy mushroom 1Select options Sale Add wishlist Quick View PSILOCYBINmdma ecstasy 1Select options Filter Showing results Sort popularity Sort average rating Sort latest Sort price low high Sort price high low DMT 3 DreamPlus Drugs 8 DreanSteam 1 LSD 2 PSILOCYBIN 6 PSYCHEDELICS 4 Sale Add wishlist Quick View PSILOCYBINGolden teacher 1Select options Sale Add wishlist Quick View PSYCHEDELICSMeth Methamphetamine 1Select options Sale Add wishlist Quick View PSILOCYBINPenis envy mushroom 1Select options Sale Add wishlist Quick View PSILOCYBINmdma ecstasy 1Select options Sale Add wishlist Quick View PSILOCYBINLiberty caps 1Select options Sale Add wishlist Quick View PSYCHEDELICSKetamine Select options Sale Add wishlist Quick View PSYCHEDELICSHeroin 1Select options Sale Add wishlist Quick View PSYCHEDELICScocaine 1Select options Sale Add wishlist Quick View DMTNN DMT 1Select options Sale Add wishlist Quick View PSILOCYBINPcp powder Select options Sale Add wishlist Quick View PSILOCYBINAyahuasca Select options Sale Add wishlist Quick View DMT5meo DMT 1Select options Sale Add wishlist Quick View DMT4AcO DMT 1Select options Sale Add wishlist Quick View DreanSteamcocaine 5Select options Add wishlist Quick View DreamPlus DrugsBLUE CRYSTAL METH 2Select options Add wishlist Quick View DreamPlus DrugsPURE MDMA 95 1Select options Sale Add wishlist Quick View LSDLiquid LSD 22Select options Add wishlist Quick View DreamPlus DrugsECSTASY PILLS Select options Add wishlist Quick View DreamPlus DrugsCHINA WHITE HEROIN 2Select options Add wishlist Quick View DreamPlus DrugsCRACK COCAINE 98 2Select options Add wishlist Quick View DreamPlus DrugsPOWDER COCAINE 95 2Select options Sale Add wishlist Quick View LSDLSD Tabs Select options Sale Add wishlist Quick View DreamPlus DrugsFIRE OG KUSH 1Select options Add wishlist Quick View DreamPlus DrugsWHITE CRYSTAL METH 1Select options Filter price Filter Price Product categoriesDMT 3 DreamPlus Drugs 8 DreanSteam 1 LSD 2 PSILOCYBIN 6 PSYCHEDELICS 4 Packing shed Recent CommentsJohn BLUE CRYSTAL METHRixiean Penis envy mushroomKai ECSTASY PILLSJohn KetamineEdward LSD TabsProducts Rated Meth Methamphetamine 1Rated Ketamine Rated Heroin 1Rated cocaine 1Rated Penis envy mushroom 1Rated Pcp powder Rated mdma ecstasy 1Rated Liberty caps 1Rated Golden teacher 1Rated Ayahuasca Rated NN DMT 1Use Crypto encourage crypto payments discracyPlace order get directly followed contacting customer support Discretion Policy keep customers secured customer information received categorized confidential discretely handled undisclosed third party company stay safe specified insurance policy protects us ship products discretely top shelf stealth prevents radar detection large orders guarantee order division smaller safer package sizes lower risks Copyright Order Cocaine Sale Rights Reserved Shop Account Search Search Search Wishlist Sign Create Account Username email Password Login Lost password CLOSE Filter price Filter Price Product categoriesDMT 3 DreamPlus Drugs 8 DreanSteam 1 LSD 2 PSILOCYBIN 6 PSYCHEDELICS 4 Packing shed Recent CommentsJohn BLUE CRYSTAL METHRixiean Penis envy mushroomKai ECSTASY PILLSJohn KetamineEdward LSD TabsProducts Rated Meth Methamphetamine 1Rated Ketamine Rated Heroin 1Rated cocaine 1Rated Penis envy mushroom 1Rated Pcp powder Rated mdma ecstasy 1Rated Liberty caps 1Rated Golden teacher 1Rated Ayahuasca Rated NN DMT 1X Shopping cart close,bad
4,http://darkcpv3kzkbizxcn6hrhzhstceitaeame7reyvry6lnm6wamdl4sead.onion,OnionDir Deep Web Link Directory Hidden Wiki Mirror OnionDir Deep Web Link Directory darkcpv3kzkbizxcn6hrhzhstceitaeame7reyvry6lnm6wamdl4seadonion copy paste friendly onion link list Feel free copy list forums pastebins etc people find hidden service links actually work add site writing us darkonionlinks secmailpro please check site working add remove nonworking sites regular basis Categories Hidden Service lists search engines http3g2upl4pq6kufc4monion DuckDuckGo Search Engine httpxmh57jrzrnw6inslonion TORCH Tor Search Engine httpzqktlwi4fecvo6rionionwikiindexphpMain_Page Uncensored Hidden Wiki http32rfckwuorlf4dlvonion Onion URL Repository httpe266al32vpuorbygonionbookmarksphp Dark Nexus http5plvrsgydwy2sgceonion Seeks Search http2vlqpcqpjlhmd5r2onion Gateway Freenet httpnlmymchrmnlmbniionion httpkpynyvym6xqi7wz2onionlinkshtml ParaZite httpwiki5kauuihowqi5onion Onion Wiki httptorwikignoueupfmonionindexphptitleMain_Page Tor Wiki httpkpvz7ki2v5agwt35onion Hidden Wiki httpidnxcnkne4qt76tgonion Tor Project Anonymity Online httptorlinkbgs6aabnsonion TorLinks httpjh32yv5zgayyyts3onion Hidden Wiki Onion Urls httpwikitjerrta4qgz4onion Hidden Wiki Tor Wiki httpxdagknwjc7aaytzhonion Anonet Webproxy http3fyb44wdhnd2ghhlonionwikiindexphptitleMain_Page Youre Wiki clone clean hidden wiki went freedom hosting http3fyb44wdhnd2ghhlonion Youre Base httpj6im4v42ur6dpic3onion TorProject Archive httpp3igkncehackjtibonion TorProject Media httpkbhpodhnfxl3clb4onion Tor Search httpcipollatnumrrahdonion Cipolla Italian httpdppmfxaacucguzpconion TorDir One oldest link lists Tor Marketplace Financial httptorbrokerge7zxgqonion TorBroker Trade securities anonymously bitcoin currently supports nearly stocks ETFs httpfogcore5n3ov3tuionion Bitcoin Fog Bitcoin Laundry http2vx63nyktk4kxbxbonion AUTOMATED PAYPAL CREDIT CARD STORE httpsamsgdtwz6hvjyu4onion Safe Anonymous Fast Easy escrow service httpeasycoinsayj7p5lonion EasyCoin Bitcoin Wallet free Bitcoin Mixer httpjzn5w5pac26sqef4onion WeBuyBitcoins Sell Bitcoins Cash USD ACH WUMG LR PayPal httpow24et3tetp6tvmkonion OnionWallet Anonymous Bitcoin Wallet Bitcoin Laundry httpqc7ilonwpv77qibmonion Western Union Exploit http3dbr5t4pygahedmsonion ccPal Store httpy3fpieiezy2sin4aonion HQER High Quality Euro Replicas httpqkj4drtgvpm7eeclonion Counterfeit USD httpnr6juudpp4as4gjgonionpptobtchtml PayPal BitCoins httpnr6juudpp4as4gjgoniondoublecoinshtml Double BitCoins httplw4ipk5choakk5zeonionraw4588 High Quality Tutorials Marketplace Commercial Services http6w6vcynl6dumn67conion Tor Market Board Anonymous Marketplace Forums httpwvk32thojln4gpp4onion Project Evil http5mvm7cg6bgklfjtponion Discounted electronics goods httplw4ipk5choakk5zeonionrawevbLewgkDSVkifzv8zAo Unfriendlysolution Legit hitman service httpnr6juudpp4as4gjgoniontorgirlshtml Tor Girls httptuu66yxvrnn3of7lonion UK Guns Ammo httpnr6juudpp4as4gjgoniontorgunshtm Used Tor Guns httpucx7bkbi2dtia36ronion Amazon Business httpnr6juudpp4as4gjgoniontorhtml Tor Technology httphbetshipq5yhhrsdonion Hidden BetCoin httpcstoreav7i44h2lronion CStore Carded Store httptfwdi3izigxllureonion Apples Bitcoin httpe2qizoerj4d6ldifonion Carded Store httpjvrnuue4bvbftibyonion DataBay httpbgkitnugq5ef2cpionion Hackintosh httpvlp4uw5ui22ljlg7onion EuroArms httpb4vqxw2j36wf2bqaonion Advantage Products httpybp4oezfhk24hxmbonion Hitman Network httpmts7hqqqeogujc5eonion Marianic Technology Services httpmobil7rab6nuf7vxonion Mobile Store http54flq67kqr5wvjqfonion MSR Shop httpyth5q7zdmqlycbczonion Old Man Fixers Fixing Services httpmatrixtxri745dfwonionneouploadsMATRIXtxri745dfwONION_130827231336IPA_pcpng PC Shop httpstoregsq3o5mfxizonion Samsung StorE httpsheep5u64fi457awonion Sheep Marketplace httpnr6juudpp4as4gjgonionbetcoinhtm Tor BetCoin httpqizriixqwmeq4p5bonion Tor Web Developer httpvfqnd6mieccqyiitonion UK Passports httpen35tuzqmn4lofbkonion US Fake ID Store httpxfnwyig7olypdq5ronion USA Citizenship httpuybu3melulmoljndonion iLike Help Guy httpdbmv53j45pcv534xonion Network Consulting Software Development httplw4ipk5choakk5zeonionraw4585 Quick Solution Hitman httpnr6juudpp4as4gjgoniontynermsrhtm Tyner MSR Store Marketplace Drugs httprso4hutlefirefqponion EuCanna Medical Grade Cannabis Buds Rick Simpson Oil Ointments Creams httpnewpdsuslmzqazvronion Peoples Drug Store Darkwebs Best Online Drug Supplier httpsmoker32pk4qt3mxonion Smokeables Finest Organic Cannabis shipped USA httpfzqnrlcvhkgbdwx5onion CannabisUK UK Wholesale Cannabis Supplier httpkbvbh4kdddiha2htonion DeDope German Weed Hash shop Bitcoin https5q54hfww56ov2xconion BitPharma EU vendor cocaine speed mdma psychedelics subscriptions httpll6lardicrvrljvqonion Brainmagic Best psychedelics darknet http25ffhnaechrbzwf3onion NLGrowers Coffee Shop grade Cannabis netherlands httpfec33nz6mhzd54zjonionindexphp Black Market Reloaded Forums httpatlmlxbk2mbupwgronion Atlantis Marketplace Forums httpatlantisrky4es5qonion Atlantis Marketplace httpdkn255hz262ypmiionion Silk Road Forums http4yjes6zfucnh7vcjonion Drug Market httpk4btcoezc5tlxyafonion Kamagra BitCoins httpsilkroadvb5piz3ronionsilkroadhome Silk Road Marketplace http5onwnspjvuk7cwvkonion Black Market Reloaded Hosting httpmatrixtxri745dfwonion Image Uploader httplw4ipk5choakk5zeonion PasteThis Tor based Pastebin httpwzrtr6gpencksu3donion8080 Gittor httpnr6juudpp4as4gjgonion Free hosting httptklxxs3rdzdjppnlonion Libertys Hackers Hosting Service httpmatrixtxri745dfwonion Matrix Trilogy Blogs http74ypjqjwf6oejmaxonion Beneath VT Exploring Virginia Techs Steam Tunnels Beyond http76qugh5bey5gum7lonion Deep Web Radio httpedramalpl7oq5npkonionMain_Page Encyclopedia Dramatica httpih4pgsz3aepacbwlonion Hushbox httpad52wtwp2goynr3aonion Dark Like Soul httptns7i5gucaaussz4onion FreeFor httpgdkez5whqhpthb4donion Scientology Archive httpnewsiiwanaduqpreonion latest news tor http5vppavyzjkfs45r4onion Michael Blizek http7ueo7ahq2xlpwx7qonion AYPSELA News http7hk64iz2vn2ewi7honion Blog Stories httptigas3l7uusztiquonion Mike Tigas httpmpf3i4k43xc2usxjonion Sam Whited http7w2rtz7rgfwj5zuvonion Open Letter Revolutionaries http3c3bdbvhb7j6yab2onion Totse http4fvfamdpoulu2nmsonion Lucky Eddies Home httpnwycvryrozllb42gonionsearchloresindexhtm Fravias Web Searching Lore httpnewsiiwanaduqpreonion OnionNews Blog onionland Forums Chans http2gxxzwnj52jutaisonionphpbbindexphp Onion Forum renewed http3fyb44wdhnd2ghhlonionib OniiChan httpbx7zrcsebkma7idsonion Jisko httpnpdaaf3s3f2xrmloonion Twitter clone httpjv7aqstbyhd5hqkionion HackBB Hacking cracking forum httpxdagknwjc7aaytzhonion20http1479forummainhtm Read access Freenet FMS forums via Anonet Webproxy httpsbforumaz7v3v6myonion SciBay Forums httpkpmp444tubeirwanonion DeepWeb httpr5c2ch4h5rogigqionion StaTorsNet httphbjw7wjeoltskholonion BEST tor social network File sharing messaging much Use fake email register httpt4is3dhdc2jd4yhwonion OnionForum New Onionforum general talk marketplace httpzw3crggtadila2sgonionimageboard TorChan One oldest chans Tor Email Messaging httpbitmailendavkbeconion swiss email http365u4txyqfy72nulonion Anonymous Email sevice communicate users currently using service tell friends httpsms4tor3vcr2geiponion SMS4TOR Self destructing messages httpnotestjxctkwbk6zonion NoteBin Create encrypted selfdestructing notes httptorbox3uiot6wchzonion TorBox Tor Mail Box httpu6lyst27lmelm6oyonionindexphp Blue matrix chat TIME chek often see httpwi7qkxyrdpu5cmvronion AutisticiInventati httpu4uoz3aphqbdc754onion Hell Online Political http6sgjmi53igmg7fm7onionindexphptitleMain_Page Bugged Planet httpfaerieuaahqvzgbyonion Fairie Underground http2r2tz6wzqh7gaji7onion Kavkaz Center httptnysbtbxsf356hiyonion New Yorker Strongbox httpduskgytldkxiuqc6onion Example rendezvous points page httprrcc5uuudhh4oz3conion Intel Exchange Forum Information discussion various topics ranging Illegal Activities Alternative Energy Conspiracy Theories Hacking people SnapBBS fully secure moderated categorized forum httpopnju4nyz7wbypmeonionweblogindexhtml A7B blog blog dedicated restoration limited constitutional republic USA httpassmkedzgorodn7oonion Anonymous safe secure crowdfunded assassinations httpduskgytldkxiuqc6onioncomsensehtml Commo Sense Thomas Paine httpnwycvryrozllb42gonion Destination Unknown httpzbnnr7qzaxlk5tmsonion Wiki Leaks Hacking httpsalted7fpnlaguiqonion SALT httpyj5rbziqttulgidyonion Itanimulli httpbbxdfsru7lmmbj32onionmarketplace Delta Initiative http2ogmrlfzdthnwkezonion RentAHacker Warez http2gxxzwnj52jutaisonion Nowhere Server restored backup FH httpjntlesnev5o7zysaonion Pirate Bay Torrents httpam4wuhz3zifexz5uonion Tor Library library books media files httpuj3wazyk5u4hnvtkonion Pirate Bay Torrents official onion httpdoxbindtelxceheronion DOXBIN httpwuvdsbmbwyjzsgeionion Music Downloads httplolicore75rq3tm5onion Lolicore Speedcore Music httpxfmro77i3lixucjaonion ebooks httpvt27twhtksyvjrkyonion lol 20th Century Western Music Recordings Scores http2ygbaoezjdmacnroonion Pony Noisebridge httpxfmro77i3lixucjaonion Imperial Library Trantor httpc3jemx2ube5v5zpgonion Jotunbanes Reading Club Drugs Noncommercial links found Erotic 18 httptklxxs3rdzdjppnlonionsharepass SharePass Password sharing community httpk4jmdeccpnsfe43conion Girls Released nice model pics http54dgeda4ik6iypuionion Gallery MetArt FTVX etc sets httppinkmethuylnenlzonion Pink Meth mirror http2fqgjzbb2h7yevomonionklixen Klixen httporsxvca7glswueo7onion EroDir Lots lots Hentai httpmmgh3rqeswrlgzdronion VORCOM Erotic Hard Candy httplovezspamopfiqulonion TLZ discussion board httptqjhyhbso4mdcrvhonionsciclaycams Sciclay Cams httpiqlnc7cbykhhurfoonion LLL Image Video upload httpoglbv4c4kpoobkidonionoglb Onion Girl Love Board Private Board httpbvunqhdbizqxyuoeonion Boy Vids httpgirlbmayme6evpwvonion Girls Boys httpop4jvhn65pjv3sltonion PedoEmpire http7haz75ietrhjds3jonion Natural Spanking httpspofoh4ucwlc7zr6onion Safe Port Forum httptqjhyhbso4mdcrvhonionforum BL Forum httpftwwebt6e3nb3lmwonion FTW Image Boards httptlz3gig7k46s4r66onion TLZ private forums httpvkq6wz4ozmldsciionion Topic Links CP sites link list Erotic Jailbait http66m4z7ygkqghb4tconion paradisebirds casey videos NonEnglish httpgermanyhusicaysxonion Deutschland im Deep Web German forum httpffi5v46ttwgx3fbyonion Das ist Deutschland hier German Board httppaisleli66axejosonion PAIS httphyjmkmb3lfymiprponionhenpapieze Dziecięca pedofilia httprunionv62ul3roitonion Russian Onion Union https6cco2jylmxqcdehonion ltimos bumps http5xki35vc4g5ts6gconion GTF Greek Tor Forum greek speaking users httpcipollatnumrrahdonionindexphp Cipolla Italian Community httprunionv62ul3roitonion Russian community market anonymous talks security guns etc httpptrackcp2noqu5fhonion PoliceTrack Ne vous faites plus suivre par la police httpamberoadychffmywonion Amberoad russian anonymous market httpr2d2akbw3jpt4zbfonion R2D2 russian anonymous market httpramp2bombkadwvgzonion RAMP biggest russian market drugs httpszmyt4v4vjbnxpg3onion Славянский httpo2tu5zjxjlibraryonion Bibliotheca Alexandrina httpxzzpowtjlobho6kdonionwordpress DeepBlog httpzqiirytam276uogbonion Thorlauta httpocbh4hoqs37unvv6onion French Deep Web,bad
