index,link,text,marker
33,http://z4odvem6bfypjqmwhsgtdaqtkkwgbxhe63dzq2lpnrmnmb6bgoafirad.onion,Xhacker xHacker Services Hacking Education Contact xHacker independent security researcher Hacking social engineering business since 2008 never real job time get really good spent half life studying researching hacking engineering web technologies worked people Silk Road Im also offering services everyone enough cash Technical Skills Web HTML PHP SQL APACHE CC Java Javascript Python 0day Exploits Highly personalized trojans Bots DDOS attacks Spear Phishing Attacks get passwords selected targets Hacking Web Technologies Fuzzing NOSQLi XSS LDAP Xpath Social Engineering Services independent security researcher Hacking social engineering business since 2004 never real job time get really good spent half life studying researching hacking engineering web technologies worked people Silk Road Im also offering services everyone enough cash Ill Ill anything money Im pussy want perform illegal shit work government targets Ill examples Hacking web servers computers smartphones Malware development operating system Economic espionage corporate espionage Getting private information someone Change grades schools universities Password recovery much Prices Im make bucks Im shit eastern europe country happy scam people bucks Im proffessional computer expert could earn 50bucks hour legal job stop reading dont serious problem worth spending cash Prices depend lot problem want solve minimum amount smaller jobs USD pay anonymously using Bitcoin Learn prices Services page Payment conditions wont start work without payment guarantee ways pay Via bitcoin directly 50 50 upon completion Via Bitcoin 100 escrow Escrow conditions Escrow protects time money okay use escrow security conditions Clearnet escrow services Escrow accept Bitcoin payments Escrow allow illegal deals Usually find terms using page going offer escrow service always choice choose exact escrow service going use going check escrow allows illegal deals Please xhackersafemailnet2015 Xhacker,bad
34,http://7swiozgvon3ypusrtdxlv2awqym35irv4y22jyj365gmdefmbs2bw2id.onion,h4ck3r Hacking Services Hire Hacker Security Researcher Offensive Security Web Expert OSWE Penetration Tester Social Engineer h4ck3r reloaded independent security researcher offensive security web expert OSWE studying web technologies hacking penetration testing social engineering information security offensive security since 2002 Technical Skills Web HTML CSS Javascript PHP MySQL MariaDB Apache NGINX CC Python Social Engineering Information Gathering Maltego Hacking Web Technologies SET Metasploit Burp Suite Nmap Wireshark Nikto Socat Reverse Proxy Advanced Web Attacks Exploitation AWAE Hacking Services Hacking web servers computers smartphones Malware development OS Social Media hacking Change grades schools universities Getting private information someone Exploits Trojans Backdoors Android RAT Keyloggers Spywares SQL injections attacks DoS attacks Phishing attacks get passwords selected targets Forensics data analysis Password Recovery Pricing Prices depends much hire discuss project provide proper estimate price timing Payment Bitcoin Monero Contact may contact h4ck3rdnmxorg via JabberXMPP h4ck3r_xmppjp advise use popular email provider get touch Gmail Yahoo Hotmail Outlook instead recommend open new account DNMX httphxuzjtocnzvv5g2rtg2bhwkcbupmk7rclb6lly3fo4tvqkk5oyrv3nidonion ProtonMail httpsprotonmailrmez3lotccipshtkleegetolb73fuirgj7r4o4vfu7ozydonion XMPP xmppjp want encrypt message PGP Public Key BEGIN PGP PUBLIC KEY BLOCK mQINBGEtBBABEADOrurXRPLWhQiSyGhmzVoSSWqp17wR7s64ShTsVqh7VmUyCu1 DbFZrIOtpDGyPOeaU97fYl5LWkGeRFQGlie0eU5Uu9LcqhM9CKSTXFRBoV7U5 l1ycDxMt1mnNW4KXe9UmAWz5uIM9JiRl3HcDpbSvoNclXKZjJtbXEViPtBL4JSP FzWijHIihunWt938AAPRXswBgzDe5uNnQbAeG9rb2CoS9A7y3O90rfE7GpGUP366 WKBseL6xRkvgtePn42nOCXEK5TodWrQZ4XdvbKbkLmCkNPyXQk3f8DfFQuY2C qePFA5bbLvCaTTHhO6vaz0zKKp9EjCHa9zXEChLPoqG1dghBUZo4H4Gr0qPVM xZRTJ5cyxkEWHMMYCkirb0YHTUDQjF2jMBigyyJAgsvZNP3HCowfHzSEcI8 RW5BNZe1KzVOlneuSizwML1CTTsdGZElCTNYOhuRlJHYiaOmAFXyGUbi88KXr Yc0K1HDMgKRShwG6QSmlzevmQtskbSYMkKvDGSGkU9dHYvv4nUJAdI0uiupNrho2 59bPW6HR5mKUYEo3fiEsXgHu1XwHBnuofm8wI09grSIw3fOCoCW3blcUkFsxp glCyrMLnmMXhg1AcmCbcZz5S1osSJhRL71HMo6tzdtSmh11ppEbz5VwARAQAB tBpEYXZpZCBXLiA8aDRjazNyQGRubXgub3JnPokCTgQTAQoAOBYhBMreCUqUTgnq 2YVzrgQnqEfDH4SIBQJhLQQQAhsDBQsJCAcDBRUKCQgLBRYCAwEAAh4BAheAAAoJ EAQnqEfDH4SIsEQQAMoOXsUw1f8RM2SKUBmKl4fG6C7UW5d2ZSISGuP8qAcrJ9 UmzG9KeAEe61Ni5AhLUB025eWrqfboH4Kj6TEjpcBHT7n1UtfNLfdUEZ0MzJ3 1UxQUefqHyr3vLTBIs2sNXPG0AuE02VmHge0lkbEtR6enqMEqvDXSohB9iYqON9g IpN5OLBHvLdjiY7GHLKOuc1R0cJ3nqnelWjHJYYhClseesuA7YQMUG4neXuBikp szu4sdQaAn9KPFgQgVUw8qjuuuHATuhs4tyW4vnmvymcYVD053maVN4K4icYkFkM h8cXt4pW1OMAKuN7Tu8UCo4yLYadmqOH9MllCdtjOAc4srZdXCzHtUpvkyDdBUb 87g4Ntdf6gjmWDmshUrJZcKSWEYh7rEjbKFLhdY0wZZmlhpaVN4kDrfatIut sg8azb7cmFYUxGjF2huxUvxcKMzXlwBVG0k41lOaHJIng7Xcm4wJGcx5CQo1Q LyeBIEAqKWogRJfKoQ1YEabCTF0yiENOz8KIWLBkmB92viUPE0xsKFeQr7DPW6b zLM4EavSzPPg4nu5tClsvgoNXC4Gi8opfdzSJY2g7c81FI2Moue5wxCwjsJ1l6P kx9MZ5YXltxH4CObKgc2ZFOkavFIKwXkLgRtMRvqcWiBsNziNcKbsNme9iauQIN BGEtBBABEADKZ0wwwbHN7gLvC6jlQ6ZzzqbKVcoKSJr84Pqf9qVMN5qXawG4fa4y 3tx7XdrBqRKI2WtpK5U4LcSal6CgBNSibn0Cf2p8gFZZsmJ0z0fOXCuLyw3vjT2 hlaoNWgKH6cGUSsrj1ipmhUL0tl8le9v8GAJ0vhNgYKiApYIxS9gJtI77dfwns ZuBTSMcaoMCfKVkieimDJAkjwa2KItwNjLlZQXAKlj5UiCnkW18NqeSQ15X1WAp BM89zxJOx1aBqMvbMGsXlp8oQChoveHfbyJZHH1ggcmC8V6KTAYaqC2EC5a8dI lJyLBJUkDyhzHgls8yonXedc2iVCEbJU2gPUIOReDmPjRPCQ7uelCmFD3lLAVFU1 nboqEOgNcPYw18sJY1q9P17A4OkQ6slP7PwBfaLwp709HAu6WGj3jJMRzfQ6qK mqoTNoFU7Oqz4xPqMsQVuehIjQWXLtSkxzdkbyXlah4konnzPMV9wjjZFcyc mCcaYsxmZMSQrsOgETJBaDtrynq4DpjByp57Xd4WKJ23pY34OFyYe8Bf4Ox73h EpIpm4kH3FTUkQ5Rev5thOh8q9jClYyV89zpYmILvkkTVxRXdKjuENJh7w24M3 dYdXTBd3cSHxOdN9dszRsYOVCG50aGAbAOHNvoUeJhiPXCRRxwARAQABiQI2 BBgBCgAgFiEEyt4JSpROCerZhXOuBCeoR8MfhIgFAmEtBBACGwwACgkQBCeoR8Mf hIjEZQ7Br2DUttT8bx1YotOe1ln1QQDJI96Io3sOuuxX2MUJgMN7u7K7CFUStf y1ApcdOsha2EpBAjTdDP9SbDSU79SWhqH1zqFN31ieiWS2m1RxDd8vMvgn6XfIF tzMy0NaqnxhKmjgAIyN0JFpDbQejGiPuGiFbOTRzLxIkkrC4imZAyMkN9HoWeYu Nq81F5tOKXSjWPzLJpbG2GNoLH8KRXljzHzRePiJSADPkEz2tzZz2ICnIOIw mj54IYeyIp48CK3NqWCjgB3ZToiQYYMMYwQOIjTvr3Ahvt2XpP8PIqz6yElG0 ZudA31DXpg4YydLBQuf54OTVcQK8tKIJ5RROvBPyPBUQMIs6dsYt8bLjmhLHhsI DVWzBIbJIsQSIiauP29SzR5qo5TO2c2wJvbWv8Yh1d03HbJj09cB1GQXbHDyO RHb5YXvLA2cCk7B6gByu4xuYb916suSfWxBL0727H5fGPliiv2ConAHgd1QZQ142 3zLAQQD6vlgoXZd1wBLaS5X76Wxh39uiq6K0j0YopCsM36rdg68DNK8FAF4 RaIm3NxCcw5nIRKrmBIHgtHFEoTaSRx1h8lHwcCRX6A3HmXGxTVbm6ivIg3MjO 6Us4iJpNyhasB55fVE7WcBcTEuSNLNzIPngIdbtF1QUOOYI W5i4 END PGP PUBLIC KEY BLOCK 2017h4ck3r mirrors,bad
35,http://bitphards4ayjjotcisqggok57wllh7xsva5qhks7zxlj2jmxax47wyd.onion,BitPharma biggest european onion drug store Cocaine Bitcoins Psychedelics Bitcoins Prescriptions Bitcoins Viagra Bitcoins Products FAQs Register Login StimulantsUncut Cocaine Speed ProductPriceQuantity 1g pure Cocaine0 X 2g pure Cocaine0 X 5g pure Cocaine0 X 25g pure Cocaine0 X 10g pure Speed0 X 50g pure Speed0 X 100g pure Speed0 X 2g pure Crystal Meth0 X 10g pure Crystal Meth0 X 50g MDMA Crystals0 X PsychedelicsFirst class psychedelics reagent tested ProductPriceQuantity x LSD Blotter 200yg Hofmann0 X x LSD Blotter 200yg Hofmann0 X x LSD Blotter 200yg Hofmann0 X 1g pure synthetic Mescaline0 X 10g pure synthetic Mescaline0 X 1g DMT freebase pure0 X 10g DMT freebase pure0 X 100g Ketamine Crystals0 X PrescriptionOriginal prescriptions freshly imported ProductPriceQuantity x Generic Viagra 100mg0 X x Generic Viagra 100mg0 X x Generic Cialis 20mg0 X x Original Kamagra 100mg0 X x Xanax 2mg0 X x 10mg Valium Diazepam X x capsules Tramadol 150mgcapsule0 X x 30mg Oxycodone Oxycodone Hydrochloride X x 30mg Oxycodone Oxycodone Hydrochloride X,bad
36,http://orezer64qvhskkk3mhw3lwxqv3225hcgb7ozlftamf5ab57ghkp5j4ad.onion,Buy drugs anxiety pain killers psychedelicsanxiety pain killers Us Contact Us account HOME COVIDADHD ANXIETY PAIN RELIEF INSOMNIA Guns Contact Us Customer Reviews account Track Order Shopping cart cart empty Continue Shopping Cart ADHD 3 Anastrozole 1 Anti Anxiety 8 atorvastatin 1 Beauty products 4 BEST PLACE Buy Methadone online 1 BOTULINUM 3 Buy ADHD 7 BUY ANXIETY PILLS 12 Buy COVIDVaccine 2 Buy Methadone online 1 BUY NEMBUTAL PENTOBARBITAL 3 Buy PAIN MEDS 27 CBD OIL 1 COVID8 AstraZeneca COVIDvaccine 1 Johnson Johnsons Janssen COVIDVaccine 1 Moderna COVIDVaccine 1 Sputnik V COVIDvaccine 1 COVIDVACCINATION CARDS 2 Date Rape Drug 1 Guns 6 HAIR LOSS 1 HIV medications 4 INSOMNIA 4 Ketamine 1 Keytruda 1 Opoid Detox 2 Pain Relief 20 Opana 1 Research chemicals 1 Uncategorized 2 Weight Loss 4 Login Register Enter username password login Remember Lost password First name Last name Fill forms create account ShopAccount 1970 775silkclinicprotonmailcom HOME COVIDADHD ANXIETY PAIN RELIEF INSOMNIA Guns Contact Us Customer Reviews account Track Order Contact us Whatsapp 1970 775Emailsilkclinicprotonmailcom Products Average ratingRated 27Rated 7Rated 1SUBMIT REVIEW review overall rating Select Rating5 Stars4 Stars3 Stars2 Stars1 Star Title review review name email review based experience genuine opinion Submit review Uncategorized products ADHD products Anastrozole product Anti Anxiety products atorvastatin product Beauty products products BEST PLACE Buy Methadone online product BOTULINUM products Buy ADHD products BUY ANXIETY PILLS products Buy COVIDVaccine products Buy Methadone online product BUY NEMBUTAL PENTOBARBITAL products Buy PAIN MEDS products CBD OIL product COVIDproducts AstraZeneca COVIDvaccine product Johnson Johnsons Janssen COVIDVaccine product Moderna COVIDVaccine product Sputnik V COVIDvaccine product COVIDVACCINATION CARDS products Date Rape Drug product Guns products HAIR LOSS product HIV medications products INSOMNIA products Ketamine product Keytruda product Opoid Detox products Pain Relief products Opana product Research chemicals product Weight Loss products Top rated products buy rohypnol online Rated Buy Norco Online Rated Shop Showing 1of results Filter Best Selling Featured Products Recent Products Sale Random Products products products products products products products Categories ADHD3 Adderall0 Ritalin0 Vyvanse0 Anastrozole1 Arimidex0 Anti Anxiety8 Activan0 Buy Green Xanax Online0 Buy Greenstone Xanax Online0 Buy Helex online0 Diazepam0 Klonopin0 Xanax0 Yellow Xanax Bars0 ANXIETY MEDS0 atorvastatin1 Beauty products4 ALIAXIN GP 1ML0 JUVEDERM VOLUMA LIDOCAINE0 juvedermultra41ml0 BEST PLACE Buy Methadone online1 BOTULINUM3 Botox0 Dysport0 NeuroBloc0 Buy ADHD7 BUY ANXIETY PILLS12 Buy COVIDVaccine2 Buy Methadone online1 BUY NEMBUTAL PENTOBARBITAL3 Buy PAIN MEDS27 CBD OIL1 Full CBD Oil0 High Grade Hemp Extract0 Clothing0 Accessories0 Hoodies0 Tshirts0 CONCERNTRATES0 COVID198 AstraZeneca COVIDvaccine1 Johnson Johnsons Janssen COVIDVaccine1 Moderna COVIDVaccine1 Sputnik V COVIDvaccine1 COVIDVACCINATION CARDS2 Date Rape Drug1 buy rohypnol online0 Decor0 ECSTASY0 Guns6 HAIR LOSS1 Generic Finasteride0 HIV medications4 Buy efavirenz online 0 Buy emtricitabine online0 Buy lamivudine online0 Buy tenofovir DF online0 HYBRID0 INDICA0 INSOMNIA4 Ambien0 Modafinil0 Stilnox0 Zopiclone0 Ketamine1 Keytruda1 Masks0 MDMA0 MOON ROCKS0 Music0 Opoid Detox2 Suboxone0 Subutex0 PAIN KILLERS0 Pain Relief20 Buy Codeine Online0 Buy Diamorphine online0 Buy Fentanyl Patches Online0 Buy Methadone online0 Buy Morphine sulphat Injection0 Demerol0 Dilaudid0 Endocet0 Hydrocodone0 Lortab0 Mobic0 Morphine Sulfate0 Norco0 Opana1 Oxycondone0 Oxycontin0 OxyNorm0 Percocet0 RHEUMACURE0 Roxicodone0 Vicodin0 Psychedelics0 Research chemicals1 Buy Flakka Apvp online0 Sanitizer0 SATIVA0 Uncategorized2 Diapers0 WAX0 WEED CANS0 Weight Loss4 Adipex0 Garcinia Cambogia Extract0 phentermine0 XLSMedical Max Strength Tablets0 Default sorting Sort popularity Sort average rating Sort latest Sort price low high Sort price high low ALIAXIN GP 1ML 0 Select options Save AstraZeneca COVIDvaccine shots 0 Add cart Save Buy Suicide Nembutal Pentobarbital Sodium Pills 100mg Online 0 Add cart Save 10000Hot Buy Actavis Promethazine cough syrup Online 0 Add cart Save 10000Hot Buy Adderall Online Rated 2 Add cart Hot Buy Adipex Online Rated 3 Add cart Hot Buy Ambien online Rated 3 Add cart Hot Buy Arimidex Online Rated 1 Add cart Hot Buy Ativan Online Rated 2 Add cart Save 2000Hot Buy Botox Online Rated 1 Add cart buy Cialis mg online without prescription 0 1Select options Hot Buy Codeine Online Rated 4 Add cart Buy Concerta Methylphenidate 54mg Online 0 Select options Buy Demerol safely Online 100mg 0 6Select options Save 8000Hot Buy Diamorphine online Rated 2 Add cart Hot Buy Diazepam Online Rated 2 Add cart Buy Dilaudid 8mg Online Order Hydromorphone Overnight 0 Select options Hot Buy Dilaudid Online Rated 2 Add cart Hot Buy Ecstasy 100mg Online Overnight 0 3Select options Buy efavirenz online 0 Select options Buy emtricitabine online Rated 1 Select options Buy Endocet online 0 Select options Hot Buy Fentanyl Patches Online Rated 3 Add cart Hot Buy Flakka Apvp online 0 Read Buy G74 OXYMORPHONE 40MG 0 6Select options Buy Garcinia Cambogia Extract 0 Select options Buy Generic Klonopin Clonazepam Rivotril mg Tablets Online 0 1Select options Buy Generic Norco AcetaminophenHydrocodone 325mg10mg Online 0 4Select options Buy Green Xanax Online Rated 3 Add cart Hot Buy Greenstone Xanax Online Rated 1 Add cart Buy Helex online 0 Add cart Buy Hydrocodone Acetaminophen 10mg Watson Sale 0 4Select options Hot Buy Hydrocodone online Rated 1 Add cart Save Buy Ketamine Online Rated 3 2Add cart Save Buy Keytruda Online 0 21Add cart Buy Klonopin Online 0 Select options Buy lamivudine online 0 Select options Save Buy Lipitor Online 0 11Add cart Hot Buy LORTAB 10hydrocodone bitartrate acetaminophen 0 6Select options Buy Lortab Online 0 Select options Buy Magnus MR Morphine Sulfate mg Capsule Safely Online 0 2Select options Save Buy Methadone 10mg Oral Tablets Online Legally 0 Add cart Save 3000Hot Buy Methadone online 0 Add cart Buy Mobic Online 0 Read Hot Buy Modafinil Online 1 Add cart Buy Morphine 30mg Online overnight 0 4Select options Hot Buy Morphine Sulfate Online Rated 9 Add cart Hot Buy Morphine sulphate Injection Rated 4 Add cart Save 1500Hot Buy NeuroBloc Online 0 Add cart Hot Buy Norco Online Rated 1 Add cart Hot Buy Opana Online Rated 3 Add cart Buy OPANAoxymorphone hydrochloride 40mg er Online 0 8Select options Hot Buy oxycodone 10mg overnight 0 4Select options Hot Buy Oxycodone Online Rated 3 Add cart Buy Oxycontin 40mg online Cheap 0 4Select options Hot Buy Oxycontin Online Rated 2 Add cart Buy Oxycotin OC 80mg Online 0 7Select options Hot Buy OxyNorm Online Rated 1 Add cart Hot Buy Pain Soma mg Carisoprodol Prescription Needed 0 4Select options Hot Buy Percocet Online Rated 2 Add cart CONTACT US question please contact us silkclinicprotonmailcom Zmdifacebook Zmditwitter Zmdiyoutubeplay Zmdiinstagram INFORMATON account Checkout Logout HELP Contact Us Us Reviews SUPPORT Us Contact Us account WHATSAPPTEXT US 1970 7758731,bad
37,http://7bw24ll47y7aohhkrfdq2wydg3zvuecvjo63muycjzlbaqlihuogqvyd.onion,BitPharma biggest european onion drug store Cocaine Bitcoins Psychedelics Bitcoins Prescriptions Bitcoins Viagra Bitcoins Products FAQs Register Login StimulantsUncut cocaine speed shipping germany france every day best stealth packaging market shipping worldwide ProductPriceQuantity 1g pure Cocaine75 EUR X 2g pure Cocaine130 EUR X 5g pure Cocaine250 EUR X 25g pure Cocaine950 EUR X 10g pure Speed90 EUR X 50g pure Speed390 EUR X 100g pure Speed650 EUR X 5g pure Crystal Meth120 EUR X 10g pure Crystal Meth200 EUR X 50g pure Crystal Meth800 EUR X 50g MDMA Crystals140 EUR X 100g MDMA Crystals220 EUR X PsychedelicsFirst class psychedelics reagent tested ProductPriceQuantity x LSD Blotter 200yg Hofmann130 EUR X x LSD Blotter 200yg Hofmann200 EUR X x LSD Blotter 200yg Hofmann380 EUR X 1g pure synthetic Mescaline80 EUR X 10g pure synthetic Mescaline750 EUR X 1g DMT freebase pure110 EUR X 10g DMT freebase pure850 EUR X 50g Ketamine Crystals450 EUR X 100g Ketamine Crystals780 EUR X PrescriptionOriginal prescriptions freshly imported ProductPriceQuantity x Generic Viagra 100mg100 EUR X x Generic Viagra 100mg350 EUR X x Generic Cialis 20mg100 EUR X x Original Kamagra 100mg100 EUR X x Xanax 2mg215 EUR X x Xanax 2mg350 EUR X x capsules Tramadol 150mgcapsule95 EUR X x 80mg Oxycodone Oxycodone HydrochlorideEUR X x 80mg Oxycodone Oxycodone HydrochlorideEUR X,bad
38,http://psyched36tpuvyilo76rofxq3zgfrw6wnxfd7mhbyzt5iekow7g7q3ad.onion,Brainmagic Biggest onion psychedelics store order LSD Bitcoins online Products FAQs Register Login Brainmagic PsychedelicsAll products tested ourself reagent lab tested Shipping USA ProductPriceQuantity Hits LSD 150ug0 X Hits LSD 150ug0 X Hits LSD 150ug0 X 1g Mescaline HCL pure0 X 10g Mescaline HCL pure0 X 1g DMT Freebase0 X 10g DMT Freebase0 X,bad
39,http://uacazc2ytcw3hi4cfkhzlxwtlh4ef4qf6g3qiq7gfsqgvmz4p22thfqd.onion,Darknet market drugs tutorials digital goods WeedPsychedelicsOpiodsBenzosEcstasy etc cookies javascript trace protect privacy drugsshopperdnmxorg Home QuestionAnswer Cart Contact Escrow Category Cannabis Seeds Cannabis Cocaine Ecstasy LSD Meth RECOMMENDED ITEMS Pure Love Cannabis 20g Feminized Mix X20 Seeds Cannabis Columbia Cocaine 1g Pills Ecstasy Blue Android 200220mg Tabs LSD 200ug Gram Crystal Meth HQ CRYSTAL DRUGS SHOP HOME,bad
40,http://gukm6235mhmwbauv3xtfz3llqm22uaaac57pmqnauxtqr67otxymx7yd.onion,Shop Wain pharmacyBuy drugs anxiety pain killers psychedelics medication pills online Categories ADHD Anastrozole Anti Anxiety atorvastatin Beauty products BEST PLACE Buy Methadone online BOTULINUM Buy ADHD BUY ANXIETY PILLS Buy COVIDVaccine Buy Methadone online BUY NEMBUTAL PENTOBARBITAL Buy PAIN MEDS CBD OIL COVIDAstraZeneca COVIDvaccine Johnson Johnsons Janssen COVIDVaccine Moderna COVIDVaccine Sputnik V COVIDvaccine COVIDVACCINATION CARDS Date Rape Drug Guns HAIR LOSS HIV medications INSOMNIA Ketamine Keytruda Opoid Detox Pain Relief Opana Research chemicals Uncategorized Weight Loss Products search Login Account Favorite Wishlist Cart Cart HOME COVIDADHD ANXIETY COVIDPAIN RELIEF INSOMNIA Guns Contact Us Customer Reviews Track Order Menu Showing 1of results Default Sorting Popularity Average Rating Latest Price Low High Price High Low Sale OnSale Feature Add wishlist ALIAXIN GP 1ML Select optionsQuick View SaleSave 11 Add wishlist AstraZeneca COVIDvaccine shots Add cartQuick View SaleSave 31 Add wishlist Buy ml Pentobarbital sodium Nembutal Oral liquid Online USA Add cartQuick View SaleSave 23 Add wishlist Buy Suicide Nembutal Pentobarbital Sodium Pills 100mg Online Add cartQuick View SaleSave 22Hot Add wishlist Buy Actavis Promethazine cough syrup Online Add cartQuick View SaleSave 17Hot Add wishlist Buy Adderall OnlineRated reviews Add cartQuick View Hot Add wishlist Buy Adipex OnlineRated reviews Add cartQuick View Hot Add wishlist Buy Ambien onlineRated reviews Add cartQuick View Hot Add wishlist Buy Arimidex OnlineRated review Add cartQuick View Hot Add wishlist Buy Ativan OnlineRated reviews Add cartQuick View SaleSave 16Hot Add wishlist Buy Botox OnlineRated review Add cartQuick View Add wishlist buy Cialis mg online without prescription 1Select optionsQuick View Hot Add wishlist Buy Codeine OnlineRated reviews Add cartQuick View Hot Add wishlist Buy Concerta Methylphenidate 54mg Online Select optionsQuick View Add wishlist Buy Demerol safely Online 100mg 6Select optionsQuick View SaleSave 17Hot Add wishlist Buy Diamorphine onlineRated reviews Add cartQuick View Hot Add wishlist Buy Diazepam OnlineRated reviews Add cartQuick View Add wishlist Buy Dilaudid 8mg Online Order Hydromorphone Overnight Select optionsQuick View Hot Add wishlist Buy Dilaudid OnlineRated reviews Add cartQuick View Hot Add wishlist Buy Ecstasy 100mg Online Overnight 3Select optionsQuick View Add wishlist Buy efavirenz online Select optionsQuick View Hot Add wishlist Buy emtricitabine onlineRated review Select optionsQuick View Hot Add wishlist Buy Endocet online Select optionsQuick View Hot Add wishlist Buy Fentanyl Patches OnlineRated reviews Add cartQuick View Hot Add wishlist Buy Flakka Apvp online Read moreQuick View Add wishlist Buy G74 OXYMORPHONE 40MG 6Select optionsQuick View Add wishlist Buy Garcinia Cambogia Extract Select optionsQuick View Add wishlist Buy Generic Klonopin Clonazepam Rivotril mg Tablets Online 1Select optionsQuick View Add wishlist Buy Generic Norco AcetaminophenHydrocodone 325mg10mg Online 4Select optionsQuick View Add wishlist Buy Green Xanax OnlineRated reviews Add cartQuick View Hot Add wishlist Buy Greenstone Xanax OnlineRated review Add cartQuick View Add wishlist Buy Helex online Add cartQuick View Add wishlist Buy Hydrocodone Acetaminophen 10mg Watson Sale 4Select optionsQuick View Hot Add wishlist Buy Hydrocodone onlineRated review Add cartQuick View SaleSave 88 Add wishlist Buy Ketamine OnlineRated reviews 2Add cartQuick View SaleSave 26 Add wishlist Buy Keytruda Online 21Add cartQuick View Add wishlist Buy Klonopin Online Select optionsQuick View Hot Add wishlist Buy lamivudine online Select optionsQuick View SaleSave 19 Add wishlist Buy Lipitor Online 11Add cartQuick View Hot Add wishlist Buy LORTAB 10hydrocodone bitartrate acetaminophen 6Select optionsQuick View Add wishlist Buy Lortab Online Select optionsQuick View Add wishlist Buy Magnus MR Morphine Sulfate mg Capsule Safely Online 2Select optionsQuick View SaleSave 50 Add wishlist Buy Methadone 10mg Oral Tablets Online Legally Add cartQuick View SaleSave 17Hot Add wishlist Buy Methadone online Add cartQuick View Add wishlist Buy Mobic Online Read moreQuick View Hot Add wishlist Buy Modafinil Online01 review Add cartQuick View Add wishlist Buy Morphine 30mg Online overnight 4Select optionsQuick View Hot Add wishlist Buy Morphine Sulfate OnlineRated reviews Add cartQuick View Hot Add wishlist Buy Morphine sulphate InjectionRated reviews Add cartQuick View SaleSave 6Hot Add wishlist Buy NeuroBloc Online Add cartQuick View Hot Add wishlist Buy Norco OnlineRated review Add cartQuick View Hot Add wishlist Buy Opana OnlineRated reviews Add cartQuick View Add wishlist Buy OPANAoxymorphone hydrochloride 40mg er Online 8Select optionsQuick View Hot Add wishlist Buy oxycodone 10mg overnight 4Select optionsQuick View Hot Add wishlist Buy Oxycodone OnlineRated reviews Add cartQuick View Add wishlist Buy Oxycontin 40mg online Cheap 4Select optionsQuick View Hot Add wishlist Buy Oxycontin OnlineRated reviews Add cartQuick View Add wishlist Buy Oxycotin OC 80mg Online 7Select optionsQuick View Hot Add wishlist Buy OxyNorm OnlineRated review Add cartQuick View Hot Add wishlist Buy Pain Soma mg Carisoprodol Prescription Needed 4Select optionsQuick View Next Login Guest Exampleemailcom Main Menu x HOMECOVID19ADHDANXIETYCOVID19PAIN RELIEFINSOMNIAGunsContact UsCustomer ReviewsTrack Order X,bad
