index,link,text,marker
22,http://docmartqq3oqe2a7eoasin53aqdvt24lu33wynmdp3tiahm35x7qmwqd.onion/index.php/product/australian-passport/,Australian Passport Fake Passport ID Cards Drivers License Skip content Email docmartadminprotonmailcom Address docmartqq3oqe2a7eoasin53aqdvt24lu33wynmdp3tiahm35x7qmwqdonion MARKET TRACK ORDER REVIEWS Proof CART Australian Passport Australian Passport Rated based customer ratings customer reviews 1Type Choose optionFake AU PassportReal AU PassportClear Australian Passport quantity Add cart SKU NA Category Australia Tag Australian Passport Description Additional information Reviews 9 Description Services BUY REALFAKE AUSTRALIAN PASSPORT ONLINE produce real novelty documents types products printed highquality printing machines valid holograms secret features passed UV light verification equipment Dont worry cop stopping Rest assured documents 100 real registered Save time buy passport online lost birth certificate fire somebody steal ID card passport expired answered yes questions solution need waste time wait long lines receive renew documents order online clicks comfort home Save time something enjoy let us fix problems BUY REAL FAKE US PASSPORT ONLINE order passport online Getting new documents easy 123 fill short form upload picture signature fingerprints scan place order soon pay proceed prepare passport printing Delivery time depends order questions regarding shipment dont hesitate contact us service 247 fake IDs passports use information want dont need upload biometrics sell novelty documents recommend using official matters work travel likely cause serious legal problems police Beware scams lot cheap passports offers web Dont fall one traps order documents frauds may sell fake passport disguised real one totally safe ordering docmartaspeuouvwonion guarantee real documents 100 genuine registered government database according official state requirements make sure personal information stays confidential shipments discreet Check testimonials happy customers book free appointment one expert consultants help solve problemsBuy Novelty US Passport online buy real passport online us years experience selling valid documents world insiders work different government institutions ensure real passports IDs certificates genuine undistinguishable documents issued authorities offer real fake passports sale reasonable price provide premium quality affordable anyone Forget bureaucracy standing long lines waiting months difference real fake Passports produce real fake documents Visually wont able tell apart difference dont register fake Passport government databases Thus surely use Unnecessary work decide immigration scanner reveal fake legal problems Fake Passports cheaper However plan use regularly highly recommend getting one real Passports instead choice discretionwhere buy Passports online Additional information Type Fake AU Passport Real AU Passport reviews Australian Passport 48Rated 5Based reviews5 star77star22star0star0star0Powered Customer Reviews plugin Rated chipolin007 April 24 Wow FedEx delivered package next day Looked great guys amazing job site Thank much Rated liao_pakan August 8 less weeks get Aussie Passport business trip ordered 5day service got passport within days complaint bit pricey service post office fee Customer service friendly companies Ive dealt important things right satisfied Rated matt_georgeff August 15 Hi docs new passport arrived courier morning thankyou prompt efficient service document quality perfectly well Rated amantc July 20 Price high question used crossing border mean traveling purpose Rated dinodin December 28 would like thank want buy passports Rated henryroberts321 January 20 way many questions answerd change information several times thry fast without problem product came looked exactly like original need product like company better Rated thomasperth February 7 Efficient friendly timely Needed passport less two weeks got time spare Notified sent arrived pickup Rated maha_mahoor April 4 Super friendly contact responses fast emails Im always happy recommend seller 100 Rated YAS store manager September 5 firstclass citizen thank comrades Add review Cancel replyYour email address published Required fields marked Name Email rating Rate Perfect Good Average bad poor review Save name email website browser next time comment Related products Australian Residency PermitRated Select options Australian Drivers LicenseRated Select options Product categoriesUK 4 USA 4 Australia 3 New Zealand 3 Canada 4 French 4 German 4 Belgium 3 Spain 3 Theme BCF aThemeArt Proudly powered WordPress BACK TOP,bad
23,http://docmartqq3oqe2a7eoasin53aqdvt24lu33wynmdp3tiahm35x7qmwqd.onion/index.php/product/buy-usa-id-card/,Buy USA ID card Fake Passport ID Cards Drivers License Skip content Email docmartadminprotonmailcom Address docmartqq3oqe2a7eoasin53aqdvt24lu33wynmdp3tiahm35x7qmwqdonion MARKET TRACK ORDER REVIEWS Proof CART Buy USA ID card Buy USA ID card Rated based customer ratings customer reviews Type Choose optionFake USA IDReal USA IDClear Buy USA ID card quantity Add cart SKU NA Category USA Tag Buy USA ID card Description Additional information Reviews 8 Description BUY REALFAKE USA ID CARD ONLINE DocMart store give opportunity buy fake ID cards online easy Pizza safely solve problem buy USA ID cards online use high quality equipment materials produce authentic fake ID Card Time goes slowly particular waiting show sooner later get identification cardBuy USA ID card online moments frustration looks like present day way come example bounced nightclub sober person party simply underage dont worry humanity already invented way ease pain called realfake ID card Teenagers using ages demand fakes IDs especially rise modern technologies enabled us make fake ID cards look real ever Long gone days broke piggy bank get blurry laminated piece paper could easily produced friends color printer Nowadays avoid dealing sketchy guys dark alleys order ID online easy pizza come looking exactly like real thingBuy USA ID card online Buy ID card online make identity protected Get Best Scannable Fake ID Online Today Order premium fake IDs come Scannable features buy Fake USA Id Cards Online Buy fake USA ID card online help common problem almost facing nowadays Without documents identity work keeping everything mind neglect even small requirement thats work always high quality help living better life dreamed us information safe trust us difference real fake ID cards produce real fake documents Visually wont able tell apart difference dont register fake ID cards government databases Thus surely use card get club buy drink bar decide vote scanner reveal fake legal problems Fake IDs cheaper However plan use regularly highly recommend getting one real IDs instead choice discretionwhere buy ID card online Additional information Type Fake USA ID Real USA ID reviews Buy USA ID card 50Rated 5Based reviews5 star100star0star0star0star0Powered Customer Reviews plugin Rated cornell September 19 Never problem mine ids anywhere Id give 10on usability document looks pretty fine nobody question Thanks Guys Rated nasty September 16 got NY ID card although yet used cant say whether works looks pretty good good fake Rated TiScHu9245 store manager October 16 YEEEEAAAAHHHH YEARS OLD EVERYTHING YOOHOOOOOOOOO Rated Daniel store manager October 30 God bless work feed family Rated harper123fog April 7 order one Texas id card Rated cornell May 6 Wait long seems like solid product Vibrant OVI UV Signature good faux microprint looks good loupe Satin lamination Rated nvxzryipstore manager May 27 third deal guys problems far Rated greenhell store manager September 26 fast delivery bad support Add review Cancel replyYour email address published Required fields marked Name Email rating Rate Perfect Good Average bad poor review Save name email website browser next time comment Related products Buy USA PassportRated 1Select options Buy USA Residency PermitRated Select options USA Drivers LicenseRated Select options Product categoriesUK 4 USA 4 Australia 3 New Zealand 3 Canada 4 French 4 German 4 Belgium 3 Spain 3 Theme BCF aThemeArt Proudly powered WordPress BACK TOP,bad
24,http://docmartqq3oqe2a7eoasin53aqdvt24lu33wynmdp3tiahm35x7qmwqd.onion/index.php/product/buy-usa-id-card/,Buy USA ID card Fake Passport ID Cards Drivers License Skip content Email docmartadminprotonmailcom Address docmartqq3oqe2a7eoasin53aqdvt24lu33wynmdp3tiahm35x7qmwqdonion MARKET TRACK ORDER REVIEWS Proof CART Buy USA ID card Buy USA ID card Rated based customer ratings customer reviews Type Choose optionFake USA IDReal USA IDClear Buy USA ID card quantity Add cart SKU NA Category USA Tag Buy USA ID card Description Additional information Reviews 8 Description BUY REALFAKE USA ID CARD ONLINE DocMart store give opportunity buy fake ID cards online easy Pizza safely solve problem buy USA ID cards online use high quality equipment materials produce authentic fake ID Card Time goes slowly particular waiting show sooner later get identification cardBuy USA ID card online moments frustration looks like present day way come example bounced nightclub sober person party simply underage dont worry humanity already invented way ease pain called realfake ID card Teenagers using ages demand fakes IDs especially rise modern technologies enabled us make fake ID cards look real ever Long gone days broke piggy bank get blurry laminated piece paper could easily produced friends color printer Nowadays avoid dealing sketchy guys dark alleys order ID online easy pizza come looking exactly like real thingBuy USA ID card online Buy ID card online make identity protected Get Best Scannable Fake ID Online Today Order premium fake IDs come Scannable features buy Fake USA Id Cards Online Buy fake USA ID card online help common problem almost facing nowadays Without documents identity work keeping everything mind neglect even small requirement thats work always high quality help living better life dreamed us information safe trust us difference real fake ID cards produce real fake documents Visually wont able tell apart difference dont register fake ID cards government databases Thus surely use card get club buy drink bar decide vote scanner reveal fake legal problems Fake IDs cheaper However plan use regularly highly recommend getting one real IDs instead choice discretionwhere buy ID card online Additional information Type Fake USA ID Real USA ID reviews Buy USA ID card 50Rated 5Based reviews5 star100star0star0star0star0Powered Customer Reviews plugin Rated cornell September 19 Never problem mine ids anywhere Id give 10on usability document looks pretty fine nobody question Thanks Guys Rated nasty September 16 got NY ID card although yet used cant say whether works looks pretty good good fake Rated TiScHu9245 store manager October 16 YEEEEAAAAHHHH YEARS OLD EVERYTHING YOOHOOOOOOOOO Rated Daniel store manager October 30 God bless work feed family Rated harper123fog April 7 order one Texas id card Rated cornell May 6 Wait long seems like solid product Vibrant OVI UV Signature good faux microprint looks good loupe Satin lamination Rated nvxzryipstore manager May 27 third deal guys problems far Rated greenhell store manager September 26 fast delivery bad support Add review Cancel replyYour email address published Required fields marked Name Email rating Rate Perfect Good Average bad poor review Save name email website browser next time comment Related products Buy USA Residency PermitRated Select options Buy USA PassportRated 1Select options USA Drivers LicenseRated Select options Product categoriesUK 4 USA 4 Australia 3 New Zealand 3 Canada 4 French 4 German 4 Belgium 3 Spain 3 Theme BCF aThemeArt Proudly powered WordPress BACK TOP,bad
25,http://docmartqq3oqe2a7eoasin53aqdvt24lu33wynmdp3tiahm35x7qmwqd.onion/index.php/product/uk-id-card/,UK ID card Fake Passport ID Cards Drivers License Skip content Email docmartadminprotonmailcom Address docmartqq3oqe2a7eoasin53aqdvt24lu33wynmdp3tiahm35x7qmwqdonion MARKET TRACK ORDER REVIEWS Proof CART UK ID card UK ID card Rated based customer ratings customer reviews Type Choose optionFake UK IDReal UK IDClear UK ID card quantity Add cart SKU NA Category UK Tag UK ID card Description Additional information Reviews 6 Description Buy UK ID card online moments frustration looks like present day way come example bounced nightclub sober person party simply underage dont worry humanity already invented way ease pain called realfake ID card Teenagers using ages demand fakes IDs especially rise modern technologies enabled us make fake ID cards look real ever Long gone days broke piggy bank get blurry laminated piece paper could easily produced friends color printer Nowadays avoid dealing sketchy guys dark alleys order ID online easy pizza come looking exactly like real thingBuy UK ID card online Buy ID card online make identity protected Get Best Scannable Fake ID Online Today Order premium fake IDs come Scannable features buy Fake UK Id Cards Online Buy fake UK ID card online help common problem almost facing nowadays Without documents identity work keeping everything mind neglect even small requirement thats work always high quality help living better life dreamed us information safe trust us difference real fake ID cards produce real fake documents Visually wont able tell apart difference dont register fake ID cards government databases Thus surely use card get club buy drink bar decide vote scanner reveal fake legal problems Fake IDs cheaper However plan use regularly highly recommend getting one real IDs instead choice discretionwhere buy ID card online Additional information Type Fake UK ID Real UK ID reviews UK ID card 47Rated 5Based reviews5 star66star33star0star0star0Powered Customer Reviews plugin Rated clarke2289 May 26 Excellent service got driver permits less days nice agents Rated johnywalker July 1 need items make discount bulk orders Rated benjamin October 25 Great service really easy fast Rated chenlau December 13 quality impressive convincing ominous impression recommend Rated qestionxx May 6 real original copy Rated michaelklark May 11 Easy fast days received order didnt even step foot delivery spot Thanks Add review Cancel replyYour email address published Required fields marked Name Email rating Rate Perfect Good Average bad poor review Save name email website browser next time comment Related products UK Drivers LicenseRated Select options UK Residency PermitRated Select options Buy Uk PassportRated 2Select options Product categoriesUK 4 USA 4 Australia 3 New Zealand 3 Canada 4 French 4 German 4 Belgium 3 Spain 3 Theme BCF aThemeArt Proudly powered WordPress BACK TOP,bad
26,http://docmartqq3oqe2a7eoasin53aqdvt24lu33wynmdp3tiahm35x7qmwqd.onion/index.php/product/uk-id-card/,UK ID card Fake Passport ID Cards Drivers License Skip content Email docmartadminprotonmailcom Address docmartqq3oqe2a7eoasin53aqdvt24lu33wynmdp3tiahm35x7qmwqdonion MARKET TRACK ORDER REVIEWS Proof CART UK ID card UK ID card Rated based customer ratings customer reviews Type Choose optionFake UK IDReal UK IDClear UK ID card quantity Add cart SKU NA Category UK Tag UK ID card Description Additional information Reviews 6 Description Buy UK ID card online moments frustration looks like present day way come example bounced nightclub sober person party simply underage dont worry humanity already invented way ease pain called realfake ID card Teenagers using ages demand fakes IDs especially rise modern technologies enabled us make fake ID cards look real ever Long gone days broke piggy bank get blurry laminated piece paper could easily produced friends color printer Nowadays avoid dealing sketchy guys dark alleys order ID online easy pizza come looking exactly like real thingBuy UK ID card online Buy ID card online make identity protected Get Best Scannable Fake ID Online Today Order premium fake IDs come Scannable features buy Fake UK Id Cards Online Buy fake UK ID card online help common problem almost facing nowadays Without documents identity work keeping everything mind neglect even small requirement thats work always high quality help living better life dreamed us information safe trust us difference real fake ID cards produce real fake documents Visually wont able tell apart difference dont register fake ID cards government databases Thus surely use card get club buy drink bar decide vote scanner reveal fake legal problems Fake IDs cheaper However plan use regularly highly recommend getting one real IDs instead choice discretionwhere buy ID card online Additional information Type Fake UK ID Real UK ID reviews UK ID card 47Rated 5Based reviews5 star66star33star0star0star0Powered Customer Reviews plugin Rated clarke2289 May 26 Excellent service got driver permits less days nice agents Rated johnywalker July 1 need items make discount bulk orders Rated benjamin October 25 Great service really easy fast Rated chenlau December 13 quality impressive convincing ominous impression recommend Rated qestionxx May 6 real original copy Rated michaelklark May 11 Easy fast days received order didnt even step foot delivery spot Thanks Add review Cancel replyYour email address published Required fields marked Name Email rating Rate Perfect Good Average bad poor review Save name email website browser next time comment Related products Buy Uk PassportRated 2Select options UK Residency PermitRated Select options UK Drivers LicenseRated Select options Product categoriesUK 4 USA 4 Australia 3 New Zealand 3 Canada 4 French 4 German 4 Belgium 3 Spain 3 Theme BCF aThemeArt Proudly powered WordPress BACK TOP,bad
27,http://lmoneylmwki7lv4vtijsqr23p6odzpyaw3uffsbm6f5e3osy3wkrfvad.onion,Light Money Discount FAQ Proofs Contact GO LIVE FREE DELIVERY World Exspress Shipping ANONIMITY safety 100 SUPPORT 24We always happy help MANUAL Detailed manual every order SERVICE SPEED Minimum lead time order ESCROW Money back guarantee Welcome world LIGHTMONEY offer large selection dark cash transactions lowest price find credit cards great balance Reliability products tested specialists fully consistent description sure honesty seller Delivery Fast free exspress shipping worldwide ship goods within hours payment Support Technical support always happy hear questions online 24also check FAQ VISA Work World Wide Digit PIN Code Included Best Stores Online Shopping ATMs withdrawals BUY VISA Work World Wide Digit PIN Code Included Best Stores Online Shopping ATMs withdrawals BUY VISA Work World Wide Digit PIN Code Included Best Stores Online Shopping ATMs withdrawals BUY MasterCard Work World Wide Digit PIN Code Included Best Stores Online Shopping ATMs withdrawals BUY MasterCard Work World Wide Digit PIN Code Included Best Stores Online Shopping ATMs withdrawals BUY MasterCard Work World Wide Digit PIN Code Included Best Stores Online Shopping ATMs withdrawals BUY American Express Work World Wide Digit PIN Code Included Best Stores Online Shopping ATMs withdrawals BUY American Express Work World Wide Digit PIN Code Included Best Stores Online Shopping ATMs withdrawals BUY American Express Work World Wide Digit PIN Code Included Best Stores Online Shopping ATMs withdrawals BUY IMPORTANT INFORMATION buying check correctness data entered transfer funds third parties wallets indicated payment cells case problems open dispute mail lightmoneyprotonmailcom success rate close 100 however card blocked first three days use receive replacement additional balance Please try deceive us always check status card case blacklisted Happy shopping Thank cooperation Enable JavaScript start order dangerous anonymity Reliability PayPal Safely Fast transfer Easy 100 guarantee blocking personal account BUY PayPal Safely Fast transfer Easy 100 guarantee blocking personal account BUY PayPal Safely Fast transfer Easy 100 guarantee blocking personal account BUY Western Union Safely Fast transfer Easy MTCN number tracking receiving transfers BUY Western Union Safely Fast transfer Easy MTCN number tracking receiving transfers BUY Western Union Safely Fast transfer Easy MTCN number tracking receiving transfers BUY MoneyGram Safely Fast transfer Easy Reference number used receive cash specified office BUY Card Transfer Safely Fast transfer Easy 100 guarantee blocking personal account BUY Payeer Safely Fast transfer Easy 100 guarantee blocking personal account BUY Welcome Easy Safe eGifts wanted buy something long time waiting discounts help make purchases enjoyable Thanks electronic gifts make purchases world sites much profitable Safely 100 Egifts tracked Funds credited resource account site convenient need wait Egifts delivered immediately payment Email address specify placing order Support 24The support service quickly solve problem Fast activation Egifs buy dream right Amazon Gift Safe fast Easy Code sent specified email address BUY Ebay Safe fast Easy Code sent specified email address BUY Asos Safe fast Easy Code sent specified email address BUY Evidence Reviews Open Proof us FAQ Proofs Contact Product Prepaid Card Money Transfer eGifts Proofs Delivery Contact lightmoneyprotonmailcom price Use EscrowCoin transactions protected EscrowCoincom,bad
28,http://2a2a2abbjsjcjwfuozip6idfxsxyowoi3ajqyehqzfqyxezhacur7oyd.onion,Empire Market Best darknet market Credit Card Cloned Carding Hacking Drugs Dumps Paypal Hack Free Bitcoin Money Counterfeit Cash Buy Gun Gift Passport Visa Mastercard Amex Verified Trusted Bitcoins Escrow Top Hidden Wiki Onion Links Forum Skip content Empire Market Best darknet market Credit Card Cloned Carding Hacking Drugs Dumps Paypal Hack Free Bitcoin Money Counterfeit Cash Buy Gun Gift Passport Visa Mastercard Amex Verified Trusted Bitcoins Escrow Top Hidden Wiki Onion Links Forum Shop FAQ Escrow Shipping Bitcoin Vendor News Total items View Cart products cart BOOKMARK SAVE URL http2a2a2abbjsjcjwfuozip6idfxsxyowoi3ajqyehqzfqyxezhacur7oydonion 12132021 Special offer Use code checkout get discount COVID EMPIRE MARKET VENDOR MONTH BTC Bitcoin wallet New items added TODAY Counterfeits Credit Cards Documents Drugs Gadgets Gift Cards Guns Money Transfers EVERY TRADE PROTECTED ESCROW LEARN iPhone Pro Max 512GB Rated based customer ratings COVIDVACCINE CARD CERTIFICATE registered WORLDWIDE w QRCODE Sale Product sale Rated based customer ratings PreShredded USD CASH Sale Product sale 21Rated based customer ratings USDEURCADAUDGBPANY Stress free virtual physical CC Private method WORLDWIDE Sale Product sale Rated based customer ratings SALE LB GRAMS Bubba Kush Fire Sale Product sale Rated based customer ratings Hacking Services network Sale Product sale Rated based customer ratings x MasterCard Prepaid 3100 2700 Sale Product sale Rated based customer ratings USD Cash App money transfer cashapp flip Sale Product sale Rated based customer ratings PayPal Transfer 2500 Rated based customer ratings Become vendor darkweb market JOIN US Tracking Tracking given day purchase found receipt confirmation email receive Physical shipment vendors ship package within hour receiving notification payment Escrow DHL UPS ship MondayFriday holidays Vendors ship FEDEX MonSat delivery service mention checkout process ask want special FEDEX DHL UPS MAIL packages mailed day Packaging Labeling Small orders shipped inside magazines binders Large orders shipped boxes labeling appear like Ebay Amazoncom package Additional stealth precautions taken dont publicly share Please let us know special requirements Items via Emai Gift Cards CreditDebit Cards Transfersetc Items sent via email require identity information name address etc enter random characters alternative Client receives response within hrs case mass digital goods orders receiving order may take 5hrs advise patient respond accordingly Recent Commentsakon PreShredded USD CASHseller x Visa Prepaid 3100 2700seller GSG FireFly Threaded Barrel Extrasxxeaus GSG FireFly Threaded Barrel Extrasxj173 x Visa Prepaid 3100 2700smizzle PreShredded USD CASHseller COVIDVACCINE CARD CERTIFICATE registered WORLDWIDE w QRCODEDes COVIDVACCINE CARD CERTIFICATE registered WORLDWIDE w QRCODEanony BTC Bitcoin wallet limited stock VENDOR MONTH seller x Visa Prepaid 3100 2700my cup runith PreShredded USD CASHFrenk x Visa Prepaid 3100 2700seller PreShredded USD CASHPeter PreShredded USD CASHAnonymous PreShredded USD CASHShopCounterfeits 12 Credit Cards 18 Documents 22 Drugs 50 Gadgets 47 Gift Cards 14 Guns 36 Money Transfers 18 30 Vendor month BTC Bitcoin wallet limited stock Hot right PreShredded USD CASH InfoHow pay Read Shipping FAQSupport empiresupportairmailcc Copyright Empire Market Right Reserved Theme NewStore ThemeFarmer X,bad
29,http://deepmexzsejpzqid3k7knaas2p73dko6kxgpou7oey7vqtmrhopjyqyd.onion,Forbidden Forbidden nginx,bad
