index,link,text,marker
0,http://passpor7quy5r2bwtzgzfmyujqqq5ciwhpd4qwpjmj7sepfi5hvfjeqd.onion,Onion Identity Services Get fake passport new identity today Products Info Registration Login Order Process buying ID passport send us message age gender find matching dataset alternatively provide dataset name age gender size etc also need biometric photo high quality signature scanned give instructions purchase Passports ProductPriceQuantity Lithuanian Passport0 X Netherlands Passport0 X Denmark Passport0 X Great Britain Passport0 X Canada Passport0 X ID Cards ProductPriceQuantity Czech ID Card0 X Netherlands ID Card0 X Denmark ID Card0 X French ID Card0 X Lithuanian ID Card0 X Drivers Licenses ProductPriceQuantity Norway Drivers License0 X Denmark Drivers License0 X Netherlands Drivers License0 X UK Drivers License0 X Onion Identity Services rights reserved,bad
1,http://ymvhtqya23wqpez63gyc3ke4svju3mqsby2awnhd3bk2e65izt7baqad.onion,Onion Identity Services Get fake passport new identity today Products Info Registration Login Order Process buying ID passport send us message age gender find matching dataset alternatively provide dataset name age gender size etc also need biometric photo high quality signature scanned give instructions purchase Passports ProductPriceQuantity Lithuanian Passport1350 EUR X Netherlands Passport1500 EUR X Denmark Passport1500 EUR X Great Britain Passport1800 EUR X Canada Passport1250 EUR X ID Cards ProductPriceQuantity Czech ID Card500 EUR X Netherlands ID Card550 EUR X Denmark ID Card550 EUR X French ID Card550 EUR X Lithuanian ID Card500 EUR X Drivers Licenses ProductPriceQuantity Norway Drivers License550 EUR X Denmark Drivers License550 EUR X Netherlands Drivers License550 EUR X UK Drivers License500 EUR X Onion Identity Services,bad
2,http://kuganzoycoyju5felbhrforat3a5gxgzamt4x2aamuzlytx5j4fjrfid.onion,Shop FakeReal Passport ID Cards Drivers License Residency Visa MARKET TRACK ORDER SERVICES REVIEWS PROOFS IMAGES CART Blog Shop Shop sliders_pack id9956 Sort Default sortingSort popularitySort average ratingSort latestSort price low highSort price high low Showing 1of results Australian Drivers LicenseRated Australian ID cardRated Australian PassportRated 1Australian Residency PermitRated Canada Drivers LicenseRated Canada ID cardRated Canada PassportRated 1Canadian Residency PermitRated French Drivers LicenseRated French ID cardRated French PassportRated 1French Residency PermitRated Filter price Filter Price Product categoriesUK 4 USA 4 Australia 4 New Zealand 3 Canada 4 French 4 German 4 FakeReal Passport ID Cards Drivers License Residency Visa Checkout items,bad
3,http://ukpasspnxpdvtpqphksw43jazohlcf6yxz36w4zoslnuatzmmkkatkqd.onion,UK Passports Buy real UK passports become UK citizen passports fake passports real passports Products Login Register FAQs UK Passport Name choiceWe selling original UK Passports made infopicture Also info get entered official passport database possible travel passports Trade secret Information send us info pictures given purchase even enter UKEU passports add stamp country Ideal people want work EUUK ProductPriceQuantity original UK passport infopictures0 X,bad
4,http://dsbawehn5fpjygwixyuohwn4lnsoa2xilt2n47ppcvtmehqhfkq5cqad.onion,Fake passport sale Fast Documents Skip content Home Services Bank statement Driver License Cloned Credit Cards Social Security Card FAQs Payment Blog Contact Search Toggle Navigation Toggle Navigation Home Services Bank statement Driver License Cloned Credit Cards Social Security Card FAQs Payment Blog Contact Fake passport sale Fake passport sale Buy real passport onlineBuy real fake documentsFake documents makerBuy real fake passportsBuy fake documents online fake passport sale genuine passport sale sell high quality fake passportsgenuine passport salereal fake passports salenovelty passports sale fake passport sale Marriage Certificate onlineBuy social security cardGet marriage certificate onlineBuy fake driver lincense onlineReal fake resident permit Buy documents onlineBuy fake ielts certificate fake passport sale Buy genuine ielts certificateBuy SSN Online Noverlty documents maker Buy faje SNN OnlineBuy Fake ID card Online Apply real passportBuy real fake passportBuy fake real documents online fake passport saleDrivers license Buy fake real passports online Buy drivers license online Get new id cards onlineBuy new birth certificatepurchase documents onlineBuy certificates online fake passport saleBuy diplomas online Original ielts certificates onlineBuy passport onlineBuy identity card online Get Citizenship Online Buy driving license onlineBuy residence permit online fake passport sale Buy documents onlineBuy IELTS without exams Fake passport saleBUY FAKE PASSPORTSBuy fake passports USA USAfake passport sale Novelty passport saleBuy fake drivers license Malta Malta Fake passport sale decade experience producing selling best quality fake real Identification Documents Trust us better tomorrow Fast Documents offer Fake passports Drivers license SSN Fake bank statement Sell hacked credit cards aim providing quality passport services clients email protected WhatsApp novelty passport salenovelty passportplastic id card printernovelty documentsdrivers license hologram salecamouflage passport salefake passportsnovelty passportcamouflage passportfake passports salebuy fake moneybuy counterfeit moneyfake drivers licensereplica passportreal fake passports salefake ids salepassports saleaustralian fake idfake british money salefake passports onlinereal passport salecamo passport holderwhere buy fake moneyhigh quality camouflage passportsfake documents onlinecounterfeit money sale onlinebuy passportsell passport onlinewhere buy counterfeit moneybuy camouflage passportbuy novelty passportnovelty passport onlinebuy passportnovelty drivers licensecamouflage passportpassport salefake licensenovelty documentsfake uk driving licencereal fbi badgebuy passport onlinehow make idnovelty passport holdernovelty documents salefree id card uknovelty passport templatefake passports salefake driving licence online diplomatic passport salewe sell high quality fake passportsfake bank statementfake bank statementsbank statement templatebank statement examplesample bank statementsbank statement examplesbank statements examplefake documentbank statement generatorfake documentbank statement samplebank statements sample novelty passport salenovelty passportplastic id card printerdrivers license hologram salecamouflage passport salefake passportsnovelty passportcamouflage passportfake passports salebuy fake moneybuy counterfeit moneyfake drivers licensereplica passportreal fake passports salefake ids salepassports saleaustralian fake idfake british money salefake passports onlinereal passport salecamo passport holderwhere buy fake moneyhigh quality camouflage passportsfake documents onlinecounterfeit money sale onlinebuy passportsell passport onlinewhere buy counterfeit moneybuy camouflage passportbuy novelty passportnovelty passport onlinebuy passportnovelty drivers licensecamouflage passportpassport salefake licensenovelty documentsfake uk driving licencereal fbi badgebuy passport onlinehow make idnovelty passport holdernovelty documents salefree id card uknovelty passport templatefake visawe sell high quality fake passportsfake passports salefake driving licence online diplomatic passport sale choose us decade experience producing selling best quality fake real Identification Documents Trusted many globe produce better quality better service better turnaround Continual growth enabled us compete even worlds largest manufacturers produce genuine fake documents work numerous embassies within without country authenticate everything processed goal one best document vendors online help people difficulties obtaining legal travel documents Novelty passport sale High Security clients security number one priority 100 SECURITY guaranteed clients keep clients encrypted period longer months ship clients order information deleted servers Quality Materials Genuine sophisticated materials used production documents use quality materials used government authorities worldwide bring secure durable quality products clients used documents thus documents 100 Scannable Documents real documents pass test including data scanning devices confident going customs real passports guarantee nobody stop border documents genuine Services Buy fake passportsFake passports sale Get new life new identity fake passports exactly like original passports Novelty passport sale Fake Bank StatementFake Bank Statement Create replacement fake bank statement European American UK banks Buy Drivers LicenceFast Documents supply full drivers license without taking drivers license exam also save lot money time Cloned Credit CardHackers use credit card skimmers obtain magnetic stripe information credit debit card information gotten limited credit card pin numbers CVV expiry date docentwelzijn Fast Documents serviceIf lacking time go standard process obtaining personal identification document Fortunately lot vendors provide fake passports sale web Need documents like yesterday Send us message Novelty passport sale Fake passport saleThere million reasons people might need fake documents common one course urgent need leave country even new life face emergencies dont time deal redtape hassles may long days weeks Fast Documents comes years operation weve helped thousands clients find way troublesome situations wide range passports sale possess features governmentissued documents used anywhere go local institutions customs Fast Documents Rights Reserved WhatsApp English Arabic Chinese Simplified Czech Danish Dutch English Estonian Filipino French German Indonesian Irish Italian Korean Latvian Lithuanian Portuguese Russian Spanish clients say Fast Documents customers say Duvall Pretty good polite kind outstanding work carried good price would highly recommend Kylie Hodgson Ordered online fast efficient communication Richard receive parcel Fast Documents time Thanks Chaze lambert Thank guys making replacement bank statement order Max Jason Excellent service Richard friendly professional Thank getting us real registered passports great prices James Pretty good polite kind outstanding work carried good price would highly recommend Clair Martha Thanks much pay house bills blank credit card Highly Recommended Johnathan Otto Outstanding quality services excellent value fantastic customer service Highly recommend company buy real German passport online drivers license real fake documents Leo Highly Recommended Chase bank statement processed within hours served purpose thanks Job Marcus car year failed many driving tests thanks able real drivers license find best place like Fast Documents stick refer many people Blažej Great service happy service called several times asking questions kind helpful Czech Passport came within business days promised Read Excellent,bad
5,http://wosc4noitfscyywccasl3c4yu3lftpl2adxuvprp6sbg4fud6mkrwqqd.onion,UK Passports Buy real UK passports become UK citizen passports fake passports real passports Products Login Register FAQs UK Passport Name choiceWe selling original UK Passports made infopicture info get entered official passport database possible travel passports Trade secret Information send us information pictures given purchase even enter UKEU passports add stamp country send passport country Ideal people want work EUUK ProductPriceQuantity original UK passport infopictures 50 final price pay 50 show pictures new passport850 GBP X NEW UK bank account online banking card Great cashing bitcoin Accounts created secure way make sure dont get bannedGBP X,bad
6,http://tshop5vevklkyadr2tzxuo3ywylbx3f6ewnvkuqjhz36epcwr6e7klqd.onion,TorShops Create onion store buy sell drugs guns counterfeits fake ids fake passports bitcoin Products Login Register Info Buy onion store Get onion store full Bitcoin integration want run independent shop Tor hidden service anonymously want accept Bitcoins payment goods services Maybe already selling SilkRoad would prefer website TorShops lets create shop like affordable prices TorShops anyone run store Tor hidden service accept Bitcoins without worry technical details Create account contact us questions Features Integrated Bitcoin Wallet Message Center easy communication customers Easy tracking orders users pay order gets submitted Intelligent inventory management Support multiple categories may use HTML make product descriptions unique Secure fast server daily backups onion domain characters beginning choose example 123456xxxxxxxxxxonion Choose many free design templates buy custom design template Free custom logo every store SubForum TorShops Forums user feedback reviews Click list FREE designs Pricing Setup fee currently USD Sales fee 6 sales 35 large volume sellers individual basis See upgrades store upgrade prices Get started ProductPriceQuantity onion store100 USD X Store upgradesPurchase upgrades store ProductPriceQuantity Fully custom shop design made one designers500 USD X forums extra onion address150 USD X TorShops Create onion storetshop5vevklkyadr2tzxuo3ywylbx3f6ewnvkuqjhz36epcwr6e7klqdonion,bad
7,http://wx2suzjqi7ulub6uoslahhnqggkxmbpo5avpw3eacplvmqvin4mccdid.onion,Javascript currently disabled browserPlease enable Javascript refresh page best experience Refresh EzPass Buy real passport Buy passport Online fake passport sale BuyPass Buy genuine passportsAbout Passports Questions answers Contact Welcome BuyPassEasy passports real legally issued passport associates within Department State Passport Agency work exactly like US passport valid years passport document issued national government namely special ministries Ministry Foreign Affairs Ministry Internal Affairs document given certifies holderis identity nationality Moreover passing relevant verification procedure facilitates attaining different purposes eg ones associated international visits structure passport elements usually accounted four basic types data man particular name date birth place birth sex However passports involve data holderis height color eyes etc passport brings thought right protection abroad adequate needed actions exercised governmentis representatives national get hot water hand passport associated right enter oneis country However passport promote rights De facto determined nationality passport attests holderis nationality thus guarantee rights protecting abroad entering country passport perceived nationstate confident demonstration national sovereignty ability control citizens Herewith potential actual control people national foreign territory nationstate explicit interest control movement freedom interest motivate colluding cryptological measures aimed exercising limiting actions regarding citizen Quick anonymous payment Delivery EU days Delivery outside EU days problem guarantee 90 money backPassports service real dont need prove know real ones among Dark Web passport selling sites Trust us chose others risk USA Passport Authentic real USA passport matching biometric picture profile Include travel stamps country use travel USA anywhere world Price UK Passport Authentic real UK passport matching biometric picture profile Include travel stamps country use travel anywhere world Price US Citizenship Birth Certificate Identification Social Security USA passport travel stamps country use package travel anywhere world travel USA live citizen Price EU Passport Authentic real EU passport matching biometric picture profile Include travel stamps country use travel anywhere world Price JP Passport Authentic real JP passport matching biometric picture profile Include travel stamps country use travel anywhere world WarrantyPrice CN Passport Authentic real CN passport matching biometric picture profile Include travel stamps country use travel anywhere world WarrantyPrice Questions answers 1 passports genuine check someone get caught immigration whilst travelling Yes passports genuine free possible immigration inspection course control unforeseen events 2 passport holders details database holders data consulted previously database consulates access 3 guarantees provide passport cannot used fully responsible customers cases problem use passport inform us correctly exactly happened refund 90 amount paid 4 discount ordering one passport Yes passports make discount 5 need provide genuine name address Yes name genuine address third party delivery doubt contact usrealtorsellerkeemailmeCopyright BUYPASS rights reserved Email Address COPY PAYMENT MADE BUY BITCOIN virtual intangible currency currency changing value stocks stored Wallet virtual purse sent received Transactions Bitcoin made directly without need intermediaries Banks financial entities necessary Bitcoin backed government rely trust central issuer Bitcoin Units BTC dBTC cBTC mBTC µBTC Satoshi smallest unit Bitnovocom,bad
8,http://uescqfrcztbhb6tmhdlbejrjfwgtpckcoiwmwq5bfq5hhkwfioan7qad.onion,TorShops Create onion store buy sell drugs guns counterfeits fake ids fake passports bitcoin Products Login Register Info Buy onion storeGet onion store full Bitcoin integration want run independent shop Tor hidden service anonymously want accept Bitcoins payment goods services Maybe already selling SilkRoad would prefer website TorShops lets create shop like affordable prices TorShops anyone run store Tor hidden service accept Bitcoins without worry technical details Create account contact us questions Features Integrated Bitcoin Wallet Message Center easy communication customers Easy tracking orders users pay order gets submitted Intelligent inventory management Support multiple categories may use HTML make product descriptions unique Secure fast server daily backups onion domain characters beginning choose example 123456xxxxxxxxxxonion Choose many free design templates buy custom design template Free custom logo every store SubForum TorShops Forums user feedback reviews Click list FREE designs Pricing Setup fee currently USD Sales fee 6 sales 35 large volume sellers individual basis See upgrades store upgrade prices Get started ProductPriceQuantity onion store100 USD X Store upgradesPurchase upgrades store ProductPriceQuantity Fully custom shop design made one designers500 USD X forums extra onion address150 USD X TorShops Create onion store buy sell drugs guns counterfeits fake ids fake passports bitcoin,bad
9,http://ko5enel7ogpruey25y3pcfmobcwrjiwwhyjp3t5nqsuqoytpsjrls2qd.onion,TorShops Create onion store buy sell drugs guns counterfeits fake ids fake passports bitcoin Products Shops hosted TorShops Login Register Info Buy onion storeGet onion store full Bitcoin integration want run independent shop Tor hidden service anonymously want accept Bitcoins payment goods services Maybe already selling SilkRoad would prefer website TorShops lets create shop like affordable prices TorShops anyone run store Tor hidden service accept Bitcoins without worry technical details Create account contact us questions Features Integrated Bitcoin Wallet Message Center easy communication customers Easy tracking orders users pay order gets submitted Intelligent inventory management Support multiple categories may use HTML make product descriptions unique Secure fast server daily backups onion domain characters beginning choose example 123456xxxxxxxxxxonion Choose many free design templates buy custom design template Free custom logo every store SubForum TorShops Forums user feedback reviews Free listing TorLinks torlinkbgs6aabnsonion sites Click list FREE designs Pricing Setup fee currently USD Sales fee 6 sales 35 large volume sellers individual basis See upgrades store upgrade prices Get started ProductPriceQuantity onion store100 USD X Store upgradesPurchase upgrades store ProductPriceQuantity Fully custom shop design made one designers500 USD X forums extra onion address150 USD X TorShops Create onion store buy sell drugs guns counterfeits fake ids fake passports bitcoinshopsat2dotfotbsonion,bad
10,http://docmartqq3oqe2a7eoasin53aqdvt24lu33wynmdp3tiahm35x7qmwqd.onion,Doc Mart Fake Passport ID Cards Drivers License residency permit Skip content Email docmartadminprotonmailcom Address docmartqq3oqe2a7eoasin53aqdvt24lu33wynmdp3tiahm35x7qmwqdonion MARKET TRACK ORDER REVIEWS Proof CART Archives Default sorting Sort popularity Sort average rating Sort latest Sort price low high Sort price high low View Australian Drivers LicenseRated Select options Australian PassportRated 1Select options Australian Residency PermitRated Select options Buy Belgium Drivers LicenseRated Select options Buy Belgium ID cardRated BUY REAL FAKE BELGIUM ID CARD ONLINE Counterfeit Note store give opportunity buy fake ID cards online easy Pizza safely solve problem buy fake Belgium ID cards online use high quality equipment materials produce authentic fake ID Card secret features real IDs carefully duplicated Registered unregistered ID Card Feel free order Registered unregistered Belgium ID Card online visit website Select options Buy Belgium Passport 1Select options Buy Canada Drivers LicenseRated Select options Buy Canada ID cardRated Select options Buy Canada PassportRated 1Select options Buy French ID cardRated Select options Buy New Zealand PassportRated 1Select options Buy Spain ID card Select options Product categoriesUK 4 USA 4 Australia 3 New Zealand 3 Canada 4 French 4 German 4 Belgium 3 Spain 3 Theme BCF aThemeArt Proudly powered WordPress BACK TOP,bad
11,http://docmartqq3oqe2a7eoasin53aqdvt24lu33wynmdp3tiahm35x7qmwqd.onion/index.php/product/canada-id-card/,Buy Canada ID card Fake Passport ID Cards Drivers License Skip content Email docmartadminprotonmailcom Address docmartqq3oqe2a7eoasin53aqdvt24lu33wynmdp3tiahm35x7qmwqdonion MARKET TRACK ORDER REVIEWS Proof CART Buy Canada ID card Buy Canada ID card Rated based customer ratings customer reviews Type Choose optionFake Canada IDReal Canada IDClear Buy Canada ID card quantity Add cart SKU NA Category Canada Tag Canada ID card Description Additional information Reviews 4 Description BUY REAL FAKE CANADA ID CARD ONLINE Counterfeit Note store give opportunity buy fake ID cards online easy Pizza safely solve problem buy fake Canada ID cards online use high quality equipment materials produce authentic fake ID Card secret features real IDs carefully duplicated Registered unregistered ID Card Feel free order Registered unregistered CANADA ID Card online visit website Buy Canada ID card online moments frustration looks like present day way come example bounced nightclub sober person party simply underage dont worry humanity already invented way ease pain called realfake ID card Teenagers using ages demand fakes IDs especially rise modern technologies enabled us make fake ID cards look real ever Long gone days broke piggy bank get blurry laminated piece paper could easily produced friends color printer Nowadays avoid dealing sketchy guys dark alleys order ID online easy pizza come looking exactly like real thingBuy Canada ID card online Buy ID card online make identity protected Get Best Scannable Fake ID Online Today Order premium fake IDs come Scannable features buy Fake Canada Id Cards Online Buy fake Canada ID card online help common problem almost facing nowadays Without documents identity work keeping everything mind neglect even small requirement thats work always high quality help living better life dreamed us information safe trust us difference real fake canada ID cards produce real fake documents Visually wont able tell apart difference dont register fake ID cards government databases Thus surely use card get club buy drink bar decide vote scanner reveal fake legal problems Fake IDs cheaper However plan use regularly highly recommend getting one real IDs instead choice discretionwhere buy ID card online Additional information Type Fake Canada ID Real Canada ID reviews Buy Canada ID card 48Rated 5Based reviews5 star75star25star0star0star0Powered Customer Reviews plugin Rated Wilson September 3 Urgently need one card New Brunswick Rated Nathan K October 21 Finally received ID day weeks delay regular mail got documents clones instead make delay great Overall looks good definitely worth price Rated Rishabh November 2 Excellent fast service Professional Quick honestly worth cost quickly get ID card passport Id highly recommend want travel without problems use guys Rated Hayden Chong February 3 recommend website peoples wanting one best looking professional cards procedure order slick easy understand One best looking cards Many impressive security features Add review Cancel replyYour email address published Required fields marked Name Email rating Rate Perfect Good Average bad poor review Save name email website browser next time comment Related products Canadian Residency PermitRated Select options Buy Canada Drivers LicenseRated Select options Buy Canada PassportRated 1Select options Product categoriesUK 4 USA 4 Australia 3 New Zealand 3 Canada 4 French 4 German 4 Belgium 3 Spain 3 Theme BCF aThemeArt Proudly powered WordPress BACK TOP,bad
12,http://sz5h6tiqkdkfl55qa3kcxgzck3xeffo6cso7sjpc7hc7sr3vghdyicqd.onion/siteinfo/479,Vote EzPass Buy Passports Dark Web Links Directory AdBlock detected using AdBlock Plus adblocking software need money operate site almost comes online advertising would appreciate much whitelist website AdBlocker Thank Toggle navigation LinkDir Add Link Login Register EzPass Buy Passports httpezpasscpnwe673zconion real legally issued passport associates within Department State Passport Agency work exactly like US passport valid years sure give Rank Point EzPass Buy Passports Captcha Need Rank Points Get Return homepage LinkDir Us Terms Privacy,bad
