index,link,text,marker
13,http://docmartqq3oqe2a7eoasin53aqdvt24lu33wynmdp3tiahm35x7qmwqd.onion/index.php/page/3/,Doc Mart Page Fake Passport ID Cards Drivers License residency permit Skip content Email docmartadminprotonmailcom Address docmartqq3oqe2a7eoasin53aqdvt24lu33wynmdp3tiahm35x7qmwqdonion MARKET TRACK ORDER REVIEWS Proof CART Archives Default sorting Sort popularity Sort average rating Sort latest Sort price low high Sort price high low View German Residency PermitRated Select options New Zealand Drivers LicenseRated Select options New Zealand Residency PermitRated Select options Spain Drivers LicenseRated Select options UK Drivers LicenseRated Select options UK ID cardRated Select options UK Residency PermitRated Select options USA Drivers LicenseRated Select options Product categoriesUK 4 USA 4 Australia 3 New Zealand 3 Canada 4 French 4 German 4 Belgium 3 Spain 3 Theme BCF aThemeArt Proudly powered WordPress BACK TOP,bad
14,http://docmartqq3oqe2a7eoasin53aqdvt24lu33wynmdp3tiahm35x7qmwqd.onion/index.php/product/usa-residency-permit/,Buy USA Residency Permit Fake Passport ID Cards Drivers License Skip content Email docmartadminprotonmailcom Address docmartqq3oqe2a7eoasin53aqdvt24lu33wynmdp3tiahm35x7qmwqdonion MARKET TRACK ORDER REVIEWS Proof CART Buy USA Residency Permit Buy USA Residency Permit Rated based customer ratings customer reviews Type Choose optionFake Residency VisaReal Residency VisaClear Buy USA Residency Permit quantity Add cart SKU NA Category USA Tag USA Residency Permit Description Additional information Reviews 4 Description BUY RESIDENCE PERMIT ONLINE USA PROFESSIONALS produce Real Novelty Documents buy residence permit online reasonable prices company opportunity get work accomplished experts working industry extended period successfully gained ample experience apply every project work get comes making resident permit turn pro samebuy residence permit online Buy USA Residence Permit want buy residence permit USA company would serve better make document specification full efforts dedication resident permit works document help live country specific time period legal power understand importance document offering service needy around world buy fake real residence permit online company best rates visit places get permit hand Connect company today via official website submit personalized requirements promise deliver earliest Contact difference real fake RP cards produce real fake documents Visually wont able tell apart difference dont register fake RP cards government databases Thus surely use card get club buy drink bar decide find job scanner reveal fake legal problems Fake RPs cheaper However plan use regularly highly recommend getting one real RPs instead choice discretionwhere buy RP card online Additional information Type Fake Residency Visa Real Residency Visa reviews Buy USA Residency Permit 45Rated 5Based reviews5 star50star50star0star0star0Powered Customer Reviews plugin Rated noobsaibot September 25 best authentic document offered real highly recommend Rated maha_mahoor September 30 good quality Residency Permit Rated maha_mahoor March 6 Recently ordered good amount Residency Permits website plan order much liked quick weeks tops receive documents look good Rated joana_p November 11 interested one Add review Cancel replyYour email address published Required fields marked Name Email rating Rate Perfect Good Average bad poor review Save name email website browser next time comment Related products Buy USA ID cardRated Select options Buy USA PassportRated 1Select options USA Drivers LicenseRated Select options Product categoriesUK 4 USA 4 Australia 3 New Zealand 3 Canada 4 French 4 German 4 Belgium 3 Spain 3 Theme BCF aThemeArt Proudly powered WordPress BACK TOP,bad
15,http://docmartqq3oqe2a7eoasin53aqdvt24lu33wynmdp3tiahm35x7qmwqd.onion/index.php/product/buy-belgium-drivers-license/,Buy Belgium Drivers License Fake Passport ID Cards Drivers License Skip content Email docmartadminprotonmailcom Address docmartqq3oqe2a7eoasin53aqdvt24lu33wynmdp3tiahm35x7qmwqdonion MARKET TRACK ORDER REVIEWS Proof CART Buy Belgium Drivers License Buy Belgium Drivers License Rated based customer rating customer review Type Choose optionFake Drivers LicenseReal Drivers LicenseClear Buy Belgium Drivers License quantity Add cart SKU NA Category Belgium Tag Belgium Drivers License Description Additional information Reviews 1 Description Purchase real fake Belgium drivers license online spend free time money saved visiting driving school know many exciting things buy drivers license online say goodbye classes unnecessary bureaucracy click Add Cart button rest easy knowing requirements fulfilled produce real replica drivers licenses highest quality thanks expertise cuttingedge equipment go former use legally without scared getting busted experts capable registering information database machinereadable checks passed quickly Much like genuine document counterfeit one needed security features like holograms barcodes magnetic stripes However cant go datareading tests Order fakereal Belgium drivers license online save trouble Counterfeit Note Store manufactures documents numerous countries including Canada Australia UK France Germany USA many others Imagine drive car hometown also abroad especially point plan work move overseas case better buy drivers license online stopped police officer show document keep going like residents provide solid footing country untold number opportunities available driver much convenient run sort errands get place fun friends car Cant wait enjoy multiple behindthewheel experiences pick real replica drivers license website Make order see appreciated recognized people Dont put fantastic driving experience back burner Select license option today get envious pedestrian looks assistance required dont hesitate ask friendly staff help difference real fake DL cards produce real fake documents Visually wont able tell apart difference dont register fake DL cards government databases Thus surely use card get club buy drink bar decide driving scanner reveal fake legal problems Fake DLs cheaper However plan use regularly highly recommend getting one real DLs instead choice discretionwhere buy DL card online Additional information Type Fake Drivers License Real Drivers License review Buy Belgium Drivers License 50Rated 5Based review5 star100star0star0star0star0Powered Customer Reviews plugin Rated samtoy store manager July 25 convenient site high quality docs Add review Cancel replyYour email address published Required fields marked Name Email rating Rate Perfect Good Average bad poor review Save name email website browser next time comment Related products Buy Belgium Passport 1Select options Buy Belgium ID cardRated BUY REAL FAKE BELGIUM ID CARD ONLINE Counterfeit Note store give opportunity buy fake ID cards online easy Pizza safely solve problem buy fake Belgium ID cards online use high quality equipment materials produce authentic fake ID Card secret features real IDs carefully duplicated Registered unregistered ID Card Feel free order Registered unregistered Belgium ID Card online visit website Select options Product categoriesUK 4 USA 4 Australia 3 New Zealand 3 Canada 4 French 4 German 4 Belgium 3 Spain 3 Theme BCF aThemeArt Proudly powered WordPress BACK TOP,bad
16,http://docmartqq3oqe2a7eoasin53aqdvt24lu33wynmdp3tiahm35x7qmwqd.onion/index.php/product/buy-belgium-drivers-license/,Buy Belgium Drivers License Fake Passport ID Cards Drivers License Skip content Email docmartadminprotonmailcom Address docmartqq3oqe2a7eoasin53aqdvt24lu33wynmdp3tiahm35x7qmwqdonion MARKET TRACK ORDER REVIEWS Proof CART Buy Belgium Drivers License Buy Belgium Drivers License Rated based customer rating customer review Type Choose optionFake Drivers LicenseReal Drivers LicenseClear Buy Belgium Drivers License quantity Add cart SKU NA Category Belgium Tag Belgium Drivers License Description Additional information Reviews 1 Description Purchase real fake Belgium drivers license online spend free time money saved visiting driving school know many exciting things buy drivers license online say goodbye classes unnecessary bureaucracy click Add Cart button rest easy knowing requirements fulfilled produce real replica drivers licenses highest quality thanks expertise cuttingedge equipment go former use legally without scared getting busted experts capable registering information database machinereadable checks passed quickly Much like genuine document counterfeit one needed security features like holograms barcodes magnetic stripes However cant go datareading tests Order fakereal Belgium drivers license online save trouble Counterfeit Note Store manufactures documents numerous countries including Canada Australia UK France Germany USA many others Imagine drive car hometown also abroad especially point plan work move overseas case better buy drivers license online stopped police officer show document keep going like residents provide solid footing country untold number opportunities available driver much convenient run sort errands get place fun friends car Cant wait enjoy multiple behindthewheel experiences pick real replica drivers license website Make order see appreciated recognized people Dont put fantastic driving experience back burner Select license option today get envious pedestrian looks assistance required dont hesitate ask friendly staff help difference real fake DL cards produce real fake documents Visually wont able tell apart difference dont register fake DL cards government databases Thus surely use card get club buy drink bar decide driving scanner reveal fake legal problems Fake DLs cheaper However plan use regularly highly recommend getting one real DLs instead choice discretionwhere buy DL card online Additional information Type Fake Drivers License Real Drivers License review Buy Belgium Drivers License 50Rated 5Based review5 star100star0star0star0star0Powered Customer Reviews plugin Rated samtoy store manager July 25 convenient site high quality docs Add review Cancel replyYour email address published Required fields marked Name Email rating Rate Perfect Good Average bad poor review Save name email website browser next time comment Related products Buy Belgium ID cardRated BUY REAL FAKE BELGIUM ID CARD ONLINE Counterfeit Note store give opportunity buy fake ID cards online easy Pizza safely solve problem buy fake Belgium ID cards online use high quality equipment materials produce authentic fake ID Card secret features real IDs carefully duplicated Registered unregistered ID Card Feel free order Registered unregistered Belgium ID Card online visit website Select options Buy Belgium Passport 1Select options Product categoriesUK 4 USA 4 Australia 3 New Zealand 3 Canada 4 French 4 German 4 Belgium 3 Spain 3 Theme BCF aThemeArt Proudly powered WordPress BACK TOP,bad
17,http://sz5h6tiqkdkfl55qa3kcxgzck3xeffo6cso7sjpc7hc7sr3vghdyicqd.onion/siteinfo/620,Vote Fake Passports Dark Web Links Directory AdBlock detected using AdBlock Plus adblocking software need money operate site almost comes online advertising would appreciate much whitelist website AdBlocker Thank Toggle navigation LinkDir Add Link Login Register Fake Passports httpfakeidnyv3st7tpuonion Fake Diplomatic Camouflage Passports Sale fake passport drivers license fake ID passports drivers licences travel document false counterfeit alternative ID phonies id phoneys forged identification documents identification cards driving permit camou sure give Rank Point Fake Passports Captcha Need Rank Points Get Return homepage LinkDir Us Terms Privacy,bad
18,http://docmartqq3oqe2a7eoasin53aqdvt24lu33wynmdp3tiahm35x7qmwqd.onion/index.php/product/buy-spain-id-card/,Buy Spain ID card Fake Passport ID Cards Drivers License Skip content Email docmartadminprotonmailcom Address docmartqq3oqe2a7eoasin53aqdvt24lu33wynmdp3tiahm35x7qmwqdonion MARKET TRACK ORDER REVIEWS Proof CART Buy Spain ID card Buy Spain ID card Type Choose optionFake German IDReal German IDClear Buy Spain ID card quantity Add cart SKU NA Category Spain Tag Buy Spain ID card Description Additional information Reviews 0 Description BUY REAL FAKE SPAIN ID CARD ONLINE Counterfeit Note store give opportunity buy fake ID cards online easy Pizza safely solve problem buy fake Spain ID cards online use high quality equipment materials produce authentic fake ID Card secret features real IDs carefully duplicated Registered unregistered ID Card Feel free order Registered unregistered Spain ID Card online visit website Buy ID card online make identity protected Get Best Scannable Fake ID Online Today Order premium fake IDs come Scannable features buy Fake German Id Cards Online Buy fake German ID card online help common problem almost facing nowadays Without documents identity work keeping everything mind neglect even small requirement thats work always high quality help living better life dreamed us information safe trust us difference real fake ID cards produce real fake documents Visually wont able tell apart difference dont register fake ID cards government databases Thus surely use card get club buy drink bar decide vote scanner reveal fake legal problems Fake IDs cheaper However plan use regularly highly recommend getting one real IDs instead choice discretionwhere buy ID card online Additional information Type Fake German ID Real German ID Reviews reviews yet first review Buy Spain ID card Cancel replyYour email address published Required fields marked Name Email rating Rate Perfect Good Average bad poor review Save name email website browser next time comment Related products Spain Drivers LicenseRated Select options Buy Spain PassportRated 1Select options Product categoriesUK 4 USA 4 Australia 3 New Zealand 3 Canada 4 French 4 German 4 Belgium 3 Spain 3 Theme BCF aThemeArt Proudly powered WordPress BACK TOP,bad
19,http://docmartqq3oqe2a7eoasin53aqdvt24lu33wynmdp3tiahm35x7qmwqd.onion/index.php/product/buy-spain-id-card/,Buy Spain ID card Fake Passport ID Cards Drivers License Skip content Email docmartadminprotonmailcom Address docmartqq3oqe2a7eoasin53aqdvt24lu33wynmdp3tiahm35x7qmwqdonion MARKET TRACK ORDER REVIEWS Proof CART Buy Spain ID card Buy Spain ID card Type Choose optionFake German IDReal German IDClear Buy Spain ID card quantity Add cart SKU NA Category Spain Tag Buy Spain ID card Description Additional information Reviews 0 Description BUY REAL FAKE SPAIN ID CARD ONLINE Counterfeit Note store give opportunity buy fake ID cards online easy Pizza safely solve problem buy fake Spain ID cards online use high quality equipment materials produce authentic fake ID Card secret features real IDs carefully duplicated Registered unregistered ID Card Feel free order Registered unregistered Spain ID Card online visit website Buy ID card online make identity protected Get Best Scannable Fake ID Online Today Order premium fake IDs come Scannable features buy Fake German Id Cards Online Buy fake German ID card online help common problem almost facing nowadays Without documents identity work keeping everything mind neglect even small requirement thats work always high quality help living better life dreamed us information safe trust us difference real fake ID cards produce real fake documents Visually wont able tell apart difference dont register fake ID cards government databases Thus surely use card get club buy drink bar decide vote scanner reveal fake legal problems Fake IDs cheaper However plan use regularly highly recommend getting one real IDs instead choice discretionwhere buy ID card online Additional information Type Fake German ID Real German ID Reviews reviews yet first review Buy Spain ID card Cancel replyYour email address published Required fields marked Name Email rating Rate Perfect Good Average bad poor review Save name email website browser next time comment Related products Buy Spain PassportRated 1Select options Spain Drivers LicenseRated Select options Product categoriesUK 4 USA 4 Australia 3 New Zealand 3 Canada 4 French 4 German 4 Belgium 3 Spain 3 Theme BCF aThemeArt Proudly powered WordPress BACK TOP,bad
20,http://docmartqq3oqe2a7eoasin53aqdvt24lu33wynmdp3tiahm35x7qmwqd.onion/index.php/product/uk-residency-permit/,UK Residency Permit Fake Passport ID Cards Drivers License Skip content Email docmartadminprotonmailcom Address docmartqq3oqe2a7eoasin53aqdvt24lu33wynmdp3tiahm35x7qmwqdonion MARKET TRACK ORDER REVIEWS Proof CART UK Residency Permit UK Residency Permit Rated based customer ratings customer reviews Type Choose optionFake Residency VisaReal Residency VisaClear UK Residency Permit quantity Add cart SKU NA Category UK Tag UK Residency Permit Description Additional information Reviews 5 Description BUY RESIDENCE PERMIT ONLINE UK PROFESSIONALS produce Real Novelty Documents buy residence permit online reasonable prices company opportunity get work accomplished experts working industry extended period successfully gained ample experience apply every project work get comes making resident permit turn pro samebuy residence permit online Buy UK Residence Permit want buy residence permit UK company would serve better make document specification full efforts dedication resident permit works document help live country specific time period legal power understand importance document offering service needy around world buy fake real residence permit online company best rates visit places get permit hand Connect company today via official website submit personalized requirements promise deliver earliest Contact difference real fake RP cards produce real fake documents Visually wont able tell apart difference dont register fake RP cards government databases Thus surely use card get club buy drink bar decide find job scanner reveal fake legal problems Fake RPs cheaper However plan use regularly highly recommend getting one real RPs instead choice discretionwhere buy RP card online Additional information Type Fake Residency Visa Real Residency Visa reviews UK Residency Permit 48Rated 5Based reviews5 star80star20star0star0star0Powered Customer Reviews plugin Rated harper123fog November 16 Fast communication shipping great uv printing template nice hologram lines authentic real Rated rodrigon October 8 recently organized sent order site best id shopping Ive ever done Besides amazing perfect looking customer service excellent 1 Shipping delivery order took weeks Obviously confused came quickly look like made DMV Amazing really 2 Holograms 10 everything looks good visually 3 Scanning ID undetectable fake overall Always scanned theres never problems id Rated daniaz December 18 Hello want information Rated oliviamarquez January 25 Easy ordering Flexible payment could pay online Fast delivery Europe Rated 1emelineus2 February 25 payment bit hard know exactly pay However everything worked perfectly Add review Cancel replyYour email address published Required fields marked Name Email rating Rate Perfect Good Average bad poor review Save name email website browser next time comment Related products Buy Uk PassportRated 2Select options UK ID cardRated Select options UK Drivers LicenseRated Select options Product categoriesUK 4 USA 4 Australia 3 New Zealand 3 Canada 4 French 4 German 4 Belgium 3 Spain 3 Theme BCF aThemeArt Proudly powered WordPress BACK TOP,bad
21,http://docmartqq3oqe2a7eoasin53aqdvt24lu33wynmdp3tiahm35x7qmwqd.onion/index.php/product/uk-residency-permit/,UK Residency Permit Fake Passport ID Cards Drivers License Skip content Email docmartadminprotonmailcom Address docmartqq3oqe2a7eoasin53aqdvt24lu33wynmdp3tiahm35x7qmwqdonion MARKET TRACK ORDER REVIEWS Proof CART UK Residency Permit UK Residency Permit Rated based customer ratings customer reviews Type Choose optionFake Residency VisaReal Residency VisaClear UK Residency Permit quantity Add cart SKU NA Category UK Tag UK Residency Permit Description Additional information Reviews 5 Description BUY RESIDENCE PERMIT ONLINE UK PROFESSIONALS produce Real Novelty Documents buy residence permit online reasonable prices company opportunity get work accomplished experts working industry extended period successfully gained ample experience apply every project work get comes making resident permit turn pro samebuy residence permit online Buy UK Residence Permit want buy residence permit UK company would serve better make document specification full efforts dedication resident permit works document help live country specific time period legal power understand importance document offering service needy around world buy fake real residence permit online company best rates visit places get permit hand Connect company today via official website submit personalized requirements promise deliver earliest Contact difference real fake RP cards produce real fake documents Visually wont able tell apart difference dont register fake RP cards government databases Thus surely use card get club buy drink bar decide find job scanner reveal fake legal problems Fake RPs cheaper However plan use regularly highly recommend getting one real RPs instead choice discretionwhere buy RP card online Additional information Type Fake Residency Visa Real Residency Visa reviews UK Residency Permit 48Rated 5Based reviews5 star80star20star0star0star0Powered Customer Reviews plugin Rated harper123fog November 16 Fast communication shipping great uv printing template nice hologram lines authentic real Rated rodrigon October 8 recently organized sent order site best id shopping Ive ever done Besides amazing perfect looking customer service excellent 1 Shipping delivery order took weeks Obviously confused came quickly look like made DMV Amazing really 2 Holograms 10 everything looks good visually 3 Scanning ID undetectable fake overall Always scanned theres never problems id Rated daniaz December 18 Hello want information Rated oliviamarquez January 25 Easy ordering Flexible payment could pay online Fast delivery Europe Rated 1emelineus2 February 25 payment bit hard know exactly pay However everything worked perfectly Add review Cancel replyYour email address published Required fields marked Name Email rating Rate Perfect Good Average bad poor review Save name email website browser next time comment Related products UK ID cardRated Select options Buy Uk PassportRated 2Select options UK Drivers LicenseRated Select options Product categoriesUK 4 USA 4 Australia 3 New Zealand 3 Canada 4 French 4 German 4 Belgium 3 Spain 3 Theme BCF aThemeArt Proudly powered WordPress BACK TOP,bad
