index,link,text,marker
18,http://onionwsoiu53xre32jwve7euacadvhprq2jytfttb55hrbo3execodad.onion/2014/07/29/vendor-xanaxking-anti-bail-letter/,Vendor XanaxKing AntiBail Letter Onion Web Explore Popular Posts Access Darknet buy Dark web Tour Darkweb Markets Mustread Dont Get Scammed PGP Keys Encrypted Messages use Monero buy online Darknet VS Darkweb Difference Topics ViewallTopics Dark web Drugs Bitcoin Leaks Altcoins Trading Markets Hacking Security DeepDotWeb Guides Reviews Interviews Arrests Popular Spaces Onion Web Darknet Dummies Dr Greenthumb Wheres Mind Doggystyle Reviews Rich 30s High Jones Discover MustVisit DarkRise Darknet Doesnt Fail Darkguard Verify URL dReviews dDarknetStars Recon Vendor Database Reviews Coming soon Dread DiscoverAll Markets Ranking Darknet Marketplaces Darknet Forums Darknet Shops Dead Sites Actions Contact SubmitmyStory AddaSite Donate PGP Mirrors Canary Related Log Sign Account Spaces Topics Contact Us Vendor XanaxKing AntiBail Letter DeepDotWeb DeepDotWeb Jul posted another great summary brought Gwern Reddit thread join discussion redditAs Gwern saidI stopped PACER today see XK criminal complaint unsealed yet doesnt seem tove like Ross Ulbricht case antibail letter written prosecutor describes information Given scale XKs operations exposure evidence obtained XKs bust may overdetermined exact cause particularly importantFrom httpspdfytdWw_UFfu2ij1lA9r httpswwwdropboxcoms583q65p9opdp13tcand035011914356pdf Defendants direction organization produced million Xanax tablets per week shipped pills throughout country Defendant also responsible production distribution significant quantities GHB steroids drugsWhen agents executed search warrants locations controlled Defendant seized massive amount drugs related contraband combined earlier controlled purchases limited seizures investigation agents recovered following six industrial pill presses including multiple rotary presses capable stamping tens thousands pills per hour two industrial mixers roughly million Xanax tablets pounds anabolic steroids four pounds suspected oxycodone pills four gallons GHB roughly kilograms alprazolam powder estimated produce approximately million Xanax tablets estimated 4kilograms binding agent combined sufficient alprazolam would generate million Xanax tablets materialsIn addition nine defendants case evidence gathered Defendants enterprise led arrest nearly people throughout country seizure multiple tens thousands pills well cash firearmsDefendants operation sophisticated massive raw materials Defendant arranged large quantities alprazolam Xanax powder pillmaking equipment shipped China usually codefendants nominee addresses pay material wired significant sums cash connections China often Western Union example agents obtained records showing Defendant codefendants Christopher Neely Alicia Mitts wiring 80to recipients China period three months fact Defendant told one associates earlier wires China generated high volume suspicious transaction activity Western Union blacklisted conducting business company light experience Defendant arranged others place wires China behalf structure wires avoid detection law enforcementDefendant sold pills online including using underground websites Silk Road Silk Road 20 personal website wwwxklovesus shipped drugs states Prices Xanax tablets varied depending size order ranging per pill small orders per pill orders multiple tens thousands Defendant frequently paid customers digital currency Bitcoins also paid cash regularly receiving boxes full cash Internet sales example selected interceptions one location Defendant payments sent address codefendant Thomas Elliott using fictitious name Tim Elliot agents seized 175in cash sent US mail execution search warrants May 28 2014 agents found least one cash package location associated Defendant date agents seized 200in cash 25in Bitcoins Defendants operationIt critical note however figure represents small fraction proceeds flowing Defendant cash seized came funds Defendant hand May 28 2014 earlier limited seizure packages discussed Defendants operation highvolume lucrative agents know Defendant hidden rest money Defendant also sold drugs locally distributing Xanax tablets GHB steroidsDefendant employed number individuals various capacities including codefendants case individuals worked manufacturing pills sending completed orders Others responsible maintaining machines Still others including people never met person responsible collating consolidating Silk Road orders maintaining Silk Road website coordinating conversion Defendants Bitcoins cash cash shipped Defendant Defendant hired individuals receive packages behalf packages cash customers Bitcoin conversation packages alprazolam powder ChinaAs example organized Defendants operation Defendant installed time clock manufacturing location employees worked pill presses industrial mixers punched regular factoryDefendant also poses significant danger community virtue fact convicted felon possession assaultstyle weapon obliterated serial number Among locations agents searched May 28 2014 storage unit Defendant rented course investigation agents observed Defendant going location numerous times Inside unit agents found significant quantity steroids well equipment could used processing steroids also found ARstyle carbine rifle complete several loaded magazines ammunition See Ex photograph weapon Even significantly serial number weapon obliteratedAlthough significant factor Court consider wealth Considerable Evidence Defendant evidence Defendant Agents host recorded conversations Defendant discussed set drug transactions Agents also coordinated number controlled purchases drugs Defendant including deals Xanax tablets GHB steroids ultimately led authorization Title III interception Defendants phone period interception earlier recorded calls texts inperson communications Defendant openly discussed drug operation talked massive volume orders fill difficulty getting quality help various strategies launder money including setting purportedly legitimate business provide front drug operationAgents also recorded Defendant reveling success instance one point interception period boasted best week ever week produced million Xanax tablets earlier conversation told confidential informant million cash available somewhere another point laid retirement plan generate million four years turn business others collect royalty payments successors discussed agents seized small portion money Previous article Vendor CALIGIRL Criminal Complaint Excerpts Next article Agora Time Hardware Failure Author DeepDotWeb Without doubt predecessor TheOnionWeb DeepDotWeb news site dedicated events surrounding dark web featuring interviews reviews darknet markets Tor hidden services legal actions privacy bitcoin related news Articles Donate Bitcoin 1NDqCHu3C8rjgfJs34TgZ8BKa2VsuduRMC Monero 46UwFaceGmLheF9qRq6EjSAmuJF2P5KVfXinVM4NEr6DJhxAWW2j2D79BUTe1HMnTTNt3cbz6QKUEEhmnaZVrMzMKaAtgCW Comments Write comment August 8 7am prancer Although wasnt particularly rich drug dealer scale someone whos business revolved around Xanax fucking king rare people get rich selling XanaxLong live Xanaxking fought good fight bravely even though youre gone weve learnt efforts youve helped us progress revolution Reply comment reply comment read guidelines X Comment text Post Comment August 5 5am Damn guy really Xanax Kingpin amazes guys like obviously clever organize operation something stupid talking texting openly fking phones pride need brag leads one disclose earned millions text message also amazes schedule drug alprazolam completely harmess drug used inteligently GHB steroids Reply comment reply comment read guidelines X Comment text Post Comment Write Comment view comments Read write comment Read guidelines Comment text Post Comment Advertise Darknet Sites Featured Sites Torrez 100 CannaHome 100 Abacus Market 97 Markets Revolution Market 98 Vice City 100 Dark0de 95 Cannazon 74 ASAP Asean 100 Cartel 86 Archetyp Market 97 Tor2door 100 Monopoly 94 Versus 98 Tor Market NZ 100 HYDRA RU 76 Vendor Shops new shit 99 WeAreAmsterdam 95 CharlieUK 100 French Connection 100 ThePirateIsland 93 TomJerry 100 Medicine Man UK 100 SmokersCo 100 Auspride 100 Digital Thrift Shop Pl 100 HeinekenExpress 100 o3shop RU 100 Social Dread 92 Majestic Garden 86 HUB 57 Deutschland im Deep Web DE 85 Cebulka PL 90 Services News Directories LARGEST Markets December TOP number products Full Ranking Torrez Dark0de Versus ASAP Asean Cartel Bitcoin Today High Low Monero Today High Low Latest Comments Authentik2900 Site à éviter commande de c faite chez eux jamais reçu une arnaque TomJerrys profile mawosx low contact waiting days parcel 50g coco contact pr WeAreAmsterdams profile foster6la biggest greatest Torrezs profile Fidel Dam Im cannabis plug left Cannazons profile 14characters Looking make Make Money Looking Job Post Find Job Deep Web krazydversa ey ross aim chile espero que algun dia encuentres la libertad fr Life Box kotorfan21 anyone know actual Nonscams registeredreal passports Newbies Spaces space MahNemzJeff loyal Torguard user going years hands TorGuard VPN Review FUCKOFF MOTHER SCAM WEBSITE DarkFox Markets profile oshit Allowing users finalize orders withdraw funds White House Markets profile Tag Cloud Bitcoin Darknet Dark Web Drug Sentenced Arrested Man News Tor Drugs Silk Road Prison Market German years Price Busted Cybercrime Net Markets Cannabis Bitcoin Monero Forum Bitcoin,bad
19,http://darkzzx4avcsuofgfez5zq75cqc4mprjvfqywo45dfcaxrwqg6qrlfid.onion/post/xanaxking2-convicted-by-a-jury-in-california/,Jury Convicts XanaxKing2 Selling Fentanyl Analogues DarknetliveMonero needs help OSPEAD Fortifying Monero Statistical Attack ccsgetmoneroorgDarknetlive HomeArrestsMarketsCryptoForumsOnionsShopsHomePostsJury Convicts XanaxKing2 Selling Fentanyl AnaloguesJury Convicts XanaxKing2 Selling Fentanyl Analoguesmins Published Dennis Jul tagged Darkweb Vendors using words Comment jury convicted California man conspiring manufacturing distributing fentanyl pills darkwebAndrew Tablack 29 Beverly Hills California found guilty following sixday trial presided US District Judge Michael Shipp Trenton federal court jury found Tablack guilty one count manufacturing supplying possessing intent manufacture distribute cyclopropyl fentanyl pills also found guilty one count conspiracy Manufacture Distribute Fentanyl pills Tablacks conviction based evidence acquired investigations conducted Organized Crime Drug Enforcement Task Force OCDETF Investigators reportedly established Tablack accomplice Stephan Durham 43 Altadena California operated fentanyl pill production facility early March December 2017The duo manufactured hundreds thousands fentanyl pills distributed throughout US via darkweb XanaxKing2 vendor name vendor sold approximately 400of pills every monthThe investigations led Tablacks conviction began investigation distribution fentanyl New Jersey launched DEA DEA investigators executed search warrant residence Monmouth County New Jersey seized large quantities wide variety drugs including approximately 300cyclopropyl fentanyl pills investigators later found fentanyl pills allegedly shipped owner residence Tablack investigators intercepted several packages mailed Monmouth County Tablack September 2017 opening packages investigators found total 226cyclopropyl fentanyl pills total weight approximately kilogramsFurther investigations revealed Tablack running massive pill production facility California investigators acquired shipping records showed Tablack purchased least nine pill press machines shipped industrial property California industrial property leased company run Tablacks accomplice DurhamThe investigators also found Tablack purchasing large quantities fentanyl lab China lab shipped fentanyl disguised food beauty products packages properties controlled Tablack Durham investigators allegedly intercepted several packages sent Asia properties interceptions resulted seizure undisclosed quantities fentanyl Tablack Durham arrested December 20 2017 charged one count conspiracy manufacture distribute fentanyl analogue pills Tablack also charged one count manufacturing distributing fentanyl analogue pillsThe jury found Tablack guilty two charges leveled July 14 2021 charge carries maximum years prison million fine Tablacks sentencing take place December 6 2021Indictment pdfDNL note law enforcement seized dozens different cryptocurrencies Tablack also Rolls Royce Wraith seems unusualApproximately 106Waves seized December 20 2017Approximately 275Syscoin seized December 20 2017Approximately 159Shift seized December 20 2017Approximately 95Waves seized December 20 2017Approximately 25Ark seized December 20 2017Approximately 7OmiseGo seized December 20 2017Approximately Bitcoin seized March 19 2018Approximately 5in United States currency seized December 20 2017One RollsRoyce Wraith SedanOne Apple iPhone Plus 32GB capacity seized December 20 2017One Apple iPhone 7 seized December 20 2017One Apple iPhone Plus broken seized December 20 2017One Apple iPhone Plus seized December 20 2017One Samsung Cellular Phone seized December 20 2017One Dell Inspiron Laptop seized December 20 2017One Ledger Blue Security Device seized December 20 2017Two Ledger Nano Digital Currency Hardware Wallets seized December 20 2017One Apple iPhone SE seized December 20 2017One Apple iPad Pro seized December 20 2017Also comments returning soon Finally working systemShare Telegram Gab Mastodon Email Reddit Twitter1 CommentAnyone claiming vendor either scammer fed Click links riskSilent6b3d4340 Sun Jul 25 2021Im curious many pill presses manufacturer needs dont understand would need unless multiple labs different locations redundancyPackaging OPSEC paramount takes bad customerNew comments disabled one month attempt limit spamSee AlsoEmpire Vendor XanScriptz Admits Selling Fake Xanax PillsTrio Admits Selling Psychedelics DarkwebPolice Found Sales Records Vendors USB DriveHeroin Vendor Bestman365 Sentenced PrisonWallstreet Vendor RaptureReloaded Sentenced PrisonNewerOlder DarknetLivepgp mirrors donate canary bible rss,bad
20,http://orezer64qvhskkk3mhw3lwxqv3225hcgb7ozlftamf5ab57ghkp5j4ad.onion/shop/buy-anxiety-pills/buy-xanax-2mg-bars-online-no-prescription-overnight-delivery/,Buy Xanax 2mg bars Online Prescription Overnight Delivery Us Contact Us account HOME COVIDADHD ANXIETY PAIN RELIEF INSOMNIA Guns Contact Us Customer Reviews account Track Order Shopping cart cart empty Continue Shopping Cart ADHD 3 Anastrozole 1 Anti Anxiety 8 atorvastatin 1 Beauty products 4 BEST PLACE Buy Methadone online 1 BOTULINUM 3 Buy ADHD 7 BUY ANXIETY PILLS 12 Buy COVIDVaccine 2 Buy Methadone online 1 BUY NEMBUTAL PENTOBARBITAL 3 Buy PAIN MEDS 27 CBD OIL 1 COVID8 AstraZeneca COVIDvaccine 1 Johnson Johnsons Janssen COVIDVaccine 1 Moderna COVIDVaccine 1 Sputnik V COVIDvaccine 1 COVIDVACCINATION CARDS 2 Date Rape Drug 1 Guns 6 HAIR LOSS 1 HIV medications 4 INSOMNIA 4 Ketamine 1 Keytruda 1 Opoid Detox 2 Pain Relief 20 Opana 1 Research chemicals 1 Uncategorized 2 Weight Loss 4 Login Register Enter username password login Remember Lost password First name Last name Fill forms create account 1970 775silkclinicprotonmailcom HOME COVIDADHD ANXIETY PAIN RELIEF INSOMNIA Guns Contact Us Customer Reviews account Track Order Buy Xanax 2mg bars Online Prescription Overnight Delivery customer reviews Sold 2Pills Choose option 2Pills Choose option100 pills1000 Pills200 Pills500 Pills100 pills1000 Pills200 Pills500 PillsClear Buy Xanax 2mg bars Online Prescription Overnight Delivery quantity Add cart Buy Add cart Buy SKU NA Category BUY ANXIETY PILLS Description Additional information Reviews 0 Buy Xanax 2mg bars Online Prescription Buy Xanax 2mg bars Online Prescription Overnight Delivery legal Meds Store httpslegalmedstorecomproductbuyxanax2mgbarsonlinenoprescriptionovernightdelivery buy Xanax 2mg online legally USA CANADA AUSTRALIA UK Best Price httpslegalmedstorecomproductbuyxanax2mgbarsonlinenoprescriptionovernightdelivery BUY XANAXAlprazolam ONLINE EuropeASIA AMERICA ANXIETY TREATMENT Buy Xanax 2mg Online without Prescription Legal Meds Store Buy Xanax 2mg Alprazolam White Yellow Bar Online Overnight Delivery Order Generic Xanax 2mg Alprazolam Safely Online USA UK CANADA ASIA Purchase Xanax 2mg Bars Online Alprazolam Guaranteed WorldWide Delivery Quality Generic Xanax 2mg Alprazolam Bars Sale Online LEGAL MEDS STORE buy Generic Xanax 2mg Alprazolam Online Safely Discreetly Buy Xanax 2mg Alprazolam White Yellow Bars Anxiety Panics Treatment Best Pharmacy buy Xanax 2mg Alprazolam Bars Online SafelyLEGAL MEDS STORE DESCRIPTION XANAX Tablets contain alprazolam triazolo analog 1benzodiazepine class central nervous systemactive compounds chemical name alprazolam 8Chloro1methyl6phenyl4Hstriazolo 43α 14 benzodiazepine XANAX Tablet oral administration contains mg alprazolam XANAX Tablets mg multiscored may divided shown Inactive Ingredients Cellulose corn starch docusate sodium lactose magnesium stearate silicon dioxide sodium benzoate INDICATIONS 1Anxiety Disorders XANAX Tablets alprazolam indicated management anxiety disorder condition corresponding closely APA Diagnostic Statistical Manual DSMIIIR diagnosis generalized anxiety disorder shortterm relief symptoms anxiety Anxiety tension associated stress everyday life usually require treatment anxiolytic Anxiety associated depression responsive XANAX 2Panic Disorder Studies supporting claim conducted patients whose diagnoses corresponded closely DSMIIIRIV criteria panic disorder see Clinical Studies Panic disorder DSMIV characterized recurrent unexpected panic attacks ie discrete period intense fear discomfort four following symptoms develop abruptly reach peak within minutes 1 palpitations pounding heart accelerated heart rate 2 sweating 3 trembling shaking 4 sensations shortness breath smothering 5 feeling choking 6 chest pain discomfort 7 nausea abdominal distress 8 feeling dizzy unsteady lightheaded faint 9 derealization feelings unreality depersonalization detached oneself 10 fear losing control 11 fear dying 12 paresthesias numbness tingling sensations 13 chills hot flushes physician periodically reassess usefulness drug individual patient SUPPLIED mg white oblong multiscored imprinted XANAX one side 2 reverse side Additional Information Pills pills Pills Pills Pills Reviews reviews yet first review Buy Xanax 2mg bars Online Prescription Overnight Delivery Cancel replyYour email address published Required fields marked rating Rate Perfect Good Average bad poor review Name Email Save name email website browser next time comment Related products Buy Generic Klonopin Clonazepam Rivotril mg Tablets Online 0 1Select options Buy Zolpidem Ambien 10mg Oral Pills Online Without Prescription 0 Select options Buy Valium diazepamBensedin Diazepam 10mg Online Safely 0 1Select options Buy Zopiclone 75mg Online 0 2Select options Buy Subutex Buprenorphine 2mg Online Overnight Shipping 0 4Select options Buy Concerta Methylphenidate 54mg Online 0 Select options Hot Buy Rohypnol 2mg Tablets Online 0 1Select options Buy Magnus MR Morphine Sulfate mg Capsule Safely Online 0 2Select options Buy Ritalin Methylphenidate 10mg Online Without Prescription 0 Select options Buy G74 OXYMORPHONE 40MG 0 6Select options Save Buy Methadone 10mg Oral Tablets Online Legally 0 Add cart CONTACT US question please contact us silkclinicprotonmailcom Zmdifacebook Zmditwitter Zmdiyoutubeplay Zmdiinstagram INFORMATON account Checkout Logout HELP Contact Us Us Reviews SUPPORT Us Contact Us account WHATSAPPTEXT US 1970 7758731,bad
21,http://orezer64qvhskkk3mhw3lwxqv3225hcgb7ozlftamf5ab57ghkp5j4ad.onion/shop/buy-anxiety-pills/buy-xanax-2mg-bars-online-no-prescription-overnight-delivery/,Buy Xanax 2mg bars Online Prescription Overnight Delivery Us Contact Us account HOME COVIDADHD ANXIETY PAIN RELIEF INSOMNIA Guns Contact Us Customer Reviews account Track Order Shopping cart cart empty Continue Shopping Cart ADHD 3 Anastrozole 1 Anti Anxiety 8 atorvastatin 1 Beauty products 4 BEST PLACE Buy Methadone online 1 BOTULINUM 3 Buy ADHD 7 BUY ANXIETY PILLS 12 Buy COVIDVaccine 2 Buy Methadone online 1 BUY NEMBUTAL PENTOBARBITAL 3 Buy PAIN MEDS 27 CBD OIL 1 COVID8 AstraZeneca COVIDvaccine 1 Johnson Johnsons Janssen COVIDVaccine 1 Moderna COVIDVaccine 1 Sputnik V COVIDvaccine 1 COVIDVACCINATION CARDS 2 Date Rape Drug 1 Guns 6 HAIR LOSS 1 HIV medications 4 INSOMNIA 4 Ketamine 1 Keytruda 1 Opoid Detox 2 Pain Relief 20 Opana 1 Research chemicals 1 Uncategorized 2 Weight Loss 4 Login Register Enter username password login Remember Lost password First name Last name Fill forms create account 1970 775silkclinicprotonmailcom HOME COVIDADHD ANXIETY PAIN RELIEF INSOMNIA Guns Contact Us Customer Reviews account Track Order Buy Xanax 2mg bars Online Prescription Overnight Delivery customer reviews Sold 2Pills Choose option 2Pills Choose option100 pills1000 Pills200 Pills500 Pills100 pills1000 Pills200 Pills500 PillsClear Buy Xanax 2mg bars Online Prescription Overnight Delivery quantity Add cart Buy Add cart Buy SKU NA Category BUY ANXIETY PILLS Description Additional information Reviews 0 Buy Xanax 2mg bars Online Prescription Buy Xanax 2mg bars Online Prescription Overnight Delivery legal Meds Store httpslegalmedstorecomproductbuyxanax2mgbarsonlinenoprescriptionovernightdelivery buy Xanax 2mg online legally USA CANADA AUSTRALIA UK Best Price httpslegalmedstorecomproductbuyxanax2mgbarsonlinenoprescriptionovernightdelivery BUY XANAXAlprazolam ONLINE EuropeASIA AMERICA ANXIETY TREATMENT Buy Xanax 2mg Online without Prescription Legal Meds Store Buy Xanax 2mg Alprazolam White Yellow Bar Online Overnight Delivery Order Generic Xanax 2mg Alprazolam Safely Online USA UK CANADA ASIA Purchase Xanax 2mg Bars Online Alprazolam Guaranteed WorldWide Delivery Quality Generic Xanax 2mg Alprazolam Bars Sale Online LEGAL MEDS STORE buy Generic Xanax 2mg Alprazolam Online Safely Discreetly Buy Xanax 2mg Alprazolam White Yellow Bars Anxiety Panics Treatment Best Pharmacy buy Xanax 2mg Alprazolam Bars Online SafelyLEGAL MEDS STORE DESCRIPTION XANAX Tablets contain alprazolam triazolo analog 1benzodiazepine class central nervous systemactive compounds chemical name alprazolam 8Chloro1methyl6phenyl4Hstriazolo 43α 14 benzodiazepine XANAX Tablet oral administration contains mg alprazolam XANAX Tablets mg multiscored may divided shown Inactive Ingredients Cellulose corn starch docusate sodium lactose magnesium stearate silicon dioxide sodium benzoate INDICATIONS 1Anxiety Disorders XANAX Tablets alprazolam indicated management anxiety disorder condition corresponding closely APA Diagnostic Statistical Manual DSMIIIR diagnosis generalized anxiety disorder shortterm relief symptoms anxiety Anxiety tension associated stress everyday life usually require treatment anxiolytic Anxiety associated depression responsive XANAX 2Panic Disorder Studies supporting claim conducted patients whose diagnoses corresponded closely DSMIIIRIV criteria panic disorder see Clinical Studies Panic disorder DSMIV characterized recurrent unexpected panic attacks ie discrete period intense fear discomfort four following symptoms develop abruptly reach peak within minutes 1 palpitations pounding heart accelerated heart rate 2 sweating 3 trembling shaking 4 sensations shortness breath smothering 5 feeling choking 6 chest pain discomfort 7 nausea abdominal distress 8 feeling dizzy unsteady lightheaded faint 9 derealization feelings unreality depersonalization detached oneself 10 fear losing control 11 fear dying 12 paresthesias numbness tingling sensations 13 chills hot flushes physician periodically reassess usefulness drug individual patient SUPPLIED mg white oblong multiscored imprinted XANAX one side 2 reverse side Additional Information Pills pills Pills Pills Pills Reviews reviews yet first review Buy Xanax 2mg bars Online Prescription Overnight Delivery Cancel replyYour email address published Required fields marked rating Rate Perfect Good Average bad poor review Name Email Save name email website browser next time comment Related products Buy Zopiclone 75mg Online 0 2Select options Buy Concerta Methylphenidate 54mg Online 0 Select options Hot Buy Rohypnol 2mg Tablets Online 0 1Select options Buy Magnus MR Morphine Sulfate mg Capsule Safely Online 0 2Select options Buy Ritalin Methylphenidate 10mg Online Without Prescription 0 Select options Buy Zolpidem Ambien 10mg Oral Pills Online Without Prescription 0 Select options Buy Subutex Buprenorphine 2mg Online Overnight Shipping 0 4Select options Save Buy Methadone 10mg Oral Tablets Online Legally 0 Add cart Buy Valium diazepamBensedin Diazepam 10mg Online Safely 0 1Select options Buy G74 OXYMORPHONE 40MG 0 6Select options Buy Generic Klonopin Clonazepam Rivotril mg Tablets Online 0 1Select options CONTACT US question please contact us silkclinicprotonmailcom Zmdifacebook Zmditwitter Zmdiyoutubeplay Zmdiinstagram INFORMATON account Checkout Logout HELP Contact Us Us Reviews SUPPORT Us Contact Us account WHATSAPPTEXT US 1970 7758731,bad
