index,link,text,marker
0,http://onionwsoiu53xre32jwve7euacadvhprq2jytfttb55hrbo3execodad.onion/2017/12/02/drug-dealer-made-xanax-sold-dark-web/,Drug Dealer Made Xanax Sold Dark Web Onion Web Explore Popular Posts Access Darknet buy Dark web Tour Darkweb Markets Mustread Dont Get Scammed PGP Keys Encrypted Messages use Monero buy online Darknet VS Darkweb Difference Topics ViewallTopics Dark web Drugs Bitcoin Leaks Altcoins Trading Markets Hacking Security DeepDotWeb Guides Reviews Interviews Arrests Popular Spaces Onion Web Darknet Dummies Dr Greenthumb Wheres Mind Doggystyle Reviews Rich 30s High Jones Discover MustVisit DarkRise Darknet Doesnt Fail Darkguard Verify URL dReviews dDarknetStars Recon Vendor Database Reviews Coming soon Dread DiscoverAll Markets Ranking Darknet Marketplaces Darknet Forums Darknet Shops Dead Sites Actions Contact SubmitmyStory AddaSite Donate PGP Mirrors Canary Related Log Sign Account Spaces Topics Contact Us Drug Dealer Made Xanax Sold Dark Web DeepDotWeb DeepDotWeb Dec Xanax brand name powerful drug called Benzodiazepine Alprazolam used medicinal purposes treat anxiety panic attacks Xanax highly addictive prescribed temporarily effectiveness diminishes longer patient takes addictive patients require supervised withdrawal withdrawal process induce anxiety making addiction selffulfilling painful According recently unsealed indictment Matthew Lee Yensan Raleigh North Carolina charged possession intent distribute marijuana possession intent distribute alprazolam generic name Xanax distribution controlled substance means internet possession firearms drug traffickingThe US Drug Enforcement Administration received tip June Yensan mass producing Xanax unit storage Gorman Street sold drugs dark web DEA agents followed weeksAccording recently unsealed application forfeiture warrant postal inspectors intercepted package headed Yensans home found contain three pounds highgrade marijuana agents tried deliver package Yensan fled house chased house agents found another pounds marijuana two pounds shatter wax derived marijuana plants prescription drugs cash locked safe several loaded guns rifle hidden defensive positions throughout house bitcoin storage cards items used trade cryptocurrency including fake South Carolina drivers license used rent Gorman Street storage unitAt storage unit authorities seized pounds Xanax precursors benzodiazepine 70counterfeit pills pressed Xanax street value per pill postal shipping boxes containing various amounts Xanax pills packaged Mylar bags three industrialsize pill presses two electronic mixers electronic pill counter18DEA635639Bitcoins valued 28652026 seized DEA October 12 MatthewLee Yensan AKA Jacob Mason Knight Raleigh NC forfeiture pursuant USC 88118DEA635642Bitcoins valued 28594950 seized DEA October 12 Matthew LeeYensan AKA Jacob Mason Knight Raleigh NC forfeiture pursuant USC 881Authorities later able access Yensans bitcoins account found equivalent 715in addition bitcoins federal authorities also seized Yensans firearms ammunition Chevrolet Colorado pickup corvette two jet skis three pill presses storage unit cash found home proceeds alleged drug activityYensan currently held Franklin County jail awaiting trial Previous article USYD Student Busted Ordering Drugs Redistribute Next article Nearly Every Briton Hacked Personal Deta Author DeepDotWeb Without doubt predecessor TheOnionWeb DeepDotWeb news site dedicated events surrounding dark web featuring interviews reviews darknet markets Tor hidden services legal actions privacy bitcoin related news Articles Donate Bitcoin 1NDqCHu3C8rjgfJs34TgZ8BKa2VsuduRMC Monero 46UwFaceGmLheF9qRq6EjSAmuJF2P5KVfXinVM4NEr6DJhxAWW2j2D79BUTe1HMnTTNt3cbz6QKUEEhmnaZVrMzMKaAtgCW Comments Write comment December 4 6am Donnald j trump fucking liberty RIP Reply comment reply comment read guidelines X Comment text Post Comment December 4 5am chris shows impotent LE without informants received tip guy probably ex lover jealous friend either way somebody ran mouth probably zero clue guy operating area Reply comment reply comment read guidelines X Comment text Post Comment December 18 9am Amanda living within easy walking distance Jenkins family would surprised tip subsequent arrest related deaths Reply comment reply comment read guidelines X Comment text Post Comment December 3 6am artaban rest peace Reply comment reply comment read guidelines X Comment text Post Comment Write Comment view comments Read write comment Read guidelines Comment text Post Comment Advertise Darknet Sites Featured Sites Torrez 100 CannaHome 100 Abacus Market 97 Markets Revolution Market 98 Vice City 100 Dark0de 95 Cannazon 74 ASAP Asean 100 Cartel 86 Archetyp Market 97 Tor2door 100 Monopoly 94 Versus 98 Tor Market NZ 100 HYDRA RU 76 Vendor Shops new shit 99 WeAreAmsterdam 95 CharlieUK 100 French Connection 100 ThePirateIsland 93 TomJerry 100 Medicine Man UK 100 SmokersCo 100 Auspride 100 Digital Thrift Shop Pl 100 HeinekenExpress 100 o3shop RU 100 Social Dread 92 Majestic Garden 86 HUB 57 Deutschland im Deep Web DE 85 Cebulka PL 90 Services News Directories LARGEST Markets December TOP number products Full Ranking Torrez Dark0de Versus ASAP Asean Cartel Bitcoin Today High Low Monero Today High Low Latest Comments Authentik2900 Site à éviter commande de c faite chez eux jamais reçu une arnaque TomJerrys profile mawosx low contact waiting days parcel 50g coco contact pr WeAreAmsterdams profile foster6la biggest greatest Torrezs profile Fidel Dam Im cannabis plug left Cannazons profile 14characters Looking make Make Money Looking Job Post Find Job Deep Web krazydversa ey ross aim chile espero que algun dia encuentres la libertad fr Life Box kotorfan21 anyone know actual Nonscams registeredreal passports Newbies Spaces space MahNemzJeff loyal Torguard user going years hands TorGuard VPN Review FUCKOFF MOTHER SCAM WEBSITE DarkFox Markets profile oshit Allowing users finalize orders withdraw funds White House Markets profile Tag Cloud Bitcoin Darknet Dark Web Drug Sentenced Arrested Man News Tor Drugs Silk Road Prison Market German years Price Busted Cybercrime Net Markets Cannabis Bitcoin Monero Forum Bitcoin,bad
1,http://onionwsoiu53xre32jwve7euacadvhprq2jytfttb55hrbo3execodad.onion/2018/07/06/maryland-man-charged-for-selling-counterfeit-xanax-on-the-darknet/,Maryland Man Charged Selling Counterfeit Xanax Darknet Onion Web Explore Popular Posts Access Darknet buy Dark web Tour Darkweb Markets Mustread Dont Get Scammed PGP Keys Encrypted Messages use Monero buy online Darknet VS Darkweb Difference Topics ViewallTopics Dark web Drugs Bitcoin Leaks Altcoins Trading Markets Hacking Security DeepDotWeb Guides Reviews Interviews Arrests Popular Spaces Onion Web Darknet Dummies Dr Greenthumb Wheres Mind Doggystyle Reviews Rich 30s High Jones Discover MustVisit DarkRise Darknet Doesnt Fail Darkguard Verify URL dReviews dDarknetStars Recon Vendor Database Reviews Coming soon Dread DiscoverAll Markets Ranking Darknet Marketplaces Darknet Forums Darknet Shops Dead Sites Actions Contact SubmitmyStory AddaSite Donate PGP Mirrors Canary Related Log Sign Account Spaces Topics Contact Us Maryland Man Charged Selling Counterfeit Xanax Darknet DeepDotWeb DeepDotWeb Jul Federal authorities Maryland accused Baltimore County man selling millions dollars worth counterfeit Xanax pills darknet faces drug distribution charges money laundering charges assortment charges related crimesThe Baltimore Sun reported newly unsealed court documents accused Ryan Farace 34 operating lucrative vendor account undisclosed darknet market since 2013 documents specify marketplaces Farace allegedly used operation addition lack information specific darknet marketplaces documents also left name names Faraces alleged darknet vendor accounts Like court documents many busts similar nature majority documents made available public trialWhen asked case Faraces attorney provided boilerplate response complex nature new case evaluating evidence lawyer Warren Brown saidAccording indictment Farace purchased pill presses alprazolam powder 2013 Alprazolam active ingredient benzodiazepine sold trade name Xanax Later 2014 Farace posted Facebook creating top secret web site post followed similarly cryptic post read cant reveal details still looking legalities got huge potential things got really excitedWe doin big things FARACE INC Farace wrote reference purchase Lincoln Navigator government seized Navigator GMC Sierra seeking forfeiture two homes owned Farace total according court documents federal government seeking almost million dollars cash bitcoin assetsAt point operation Farace worked codefendant Robert Swain effort launder illicitly earned cryptocurrency documents revealed next nothing Swains specific role Faraces operation indicated Swain indicted separate case connection Farace Swain faces conspiracy launder money chargeIn 2016 Farace possessed 5counterfeit Xanax pills Authorities disclose answer obvious question know many pills possessed roughly one year prior arrest November 2016 Farace 1fake pills possession early 2017 less pills Officials filed indictment February unsealed late June 2018The investigation ongoing Previous article Ecstasy Vendor Busted Joint Taskforce Netherlands Next article Nine Arrested France Possession Darknet Bought Dev Author DeepDotWeb Without doubt predecessor TheOnionWeb DeepDotWeb news site dedicated events surrounding dark web featuring interviews reviews darknet markets Tor hidden services legal actions privacy bitcoin related news Articles Donate Bitcoin 1NDqCHu3C8rjgfJs34TgZ8BKa2VsuduRMC Monero 46UwFaceGmLheF9qRq6EjSAmuJF2P5KVfXinVM4NEr6DJhxAWW2j2D79BUTe1HMnTTNt3cbz6QKUEEhmnaZVrMzMKaAtgCW Comments Write comment July 9 7am BK million easy game Reply comment reply comment read guidelines X Comment text Post Comment July 8 11am narcotrafficante Sucks got cought dont know much way sounds seized trucks great haul 30million dollar man guy almost much AK Reply comment reply comment read guidelines X Comment text Post Comment July 7 10am Caliconnect got XM years ago twice came Baltimore area 100 bummer hooked times lol Reply comment reply comment read guidelines X Comment text Post Comment July 6 12am Johnny mustache fuck vendorgod damn cops Reply comment reply comment read guidelines X Comment text Post Comment July 7 2am Ironicisntit âdamn criminals Reply comment reply comment read guidelines X Comment text Post Comment July 6 12am OPSECpeople clearly water multiple years thats knew quantities back 2016 dont run anything home Dont shit eat FFS nobody learns Ultimately set traps video cameras watching key points ffs use invisible ink got get creative door handles youll know someone touched door handle may lead compromised Take burner phones inside faraday cage Gods sake 247 Dont leave without takes 30sec2mins download contents fucked way kids learn opsec jumping balls deep Reply comment reply comment read guidelines X Comment text Post Comment July 6 12am Donald XM xanaxman shipped Baltimore area Hes mia quite time Reply comment reply comment read guidelines X Comment text Post Comment July 19 10am Lawson F exactly thought man wondering went xk best vendors Reply comment reply comment read guidelines X Comment text Post Comment July 6 10am legalbeagle Oh missing information Oh know year arrest exact quantity guy Well let give information missing investigation police request obtain Knock Sneak Peek Warrant allows police go house look Let add Police Break Enter house home also cannot usually use anything find break use knowledge continue investigation careful Reply comment reply comment read guidelines X Comment text Post Comment July 6 2am digidy Cant believe get away shit US would enough get case thrown court developed countries would probably get settlement Police Ombudsman basically would walk free get hefty compensation payout troubles land free ass Reply comment reply comment read guidelines X Comment text Post Comment Write Comment view comments Read write comment Read guidelines Comment text Post Comment Advertise Darknet Sites Featured Sites Torrez 100 CannaHome 100 Abacus Market 97 Markets Revolution Market 98 Vice City 100 Dark0de 95 Cannazon 74 ASAP Asean 100 Cartel 86 Archetyp Market 97 Tor2door 100 Monopoly 94 Versus 98 Tor Market NZ 100 HYDRA RU 76 Vendor Shops new shit 99 WeAreAmsterdam 95 CharlieUK 100 French Connection 100 ThePirateIsland 93 TomJerry 100 Medicine Man UK 100 SmokersCo 100 Auspride 100 Digital Thrift Shop Pl 100 HeinekenExpress 100 o3shop RU 100 Social Dread 92 Majestic Garden 86 HUB 57 Deutschland im Deep Web DE 85 Cebulka PL 90 Services News Directories LARGEST Markets December TOP number products Full Ranking Torrez Dark0de Versus ASAP Asean Cartel Bitcoin Today High Low Monero Today High Low Latest Comments Authentik2900 Site à éviter commande de c faite chez eux jamais reçu une arnaque TomJerrys profile mawosx low contact waiting days parcel 50g coco contact pr WeAreAmsterdams profile foster6la biggest greatest Torrezs profile Fidel Dam Im cannabis plug left Cannazons profile 14characters Looking make Make Money Looking Job Post Find Job Deep Web krazydversa ey ross aim chile espero que algun dia encuentres la libertad fr Life Box kotorfan21 anyone know actual Nonscams registeredreal passports Newbies Spaces space MahNemzJeff loyal Torguard user going years hands TorGuard VPN Review FUCKOFF MOTHER SCAM WEBSITE DarkFox Markets profile oshit Allowing users finalize orders withdraw funds White House Markets profile Tag Cloud Bitcoin Darknet Dark Web Drug Sentenced Arrested Man News Tor Drugs Silk Road Prison Market German years Price Busted Cybercrime Net Markets Cannabis Bitcoin Monero Forum Bitcoin,bad
2,http://onionwsoiu53xre32jwve7euacadvhprq2jytfttb55hrbo3execodad.onion/2017/02/09/second-member-three-man-xanax-smuggling-group-sentenced-time-served/,Second Member ThreeMan Xanax Smuggling Group Sentenced Time Served Onion Web Explore Popular Posts Access Darknet buy Dark web Tour Darkweb Markets Mustread Dont Get Scammed PGP Keys Encrypted Messages use Monero buy online Darknet VS Darkweb Difference Topics ViewallTopics Dark web Drugs Bitcoin Leaks Altcoins Trading Markets Hacking Security DeepDotWeb Guides Reviews Interviews Arrests Popular Spaces Onion Web Darknet Dummies Dr Greenthumb Wheres Mind Doggystyle Reviews Rich 30s High Jones Discover MustVisit DarkRise Darknet Doesnt Fail Darkguard Verify URL dReviews dDarknetStars Recon Vendor Database Reviews Coming soon Dread DiscoverAll Markets Ranking Darknet Marketplaces Darknet Forums Darknet Shops Dead Sites Actions Contact SubmitmyStory AddaSite Donate PGP Mirrors Canary Related Log Sign Account Spaces Topics Contact Us Second Member ThreeMan Xanax Smuggling Group Sentenced Time Served DeepDotWeb DeepDotWeb Feb January 24 Adam Brzozowski member Xanax smuggling ring finally faced Judge sentencing US District Judge Richard J Arcara sentenced Brzozowski timeserved additional oneyear period supervised release superseding indictment case implicated accomplices Grand Jury charged Brzozowski conspiracy distribute controlled substance importation alprazolam two codefendants faced additional charges involved Bitcoin money laundering Brzozowski dodged charges According criminal complaint Brzozowskis accomplices Zhe Wang Kevin Szura sold significant amount drugs laundered hundreds thousands Bitcoin three University Buffalo students Wang received initial publicity Wang signed plea agreement early heand yet sentenced Szurahighlighted DoJ press release statement US Attorneys Office Western District New York featured men p Interestingly Brzozowskis name never made list case nonexistent time according court documentsRegarding darknet US Attorney Hochul said case demonstrates evergrowing ways virtual world intersecting exploited real life crime criminals continued involved illicit activities know law enforcement prepared track deep dark portions web order bring criminals justiceInstead another case filled third slot albeit another indictment press release announced Richard Petix 30yearold Rochester faced unlicensed money transmitting charges sold 200in Bitcoin Wang Szura though made list Bitcoinrelated money laundering drug distribution darknet drug importation Officially listed conspiracy distribute controlled substances money laundering conspiracy money laundering conducting monetary transaction criminally derived property according announcementOnce case took full extent groups crimes became clear part sold Xanaxalso known alprazolam mentioned MDMA occasion paid cash vs Bitcoin Xanax investigation group began undercover Homeland Security agent made contact Wang Szura two caused unraveling security according criminal complaintwherein agents codename UCA1 replaced real nameThe group members openly discussed details operation undercover agentI UCA1 asked needed bitcoins Szura replied bars Wang added Xanax replied sold Xanax amounts thousands also said Xanax came CanadaAdditionally Wang Szura discussed UCA one well known dark web vendors controlled substances typically accept payment virtual currency Bitcoins prices various controlled substances websites March 2016 law enforcement intercepted two packagesfrom Canadawith 3Xanax bars per package Brzozowski ordered real name address police officers found quickly end groups Xanax reign University Buffalo law enforcement estimated sold 80bars course year Officers added majority Xanax circulated locally implied group sold remotely details specifics surfaced available court documentsBrzozowski 23yearold former UB student received time servedabout six monthsso became free man last hearing Assuming violate terms supervised release Wang mentioned pleaded guilty exchange 24month sentence federal cell went Szura guilty Authorities revealed sentencing date Previous article Bitcoin Legislation Investigation Proposal Next article Suspected Hacker Behind NeverQuest Banking Trojan Arres Author DeepDotWeb Without doubt predecessor TheOnionWeb DeepDotWeb news site dedicated events surrounding dark web featuring interviews reviews darknet markets Tor hidden services legal actions privacy bitcoin related news Articles Donate Bitcoin 1NDqCHu3C8rjgfJs34TgZ8BKa2VsuduRMC Monero 46UwFaceGmLheF9qRq6EjSAmuJF2P5KVfXinVM4NEr6DJhxAWW2j2D79BUTe1HMnTTNt3cbz6QKUEEhmnaZVrMzMKaAtgCW Comments Write comment Write Comment view comments Read write comment Read guidelines Comment text Post Comment Advertise Darknet Sites Featured Sites Torrez 100 CannaHome 100 Abacus Market 97 Markets Revolution Market 98 Vice City 100 Dark0de 95 Cannazon 74 ASAP Asean 100 Cartel 86 Archetyp Market 97 Tor2door 100 Monopoly 94 Versus 98 Tor Market NZ 100 HYDRA RU 76 Vendor Shops new shit 99 WeAreAmsterdam 95 CharlieUK 100 French Connection 100 ThePirateIsland 93 TomJerry 100 Medicine Man UK 100 SmokersCo 100 Auspride 100 Digital Thrift Shop Pl 100 HeinekenExpress 100 o3shop RU 100 Social Dread 92 Majestic Garden 86 HUB 57 Deutschland im Deep Web DE 85 Cebulka PL 90 Services News Directories LARGEST Markets December TOP number products Full Ranking Torrez Dark0de Versus ASAP Asean Cartel Bitcoin Today High Low Monero Today High Low Latest Comments Authentik2900 Site à éviter commande de c faite chez eux jamais reçu une arnaque TomJerrys profile mawosx low contact waiting days parcel 50g coco contact pr WeAreAmsterdams profile foster6la biggest greatest Torrezs profile Fidel Dam Im cannabis plug left Cannazons profile 14characters Looking make Make Money Looking Job Post Find Job Deep Web krazydversa ey ross aim chile espero que algun dia encuentres la libertad fr Life Box kotorfan21 anyone know actual Nonscams registeredreal passports Newbies Spaces space MahNemzJeff loyal Torguard user going years hands TorGuard VPN Review FUCKOFF MOTHER SCAM WEBSITE DarkFox Markets profile oshit Allowing users finalize orders withdraw funds White House Markets profile Tag Cloud Bitcoin Darknet Dark Web Drug Sentenced Arrested Man News Tor Drugs Silk Road Prison Market German years Price Busted Cybercrime Net Markets Cannabis Bitcoin Monero Forum Bitcoin,bad
