index,link,text,marker
22,http://darkzzx4avcsuofgfez5zq75cqc4mprjvfqywo45dfcaxrwqg6qrlfid.onion/post/nottinghamshire-darkweb-xanax-vendor-avoids-prison/,Nottinghamshire Xanax Vendor Avoids Prison DarknetliveMonero needs help OSPEAD Fortifying Monero Statistical Attack ccsgetmoneroorgDarknetlive HomeArrestsMarketsCryptoForumsOnionsShopsHomePostsNottinghamshire Xanax Vendor Avoids PrisonNottinghamshire Xanax Vendor Avoids Prisonmins Published Dennis Jan tagged Darkweb Vendors using words Comments Nottinghamshire man sentenced months prison suspended two years darkweb drug trafficking years Stephen HenryPalmer Retford Nottinghamshire sold thousands Xanax Diazepam pills undisclosed darkweb marketplace exchange bitcoinOn December 7 2020 HenryPalmer appeared Judge James Sampson Nottingham Crown Court sentencing hearing hearing prosecution led Jon Fountain explained court defendant ran darkweb drug trafficking operation law enforcement finally caught manAccording prosecution investigations HenryPalmer began law enforcement went residence Retford found considerable amount Xanax Diazepam pills police questioned defendant concerning discovered pills questioning HenryPalmer claimed purchased pills personal use Investigators found evidence contradicted claim receipts packaging material emails HenryPalmer used recorded delivery customers received email customer received packageLaw enforcement looked least two HenryPalmers customers addresses recovered recorded delivery emails seized computer first customer told investigators learned defendant online form making initial contact HenryPalmer customer routinely purchased packages diazepam pills second buyer similar story except first learned HenryPalmer darkweb marketplace instead forum also purchased several packages diazepam pills paid BitcoinThe prosecution told court law enforcement recovered 21Xanax diazepam pills investigation defendant Evidence indicated dealer originally sourced drugs locally quickly find new suppliers India France match increased demand darkweb market usersMr Fountain told court Crown suggests degree sophistication exercised defendant anonymity provided entirely undone recordkeeping significant role street dealing internet Class C drugsAt end hearing Judge Sampson said clear defendant profound medical issues physical mental sentenced months prison suspended two yearsWhat particularly serious effectively dispensing drugs ordinarily controlled available prescription doctor said Judge Sampson saves today medical position genuine illhealth save againThe investigators yet traced bitcoins received defendant marketplace used HenryPalmer customers shut law enforcement completed investigationShare Telegram Gab Mastodon Email Reddit Twitter3 CommentsAnyone claiming vendor either scammer fed Click links riskheydarknetlive031eb440 Sun Jan 12 2020what happening empire right nowiavabo33aac140 Thu Jan 16 2020i think name happyshopper EmpireComprimised3fdb37f0 Sat Feb 22 2020HappyShopper replying Dread saying everything fine LE taken Empire hence exit scamming Making new btc addresses TRACE users Also another vendor supposedly banned also replying Dread users able withdraw deposit funds points LE controlling marketNew comments disabled one month attempt limit spamSee AlsoEmpire Vendor XanScriptz Admits Selling Fake Xanax PillsTrio Admits Selling Psychedelics DarkwebPolice Found Sales Records Vendors USB DriveHeroin Vendor Bestman365 Sentenced PrisonWallstreet Vendor RaptureReloaded Sentenced PrisonNewerOlder DarknetLivepgp mirrors donate canary bible rss,bad
23,http://onionwsoiu53xre32jwve7euacadvhprq2jytfttb55hrbo3execodad.onion/2018/03/02/raleigh-man-pleaded-guilty-darknet-xanax-distribution/,Raleigh Man Pleaded Guilty Darknet Xanax Distribution Onion Web Explore Popular Posts Access Darknet buy Dark web Tour Darkweb Markets Mustread Dont Get Scammed PGP Keys Encrypted Messages use Monero buy online Darknet VS Darkweb Difference Topics ViewallTopics Dark web Drugs Bitcoin Leaks Altcoins Trading Markets Hacking Security DeepDotWeb Guides Reviews Interviews Arrests Popular Spaces Onion Web Darknet Dummies Dr Greenthumb Wheres Mind Doggystyle Reviews Rich 30s High Jones Discover MustVisit DarkRise Darknet Doesnt Fail Darkguard Verify URL dReviews dDarknetStars Recon Vendor Database Reviews Coming soon Dread DiscoverAll Markets Ranking Darknet Marketplaces Darknet Forums Darknet Shops Dead Sites Actions Contact SubmitmyStory AddaSite Donate PGP Mirrors Canary Related Log Sign Account Spaces Topics Contact Us Raleigh Man Pleaded Guilty Darknet Xanax Distribution DeepDotWeb DeepDotWeb Mar Raleigh North Carolina 25yearold Matthew Lee Yensan pleaded guilty several different charges related darknet alprazolam distribution 2017 DEA received tip Raleigh man producing Xanax pills selling darknet DEA raided Yensans house storage unit name found massive quantities pressed Xanax pills hundreds pounds alprazolam powder numerous firearms almost one million dollars cash BitcoinFederal authorities targeted Yensan July 2017 socalled tipster notified DEA Yensan pressing massive numbers alprazolam pills informant told DEA helped Yensan move several pill presses storage unit Raleigh informant also said Yensan selling pressed Xanax bars darknet exchange Bitcoin Federal authorities waited September take action Hereinafter brand name Xanax refer Yensans pressed replicasOn September 9 postal inspector intercepted package headed Yensans address contained three pounds marijuana criminal complaint explained Federal authorities search warrant raided Yensans house three days later Inside law enforcement found pounds marijuana two pounds shatter wax prescription pills MPS rifle Smith Wesson pistol Colt pistol two Glock pistols search house yielded safe contained 300in cash information connected 25yearold several cold storage Bitcoin wallets holding 700000On day authorities searched storage unit Ample Storage facility Raleigh Inside unit court documents revealed authorities found pounds alprazolam Xanax precursors Xanax consists one active ingredient alprazolam Precursors could referred pill binders ingredients required turn powder Xanax pills addition alp powder DEA found 5and 70Xanax pills number pills criminal complaint later court documents varied wildly found many packages contained varying amounts pressed Xanax pills three pill presses electronic pill counterYensan pleaded guilty one count possession intent distribute one count distribution alprazolam one count possession firearm furtherance drug related felony one count money laundering one count conspiracy conceal transaction proceeds drug crime Previous article Man Used Dark Web Browser Download Child Abuse Files Next article Cryptocurrency news roundup March 3 Author DeepDotWeb Without doubt predecessor TheOnionWeb DeepDotWeb news site dedicated events surrounding dark web featuring interviews reviews darknet markets Tor hidden services legal actions privacy bitcoin related news Articles Donate Bitcoin 1NDqCHu3C8rjgfJs34TgZ8BKa2VsuduRMC Monero 46UwFaceGmLheF9qRq6EjSAmuJF2P5KVfXinVM4NEr6DJhxAWW2j2D79BUTe1HMnTTNt3cbz6QKUEEhmnaZVrMzMKaAtgCW Comments Write comment March 10 10am Leethee Damn dude mustve lived cash handToo bad gov doesnt want average civilian pleb hold whatsoever Reply comment reply comment read guidelines X Comment text Post Comment March 5 12am Kurt CHRISTOPH saying use regular mail ship drugs exactly mean whole idea DNMs order drugs mail Thats works please explain exactly mean Reply comment reply comment read guidelines X Comment text Post Comment March 3 7am Christoph fk runnin would done differently Used monero instead bitcoin cooking factory friggin storage unit legal name registry slap bro dont put stuff house Diversify boy Move overseas move another city dunno move another country Dont use regular mail ship drugs dont use regular mail ship drugs dont use regular mail ship drugs need make everyone write chalk board finally head USE REGULAR MAIL SHIP DRUGS odds tripping alarm higher Also careful hire work person hired ratted DEA probably got paid anonymous tip kid genius paid dunno maybe theres incentive rat dunno maybe mention diversify guns drugs cash one house Ok least multiple states prevented interstate trafficking violations would go keeping house million dollars person may bit tricky explain Theres many places launder million large todays technoage Im sure theres casinos car washes bars etc hide safely million would homework made first 10kUSD xanax pushing plan worst thoughtsChristoph Reply comment reply comment read guidelines X Comment text Post Comment March 5 2am trippy g0d Amazing hadnt got dumbass quicker Reply comment reply comment read guidelines X Comment text Post Comment March 10 10am Leethee entire passsageThumbs 100 broham Reply comment reply comment read guidelines X Comment text Post Comment Write Comment view comments Read write comment Read guidelines Comment text Post Comment Advertise Darknet Sites Featured Sites Torrez 100 CannaHome 100 Abacus Market 97 Markets Revolution Market 98 Vice City 100 Dark0de 95 Cannazon 74 ASAP Asean 100 Cartel 86 Archetyp Market 97 Tor2door 100 Monopoly 94 Versus 98 Tor Market NZ 100 HYDRA RU 76 Vendor Shops new shit 99 WeAreAmsterdam 95 CharlieUK 100 French Connection 100 ThePirateIsland 93 TomJerry 100 Medicine Man UK 100 SmokersCo 100 Auspride 100 Digital Thrift Shop Pl 100 HeinekenExpress 100 o3shop RU 100 Social Dread 92 Majestic Garden 86 HUB 57 Deutschland im Deep Web DE 85 Cebulka PL 90 Services News Directories LARGEST Markets December TOP number products Full Ranking Torrez Dark0de Versus ASAP Asean Cartel Bitcoin Today High Low Monero Today High Low Latest Comments Authentik2900 Site à éviter commande de c faite chez eux jamais reçu une arnaque TomJerrys profile mawosx low contact waiting days parcel 50g coco contact pr WeAreAmsterdams profile foster6la biggest greatest Torrezs profile Fidel Dam Im cannabis plug left Cannazons profile 14characters Looking make Make Money Looking Job Post Find Job Deep Web krazydversa ey ross aim chile espero que algun dia encuentres la libertad fr Life Box kotorfan21 anyone know actual Nonscams registeredreal passports Newbies Spaces space MahNemzJeff loyal Torguard user going years hands TorGuard VPN Review FUCKOFF MOTHER SCAM WEBSITE DarkFox Markets profile oshit Allowing users finalize orders withdraw funds White House Markets profile Tag Cloud Bitcoin Darknet Dark Web Drug Sentenced Arrested Man News Tor Drugs Silk Road Prison Market German years Price Busted Cybercrime Net Markets Cannabis Bitcoin Monero Forum Bitcoin,bad
24,http://onionwsoiu53xre32jwve7euacadvhprq2jytfttb55hrbo3execodad.onion/2018/06/16/man-who-distributed-xanax-on-the-dark-web-sentenced-to-six-and-half-years/,Man Distributed Xanax Dark Web Sentenced Six Half Years Onion Web Explore Popular Posts Access Darknet buy Dark web Tour Darkweb Markets Mustread Dont Get Scammed PGP Keys Encrypted Messages use Monero buy online Darknet VS Darkweb Difference Topics ViewallTopics Dark web Drugs Bitcoin Leaks Altcoins Trading Markets Hacking Security DeepDotWeb Guides Reviews Interviews Arrests Popular Spaces Onion Web Darknet Dummies Dr Greenthumb Wheres Mind Doggystyle Reviews Rich 30s High Jones Discover MustVisit DarkRise Darknet Doesnt Fail Darkguard Verify URL dReviews dDarknetStars Recon Vendor Database Reviews Coming soon Dread DiscoverAll Markets Ranking Darknet Marketplaces Darknet Forums Darknet Shops Dead Sites Actions Contact SubmitmyStory AddaSite Donate PGP Mirrors Canary Related Log Sign Account Spaces Topics Contact Us Man Distributed Xanax Dark Web Sentenced Six Half Years DeepDotWeb DeepDotWeb Jun North Carolina man pleaded guilty manufacturing Xanax pills selling large batches dark web handed six half years prison sentence Matthew Lee Yensan 25 admitted following charges possession intent distribute quantity alprazolam distribution quantity alprazolam means internet possession firearm furtherance drug trafficking crime conspiracy conceal transactions financial institution drug proceeds 10000 international money launderingYensans illegal business came radar US Drug Enforcement Agency July last year DEA received tip informant Yensan producing large amounts Xanax storage unit Gorman Street West Raleigh aid many pill presses took dark web sell exchange bitcoins According informant helped Yensan move numerous pill presses storage unitThe events transpired compelled federal authorities keep close eye Yensan months later September package seized agent federal postal inspectors service supposed land Yensans home seized package three pounds highend marijuana later opened Three days later search warrant Yensans house issued federal agents search uncovered pounds highend marijuana two pounds shatter several prescription medications THCbased product smokingYensan owner Vending bought pill presses Xanax molds China paid sending 1in US currency Postal Savings Bank China action considered international money launderingMany firearms including two Glock caliber pistols Colt revolver MPS caliber rifle Smith Wesson revolver fully loaded also seized federal agents agents described positions firearms hidden defensive positions Two safes also found one locked containing stack cash totalling 300000 Computer forensic analysis also revealed Yensan million virtual currencyA fake South Carolina drivers license reportedly used acquiring storage unit Gorman Street also uncovered federal agents together cryptocurrency storage cards digital evidence Somehow satisfied accomplished federal agents obtained second warrant search another unit Ample Storage Agents seized pounds Xanax precursors benzodiazepine postal shipping boxes containing various amounts Xanax pills packaged Mylar bags three industrialsize pill presses two electronic mixers electronic pill counter 70counterfeit pills pressed XanaxYensan made forfeit belongings earnings could result illegal business surrendered three pill presses two personal watercraft personal watercraft trailer Chevrolet Colorado Chevrolet Corvette bitcoins worth 71515197 269in cash addition firearms seizedYensan however Raleigh native get trouble law illegal drug dealings involving Xanax last month another Raleigh man arrested drug charges selling Xanax Snapchat Reports police report state 22yearold Charles Burney block Lash Avenue contacted supplier using multimedia messaging appThe police received complaint Burney selling large amounts Xanax marijuana home according affidavit Upon interrogation stated got drugs guy knew Prophet charged possession intent manufacture sell deliver schedule IV controlled substance Previous article German Police Arrest Two Suspected Darknet Dealers Next article Years Prison Hacker Helped Russians Author DeepDotWeb Without doubt predecessor TheOnionWeb DeepDotWeb news site dedicated events surrounding dark web featuring interviews reviews darknet markets Tor hidden services legal actions privacy bitcoin related news Articles Donate Bitcoin 1NDqCHu3C8rjgfJs34TgZ8BKa2VsuduRMC Monero 46UwFaceGmLheF9qRq6EjSAmuJF2P5KVfXinVM4NEr6DJhxAWW2j2D79BUTe1HMnTTNt3cbz6QKUEEhmnaZVrMzMKaAtgCW Comments Write comment Write Comment view comments Read write comment Read guidelines Comment text Post Comment Advertise Darknet Sites Featured Sites Torrez 100 CannaHome 100 Abacus Market 97 Markets Revolution Market 98 Vice City 100 Dark0de 95 Cannazon 74 ASAP Asean 100 Cartel 86 Archetyp Market 97 Tor2door 100 Monopoly 94 Versus 98 Tor Market NZ 100 HYDRA RU 76 Vendor Shops new shit 99 WeAreAmsterdam 95 CharlieUK 100 French Connection 100 ThePirateIsland 93 TomJerry 100 Medicine Man UK 100 SmokersCo 100 Auspride 100 Digital Thrift Shop Pl 100 HeinekenExpress 100 o3shop RU 100 Social Dread 92 Majestic Garden 86 HUB 57 Deutschland im Deep Web DE 85 Cebulka PL 90 Services News Directories LARGEST Markets December TOP number products Full Ranking Torrez Dark0de Versus ASAP Asean Cartel Bitcoin Today High Low Monero Today High Low Latest Comments Authentik2900 Site à éviter commande de c faite chez eux jamais reçu une arnaque TomJerrys profile mawosx low contact waiting days parcel 50g coco contact pr WeAreAmsterdams profile foster6la biggest greatest Torrezs profile Fidel Dam Im cannabis plug left Cannazons profile 14characters Looking make Make Money Looking Job Post Find Job Deep Web krazydversa ey ross aim chile espero que algun dia encuentres la libertad fr Life Box kotorfan21 anyone know actual Nonscams registeredreal passports Newbies Spaces space MahNemzJeff loyal Torguard user going years hands TorGuard VPN Review FUCKOFF MOTHER SCAM WEBSITE DarkFox Markets profile oshit Allowing users finalize orders withdraw funds White House Markets profile Tag Cloud Bitcoin Darknet Dark Web Drug Sentenced Arrested Man News Tor Drugs Silk Road Prison Market German years Price Busted Cybercrime Net Markets Cannabis Bitcoin Monero Forum Bitcoin,bad
25,http://onionwsoiu53xre32jwve7euacadvhprq2jytfttb55hrbo3execodad.onion/2018/03/11/high-school-student-busted-selling-xanax-undercover-cop/,High school Student Busted Selling Xanax Undercover Cop Onion Web Explore Popular Posts Access Darknet buy Dark web Tour Darkweb Markets Mustread Dont Get Scammed PGP Keys Encrypted Messages use Monero buy online Darknet VS Darkweb Difference Topics ViewallTopics Dark web Drugs Bitcoin Leaks Altcoins Trading Markets Hacking Security DeepDotWeb Guides Reviews Interviews Arrests Popular Spaces Onion Web Darknet Dummies Dr Greenthumb Wheres Mind Doggystyle Reviews Rich 30s High Jones Discover MustVisit DarkRise Darknet Doesnt Fail Darkguard Verify URL dReviews dDarknetStars Recon Vendor Database Reviews Coming soon Dread DiscoverAll Markets Ranking Darknet Marketplaces Darknet Forums Darknet Shops Dead Sites Actions Contact SubmitmyStory AddaSite Donate PGP Mirrors Canary Related Log Sign Account Spaces Topics Contact Us High school Student Busted Selling Xanax Undercover Cop DeepDotWeb DeepDotWeb Mar Police arrested high school senior Massachusetts distributing Xanax allegedly purchased darknet senior 18yearold Ethan Morris fell trap set law enforcement selling undercover officer met Facebook arrest pleaded guilty drug charges arraignment hearing front Judge William Rota Southern Berkshire District CourtThe school alerted police someone selling pressed alprazolam bars double dose pharmaceutical Xanax school also sent email instilling fear parents students attended school FUDfilled email saidCounterfeit Xanax often comes bars contain 3times amount Benzodiazepine prescribed Xanax Fake Xanax bars produced home labs substitute ingredients may include chalk baking powder Hydrochloric Acid ammonia rat poison fentanyl deadly analgesicSomeone sent tip police set investigation onto Morris motion officer Morris using Facebook Messenger decided meet Housatonic conduct transaction agreed upon price pills Police officers arrested Morris conducted business undercover officerPolice officers seized iPhone drugs received consent search Morris bedroom found laptop flash drive pill halves reason Morris began admitting police every detail needed build even better case told officers purchased 1pills darknet 750 Postal Service delivered pills pills arrived 18yearold said sold anywhere buyers later point interview lowered range buyers 50He assured investigators never sold anyone years old Morris said charged pill unless buyer purchased pills point Morris dropped price per pill told investigators sold pressed bars anyone high school investigators reason believe otherwise thoughIn January car containing four girls ages rolled ditch police found Xanax marijuana alcohol vehicle One girls told police taken Xanax blacked two days using police good reason believe Xanax found scene incident matched Xanax sold Morris State Police Crime Lab running tests pills Morris pills car find matchMeanwhile Morris waiting next court appearance late March Previous article German Darknet Vendor Sentenced Rehab Probation Next article Europol Monero Zcash Dash Hamper Work Author DeepDotWeb Without doubt predecessor TheOnionWeb DeepDotWeb news site dedicated events surrounding dark web featuring interviews reviews darknet markets Tor hidden services legal actions privacy bitcoin related news Articles Donate Bitcoin 1NDqCHu3C8rjgfJs34TgZ8BKa2VsuduRMC Monero 46UwFaceGmLheF9qRq6EjSAmuJF2P5KVfXinVM4NEr6DJhxAWW2j2D79BUTe1HMnTTNt3cbz6QKUEEhmnaZVrMzMKaAtgCW Comments Write comment July 15 5am Todd actually feel sorry kid confessed oh God kid way head good prices though lol Reply comment reply comment read guidelines X Comment text Post Comment March 11 12am Klank Whoop goes future Reply comment reply comment read guidelines X Comment text Post Comment March 13 6am dsfasf nope arrested thing except aint snitch narc like 18 1st offense get drug program depending states lawsand boston dude fucked gonnna get beat hrs community labor months jail timeif complete program could possiby dropped wobbler charge even dismissedif police read miranda rights know 5th amendment w lawyer present likely casenever sell drugs kidsi mean never go MEET always come LMAO Reply comment reply comment read guidelines X Comment text Post Comment March 11 10am DeezNuts reasonable prices hate see kid go Reply comment reply comment read guidelines X Comment text Post Comment Write Comment view comments Read write comment Read guidelines Comment text Post Comment Advertise Darknet Sites Featured Sites Torrez 100 CannaHome 100 Abacus Market 97 Markets Revolution Market 98 Vice City 100 Dark0de 95 Cannazon 74 ASAP Asean 100 Cartel 86 Archetyp Market 97 Tor2door 100 Monopoly 94 Versus 98 Tor Market NZ 100 HYDRA RU 76 Vendor Shops new shit 99 WeAreAmsterdam 95 CharlieUK 100 French Connection 100 ThePirateIsland 93 TomJerry 100 Medicine Man UK 100 SmokersCo 100 Auspride 100 Digital Thrift Shop Pl 100 HeinekenExpress 100 o3shop RU 100 Social Dread 92 Majestic Garden 86 HUB 57 Deutschland im Deep Web DE 85 Cebulka PL 90 Services News Directories LARGEST Markets December TOP number products Full Ranking Torrez Dark0de Versus ASAP Asean Cartel Bitcoin Today High Low Monero Today High Low Latest Comments Authentik2900 Site à éviter commande de c faite chez eux jamais reçu une arnaque TomJerrys profile mawosx low contact waiting days parcel 50g coco contact pr WeAreAmsterdams profile foster6la biggest greatest Torrezs profile Fidel Dam Im cannabis plug left Cannazons profile 14characters Looking make Make Money Looking Job Post Find Job Deep Web krazydversa ey ross aim chile espero que algun dia encuentres la libertad fr Life Box kotorfan21 anyone know actual Nonscams registeredreal passports Newbies Spaces space MahNemzJeff loyal Torguard user going years hands TorGuard VPN Review FUCKOFF MOTHER SCAM WEBSITE DarkFox Markets profile oshit Allowing users finalize orders withdraw funds White House Markets profile Tag Cloud Bitcoin Darknet Dark Web Drug Sentenced Arrested Man News Tor Drugs Silk Road Prison Market German years Price Busted Cybercrime Net Markets Cannabis Bitcoin Monero Forum Bitcoin,bad
