index,link,text,marker
0,http://onionwsoiu53xre32jwve7euacadvhprq2jytfttb55hrbo3execodad.onion/2018/03/29/pedophile-charged-child-porn-ordering-fentanyl/,Pedophile Charged Child Porn Ordering Fentanyl Onion Web Explore Popular Posts Access Darknet buy Dark web Tour Darkweb Markets Mustread Dont Get Scammed PGP Keys Encrypted Messages use Monero buy online Darknet VS Darkweb Difference Topics ViewallTopics Dark web Drugs Bitcoin Leaks Altcoins Trading Markets Hacking Security DeepDotWeb Guides Reviews Interviews Arrests Popular Spaces Onion Web Darknet Dummies Dr Greenthumb Wheres Mind Doggystyle Reviews Rich 30s High Jones Discover MustVisit DarkRise Darknet Doesnt Fail Darkguard Verify URL dReviews dDarknetStars Recon Vendor Database Reviews Coming soon Dread DiscoverAll Markets Ranking Darknet Marketplaces Darknet Forums Darknet Shops Dead Sites Actions Contact SubmitmyStory AddaSite Donate PGP Mirrors Canary Related Log Sign Account Spaces Topics Contact Us Pedophile Charged Child Porn Ordering Fentanyl DeepDotWeb DeepDotWeb Mar Recently unsealed court documents US District Court Northern District Ohio revealed Ryan Klutha 47yearold Marion Countyordered fentanyl darknet unusual reason told investigators ordering fentanyl carfentanil China effort curb desire access child abuse contentIn October 2017 Cleveland Postal Inspection Service Field Office received package Marion County postal service center package raised flags instead sending package Kluth postal service management sent increasingly skilled postal inspectors October 5 postal inspectors opened package found bag contained white powder USPIS securely transported unidentified powder Cuyahoga County Forensic Laboratory lab identified powder furanylfentanylAn affidavit signed Postal Inspector Bryon Green revealed USPIS field office forensic laboratory agreed upon weight furanylfentanyl weighed grams Green confirming package contained illegal substance spoke postal carrier frequently delivered mail address Kluth given darknet vendor postal carrier said often delivered packages Kluths place employmentAlloway Environmental Testingbut never actually met Kluth employees signed packages carrier confirmed Kluth received number packages Canada ChinaAlloway Environmental Testing longer employs KluthGreen according affidavit interviewed Kluth October 11 2017 Kluth allegedly admitted ordering fentanyl carfentanil darknet packages always delivered former place employment Columbus home Kluth said interview Kluth consented searches electronic devices Investigators found evidence led believe Kluth made dozens purchases darknet August September alone Kluth purchased carfentanil fentanyl nine times February 2017 allegedly placed order one gram fentanyl denied ever selling drug thoughHe explained used curb appetite child abuse content found darknet addition history drug purchases electronic devices contained thousands illegal pictures Investigators found 1pictures videos child abuse almost 30exploitive pictures videos Kluths iPad computers allegedly proved used access wellknown child abuse forum darknetKluth said never uploaded picture also said touched abused child life According statement cravings vanished started using fentanyl carfentanil one year prior arrest must significant amount faith fentanylbased abstinence investigation postal workers kept intercepting packages Even day arrest law enforcement seized packages retrieved mailboxes belonged KluthA criminal complaint filed March accused Kluth conspiracy possess intent distribute distribute controlled substances attempted possession controlled substances intent distribute possession child pornography receipt child pornography court date made public Previous article Man Used Darknet Incite Sexual Abuse Next article Drugs ordered Darknet Austrian police arrest three deal Author DeepDotWeb Without doubt predecessor TheOnionWeb DeepDotWeb news site dedicated events surrounding dark web featuring interviews reviews darknet markets Tor hidden services legal actions privacy bitcoin related news Articles Donate Bitcoin 1NDqCHu3C8rjgfJs34TgZ8BKa2VsuduRMC Monero 46UwFaceGmLheF9qRq6EjSAmuJF2P5KVfXinVM4NEr6DJhxAWW2j2D79BUTe1HMnTTNt3cbz6QKUEEhmnaZVrMzMKaAtgCW Comments Write comment April 5 6am Lock Us kind problem agree drugs curb sexual desire anyone used heroin would push woman roll shoot Seems like possible way put child rapist check Prison doesnt help drug criminals makes worst criminals problem illegality drugs drugs illegal saves lives drugs killing people correct degree understand laws meant prevent deaths actually cause death drugs massive amount First always demand drugs First thing learn economics business law supply demand demand something supply cant blame people demand Drugs around since way illegal back wasnt blown proportion actually less users looked differently days laws make people get drugs violence street possible gun toting lunatic higher anything Violence happens someone caught drugs always make rat dealers higher chain gets people killed Gangs kill selling street corners selling get money fund guns People kill eachother drug deals gone bad shoot police facing life prison drugs Wouldnt getting perverts street likely work rehab way get drugs street Stop people wanting arresting everyone Prison makes worst better citizens know many people die Mexico everyyear cartels kill fun bribe officials kill dont take bribes whole government Mexico corrupt MANY die drug laws countries survive financially producing drugs country Cartels come border Wait till police wear masks bring violence Remember worst drug except heroin made illegal Alchohol Alcohol kills many people heroin year US never win war drugs prohibition caused much higher death rate everything became criminally run Mobsters moonshiners polititians murder rampant like drugs try stop sale drugs online safer street like want laws create violence murder could go whole thing gov could regulate drugs sell cheaper less robbery like marijuana dispensary know weed doesnt phermeldahide Drugs wouldnt laced Money would go rehab addicts want get find room rehab could afford rehab cant laws even court forces countries made drugs legal much higher amount drug addicts offered help prison trained councelors work pedophiles much chance losing desire kids help born way wrong gay people sexual deviations law pedophile dont chose pedophiles wish could get help society freaks announce pedophiles harm kids family member could pedophile know hurt child everywhere Thy took pedophile site online millions users people scared help people drug addicts goto prison pedophile believe hurt kid go prison eventually get prison doesnt make better like drug addict pedophile learns hunt children makes WORST society understands criminalization isnt answer everything wont make better world already highest prison population even compared size every males US jail Thats ridiculous ashamed criminals country Even North Korea doesnt put many people work camps prison damn fart order go work camp Could US harder crime North Korea heard doesnt seem way Reply comment reply comment read guidelines X Comment text Post Comment April 1 5am Postal Inspection country lambs sounds like North Korea Reply comment reply comment read guidelines X Comment text Post Comment March 30 2am Justin Time feel like prime example someone attempting selfmedicate great drug government hates someone using dn drug markets exaclty classic dictum harm reduction applies Purchasing home allows avoid meeting someone shady uses drug prevent danger society pedos suck guy used one hurting anyone sitting house drugged playing flacid pecker Reply comment reply comment read guidelines X Comment text Post Comment March 29 4am johngalt would definitely work though fentanyl destroys sexual desire didnt get boner year Reply comment reply comment read guidelines X Comment text Post Comment Write Comment view comments Read write comment Read guidelines Comment text Post Comment Advertise Darknet Sites Featured Sites Torrez 100 CannaHome 100 Abacus Market 97 Markets Revolution Market 98 Vice City 100 Dark0de 95 Cannazon 74 ASAP Asean 100 Cartel 86 Archetyp Market 97 Tor2door 100 Monopoly 94 Versus 98 Tor Market NZ 100 HYDRA RU 76 Vendor Shops new shit 99 WeAreAmsterdam 95 CharlieUK 100 French Connection 100 ThePirateIsland 93 TomJerry 100 Medicine Man UK 100 SmokersCo 100 Auspride 100 Digital Thrift Shop Pl 100 HeinekenExpress 100 o3shop RU 100 Social Dread 92 Majestic Garden 86 HUB 57 Deutschland im Deep Web DE 85 Cebulka PL 90 Services News Directories LARGEST Markets December TOP number products Full Ranking Torrez Dark0de Versus ASAP Asean Cartel Bitcoin Today High Low Monero Today High Low Latest Comments Authentik2900 Site à éviter commande de c faite chez eux jamais reçu une arnaque TomJerrys profile mawosx low contact waiting days parcel 50g coco contact pr WeAreAmsterdams profile foster6la biggest greatest Torrezs profile Fidel Dam Im cannabis plug left Cannazons profile 14characters Looking make Make Money Looking Job Post Find Job Deep Web krazydversa ey ross aim chile espero que algun dia encuentres la libertad fr Life Box kotorfan21 anyone know actual Nonscams registeredreal passports Newbies Spaces space MahNemzJeff loyal Torguard user going years hands TorGuard VPN Review FUCKOFF MOTHER SCAM WEBSITE DarkFox Markets profile oshit Allowing users finalize orders withdraw funds White House Markets profile Tag Cloud Bitcoin Darknet Dark Web Drug Sentenced Arrested Man News Tor Drugs Silk Road Prison Market German years Price Busted Cybercrime Net Markets Cannabis Bitcoin Monero Forum Bitcoin,bad
1,http://pornhubvybmsymdol4iibwgwtkpwmeyd6luq2gxajgjzfjvotyt5zhyd.onion/users/elchinoquepedo,Elchinoquepedos Profile Pornhubcom OK looking Upload Photos Videos Upgrade Login Sign Home Porn Videos Categories Live Cams Pornstars Meet Fuck Community Photos GIFs Discover Videos Recommended Hottest Viewed Top Rated Popular Homemade Explore Playlists Channels Random Pornhub Premium Newest Viewers Choice Hottest 12HD Seductive MILF Emily Addison Big Tits Multiple Orgasms Bratty Milf 15M views 89 days ago 10HD Used Like Personal Fuck Toy ROUGH Passionate Sex Horny Babe Abbie Maley Abbie Maley 83M views 86 days ago Hottest Recommended 34HD Free MomsTeachSex Im thankful stepmoms titties helpful Im fantasizing Moms Teach Sex 72M views 90 weeks ago 26HD Free Family Swap Swap Sis Ill show mine show S2E6 Family Swap XXX 35M views 91 weeks ago Recommended Playlists videos Play View Playlist BBC Pussy farts Bigchocolatebbc views 100 videos Play View Playlist Fourth July milf 250Yummycakefordays 148K views 100 Playlists Channels Limit Rank Model Media Rank Channels Trending Searches gentstudent anouk maze hannistons astrid wett stella barey doggy style abbie maley sheena ryder Discover Categories Popular Alphabetical Number Videos Gay Categories Trending Searches gentstudent anouk maze hannistons astrid wett stella barey doggy style abbie maley sheena ryder Japanese Teen 18 Lesbian Mature Ebony MILF Anal Amateur Hentai Cartoon Threesome Big Tits Public Transgender OldYoung Big Dick Creampie Female Orgasm Bondage Squirt See Discover Pornstars Verified Amateurs Pornstars Male Actors Top Trending Candy Love Videos 121M Views Codi Vore Videos 686M Views Popular Adriana Chechik Videos 959M Views Violet Myers Videos 186M Views Viewed Sara Jay Videos 312M Views Kim Kardashian Videos 336M Views Popular Filters Fake Tits Natural Tits Small Tits Huge Tits Red Heads Blondes Brunettes Piercings Tattooed Asian Arab Latin Black Indian White 18 Teens MILFs Mature Discover Community Model Contests Community Feed Top Members Newest Verified Girls Newest Verified Couples Newest Verified Guys Popular Verified Models Online Members Member Search Contests Popular Viewers Choice December SweetDarling FoxyElf papaxmama Arrilast AmateurHomeGirls Flame Jade See Viewed November Leolulu Cory Chase October Danika Mori Jordi El Nino Polla September littlebuffbabe Angela White See Popular Verified Mayven Doll Ainsley Lea MaxiLovers litclit69 Peeplay Squirt Queen LilMissCumSponge See Popular New Daddydumz nekomaruroom miss_hediye Gadis asia Sweetieline French Majestix See Discover Photos Gifs Porn GIFs Top Rated GIFs Viewed GIFs Photo Albums Top Rated Albums Viewed Albums Upload Photos Make GIF Top Rated Gifs asdfg deepthroat Top Rated Viewed Gifs Hot Doggy cute honey Viewed Top Rated Albums High Socks Lollipop Photos Play time Photos Top Rated Viewed Albums Wiileuse Photos 98 adventures Photos 98 Viewed Popular Tags Tits Ass Pussy Amateur Dick Hot Teen Hentai Sex Boobs Babe Cum Blonde Blowjob Anal Black Brunette Asian MILF Cumshot leaving Pornhubcom ADS PREMIUM PORN HANDLE WELCOME BEST PORN EXPERIENCE EVER FINALLY PORN EXPERIENCE DESERVE Ads Exclusive Content High Quality HD Cancel Anytime Offering exclusive content available Pornhubcom Super affordable 999month Start Free Week Pornhub Premium Go Back leaving Pornhubcom Free day premium access Ads Exclusive Content HD Videos Cancel Anytime Start Watch exclusive video pornhub premium Luckily FREE day access Watch hd video never see ads Claim day free access Watch 1080p video pornhub premium Luckily FREE day access Watch hd video upgrading today get one week free access Ads Exclusive Content HD Videos Cancel Anytime Claim day free access signing today get one week free access Ads Exclusive Content HD Videos Cancel Anytime Claim day free access Offering exclusive content available Pornhubcom Elchinoquepedo Mexico subscribers friend videos watched Stream Videos Photos Add Friend Subscribe Login Sign post Post Video Photo Playlist Gifs View Activity View Activity Posts View View Videos Photos Playlists Posts Achievements Elchinoquepedo unlocked new achievement Freshman weeks ago Thumbs Thumbs Elchinoquepedo subscribed pornstars month ago Rank Angela White Elchinoquepedo subscribed users month ago Angela White Sweetie_Fox Elchinoquepedo unlocked new achievement Porn Buff months ago Thumbs Thumbs Elchinoquepedo unlocked new achievement Hand Held months ago Thumbs Thumbs Elchinoquepedo unlocked new achievement Virgin months ago Thumbs Thumbs Elchinoquepedo subscribed users months ago Purple Bitch Gender None Last Login weeks ago Relationship Status Single Interested Girls Country Mexico Profile Views Videos Watched Achievements 4View Pornstar Subscriptions 1View Angela White Subscribers 2View Sofia Sordilli BentleyKaryn Subscriptions 2View Angela White Purple Bitch Channel Subscriptions 1View Blacked Rank Report User Youre subscribe Fan Club Becoming Fan supporting model continue creating amazing content may even get additional exclusive content would listed Plus chosen include Report Perks FANCLUB_PRICE Become Fan PRICE_DISCLAIMER prices include VAT charge appear statement PROBILLERCOM 855232All purchases final US unless otherwise stated See terms conditions Enter last digits credit card associated account FANCLUB_PRICE Become Fan PRICE_DISCLAIMER prices include VAT charge appear statement PROBILLERCOM 855232All purchases final US unless otherwise stated See terms conditions Login Signup Logging Remember computer recommended public shared computers FANCLUB_PRICE Become Fan PRICE_DISCLAIMER prices include VAT TwoStep Verification Logging text message code sent Enter code Verify Didnt receive code Resend Dont phone Contact Support signing agree Terms Conditions FANCLUB_PRICE Become Fan PRICE_DISCLAIMER prices include VAT sure want stop becoming Fan dont want leave Yes please let leave restart purchase leave Amazing Youre big Fan actually wanted sign 2nd time Congratulations youre fan dont worry arent charging want support send tip Send tip Fan Club currently disabled Fan Club Please check back future become Fan Ok Understood Fanclub membership Card Number Card Number required MM YY Expiry Date invalid CVC Security Code CVC required First Name First Name required Last Name Last Name required ZipPostal Zip Code required Saved Total PRICE_DISCLAIMER Please note charges US unless otherwise specified charges appear statement discretely Probillercom 8552329555 prices include VAT completing transaction certify years older accept Privacy Policy Terms Conditions Contact customer support PROBILLERCOM use cookies optimize site functionality give best possible experience Learn OK Ads Traffic Junky Information Sitemap Terms Conditions Privacy Policy DMCA Work Us Content Partners Advertise Webmasters Model Program Press Support Help Content Removal Contact Support FAQ Trust Safety Parental Controls Feedback Discover Pornhub Blog Insights Blog Sexual Wellness Center Mobile Visually Impaired Language English Deutsch Français Español Italiano Português Polski Русский 日本語 Dutch Czech 中文简体 Pornhubcom Notice Leaving Pornhub page youre trying access part Pornhub safety privacy Pornhub account remember never enter password site pornhubcom pornhubpremiumcom Continue external site Go Back Warning Link May Unsafe page trying access official Pornhub site may dangerous safety privacy link disabled Close,bad
2,http://onionwsoiu53xre32jwve7euacadvhprq2jytfttb55hrbo3execodad.onion/2017/02/17/police-fear-that-an-infamous-pedophile-still-runs-his-darknet-porn-site/,Police Fear Infamous Pedophile Still Runs Darknet Porn Site Behind Bars Onion Web Explore Popular Posts Access Darknet buy Dark web Tour Darkweb Markets Mustread Dont Get Scammed PGP Keys Encrypted Messages use Monero buy online Darknet VS Darkweb Difference Topics ViewallTopics Dark web Drugs Bitcoin Leaks Altcoins Trading Markets Hacking Security DeepDotWeb Guides Reviews Interviews Arrests Popular Spaces Onion Web Darknet Dummies Dr Greenthumb Wheres Mind Doggystyle Reviews Rich 30s High Jones Discover MustVisit DarkRise Darknet Doesnt Fail Darkguard Verify URL dReviews dDarknetStars Recon Vendor Database Reviews Coming soon Dread DiscoverAll Markets Ranking Darknet Marketplaces Darknet Forums Darknet Shops Dead Sites Actions Contact SubmitmyStory AddaSite Donate PGP Mirrors Canary Related Log Sign Account Spaces Topics Contact Us Police Fear Infamous Pedophile Still Runs Darknet Porn Site Behind Bars DeepDotWeb DeepDotWeb Feb Richard Huckle earned crown Britains worst pedophile ever parts world Huckleand possibly even worse one Philippines dealt one example Peter Scullys name traveled far beyond small circles follow darknet deepweb news made mainstream media prolific acts violence towards children TV show Minutes featured entire episode man Police Philippines hunted placed behind bars 2015 ending reign terror recent arrest however shined light evidence suggested Scully still ran child abuse network darknetfrom jail cellThe term worst comes attached personal preferences opinions Richard Huckle earned title news outlets used without objection debate Peter Scully earned similar title jail staff police officers Though may outside Philippines left much imprint Huckle left news presence may ended Additionally world never saw large scale takedown Scully Huckle via Taskforce Argoss international bust Love ZoneBut Scully ran massive online child pornography scene abused children live viewers across world via hidden services left nearly untraceable child pornography days Scully already faced charges Australia fraud fraud charges pushed flee Philippines earned name Online people knew chld porntorture video sold pedophiles across world 10000After scurrying Philippines 52yearold pedophile began growing popularity films featured female accomplices children young 18monthsold Police knocked doors matched parts Scullys videos found man himselfThey arrested Scully livein partnergirlfriend met young age pimped source income However let go lacked concrete proof involvement later 2015 led police house Scully buried remains 12yearold girl underneath According Liezyl Margallo former livein partner kept girl sex slave strangled Officials said planned testify predator charges pleaded guilty including murder child abuseIn arguably popular video woman participated filmed child abuse wore nothing face mask Recent evidence authorities announced called arrest Liezyl Margallo former partner evidence indicated acted Scullys film tooas naked woman behind maskAfter arrest police found communications Scully cell phone texted called man week arrest Investigators neglected reveal contents messages speak press Dominador Cimafranca director Philippine National Bureau Investigation said fear Scully still top online servicesIf Margallo started working Scully againor never stoppedthe case child abuser took major blow fire Cagayan de Oro City Hall destroyed evidence collected Australian Philippine police Prosecutors counted Margallos testimonyLaw enforcement said would perform full investigation Scully used cellphone potentially operate business behind bars Previous article FBI Concerned Criminals Could Use Monero Next article Famed Hacker Emails Source Says Spanish Police Never Arres Author DeepDotWeb Without doubt predecessor TheOnionWeb DeepDotWeb news site dedicated events surrounding dark web featuring interviews reviews darknet markets Tor hidden services legal actions privacy bitcoin related news Articles Donate Bitcoin 1NDqCHu3C8rjgfJs34TgZ8BKa2VsuduRMC Monero 46UwFaceGmLheF9qRq6EjSAmuJF2P5KVfXinVM4NEr6DJhxAWW2j2D79BUTe1HMnTTNt3cbz6QKUEEhmnaZVrMzMKaAtgCW Comments Write comment February 19 4am Tarzan use cellphone take fucker Reply comment reply comment read guidelines X Comment text Post Comment February 18 6am fat Aussie bastard people fear pædophile sites run police Reply comment reply comment read guidelines X Comment text Post Comment February 17 6am q surprised managed stay king empire using cell phoneHes still threat humanity obviously Reply comment reply comment read guidelines X Comment text Post Comment February 17 1am NWOSCUUM fire Cagayan de Oro City Hall destroyed evidence collected Australian Philippine police Prosecutors counted Margallos testimonyoh come others involved evidence destroyed purpose fire broke lovely excuse Reply comment reply comment read guidelines X Comment text Post Comment Write Comment view comments Read write comment Read guidelines Comment text Post Comment Advertise Darknet Sites Featured Sites Torrez 100 CannaHome 100 Abacus Market 97 Markets Revolution Market 98 Vice City 100 Dark0de 95 Cannazon 74 ASAP Asean 100 Cartel 86 Archetyp Market 97 Tor2door 100 Monopoly 94 Versus 98 Tor Market NZ 100 HYDRA RU 76 Vendor Shops new shit 99 WeAreAmsterdam 95 CharlieUK 100 French Connection 100 ThePirateIsland 93 TomJerry 100 Medicine Man UK 100 SmokersCo 100 Auspride 100 Digital Thrift Shop Pl 100 HeinekenExpress 100 o3shop RU 100 Social Dread 92 Majestic Garden 86 HUB 57 Deutschland im Deep Web DE 85 Cebulka PL 90 Services News Directories LARGEST Markets December TOP number products Full Ranking Torrez Dark0de Versus ASAP Asean Cartel Bitcoin Today High Low Monero Today High Low Latest Comments Authentik2900 Site à éviter commande de c faite chez eux jamais reçu une arnaque TomJerrys profile mawosx low contact waiting days parcel 50g coco contact pr WeAreAmsterdams profile foster6la biggest greatest Torrezs profile Fidel Dam Im cannabis plug left Cannazons profile 14characters Looking make Make Money Looking Job Post Find Job Deep Web krazydversa ey ross aim chile espero que algun dia encuentres la libertad fr Life Box kotorfan21 anyone know actual Nonscams registeredreal passports Newbies Spaces space MahNemzJeff loyal Torguard user going years hands TorGuard VPN Review FUCKOFF MOTHER SCAM WEBSITE DarkFox Markets profile oshit Allowing users finalize orders withdraw funds White House Markets profile Tag Cloud Bitcoin Darknet Dark Web Drug Sentenced Arrested Man News Tor Drugs Silk Road Prison Market German years Price Busted Cybercrime Net Markets Cannabis Bitcoin Monero Forum Bitcoin,bad
