index,link,text,marker
10,http://onionwsoiu53xre32jwve7euacadvhprq2jytfttb55hrbo3execodad.onion/2018/12/08/suspected-pedophile-arrested-for-downloading-child-porn-in-thailand/,Suspected Pedophile Arrested Downloading Child Porn Thailand Onion Web Explore Popular Posts Access Darknet buy Dark web Tour Darkweb Markets Mustread Dont Get Scammed PGP Keys Encrypted Messages use Monero buy online Darknet VS Darkweb Difference Topics ViewallTopics Dark web Drugs Bitcoin Leaks Altcoins Trading Markets Hacking Security DeepDotWeb Guides Reviews Interviews Arrests Popular Spaces Onion Web Darknet Dummies Dr Greenthumb Wheres Mind Doggystyle Reviews Rich 30s High Jones Discover MustVisit DarkRise Darknet Doesnt Fail Darkguard Verify URL dReviews dDarknetStars Recon Vendor Database Reviews Coming soon Dread DiscoverAll Markets Ranking Darknet Marketplaces Darknet Forums Darknet Shops Dead Sites Actions Contact SubmitmyStory AddaSite Donate PGP Mirrors Canary Related Log Sign Account Spaces Topics Contact Us Suspected Pedophile Arrested Downloading Child Porn Thailand DeepDotWeb DeepDotWeb Dec Thailands Immigration Bureau announced another branch law enforcement Thailand arrested pedophile Austria accessing child pornography forums dark web view download child pornography investigation full extent activities ongoing police attempting contact possible coconspirator could help police prove Austrian man committed additional crimesThe Thailand Internet Crimes Children TICAC Task Force arrested 66yearold man Austrian state Tyrol accessing downloading child pornography According press release posted website Facebook pages Thailand Immigration Bureau Austrian man downloading illegal content undisclosed dark web sites tip different law enforcement agency pointed cybercrime investigators Thailand direction alleged pedophile Law enforcement received tip September executed search warrant suspects home city Chiang Mai early NovemberGovernment officials never revealed identity government body behind tip led arrest Austrian man However many cases involving various forms criminal activity committed internet law enforcement Thailand worked alongside international law enforcement agencies Thailands cybercrime task forces dedicated investigating child exploitation cases heavily influenced Federal Bureau Investigation similar agencies worldwide FBI Bangkok United States State Department frequently helped law enforcement Thailand investigate capture notable dark web drug dealers alleged dark web marketplace owners Europol active participant investigations notable criminals ThailandThe tip likely came international law enforcement agency example Australias Task Force Argos successfully located number child abusers uploaded content dark web forums many cases pedophiles uploaded pictures children instead content featuring uploader sharing video child abuse featured face abuser identifying features clothing pictures backdrops childs skin tone helped pinpoint general area pictures taken German law enforcement worked together law enforcement Thailand several cases One case involved dark web forum users attempt start child prostitution ring ThailandThe law enforcement agency provided Thailand Internet Crimes Children Task Force tip 66yearold Austrian man seemingly provided accurate information authorities Thailand investigated case less month executing first step plan evidence provided unnamed law enforcement agency considered credible enough police obtain court order authorized search mans home Chiang MaiDuring search cybercrime investigators sat suspected pedophiles computer law enforcement officers detained suspect Although authorities reveal specific number illegal pictures videos found suspects computer call collection mountain child pornography matched content content dark web platforms pedophiles suspect also admitted downloading illegal pictures videos dark web Law enforcement officers currently searching mans alleged partner potential codefendant illegal content Austrian mans computer led possession child pornography charges However investigators completed investigation suspect may involved distribution child pornography partner may hold evidence need charge suspect additional distribution chargesWith current charges 66yearold faces minimum prison sentence five years authorities prove man also distributed child pornography mandatory minimum sentence five years 3euro fine Previous article Report Shows Hate Crime Propagated Dark Web Next article German Son Accused Rewarding Mother Dark Web Amphet Author DeepDotWeb Without doubt predecessor TheOnionWeb DeepDotWeb news site dedicated events surrounding dark web featuring interviews reviews darknet markets Tor hidden services legal actions privacy bitcoin related news Articles Donate Bitcoin 1NDqCHu3C8rjgfJs34TgZ8BKa2VsuduRMC Monero 46UwFaceGmLheF9qRq6EjSAmuJF2P5KVfXinVM4NEr6DJhxAWW2j2D79BUTe1HMnTTNt3cbz6QKUEEhmnaZVrMzMKaAtgCW Comments Write comment Write Comment view comments Read write comment Read guidelines Comment text Post Comment Advertise Darknet Sites Featured Sites Torrez 100 CannaHome 100 Abacus Market 97 Markets Revolution Market 98 Vice City 100 Dark0de 95 Cannazon 74 ASAP Asean 100 Cartel 86 Archetyp Market 97 Tor2door 100 Monopoly 94 Versus 98 Tor Market NZ 100 HYDRA RU 76 Vendor Shops new shit 99 WeAreAmsterdam 95 CharlieUK 100 French Connection 100 ThePirateIsland 93 TomJerry 100 Medicine Man UK 100 SmokersCo 100 Auspride 100 Digital Thrift Shop Pl 100 HeinekenExpress 100 o3shop RU 100 Social Dread 92 Majestic Garden 86 HUB 57 Deutschland im Deep Web DE 85 Cebulka PL 90 Services News Directories LARGEST Markets December TOP number products Full Ranking Torrez Dark0de Versus ASAP Asean Cartel Bitcoin Today High Low Monero Today High Low Latest Comments Authentik2900 Site à éviter commande de c faite chez eux jamais reçu une arnaque TomJerrys profile mawosx low contact waiting days parcel 50g coco contact pr WeAreAmsterdams profile foster6la biggest greatest Torrezs profile Fidel Dam Im cannabis plug left Cannazons profile 14characters Looking make Make Money Looking Job Post Find Job Deep Web krazydversa ey ross aim chile espero que algun dia encuentres la libertad fr Life Box kotorfan21 anyone know actual Nonscams registeredreal passports Newbies Spaces space MahNemzJeff loyal Torguard user going years hands TorGuard VPN Review FUCKOFF MOTHER SCAM WEBSITE DarkFox Markets profile oshit Allowing users finalize orders withdraw funds White House Markets profile Tag Cloud Bitcoin Darknet Dark Web Drug Sentenced Arrested Man News Tor Drugs Silk Road Prison Market German years Price Busted Cybercrime Net Markets Cannabis Bitcoin Monero Forum Bitcoin,bad
11,http://onionwsoiu53xre32jwve7euacadvhprq2jytfttb55hrbo3execodad.onion/2016/12/03/darknet-child-porn-investigator-us-identifies-250-pedophiles-daily/,Darknet Child Porn Investigator US Identifies Pedophiles Daily Onion Web Explore Popular Posts Access Darknet buy Dark web Tour Darkweb Markets Mustread Dont Get Scammed PGP Keys Encrypted Messages use Monero buy online Darknet VS Darkweb Difference Topics ViewallTopics Dark web Drugs Bitcoin Leaks Altcoins Trading Markets Hacking Security DeepDotWeb Guides Reviews Interviews Arrests Popular Spaces Onion Web Darknet Dummies Dr Greenthumb Wheres Mind Doggystyle Reviews Rich 30s High Jones Discover MustVisit DarkRise Darknet Doesnt Fail Darkguard Verify URL dReviews dDarknetStars Recon Vendor Database Reviews Coming soon Dread DiscoverAll Markets Ranking Darknet Marketplaces Darknet Forums Darknet Shops Dead Sites Actions Contact SubmitmyStory AddaSite Donate PGP Mirrors Canary Related Log Sign Account Spaces Topics Contact Us Darknet Child Porn Investigator US Identifies Pedophiles Daily DeepDotWeb DeepDotWeb Dec Chief Criminal Investigation Bremerhaven spoke reporter intricate difficulties job job Karina Görs said hunting pedophiles internet specifically focused tracking pedophiles darknetShe told Nord North 24 daily basis sifted hundreds pictures videos content seen beyond disturbing Viewing images something Görs hated said prepared first pictures found darknet sometimes still head even told interviewer One must prepared deal worstThis work done voluntarily said 45yearold investigator young children would recommend Görs children years old threeyearold infant home suffer differently itThis work done voluntarily said 45yearold investigator young children would recommend Görs children years old threeyearold infant home suffer differently itGörs started working police 1990 passion protecting children served drive goal become even better job 1996 underwent specialized Kripo screening process small number Kriminalpolizei officers Criminal Police pass rigorous examination pass proceed pursue technical education police academy completing course officers serve threeyear apprenticeship superior officers Afterwards officers become fulltime criminal investigatorAfter became criminal investigator moved Bremerhaven 2003 said investigated pedophiles darknet five years Since start career said number child pornography cases multiplied reason growth explained complicated one Internetbased child pornography became prevalent Darknet rings groups spread quickly grew accessibilityPedophiles mainly exchange explicit media darknet said rule come across child pornography surfing netPedophiles mainly exchange explicit media darknet said rule come across child pornography surfing netLaw enforcement worldwide noticed darknets draw pedopiles Investigators busted many notable child pornography sites recent past Australias Taskforce Argos took Love Zone Britains worst pedophile Authorities arrested hundreds users result FBI investigators brought PlayPenanother notorious child pornography shop results PlayPen investigation however controversialWe know individuals abusing online platforms networks distribute child sexual abuse material determined target bring justice said Steven Wilson head Europols EC3 Cybercrime OperationsGörs said cases child pornography recorded Bremerhaven police every year search child pornography already punishable said investigator However added Bremerhaven often needed outside assistance catching darknet pedophiles Federal Criminal Police Office evaluates daily suspects USA passes us Görs said Many suspects ties Bremerhaven spidernetlike connections lead federal states BKA often handled cases explainedNot infrequently investigators encounter masses prohibited material pictures 10to 20videos per offender unusual perpetrators feed imagination sexual imprinting remain offender learn live itAs long darknet child pornography websites Görs continue investigate child pornography online drives successes capture offenders concludedThe following compilation several darknetrelated CP bustsFBIs Operation PacifierEuropols Operation DaylightItalys Web SweepIsraels child porn bustChinas major crackdown Previous article Two Germans Arrested Selling Fake Euros Darknet Next article Irish Darknet Drug Dealers Reassured Receiving Long Se Author DeepDotWeb Without doubt predecessor TheOnionWeb DeepDotWeb news site dedicated events surrounding dark web featuring interviews reviews darknet markets Tor hidden services legal actions privacy bitcoin related news Articles Donate Bitcoin 1NDqCHu3C8rjgfJs34TgZ8BKa2VsuduRMC Monero 46UwFaceGmLheF9qRq6EjSAmuJF2P5KVfXinVM4NEr6DJhxAWW2j2D79BUTe1HMnTTNt3cbz6QKUEEhmnaZVrMzMKaAtgCW Comments Write comment December 4 8am AnonHitler bottom line hate freedom people mind control train using Tor Child Porn also 100X going using higher encryptions called authorities dont really monitor due National Security course get movies like Beautiful Mind genius cracks code word messages ectto fill void lack government complete psychological warfare programs mobilized FREE program supports Freedom Censorship Reply comment reply comment read guidelines X Comment text Post Comment December 4 8am AnonHitler Well similarities everywhere example lack growth destroys human advancement government seems grow matter demons type rules regulations feed police politiciansTor privacy nothing dream world corrupt Authorities like roads freedom bad try run road good Tor would much stronger type crimes Pizzagate Catholic pedophiles reminders Tor prevent things likely psychological warfare sophisticated actors force governments mold decision making strong encryption Tor funny industial million club shove controllers onto Tor Divert Attention create ploy cover secret dealings big thing would hidden like witch hunts caused established mind control program using Child Pornography dump Tor many different reasons Reply comment reply comment read guidelines X Comment text Post Comment December 4 1am 2cents Anonymous pretty true using scare gross factor push agendaWhich means WWW control censorship best case look GB recent Privacy dismantling lawsThey also could look departments jackpot waiting Politicians High Ranking officersHeil Hilter Definitely misleading incorrect regular typo get fundings Reply comment reply comment read guidelines X Comment text Post Comment December 4 12am Heil Hilter Pedos identified every day means nearly 100K every year Reply comment reply comment read guidelines X Comment text Post Comment December 3 8am Pedro surely pedo Reply comment reply comment read guidelines X Comment text Post Comment December 3 6am Zieg Kirkwillow Pedo Killa piece shit pedo fuck approved comment angry nowholocaust part pedos Reply comment reply comment read guidelines X Comment text Post Comment December 3 5am Anonymous drives successes capture offenders concludedYeah good luck might well try prevent Sun rising EastPerverts exist fact materialistic evolution miswiring mammalian brain Homosexuals pedophiles exist among humans exist among mammals fact Nature means fact lifeDont blame Darknet making CP available existed long Tor even long Internet CP exist DeepWeb continue exist Clearnet postal mail one deny CP perverts sexual gratification one deny food water short killing one deny deserve thats DeepWebs fault problem Reply comment reply comment read guidelines X Comment text Post Comment December 5 1am dudley see point none less sick twisted see killing pedophiles way rid world evil Systematically remove pedophile planet Good riddance Reply comment reply comment read guidelines X Comment text Post Comment Write Comment view comments Read write comment Read guidelines Comment text Post Comment Advertise Darknet Sites Featured Sites Torrez 100 CannaHome 100 Abacus Market 97 Markets Revolution Market 98 Vice City 100 Dark0de 95 Cannazon 74 ASAP Asean 100 Cartel 86 Archetyp Market 97 Tor2door 100 Monopoly 94 Versus 98 Tor Market NZ 100 HYDRA RU 76 Vendor Shops new shit 99 WeAreAmsterdam 95 CharlieUK 100 French Connection 100 ThePirateIsland 93 TomJerry 100 Medicine Man UK 100 SmokersCo 100 Auspride 100 Digital Thrift Shop Pl 100 HeinekenExpress 100 o3shop RU 100 Social Dread 92 Majestic Garden 86 HUB 57 Deutschland im Deep Web DE 85 Cebulka PL 90 Services News Directories LARGEST Markets December TOP number products Full Ranking Torrez Dark0de Versus ASAP Asean Cartel Bitcoin Today High Low Monero Today High Low Latest Comments Authentik2900 Site à éviter commande de c faite chez eux jamais reçu une arnaque TomJerrys profile mawosx low contact waiting days parcel 50g coco contact pr WeAreAmsterdams profile foster6la biggest greatest Torrezs profile Fidel Dam Im cannabis plug left Cannazons profile 14characters Looking make Make Money Looking Job Post Find Job Deep Web krazydversa ey ross aim chile espero que algun dia encuentres la libertad fr Life Box kotorfan21 anyone know actual Nonscams registeredreal passports Newbies Spaces space MahNemzJeff loyal Torguard user going years hands TorGuard VPN Review FUCKOFF MOTHER SCAM WEBSITE DarkFox Markets profile oshit Allowing users finalize orders withdraw funds White House Markets profile Tag Cloud Bitcoin Darknet Dark Web Drug Sentenced Arrested Man News Tor Drugs Silk Road Prison Market German years Price Busted Cybercrime Net Markets Cannabis Bitcoin Monero Forum Bitcoin,bad
12,http://onionwsoiu53xre32jwve7euacadvhprq2jytfttb55hrbo3execodad.onion/2020/03/04/pedophile-escapes-jail-caught-darkweb-child-porn/,PEDOPHILE CAUGHT 45IMAGES CHILD PORN GETS SUSPENDED SENTENCE Onion Web Explore Popular Posts Access Darknet buy Dark web Tour Darkweb Markets Mustread Dont Get Scammed PGP Keys Encrypted Messages use Monero buy online Darknet VS Darkweb Difference Topics ViewallTopics Dark web Drugs Bitcoin Leaks Altcoins Trading Markets Hacking Security DeepDotWeb Guides Reviews Interviews Arrests Popular Spaces Onion Web Darknet Dummies Dr Greenthumb Wheres Mind Doggystyle Reviews Rich 30s High Jones Discover MustVisit DarkRise Darknet Doesnt Fail Darkguard Verify URL dReviews dDarknetStars Recon Vendor Database Reviews Coming soon Dread DiscoverAll Markets Ranking Darknet Marketplaces Darknet Forums Darknet Shops Dead Sites Actions Contact SubmitmyStory AddaSite Donate PGP Mirrors Canary Related Log Sign Account Spaces Topics Contact Us PEDOPHILE CAUGHT 45IMAGES CHILD PORN GETS SUSPENDED SENTENCE Dark Web 20year old avoided jail time even though search phone laptop showed downloaded 45pictures child porn darkweb BillyReport Apr 20year old pedophile caught 45images depicting child sexually abusive situations given suspended sentence nine months Teesside Crown Court recently Darlington resident Ethan Chapman became suspect investigation conducted darkweb forums National Crime Agency Chapman became person interest investigators found 45images child porn 36of worst known category child abuse mobile phone personal laptop back August 2018 questioned January year admitted court three counts making indecent images children varying categories sentence suspended next eighteen months followed stipulations follow including registering sex offender next five years obey fiveyear sexual harm prevention order Speaking issue Graham Ellis Operations Manager NCA shared Every child abuse image revictimised photograph viewed shared Chapmans use dark web shows degree sophistication determination avoid law enforcement detection Dark web child sex offenders worst offenders cannot hide law enforcement Previous article BONN DARKNET DRUG DEALERS SENTENCED Next article XANAX ROBBER PLEADS GUILTY Author BillyReport Articles Donate Bitcoin 1NDqCHu3C8rjgfJs34TgZ8BKa2VsuduRMC Monero 46UwFaceGmLheF9qRq6EjSAmuJF2P5KVfXinVM4NEr6DJhxAWW2j2D79BUTe1HMnTTNt3cbz6QKUEEhmnaZVrMzMKaAtgCW Comments Write comment Write Comment view comments Read write comment Read guidelines Comment text Post Comment Advertise Darknet Sites Featured Sites Torrez 100 CannaHome 100 Abacus Market 97 Markets Revolution Market 98 Vice City 100 Dark0de 95 Cannazon 74 ASAP Asean 100 Cartel 86 Archetyp Market 97 Tor2door 100 Monopoly 94 Versus 98 Tor Market NZ 100 HYDRA RU 76 Vendor Shops new shit 99 WeAreAmsterdam 95 CharlieUK 100 French Connection 100 ThePirateIsland 93 TomJerry 100 Medicine Man UK 100 SmokersCo 100 Auspride 100 Digital Thrift Shop Pl 100 HeinekenExpress 100 o3shop RU 100 Social Dread 92 Majestic Garden 86 HUB 57 Deutschland im Deep Web DE 85 Cebulka PL 90 Services News Directories LARGEST Markets December TOP number products Full Ranking Torrez Dark0de Versus ASAP Asean Cartel Bitcoin Today High Low Monero Today High Low Latest Comments Authentik2900 Site à éviter commande de c faite chez eux jamais reçu une arnaque TomJerrys profile mawosx low contact waiting days parcel 50g coco contact pr WeAreAmsterdams profile foster6la biggest greatest Torrezs profile Fidel Dam Im cannabis plug left Cannazons profile 14characters Looking make Make Money Looking Job Post Find Job Deep Web krazydversa ey ross aim chile espero que algun dia encuentres la libertad fr Life Box kotorfan21 anyone know actual Nonscams registeredreal passports Newbies Spaces space MahNemzJeff loyal Torguard user going years hands TorGuard VPN Review FUCKOFF MOTHER SCAM WEBSITE DarkFox Markets profile oshit Allowing users finalize orders withdraw funds White House Markets profile Tag Cloud Bitcoin Darknet Dark Web Drug Sentenced Arrested Man News Tor Drugs Silk Road Prison Market German years Price Busted Cybercrime Net Markets Cannabis Bitcoin Monero Forum Bitcoin,bad
13,http://onionwsoiu53xre32jwve7euacadvhprq2jytfttb55hrbo3execodad.onion/2020/09/03/darkweb-playpen-pedophile-sentenced-seven-years-possession-receipt-child-pornography/,PEDOPHILE 51 GETS YEARS DOWNLOADING 8000 IMAGES CHILD PORN DARK WEB SITE PLAYPEN Onion Web Explore Popular Posts Access Darknet buy Dark web Tour Darkweb Markets Mustread Dont Get Scammed PGP Keys Encrypted Messages use Monero buy online Darknet VS Darkweb Difference Topics ViewallTopics Dark web Drugs Bitcoin Leaks Altcoins Trading Markets Hacking Security DeepDotWeb Guides Reviews Interviews Arrests Popular Spaces Onion Web Darknet Dummies Dr Greenthumb Wheres Mind Doggystyle Reviews Rich 30s High Jones Discover MustVisit DarkRise Darknet Doesnt Fail Darkguard Verify URL dReviews dDarknetStars Recon Vendor Database Reviews Coming soon Dread DiscoverAll Markets Ranking Darknet Marketplaces Darknet Forums Darknet Shops Dead Sites Actions Contact SubmitmyStory AddaSite Donate PGP Mirrors Canary Related Log Sign Account Spaces Topics Contact Us PEDOPHILE 51 GETS YEARS DOWNLOADING 8000 IMAGES CHILD PORN DARK WEB SITE PLAYPEN Dark Web Stephus well others tracked joint investigation led FBI local law enforcement various countries across globe following seizure subsequent take child pornography site Playpen Jukebox Mar pedophile resident Chicopee Massachusetts area recently handed sevenyear sentence possessing receiving child pornography via darkweb platform named Playpen site taken law enforcement instrumental identifying 51year old agents gained accessed records pinned users arrested administrators responsible platform following leak sites IP address FBI since shared days monitored site able track 1IP addresses arrested users worldwide still working making arrests snapshot site following takedown FBI partners Image Source euocscom Pending arrest nowconvicted Victor Stephus law enforcement executed search warrant residence back found computer 8pictures videos child pornography eventually admitted downloading images via Playpen forum frequent user site November last year case finally went trial Stephus pleaded guilty charges levelled three counts Receipt Child Pornography one count Possession Child Pornography District Court Judge Mark G Mastroianni presided case sentenced years jail well additional years supervised release Previous article KINGDOM MARKET GETS HEAT BAD OPSEC Next article CARFENTANILOXY TRAFFICKER GETS TWO YEARS DRUG TRADE Author Jukebox Articles Donate Bitcoin 1NDqCHu3C8rjgfJs34TgZ8BKa2VsuduRMC Monero 46UwFaceGmLheF9qRq6EjSAmuJF2P5KVfXinVM4NEr6DJhxAWW2j2D79BUTe1HMnTTNt3cbz6QKUEEhmnaZVrMzMKaAtgCW Comments Write comment Write Comment view comments Read write comment Read guidelines Comment text Post Comment Advertise Darknet Sites Featured Sites Torrez 100 CannaHome 100 Abacus Market 97 Markets Revolution Market 98 Vice City 100 Dark0de 95 Cannazon 74 ASAP Asean 100 Cartel 86 Archetyp Market 97 Tor2door 100 Monopoly 94 Versus 98 Tor Market NZ 100 HYDRA RU 76 Vendor Shops new shit 99 WeAreAmsterdam 95 CharlieUK 100 French Connection 100 ThePirateIsland 93 TomJerry 100 Medicine Man UK 100 SmokersCo 100 Auspride 100 Digital Thrift Shop Pl 100 HeinekenExpress 100 o3shop RU 100 Social Dread 92 Majestic Garden 86 HUB 57 Deutschland im Deep Web DE 85 Cebulka PL 90 Services News Directories LARGEST Markets December TOP number products Full Ranking Torrez Dark0de Versus ASAP Asean Cartel Bitcoin Today High Low Monero Today High Low Latest Comments Authentik2900 Site à éviter commande de c faite chez eux jamais reçu une arnaque TomJerrys profile mawosx low contact waiting days parcel 50g coco contact pr WeAreAmsterdams profile foster6la biggest greatest Torrezs profile Fidel Dam Im cannabis plug left Cannazons profile 14characters Looking make Make Money Looking Job Post Find Job Deep Web krazydversa ey ross aim chile espero que algun dia encuentres la libertad fr Life Box kotorfan21 anyone know actual Nonscams registeredreal passports Newbies Spaces space MahNemzJeff loyal Torguard user going years hands TorGuard VPN Review FUCKOFF MOTHER SCAM WEBSITE DarkFox Markets profile oshit Allowing users finalize orders withdraw funds White House Markets profile Tag Cloud Bitcoin Darknet Dark Web Drug Sentenced Arrested Man News Tor Drugs Silk Road Prison Market German years Price Busted Cybercrime Net Markets Cannabis Bitcoin Monero Forum Bitcoin,bad
